Order Date,Ship Date,Ship Mode,Customer ID,Customer Name,Segment,Country,City,State,Postal Code,Region,Category,Sub-Category,Product Name,Sales,Quantity,Discount,Profit,Order Date Parsed,Ship Date Parsed
11/8/2016,11/11/2016,Second Class,CG-12520,Claire Gute,Consumer,United States,Henderson,Kentucky,42420,South,Furniture,Bookcases,Bush Somerset Collection Bookcase,261.96,2,0.0,41.9136,2016-11-08,2016-11-11
11/8/2016,11/11/2016,Second Class,CG-12520,Claire Gute,Consumer,United States,Henderson,Kentucky,42420,South,Furniture,Chairs,"Hon Deluxe Fabric Upholstered Stacking Chairs, Rounded Back",731.94,3,0.0,219.582,2016-11-08,2016-11-11
6/12/2016,6/16/2016,Second Class,DV-13045,Darrin Van Huff,Corporate,United States,Los Angeles,California,90036,West,Office Supplies,Labels,Self-Adhesive Address Labels for Typewriters by Universal,14.62,2,0.0,6.8714,2016-06-12,2016-06-16
10/11/2015,10/18/2015,Standard Class,SO-20335,Sean O'Donnell,Consumer,United States,Fort Lauderdale,Florida,33311,South,Furniture,Tables,Bretford CR4500 Series Slim Rectangular Table,957.5775,5,0.45,-383.031,2015-10-11,2015-10-18
10/11/2015,10/18/2015,Standard Class,SO-20335,Sean O'Donnell,Consumer,United States,Fort Lauderdale,Florida,33311,South,Office Supplies,Storage,Eldon Fold 'N Roll Cart System,22.368,2,0.2,2.5164,2015-10-11,2015-10-18
6/9/2014,6/14/2014,Standard Class,BH-11710,Brosina Hoffman,Consumer,United States,Los Angeles,California,90032,West,Furniture,Furnishings,"Eldon Expressions Wood and Plastic Desk Accessories, Cherry Wood",48.86,7,0.0,14.1694,2014-06-09,2014-06-14
6/9/2014,6/14/2014,Standard Class,BH-11710,Brosina Hoffman,Consumer,United States,Los Angeles,California,90032,West,Office Supplies,Art,Newell 322,7.28,4,0.0,1.9656,2014-06-09,2014-06-14
6/9/2014,6/14/2014,Standard Class,BH-11710,Brosina Hoffman,Consumer,United States,Los Angeles,California,90032,West,Technology,Phones,Mitel 5320 IP Phone VoIP phone,907.152,6,0.2,90.7152,2014-06-09,2014-06-14
6/9/2014,6/14/2014,Standard Class,BH-11710,Brosina Hoffman,Consumer,United States,Los Angeles,California,90032,West,Office Supplies,Binders,DXL Angle-View Binders with Locking Rings by Samsill,18.504,3,0.2,5.7825,2014-06-09,2014-06-14
6/9/2014,6/14/2014,Standard Class,BH-11710,Brosina Hoffman,Consumer,United States,Los Angeles,California,90032,West,Office Supplies,Appliances,Belkin F5C206VTEL 6 Outlet Surge,114.9,5,0.0,34.47,2014-06-09,2014-06-14
6/9/2014,6/14/2014,Standard Class,BH-11710,Brosina Hoffman,Consumer,United States,Los Angeles,California,90032,West,Furniture,Tables,Chromcraft Rectangular Conference Tables,1706.184,9,0.2,85.3092,2014-06-09,2014-06-14
6/9/2014,6/14/2014,Standard Class,BH-11710,Brosina Hoffman,Consumer,United States,Los Angeles,California,90032,West,Technology,Phones,Konftel 250 Conference phone - Charcoal black,911.424,4,0.2,68.3568,2014-06-09,2014-06-14
4/15/2017,4/20/2017,Standard Class,AA-10480,Andrew Allen,Consumer,United States,Concord,North Carolina,28027,South,Office Supplies,Paper,Xerox 1967,15.552,3,0.2,5.4432,2017-04-15,2017-04-20
12/5/2016,12/10/2016,Standard Class,IM-15070,Irene Maddox,Consumer,United States,Seattle,Washington,98103,West,Office Supplies,Binders,Fellowes PB200 Plastic Comb Binding Machine,407.976,3,0.2,132.5922,2016-12-05,2016-12-10
11/22/2015,11/26/2015,Standard Class,HP-14815,Harold Pawlan,Home Office,United States,Fort Worth,Texas,76106,Central,Office Supplies,Appliances,"Holmes Replacement Filter for HEPA Air Cleaner, Very Large Room, HEPA Filter",68.81,5,0.8,-123.858,2015-11-22,2015-11-26
11/22/2015,11/26/2015,Standard Class,HP-14815,Harold Pawlan,Home Office,United States,Fort Worth,Texas,76106,Central,Office Supplies,Binders,Storex DuraTech Recycled Plastic Frosted Binders,2.544,3,0.8,-3.816,2015-11-22,2015-11-26
11/11/2014,11/18/2014,Standard Class,PK-19075,Pete Kriz,Consumer,United States,Madison,Wisconsin,53711,Central,Office Supplies,Storage,"Stur-D-Stor Shelving, Vertical 5-Shelf: 72""H x 36""W x 18 1/2""D",665.88,6,0.0,13.3176,2014-11-11,2014-11-18
5/13/2014,5/15/2014,Second Class,AG-10270,Alejandro Grove,Consumer,United States,West Jordan,Utah,84084,West,Office Supplies,Storage,Fellowes Super Stor/Drawer,55.5,2,0.0,9.99,2014-05-13,2014-05-15
8/27/2014,9/1/2014,Second Class,ZD-21925,Zuschuss Donatelli,Consumer,United States,San Francisco,California,94109,West,Office Supplies,Art,Newell 341,8.56,2,0.0,2.4824,2014-08-27,2014-09-01
8/27/2014,9/1/2014,Second Class,ZD-21925,Zuschuss Donatelli,Consumer,United States,San Francisco,California,94109,West,Technology,Phones,Cisco SPA 501G IP Phone,213.48,3,0.2,16.011,2014-08-27,2014-09-01
8/27/2014,9/1/2014,Second Class,ZD-21925,Zuschuss Donatelli,Consumer,United States,San Francisco,California,94109,West,Office Supplies,Binders,"Wilson Jones Hanging View Binder, White, 1""",22.72,4,0.2,7.384,2014-08-27,2014-09-01
12/9/2016,12/13/2016,Standard Class,KB-16585,Ken Black,Corporate,United States,Fremont,Nebraska,68025,Central,Office Supplies,Art,Newell 318,19.46,7,0.0,5.0596,2016-12-09,2016-12-13
12/9/2016,12/13/2016,Standard Class,KB-16585,Ken Black,Corporate,United States,Fremont,Nebraska,68025,Central,Office Supplies,Appliances,"Acco Six-Outlet Power Strip, 4' Cord Length",60.34,7,0.0,15.6884,2016-12-09,2016-12-13
7/16/2017,7/18/2017,Second Class,SF-20065,Sandra Flanagan,Consumer,United States,Philadelphia,Pennsylvania,19140,East,Furniture,Chairs,"Global Deluxe Stacking Chair, Gray",71.372,2,0.3,-1.0196,2017-07-16,2017-07-18
9/25/2015,9/30/2015,Standard Class,EB-13870,Emily Burns,Consumer,United States,Orem,Utah,84057,West,Furniture,Tables,Bretford CR4500 Series Slim Rectangular Table,1044.63,3,0.0,240.2649,2015-09-25,2015-09-30
1/16/2016,1/20/2016,Second Class,EH-13945,Eric Hoffmann,Consumer,United States,Los Angeles,California,90049,West,Office Supplies,Binders,Wilson Jones Active Use Binders,11.648,2,0.2,4.2224,2016-01-16,2016-01-20
1/16/2016,1/20/2016,Second Class,EH-13945,Eric Hoffmann,Consumer,United States,Los Angeles,California,90049,West,Technology,Accessories,Imation 8GB Mini TravelDrive USB 2.0 Flash Drive,90.57,3,0.0,11.7741,2016-01-16,2016-01-20
9/17/2015,9/21/2015,Standard Class,TB-21520,Tracy Blumstein,Consumer,United States,Philadelphia,Pennsylvania,19140,East,Furniture,Bookcases,"Riverside Palais Royal Lawyers Bookcase, Royale Cherry Finish",3083.43,7,0.5,-1665.0522,2015-09-17,2015-09-21
9/17/2015,9/21/2015,Standard Class,TB-21520,Tracy Blumstein,Consumer,United States,Philadelphia,Pennsylvania,19140,East,Office Supplies,Binders,Avery Recycled Flexi-View Covers for Binding Systems,9.618,2,0.7,-7.0532,2015-09-17,2015-09-21
9/17/2015,9/21/2015,Standard Class,TB-21520,Tracy Blumstein,Consumer,United States,Philadelphia,Pennsylvania,19140,East,Furniture,Furnishings,"Howard Miller 13-3/4"" Diameter Brushed Chrome Round Wall Clock",124.2,3,0.2,15.525,2015-09-17,2015-09-21
9/17/2015,9/21/2015,Standard Class,TB-21520,Tracy Blumstein,Consumer,United States,Philadelphia,Pennsylvania,19140,East,Office Supplies,Envelopes,Poly String Tie Envelopes,3.264,2,0.2,1.1016,2015-09-17,2015-09-21
9/17/2015,9/21/2015,Standard Class,TB-21520,Tracy Blumstein,Consumer,United States,Philadelphia,Pennsylvania,19140,East,Office Supplies,Art,"BOSTON Model 1800 Electric Pencil Sharpeners, Putty/Woodgrain",86.304,6,0.2,9.7092,2015-09-17,2015-09-21
9/17/2015,9/21/2015,Standard Class,TB-21520,Tracy Blumstein,Consumer,United States,Philadelphia,Pennsylvania,19140,East,Office Supplies,Binders,"Acco Pressboard Covers with Storage Hooks, 14 7/8"" x 11"", Executive Red",6.858,6,0.7,-5.715,2015-09-17,2015-09-21
9/17/2015,9/21/2015,Standard Class,TB-21520,Tracy Blumstein,Consumer,United States,Philadelphia,Pennsylvania,19140,East,Office Supplies,Art,Lumber Crayons,15.76,2,0.2,3.546,2015-09-17,2015-09-21
10/19/2017,10/23/2017,Second Class,MA-17560,Matt Abelman,Home Office,United States,Houston,Texas,77095,Central,Office Supplies,Paper,Easy-staple paper,29.472,3,0.2,9.9468,2017-10-19,2017-10-23
12/8/2016,12/10/2016,First Class,GH-14485,Gene Hale,Corporate,United States,Richardson,Texas,75080,Central,Technology,Phones,GE 30524EE4,1097.544,7,0.2,123.4737,2016-12-08,2016-12-10
12/8/2016,12/10/2016,First Class,GH-14485,Gene Hale,Corporate,United States,Richardson,Texas,75080,Central,Furniture,Furnishings,"Electrix Architect's Clamp-On Swing Arm Lamp, Black",190.92,5,0.6,-147.963,2016-12-08,2016-12-10
12/27/2015,12/31/2015,Standard Class,SN-20710,Steve Nguyen,Home Office,United States,Houston,Texas,77041,Central,Office Supplies,Envelopes,"#10-4 1/8"" x 9 1/2"" Premium Diagonal Seam Envelopes",113.328,9,0.2,35.415,2015-12-27,2015-12-31
12/27/2015,12/31/2015,Standard Class,SN-20710,Steve Nguyen,Home Office,United States,Houston,Texas,77041,Central,Furniture,Bookcases,"Atlantic Metals Mobile 3-Shelf Bookcases, Custom Colors",532.3992,3,0.32,-46.9764,2015-12-27,2015-12-31
12/27/2015,12/31/2015,Standard Class,SN-20710,Steve Nguyen,Home Office,United States,Houston,Texas,77041,Central,Furniture,Chairs,"Global Fabric Manager's Chair, Dark Gray",212.058,3,0.3,-15.147,2015-12-27,2015-12-31
12/27/2015,12/31/2015,Standard Class,SN-20710,Steve Nguyen,Home Office,United States,Houston,Texas,77041,Central,Technology,Phones,Plantronics HL10 Handset Lifter,371.168,4,0.2,41.7564,2015-12-27,2015-12-31
9/10/2017,9/15/2017,Standard Class,LC-16930,Linda Cazamias,Corporate,United States,Naperville,Illinois,60540,Central,Technology,Phones,Panasonic Kx-TS550,147.168,4,0.2,16.5564,2017-09-10,2017-09-15
7/17/2016,7/22/2016,Standard Class,RA-19885,Ruben Ausman,Corporate,United States,Los Angeles,California,90049,West,Office Supplies,Storage,"Eldon Base for stackable storage shelf, platinum",77.88,2,0.0,3.894,2016-07-17,2016-07-22
9/19/2017,9/23/2017,Standard Class,ES-14080,Erin Smith,Corporate,United States,Melbourne,Florida,32935,South,Office Supplies,Storage,"Advantus 10-Drawer Portable Organizer, Chrome Metal Frame, Smoke Drawers",95.616,2,0.2,9.5616,2017-09-19,2017-09-23
3/11/2016,3/13/2016,First Class,ON-18715,Odella Nelson,Corporate,United States,Eagan,Minnesota,55122,Central,Technology,Accessories,"Verbatim 25 GB 6x Blu-ray Single Layer Recordable Disc, 25/Pack",45.98,2,0.0,19.7714,2016-03-11,2016-03-13
3/11/2016,3/13/2016,First Class,ON-18715,Odella Nelson,Corporate,United States,Eagan,Minnesota,55122,Central,Office Supplies,Binders,Wilson Jones Leather-Like Binders with DublLock Round Rings,17.46,2,0.0,8.2062,2016-03-11,2016-03-13
10/20/2014,10/25/2014,Second Class,PO-18865,Patrick O'Donnell,Consumer,United States,Westland,Michigan,48185,Central,Office Supplies,Storage,"Gould Plastics 9-Pocket Panel Bin, 18-3/8w x 5-1/4d x 20-1/2h, Black",211.96,4,0.0,8.4784,2014-10-20,2014-10-25
6/20/2016,6/25/2016,Standard Class,LH-16900,Lena Hernandez,Consumer,United States,Dover,Delaware,19901,East,Technology,Accessories,Imation 8gb Micro Traveldrive Usb 2.0 Flash Drive,45.0,3,0.0,4.95,2016-06-20,2016-06-25
6/20/2016,6/25/2016,Standard Class,LH-16900,Lena Hernandez,Consumer,United States,Dover,Delaware,19901,East,Technology,Phones,"LF Elite 3D Dazzle Designer Hard Case Cover, Lf Stylus Pen and Wiper For Apple Iphone 5c Mini Lite",21.8,2,0.0,6.104,2016-06-20,2016-06-25
4/18/2015,4/22/2015,Standard Class,DP-13000,Darren Powers,Consumer,United States,New Albany,Indiana,47150,Central,Office Supplies,Binders,"C-Line Peel & Stick Add-On Filing Pockets, 8-3/4 x 5-1/8, 10/Pack",38.22,6,0.0,17.9634,2015-04-18,2015-04-22
4/18/2015,4/22/2015,Standard Class,DP-13000,Darren Powers,Consumer,United States,New Albany,Indiana,47150,Central,Office Supplies,Labels,Avery 485,75.18,6,0.0,35.3346,2015-04-18,2015-04-22
4/18/2015,4/22/2015,Standard Class,DP-13000,Darren Powers,Consumer,United States,New Albany,Indiana,47150,Central,Furniture,Furnishings,Longer-Life Soft White Bulbs,6.16,2,0.0,2.9568,2015-04-18,2015-04-22
4/18/2015,4/22/2015,Standard Class,DP-13000,Darren Powers,Consumer,United States,New Albany,Indiana,47150,Central,Furniture,Chairs,"Global Leather Task Chair, Black",89.99,1,0.0,17.0981,2015-04-18,2015-04-22
12/11/2016,12/17/2016,Standard Class,JM-15265,Janet Molinari,Corporate,United States,New York City,New York,10024,East,Office Supplies,Fasteners,Advantus Push Pins,15.26,7,0.0,6.2566,2016-12-11,2016-12-17
12/11/2016,12/17/2016,Standard Class,JM-15265,Janet Molinari,Corporate,United States,New York City,New York,10024,East,Technology,Phones,AT&T CL83451 4-Handset Telephone,1029.95,5,0.0,298.6855,2016-12-11,2016-12-17
6/17/2016,6/18/2016,First Class,TB-21055,Ted Butterfield,Consumer,United States,Troy,New York,12180,East,Office Supplies,Storage,Home/Office Personal File Carts,208.56,6,0.0,52.14,2016-06-17,2016-06-18
6/17/2016,6/18/2016,First Class,TB-21055,Ted Butterfield,Consumer,United States,Troy,New York,12180,East,Office Supplies,Paper,Xerox 232,32.4,5,0.0,15.552,2016-06-17,2016-06-18
6/17/2016,6/18/2016,First Class,TB-21055,Ted Butterfield,Consumer,United States,Troy,New York,12180,East,Furniture,Chairs,Novimex Turbo Task Chair,319.41,5,0.1,7.098,2016-06-17,2016-06-18
6/17/2016,6/18/2016,First Class,TB-21055,Ted Butterfield,Consumer,United States,Troy,New York,12180,East,Office Supplies,Paper,"Array Parchment Paper, Assorted Colors",14.56,2,0.0,6.9888,2016-06-17,2016-06-18
6/17/2016,6/18/2016,First Class,TB-21055,Ted Butterfield,Consumer,United States,Troy,New York,12180,East,Technology,Accessories,Imation 8gb Micro Traveldrive Usb 2.0 Flash Drive,30.0,2,0.0,3.3,2016-06-17,2016-06-18
6/17/2016,6/18/2016,First Class,TB-21055,Ted Butterfield,Consumer,United States,Troy,New York,12180,East,Office Supplies,Binders,Plastic Binding Combs,48.48,4,0.2,16.362,2016-06-17,2016-06-18
6/17/2016,6/18/2016,First Class,TB-21055,Ted Butterfield,Consumer,United States,Troy,New York,12180,East,Office Supplies,Art,Prang Dustless Chalk Sticks,1.68,1,0.0,0.84,2016-06-17,2016-06-18
11/24/2015,11/30/2015,Standard Class,KM-16720,Kunst Miller,Consumer,United States,Los Angeles,California,90004,West,Technology,Accessories,"Verbatim 25 GB 6x Blu-ray Single Layer Recordable Disc, 3/Pack",13.98,2,0.0,6.1512,2015-11-24,2015-11-30
11/24/2015,11/30/2015,Standard Class,KM-16720,Kunst Miller,Consumer,United States,Los Angeles,California,90004,West,Office Supplies,Binders,"Acco PRESSTEX Data Binder with Storage Hooks, Dark Blue, 14 7/8"" X 11""",25.824,6,0.2,9.3612,2015-11-24,2015-11-30
11/24/2015,11/30/2015,Standard Class,KM-16720,Kunst Miller,Consumer,United States,Los Angeles,California,90004,West,Office Supplies,Paper,Xerox 1943,146.73,3,0.0,68.9631,2015-11-24,2015-11-30
11/24/2015,11/30/2015,Standard Class,KM-16720,Kunst Miller,Consumer,United States,Los Angeles,California,90004,West,Furniture,Furnishings,Luxo Economy Swing Arm Lamp,79.76,4,0.0,22.3328,2015-11-24,2015-11-30
4/30/2015,5/5/2015,Standard Class,PS-18970,Paul Stevenson,Home Office,United States,Chicago,Illinois,60610,Central,Furniture,Chairs,"Global Value Mid-Back Manager's Chair, Gray",213.115,5,0.3,-15.2225,2015-04-30,2015-05-05
12/5/2014,12/10/2014,Standard Class,BS-11590,Brendan Sweed,Corporate,United States,Gilbert,Arizona,85234,West,Office Supplies,Art,"Hunt BOSTON Model 1606 High-Volume Electric Pencil Sharpener, Beige",1113.024,8,0.2,111.3024,2014-12-05,2014-12-10
12/5/2014,12/10/2014,Standard Class,BS-11590,Brendan Sweed,Corporate,United States,Gilbert,Arizona,85234,West,Technology,Phones,netTALK DUO VoIP Telephone Service,167.968,4,0.2,62.988,2014-12-05,2014-12-10
6/4/2016,6/6/2016,First Class,KD-16270,Karen Daniels,Consumer,United States,Springfield,Virginia,22153,South,Office Supplies,Paper,"Snap-A-Way Black Print Carbonless Ruled Speed Letter, Triplicate",75.88,2,0.0,35.6636,2016-06-04,2016-06-06
9/18/2016,9/23/2016,Standard Class,HM-14980,Henry MacAllister,Consumer,United States,New York City,New York,10009,East,Office Supplies,Binders,Avery Binding System Hidden Tab Executive Style Index Sets,4.616,1,0.2,1.731,2016-09-18,2016-09-23
9/14/2017,9/17/2017,Second Class,TB-21520,Tracy Blumstein,Consumer,United States,Jackson,Michigan,49201,Central,Office Supplies,Paper,"Telephone Message Books with Fax/Mobile Section, 5 1/2"" x 3 3/16""",19.05,3,0.0,8.763,2017-09-14,2017-09-17
4/26/2015,5/2/2015,Standard Class,JE-15745,Joel Eaton,Consumer,United States,Memphis,Tennessee,38109,South,Furniture,Chairs,High-Back Leather Manager's Chair,831.936,8,0.2,-114.3912,2015-04-26,2015-05-02
4/26/2015,5/2/2015,Standard Class,JE-15745,Joel Eaton,Consumer,United States,Memphis,Tennessee,38109,South,Furniture,Furnishings,"Tenex Traditional Chairmats for Medium Pile Carpet, Standard Lip, 36"" x 48""",97.04,2,0.2,1.213,2015-04-26,2015-05-02
4/26/2015,5/2/2015,Standard Class,JE-15745,Joel Eaton,Consumer,United States,Memphis,Tennessee,38109,South,Office Supplies,Storage,Safco Industrial Wire Shelving System,72.784,1,0.2,-18.196,2015-04-26,2015-05-02
12/9/2017,12/11/2017,First Class,KB-16600,Ken Brennan,Corporate,United States,Houston,Texas,77041,Central,Office Supplies,Binders,Economy Binders,1.248,3,0.8,-1.9344,2017-12-09,2017-12-11
12/9/2017,12/11/2017,First Class,KB-16600,Ken Brennan,Corporate,United States,Houston,Texas,77041,Central,Furniture,Furnishings,"6"" Cubicle Wall Clock, Black",9.708,3,0.6,-5.8248,2017-12-09,2017-12-11
12/9/2017,12/11/2017,First Class,KB-16600,Ken Brennan,Corporate,United States,Houston,Texas,77041,Central,Office Supplies,Storage,"SimpliFile Personal File, Black Granite, 15w x 6-15/16d x 11-1/4h",27.24,3,0.2,2.724,2017-12-09,2017-12-11
11/26/2014,12/1/2014,Second Class,JE-15745,Joel Eaton,Consumer,United States,Houston,Texas,77070,Central,Furniture,Furnishings,"Eldon Expressions Desk Accessory, Wood Pencil Holder, Oak",19.3,5,0.6,-14.475,2014-11-26,2014-12-01
6/12/2016,6/15/2016,First Class,SC-20770,Stewart Carmichael,Corporate,United States,Decatur,Alabama,35601,South,Office Supplies,Appliances,"1.7 Cubic Foot Compact ""Cube"" Office Refrigerators",208.16,1,0.0,56.2032,2016-06-12,2016-06-15
6/12/2016,6/15/2016,First Class,SC-20770,Stewart Carmichael,Corporate,United States,Decatur,Alabama,35601,South,Office Supplies,Binders,Avery Heavy-Duty EZD  Binder With Locking Rings,16.74,3,0.0,8.0352,2016-06-12,2016-06-15
10/12/2014,10/16/2014,Standard Class,DN-13690,Duane Noonan,Consumer,United States,San Francisco,California,94122,West,Office Supplies,Art,"Premium Writing Pencils, Soft, #2 by Central Association for the Blind",14.9,5,0.0,4.172,2014-10-12,2014-10-16
10/12/2014,10/16/2014,Standard Class,DN-13690,Duane Noonan,Consumer,United States,San Francisco,California,94122,West,Office Supplies,Storage,"Sortfiler Multipurpose Personal File Organizer, Black",21.39,1,0.0,6.2031,2014-10-12,2014-10-16
9/3/2015,9/8/2015,Standard Class,JC-16105,Julie Creighton,Corporate,United States,Durham,North Carolina,27707,South,Office Supplies,Envelopes,Jet-Pak Recycled Peel 'N' Seal Padded Mailers,200.984,7,0.2,62.8075,2015-09-03,2015-09-08
11/13/2017,11/16/2017,First Class,CS-12400,Christopher Schild,Home Office,United States,Chicago,Illinois,60623,Central,Office Supplies,Storage,Safco Industrial Wire Shelving,230.376,3,0.2,-48.9549,2017-11-13,2017-11-16
5/28/2017,5/30/2017,Second Class,PO-18865,Patrick O'Donnell,Consumer,United States,Columbia,South Carolina,29203,South,Furniture,Chairs,Novimex Swivel Fabric Task Chair,301.96,2,0.0,33.2156,2017-05-28,2017-05-30
10/26/2017,11/2/2017,Standard Class,PG-18895,Paul Gonzalez,Consumer,United States,Rochester,Minnesota,55901,Central,Technology,Accessories,Logitech LS21 Speaker System - PC Multimedia - 2.1-CH - Wired,19.99,1,0.0,6.7966,2017-10-26,2017-11-02
10/26/2017,11/2/2017,Standard Class,PG-18895,Paul Gonzalez,Consumer,United States,Rochester,Minnesota,55901,Central,Office Supplies,Labels,Avery 511,6.16,2,0.0,2.9568,2017-10-26,2017-11-02
4/5/2016,4/10/2016,Second Class,GM-14455,Gary Mitchum,Home Office,United States,Houston,Texas,77095,Central,Office Supplies,Storage,Eldon Portable Mobile Manager,158.368,7,0.2,13.8572,2016-04-05,2016-04-10
9/17/2016,9/22/2016,Standard Class,JS-15685,Jim Sink,Corporate,United States,Los Angeles,California,90036,West,Office Supplies,Art,Turquoise Lead Holder with Pocket Clip,20.1,3,0.0,6.633,2016-09-17,2016-09-22
9/17/2016,9/22/2016,Standard Class,JS-15685,Jim Sink,Corporate,United States,Los Angeles,California,90036,West,Technology,Phones,Panasonic Kx-TS550,73.584,2,0.2,8.2782,2016-09-17,2016-09-22
9/17/2016,9/22/2016,Standard Class,JS-15685,Jim Sink,Corporate,United States,Los Angeles,California,90036,West,Office Supplies,Paper,Xerox 1995,6.48,1,0.0,3.1104,2016-09-17,2016-09-22
1/31/2015,2/5/2015,Second Class,KB-16315,Karl Braun,Consumer,United States,Minneapolis,Minnesota,55407,Central,Office Supplies,Paper,Xerox 1999,12.96,2,0.0,6.2208,2015-01-31,2015-02-05
1/31/2015,2/5/2015,Second Class,KB-16315,Karl Braun,Consumer,United States,Minneapolis,Minnesota,55407,Central,Furniture,Furnishings,"Seth Thomas 13 1/2"" Wall Clock",53.34,3,0.0,16.5354,2015-01-31,2015-02-05
1/31/2015,2/5/2015,Second Class,KB-16315,Karl Braun,Consumer,United States,Minneapolis,Minnesota,55407,Central,Office Supplies,Binders,Ibico Standard Transparent Covers,32.96,2,0.0,16.1504,2015-01-31,2015-02-05
11/6/2017,11/12/2017,Standard Class,RB-19705,Roger Barcio,Home Office,United States,Portland,Oregon,97206,West,Office Supplies,Binders,Flexible Leather- Look Classic Collection Ring Binder,5.682,1,0.7,-3.788,2017-11-06,2017-11-12
11/9/2017,11/11/2017,Second Class,PN-18775,Parhena Norris,Home Office,United States,New York City,New York,10009,East,Furniture,Furnishings,9-3/4 Diameter Round Wall Clock,96.53,7,0.0,40.5426,2017-11-09,2017-11-11
6/17/2017,6/20/2017,First Class,KD-16345,Katherine Ducich,Consumer,United States,San Francisco,California,94122,West,Office Supplies,Binders,Trimflex Flexible Post Binders,51.312,3,0.2,17.9592,2017-06-17,2017-06-20
9/6/2016,9/11/2016,Standard Class,ER-13855,Elpida Rittenbach,Corporate,United States,Saint Paul,Minnesota,55106,Central,Office Supplies,Appliances,Fellowes Basic Home/Office Series Surge Protectors,77.88,6,0.0,22.5852,2016-09-06,2016-09-11
8/29/2016,9/2/2016,Standard Class,RB-19465,Rick Bensley,Home Office,United States,Chicago,Illinois,60610,Central,Office Supplies,Paper,Avery Personal Creations Heavyweight Cards,64.624,7,0.2,22.6184,2016-08-29,2016-09-02
8/29/2016,9/2/2016,Standard Class,RB-19465,Rick Bensley,Home Office,United States,Chicago,Illinois,60610,Central,Technology,Accessories,SanDisk Ultra 64 GB MicroSDHC Class 10 Memory Card,95.976,3,0.2,-10.7973,2016-08-29,2016-09-02
8/29/2016,9/2/2016,Standard Class,RB-19465,Rick Bensley,Home Office,United States,Chicago,Illinois,60610,Central,Office Supplies,Binders,Avery Hidden Tab Dividers for Binding Systems,1.788,3,0.8,-3.0396,2016-08-29,2016-09-02
12/1/2016,12/4/2016,Second Class,GZ-14470,Gary Zandusky,Consumer,United States,Rochester,Minnesota,55901,Central,Office Supplies,Paper,Universal Premium White Copier/Laser Paper (20Lb. and 87 Bright),23.92,4,0.0,11.7208,2016-12-01,2016-12-04
11/13/2015,11/17/2015,Standard Class,LC-16870,Lena Cacioppo,Consumer,United States,Aurora,Colorado,80013,West,Technology,Accessories,Logitech K350 2.4Ghz Wireless Keyboard,238.896,6,0.2,-26.8758,2015-11-13,2015-11-17
11/13/2015,11/17/2015,Standard Class,LC-16870,Lena Cacioppo,Consumer,United States,Aurora,Colorado,80013,West,Furniture,Furnishings,"Deflect-o DuraMat Lighweight, Studded, Beveled Mat for Low Pile Carpeting",102.36,3,0.2,-3.8385,2015-11-13,2015-11-17
11/13/2015,11/17/2015,Standard Class,LC-16870,Lena Cacioppo,Consumer,United States,Aurora,Colorado,80013,West,Office Supplies,Binders,"Avery Trapezoid Ring Binder, 3"" Capacity, Black, 1040 sheets",36.882,3,0.7,-25.8174,2015-11-13,2015-11-17
11/23/2017,11/28/2017,Standard Class,JM-15250,Janet Martin,Consumer,United States,Charlotte,North Carolina,28205,South,Technology,Accessories,Memorex Mini Travel Drive 8 GB USB 2.0 Flash Drive,74.112,8,0.2,17.6016,2017-11-23,2017-11-28
11/23/2017,11/28/2017,Standard Class,JM-15250,Janet Martin,Consumer,United States,Charlotte,North Carolina,28205,South,Technology,Phones,Speck Products Candyshell Flip Case,27.992,1,0.2,2.0994,2017-11-23,2017-11-28
11/23/2017,11/28/2017,Standard Class,JM-15250,Janet Martin,Consumer,United States,Charlotte,North Carolina,28205,South,Office Supplies,Art,Newell Chalk Holder,3.304,1,0.2,1.0738,2017-11-23,2017-11-28
10/15/2015,10/20/2015,Standard Class,PA-19060,Pete Armstrong,Home Office,United States,Orland Park,Illinois,60462,Central,Technology,Accessories,Logitech Gaming G510s - Keyboard,339.96,5,0.2,67.992,2015-10-15,2015-10-20
12/25/2017,12/30/2017,Standard Class,CV-12805,Cynthia Voltz,Corporate,United States,New York City,New York,10035,East,Furniture,Furnishings,Magnifier Swing Arm Lamp,41.96,2,0.0,10.9096,2017-12-25,2017-12-30
11/3/2016,11/10/2016,Standard Class,CL-12565,Clay Ludtke,Consumer,United States,Urbandale,Iowa,50322,Central,Office Supplies,Art,"Hunt PowerHouse Electric Pencil Sharpener, Blue",75.96,2,0.0,22.788,2016-11-03,2016-11-10
11/3/2016,11/10/2016,Standard Class,CL-12565,Clay Ludtke,Consumer,United States,Urbandale,Iowa,50322,Central,Office Supplies,Binders,"Avery Durable Plastic 1"" Binders",27.24,6,0.0,13.3476,2016-11-03,2016-11-10
8/25/2014,8/27/2014,Second Class,RC-19960,Ryan Crowe,Consumer,United States,Columbus,Ohio,43229,East,Office Supplies,Fasteners,"OIC Colored Binder Clips, Assorted Sizes",40.096,14,0.2,14.5348,2014-08-25,2014-08-27
8/25/2014,8/27/2014,Second Class,RC-19960,Ryan Crowe,Consumer,United States,Columbus,Ohio,43229,East,Office Supplies,Envelopes,"Redi-Strip #10 Envelopes, 4 1/8 x 9 1/2",4.72,2,0.2,1.652,2014-08-25,2014-08-27
8/25/2014,8/27/2014,Second Class,RC-19960,Ryan Crowe,Consumer,United States,Columbus,Ohio,43229,East,Office Supplies,Paper,Xerox 1921,23.976,3,0.2,7.4925,2014-08-25,2014-08-27
8/25/2014,8/27/2014,Second Class,RC-19960,Ryan Crowe,Consumer,United States,Columbus,Ohio,43229,East,Office Supplies,Envelopes,"Tyvek  Top-Opening Peel & Seel Envelopes, Plain White",130.464,6,0.2,44.0316,2014-08-25,2014-08-27
3/2/2015,3/6/2015,Standard Class,DK-13090,Dave Kipp,Consumer,United States,Seattle,Washington,98103,West,Furniture,Tables,Hon Racetrack Conference Tables,787.53,3,0.0,165.3813,2015-03-02,2015-03-06
4/5/2015,4/10/2015,Standard Class,GG-14650,Greg Guthrie,Corporate,United States,Bristol,Tennessee,37620,South,Office Supplies,Binders,GBC DocuBind 300 Electric Binding Machine,157.794,1,0.7,-115.7156,2015-04-05,2015-04-10
6/12/2016,6/15/2016,First Class,SC-20725,Steven Cartwright,Consumer,United States,Wilmington,Delaware,19805,East,Furniture,Furnishings,Artistic Insta-Plaque,47.04,3,0.0,18.3456,2016-06-12,2016-06-15
6/12/2016,6/15/2016,First Class,SC-20725,Steven Cartwright,Consumer,United States,Wilmington,Delaware,19805,East,Office Supplies,Binders,DXL Angle-View Binders with Locking Rings by Samsill,30.84,4,0.0,13.878,2016-06-12,2016-06-15
6/12/2016,6/15/2016,First Class,SC-20725,Steven Cartwright,Consumer,United States,Wilmington,Delaware,19805,East,Office Supplies,Storage,"Companion Letter/Legal File, Black",226.56,6,0.0,63.4368,2016-06-12,2016-06-15
6/12/2016,6/15/2016,First Class,SC-20725,Steven Cartwright,Consumer,United States,Wilmington,Delaware,19805,East,Office Supplies,Envelopes,Globe Weis Peel & Seel First Class Envelopes,115.02,9,0.0,51.759,2016-06-12,2016-06-15
6/12/2016,6/15/2016,First Class,SC-20725,Steven Cartwright,Consumer,United States,Wilmington,Delaware,19805,East,Technology,Phones,KLD Oscar II Style Snap-on Ultra Thin Side Flip Synthetic Leather Cover Case for HTC One HTC M7,68.04,7,0.0,19.7316,2016-06-12,2016-06-15
12/26/2014,12/28/2014,Second Class,AD-10180,Alan Dominguez,Home Office,United States,Houston,Texas,77041,Central,Furniture,Chairs,Global Deluxe High-Back Manager's Chair,600.558,3,0.3,-8.5794,2014-12-26,2014-12-28
9/20/2014,9/25/2014,Standard Class,PF-19165,Philip Fox,Consumer,United States,Bloomington,Illinois,61701,Central,Furniture,Tables,Bevis 44 x 96 Conference Tables,617.7,6,0.5,-407.682,2014-09-20,2014-09-25
11/5/2017,11/12/2017,Standard Class,TS-21610,Troy Staebel,Consumer,United States,Phoenix,Arizona,85023,West,Office Supplies,Binders,"Avery Durable Slant Ring Binders, No Labels",2.388,2,0.7,-1.8308,2017-11-05,2017-11-12
11/5/2017,11/12/2017,Standard Class,TS-21610,Troy Staebel,Consumer,United States,Phoenix,Arizona,85023,West,Office Supplies,Storage,"Trav-L-File Heavy-Duty Shuttle II, Black",243.992,7,0.2,30.499,2017-11-05,2017-11-12
11/6/2016,11/10/2016,Second Class,LS-16975,Lindsay Shagiari,Home Office,United States,Los Angeles,California,90004,West,Furniture,Chairs,"Global Task Chair, Black",81.424,2,0.2,-9.1602,2016-11-06,2016-11-10
11/6/2016,11/10/2016,Second Class,LS-16975,Lindsay Shagiari,Home Office,United States,Los Angeles,California,90004,West,Furniture,Furnishings,Eldon Cleatmat Plus Chair Mats for High Pile Carpets,238.56,3,0.0,26.2416,2016-11-06,2016-11-10
2/2/2017,2/5/2017,First Class,DW-13585,Dorothy Wardle,Corporate,United States,Columbus,Ohio,43229,East,Technology,Phones,Anker 36W 4-Port USB Wall Charger Travel Power Adapter for iPhone 5s 5c 5,59.97,5,0.4,-11.994,2017-02-02,2017-02-05
2/2/2017,2/5/2017,First Class,DW-13585,Dorothy Wardle,Corporate,United States,Columbus,Ohio,43229,East,Office Supplies,Paper,Xerox 1916,78.304,2,0.2,29.364,2017-02-02,2017-02-05
2/2/2017,2/5/2017,First Class,DW-13585,Dorothy Wardle,Corporate,United States,Columbus,Ohio,43229,East,Office Supplies,Fasteners,Staples,21.456,9,0.2,6.9732,2017-02-02,2017-02-05
10/13/2016,10/19/2016,Standard Class,LC-16885,Lena Creighton,Consumer,United States,Roseville,California,95661,West,Office Supplies,Paper,Xerox 195,20.04,3,0.0,9.6192,2016-10-13,2016-10-19
10/13/2016,10/19/2016,Standard Class,LC-16885,Lena Creighton,Consumer,United States,Roseville,California,95661,West,Office Supplies,Paper,Xerox 1880,35.44,1,0.0,16.6568,2016-10-13,2016-10-19
10/13/2016,10/19/2016,Standard Class,LC-16885,Lena Creighton,Consumer,United States,Roseville,California,95661,West,Office Supplies,Art,"Sanford Colorific Colored Pencils, 12/Box",11.52,4,0.0,3.456,2016-10-13,2016-10-19
10/13/2016,10/19/2016,Standard Class,LC-16885,Lena Creighton,Consumer,United States,Roseville,California,95661,West,Office Supplies,Fasteners,Ideal Clamps,4.02,2,0.0,1.9698,2016-10-13,2016-10-19
10/13/2016,10/19/2016,Standard Class,LC-16885,Lena Creighton,Consumer,United States,Roseville,California,95661,West,Office Supplies,Binders,GBC Wire Binding Strips,76.176,3,0.2,26.6616,2016-10-13,2016-10-19
10/13/2016,10/19/2016,Standard Class,LC-16885,Lena Creighton,Consumer,United States,Roseville,California,95661,West,Office Supplies,Supplies,Fiskars Softgrip Scissors,65.88,6,0.0,18.4464,2016-10-13,2016-10-19
10/13/2016,10/19/2016,Standard Class,LC-16885,Lena Creighton,Consumer,United States,Roseville,California,95661,West,Furniture,Furnishings,Longer-Life Soft White Bulbs,43.12,14,0.0,20.6976,2016-10-13,2016-10-19
9/5/2016,9/7/2016,Second Class,JD-15895,Jonathan Doherty,Corporate,United States,Philadelphia,Pennsylvania,19140,East,Furniture,Furnishings,"Howard Miller 13-3/4"" Diameter Brushed Chrome Round Wall Clock",82.8,2,0.2,10.35,2016-09-05,2016-09-07
9/18/2017,9/23/2017,Standard Class,SH-19975,Sally Hughsby,Corporate,United States,San Francisco,California,94122,West,Office Supplies,Art,Newell 343,8.82,3,0.0,2.3814,2017-09-18,2017-09-23
9/18/2017,9/23/2017,Standard Class,SH-19975,Sally Hughsby,Corporate,United States,San Francisco,California,94122,West,Office Supplies,Envelopes,Convenience Packs of Business Envelopes,10.86,3,0.0,5.1042,2017-09-18,2017-09-23
9/18/2017,9/23/2017,Standard Class,SH-19975,Sally Hughsby,Corporate,United States,San Francisco,California,94122,West,Office Supplies,Paper,Xerox 1911,143.7,3,0.0,68.976,2017-09-18,2017-09-23
12/22/2017,12/27/2017,Standard Class,SG-20080,Sandra Glassco,Consumer,United States,Independence,Missouri,64055,Central,Office Supplies,Appliances,Sanyo 2.5 Cubic Foot Mid-Size Office Refrigerators,839.43,3,0.0,218.2518,2017-12-22,2017-12-27
9/7/2015,9/12/2015,Standard Class,HA-14920,Helen Andreada,Consumer,United States,Pasadena,California,91104,West,Office Supplies,Storage,Safco Industrial Wire Shelving,671.93,7,0.0,20.1579,2015-09-07,2015-09-12
10/22/2014,10/28/2014,Standard Class,MG-17680,Maureen Gastineau,Home Office,United States,Newark,Ohio,43055,East,Furniture,Furnishings,"Seth Thomas 14"" Putty-Colored Wall Clock",93.888,4,0.2,12.9096,2014-10-22,2014-10-28
12/5/2016,12/9/2016,Standard Class,JE-16165,Justin Ellison,Corporate,United States,Franklin,Wisconsin,53132,Central,Technology,Phones,Plantronics Cordless Phone Headset with In-line Volume - M214C,384.45,11,0.0,103.8015,2016-12-05,2016-12-09
12/5/2016,12/9/2016,Standard Class,JE-16165,Justin Ellison,Corporate,United States,Franklin,Wisconsin,53132,Central,Technology,Phones,Anker Astro 15000mAh USB Portable Charger,149.97,3,0.0,5.9988,2016-12-05,2016-12-09
12/5/2016,12/9/2016,Standard Class,JE-16165,Justin Ellison,Corporate,United States,Franklin,Wisconsin,53132,Central,Furniture,Chairs,"Hon Deluxe Fabric Upholstered Stacking Chairs, Rounded Back",1951.84,8,0.0,585.552,2016-12-05,2016-12-09
12/5/2016,12/9/2016,Standard Class,JE-16165,Justin Ellison,Corporate,United States,Franklin,Wisconsin,53132,Central,Office Supplies,Binders,GBC Prestige Therm-A-Bind Covers,171.55,5,0.0,80.6285,2016-12-05,2016-12-09
3/13/2016,3/16/2016,First Class,TW-21025,Tamara Willingham,Home Office,United States,Scottsdale,Arizona,85254,West,Office Supplies,Appliances,Belkin 7 Outlet SurgeMaster Surge Protector with Phone Protection,157.92,5,0.2,17.766,2016-03-13,2016-03-16
3/13/2016,3/16/2016,First Class,TW-21025,Tamara Willingham,Home Office,United States,Scottsdale,Arizona,85254,West,Technology,Phones,Jabra BIZ 2300 Duo QD Duo Corded Headset,203.184,2,0.2,15.2388,2016-03-13,2016-03-16
5/31/2015,6/2/2015,First Class,SP-20650,Stephanie Phelps,Corporate,United States,San Jose,California,95123,West,Office Supplies,Paper,Southworth 25% Cotton Antique Laid Paper & Envelopes,58.38,7,0.0,26.271,2015-05-31,2015-06-02
5/31/2015,6/2/2015,First Class,SP-20650,Stephanie Phelps,Corporate,United States,San Jose,California,95123,West,Office Supplies,Paper,Xerox 1883,105.52,4,0.0,48.5392,2015-05-31,2015-06-02
5/31/2015,6/2/2015,First Class,SP-20650,Stephanie Phelps,Corporate,United States,San Jose,California,95123,West,Office Supplies,Storage,"Tenex Personal Project File with Scoop Front Design, Black",80.88,6,0.0,21.0288,2015-05-31,2015-06-02
5/28/2015,6/3/2015,Standard Class,NK-18490,Neil Knudson,Home Office,United States,Seattle,Washington,98105,West,Office Supplies,Art,Newell 311,6.63,3,0.0,1.7901,2015-05-28,2015-06-03
3/1/2014,3/6/2014,Second Class,DB-13060,Dave Brooks,Consumer,United States,Seattle,Washington,98115,West,Furniture,Chairs,Global Deluxe High-Back Manager's Chair,457.568,2,0.2,51.4764,2014-03-01,2014-03-06
11/20/2016,11/24/2016,Standard Class,NP-18670,Nora Paige,Consumer,United States,Edmond,Oklahoma,73034,Central,Office Supplies,Labels,Avery 519,14.62,2,0.0,6.8714,2016-11-20,2016-11-24
11/20/2016,11/24/2016,Standard Class,NP-18670,Nora Paige,Consumer,United States,Edmond,Oklahoma,73034,Central,Technology,Phones,Avaya 5420 Digital phone,944.93,7,0.0,236.2325,2016-11-20,2016-11-24
5/11/2016,5/12/2016,First Class,TT-21070,Ted Trevino,Consumer,United States,Los Angeles,California,90045,West,Office Supplies,Paper,Xerox 1920,5.98,1,0.0,2.691,2016-05-11,2016-05-12
12/28/2015,12/31/2015,Second Class,EM-13960,Eric Murdock,Consumer,United States,Philadelphia,Pennsylvania,19134,East,Technology,Accessories,Lenovo 17-Key USB Numeric Keypad,54.384,2,0.2,1.3596,2015-12-28,2015-12-31
11/16/2016,11/20/2016,Standard Class,RD-19900,Ruben Dartt,Consumer,United States,Carlsbad,New Mexico,88220,West,Office Supplies,Envelopes,Staple envelope,28.4,5,0.0,13.348,2016-11-16,2016-11-20
11/7/2016,11/11/2016,Standard Class,MJ-17740,Max Jones,Consumer,United States,Seattle,Washington,98115,West,Office Supplies,Binders,Wilson Jones International Size A4 Ring Binders,27.68,2,0.2,9.688,2016-11-07,2016-11-11
9/8/2014,9/12/2014,Standard Class,BM-11140,Becky Martin,Consumer,United States,San Antonio,Texas,78207,Central,Office Supplies,Art,BIC Brite Liner Highlighters,9.936,3,0.2,2.7324,2014-09-08,2014-09-12
9/8/2014,9/12/2014,Standard Class,BM-11140,Becky Martin,Consumer,United States,San Antonio,Texas,78207,Central,Technology,Machines,Lexmark MX611dhe Monochrome Laser Printer,8159.952,8,0.4,-1359.992,2014-09-08,2014-09-12
9/8/2014,9/12/2014,Standard Class,BM-11140,Becky Martin,Consumer,United States,San Antonio,Texas,78207,Central,Office Supplies,Storage,Space Solutions HD Industrial Steel Shelving.,275.928,3,0.2,-58.6347,2014-09-08,2014-09-12
9/8/2014,9/12/2014,Standard Class,BM-11140,Becky Martin,Consumer,United States,San Antonio,Texas,78207,Central,Furniture,Chairs,SAFCO Arco Folding Chair,1740.06,9,0.3,-24.858,2014-09-08,2014-09-12
9/8/2014,9/12/2014,Standard Class,BM-11140,Becky Martin,Consumer,United States,San Antonio,Texas,78207,Central,Office Supplies,Art,Sanford Liquid Accent Highlighters,32.064,6,0.2,6.8136,2014-09-08,2014-09-12
9/8/2014,9/12/2014,Standard Class,BM-11140,Becky Martin,Consumer,United States,San Antonio,Texas,78207,Central,Office Supplies,Appliances,Kensington 7 Outlet MasterPiece Power Center,177.98,5,0.8,-453.849,2014-09-08,2014-09-12
9/8/2014,9/12/2014,Standard Class,BM-11140,Becky Martin,Consumer,United States,San Antonio,Texas,78207,Central,Technology,Phones,JBL Micro Wireless Portable Bluetooth Speaker,143.976,3,0.2,8.9985,2014-09-08,2014-09-12
8/5/2014,8/9/2014,Standard Class,CS-12130,Chad Sievert,Consumer,United States,Los Angeles,California,90004,West,Office Supplies,Paper,"Adams Phone Message Book, Professional, 400 Message Capacity, 5 3/6 x 11",20.94,3,0.0,9.8418,2014-08-05,2014-08-09
8/5/2014,8/9/2014,Standard Class,CS-12130,Chad Sievert,Consumer,United States,Los Angeles,California,90004,West,Office Supplies,Paper,Xerox 1913,110.96,2,0.0,53.2608,2014-08-05,2014-08-09
8/5/2014,8/9/2014,Standard Class,CS-12130,Chad Sievert,Consumer,United States,Los Angeles,California,90004,West,Furniture,Chairs,"Global Value Steno Chair, Gray",340.144,7,0.2,21.259,2014-08-05,2014-08-09
9/14/2014,9/19/2014,Standard Class,JB-15400,Jennifer Braxton,Corporate,United States,Chicago,Illinois,60623,Central,Office Supplies,Appliances,Kensington 7 Outlet MasterPiece HOMEOFFICE Power Control Center,52.448,2,0.8,-131.12,2014-09-14,2014-09-19
9/14/2014,9/19/2014,Standard Class,JB-15400,Jennifer Braxton,Corporate,United States,Chicago,Illinois,60623,Central,Office Supplies,Labels,Avery 51,20.16,4,0.2,6.552,2014-09-14,2014-09-19
4/21/2017,4/25/2017,Second Class,SJ-20500,Shirley Jackson,Consumer,United States,Houston,Texas,77036,Central,Office Supplies,Appliances,"Acco 7-Outlet Masterpiece Power Center, Wihtout Fax/Phone Line Protection",97.264,4,0.8,-243.16,2017-04-21,2017-04-25
11/21/2015,11/23/2015,Second Class,JE-15745,Joel Eaton,Consumer,United States,Newark,Ohio,43055,East,Furniture,Chairs,"Padded Folding Chairs, Black, 4/Carton",396.802,7,0.3,-11.3372,2015-11-21,2015-11-23
11/21/2015,11/23/2015,Second Class,JE-15745,Joel Eaton,Consumer,United States,Newark,Ohio,43055,East,Office Supplies,Supplies,Acme Rosewood Handle Letter Opener,15.88,5,0.2,-3.7715,2015-11-21,2015-11-23
12/15/2015,12/19/2015,Standard Class,JK-15640,Jim Kriz,Home Office,United States,New York City,New York,10009,East,Office Supplies,Art,"Sanford Colorific Eraseable Coloring Pencils, 12 Count",3.28,1,0.0,1.4104,2015-12-15,2015-12-19
12/5/2014,12/9/2014,Second Class,DK-13150,David Kendrick,Corporate,United States,Decatur,Illinois,62521,Central,Office Supplies,Storage,"Tenex File Box, Personal Filing Tote with Lid, Black",24.816,2,0.2,1.8612,2014-12-05,2014-12-09
12/5/2014,12/9/2014,Second Class,DK-13150,David Kendrick,Corporate,United States,Decatur,Illinois,62521,Central,Technology,Accessories,Imation Secure+ Hardware Encrypted USB 2.0 Flash Drive; 16GB,408.744,7,0.2,76.6395,2014-12-05,2014-12-09
11/19/2014,11/24/2014,Second Class,RM-19675,Robert Marley,Home Office,United States,Monroe,Louisiana,71203,South,Technology,Phones,AT&T TR1909W,503.96,4,0.0,131.0296,2014-11-19,2014-11-24
11/19/2014,11/24/2014,Second Class,RM-19675,Robert Marley,Home Office,United States,Monroe,Louisiana,71203,South,Technology,Phones,Nokia Lumia 521 (T-Mobile),149.95,5,0.0,41.986,2014-11-19,2014-11-24
11/19/2014,11/24/2014,Second Class,RM-19675,Robert Marley,Home Office,United States,Monroe,Louisiana,71203,South,Technology,Accessories,HP Standard 104 key PS/2 Keyboard,29.0,2,0.0,7.25,2014-11-19,2014-11-24
11/28/2016,12/2/2016,Standard Class,SK-19990,Sally Knutson,Consumer,United States,Fairfield,Connecticut,6824,East,Office Supplies,Binders,Avery Poly Binder Pockets,7.16,2,0.0,3.4368,2016-11-28,2016-12-02
8/26/2014,8/30/2014,Standard Class,FM-14290,Frank Merwin,Home Office,United States,Los Angeles,California,90032,West,Technology,Accessories,SanDisk Ultra 32 GB MicroSDHC Class 10 Memory Card,176.8,8,0.0,22.984,2014-08-26,2014-08-30
7/16/2016,7/22/2016,Standard Class,AM-10360,Alice McCarthy,Corporate,United States,Grand Prairie,Texas,75051,Central,Office Supplies,Storage,"Personal Filing Tote with Lid, Black/Gray",37.224,3,0.2,3.7224,2016-07-16,2016-07-22
7/16/2016,7/22/2016,Standard Class,AM-10360,Alice McCarthy,Corporate,United States,Grand Prairie,Texas,75051,Central,Office Supplies,Paper,Southworth 25% Cotton Antique Laid Paper & Envelopes,20.016,3,0.2,6.255,2016-07-16,2016-07-22
10/12/2015,10/14/2015,First Class,MP-17470,Mark Packer,Home Office,United States,New York City,New York,10035,East,Furniture,Bookcases,"Atlantic Metals Mobile 4-Shelf Bookcases, Custom Colors",899.136,4,0.2,112.392,2015-10-12,2015-10-14
10/12/2015,10/14/2015,First Class,MP-17470,Mark Packer,Home Office,United States,New York City,New York,10035,East,Technology,Phones,I Need's 3d Hello Kitty Hybrid Silicone Case Cover for HTC One X 4g with 3d Hello Kitty Stylus Pen Green/pink,71.76,6,0.0,20.0928,2015-10-12,2015-10-14
10/12/2015,10/14/2015,First Class,MP-17470,Mark Packer,Home Office,United States,New York City,New York,10035,East,Office Supplies,Paper,Xerox 205,51.84,8,0.0,24.8832,2015-10-12,2015-10-14
10/12/2015,10/14/2015,First Class,MP-17470,Mark Packer,Home Office,United States,New York City,New York,10035,East,Furniture,Bookcases,"Atlantic Metals Mobile 3-Shelf Bookcases, Custom Colors",626.352,3,0.2,46.9764,2015-10-12,2015-10-14
10/12/2015,10/14/2015,First Class,MP-17470,Mark Packer,Home Office,United States,New York City,New York,10035,East,Office Supplies,Art,4009 Highlighters by Sanford,19.9,5,0.0,6.567,2015-10-12,2015-10-14
10/31/2015,11/6/2015,Standard Class,MZ-17515,Mary Zewe,Corporate,United States,Redlands,California,92374,West,Office Supplies,Envelopes,Poly String Tie Envelopes,14.28,7,0.0,6.7116,2015-10-31,2015-11-06
3/21/2014,3/25/2014,Standard Class,CB-12025,Cassandra Brandow,Consumer,United States,Hamilton,Ohio,45011,East,Office Supplies,Art,"Binney & Smith Crayola Metallic Colored Pencils, 8-Color Set",7.408,2,0.2,1.2038,2014-03-21,2014-03-25
3/21/2014,3/25/2014,Standard Class,CB-12025,Cassandra Brandow,Consumer,United States,Hamilton,Ohio,45011,East,Office Supplies,Art,"Binney & Smith inkTank Erasable Desk Highlighter, Chisel Tip, Yellow, 12/Box",6.048,3,0.2,1.5876,2014-03-21,2014-03-25
11/6/2017,11/13/2017,Standard Class,VM-21685,Valerie Mitchum,Home Office,United States,Westfield,New Jersey,7090,East,Office Supplies,Storage,Decoflex Hanging Personal Folder File,46.26,3,0.0,12.0276,2017-11-06,2017-11-13
7/6/2017,7/13/2017,Standard Class,FH-14365,Fred Hopkins,Corporate,United States,Philadelphia,Pennsylvania,19120,East,Office Supplies,Binders,"Pressboard Covers with Storage Hooks, 9 1/2"" x 11"", Light Blue",2.946,2,0.7,-2.2586,2017-07-06,2017-07-13
7/6/2017,7/13/2017,Standard Class,FH-14365,Fred Hopkins,Corporate,United States,Philadelphia,Pennsylvania,19120,East,Office Supplies,Paper,"Wirebound Message Books, 5-1/2 x 4 Forms, 2 or 4 Forms per Page",16.056,3,0.2,5.8203,2017-07-06,2017-07-13
6/24/2017,6/29/2017,Standard Class,MB-17305,Maria Bertelson,Consumer,United States,Akron,Ohio,44312,East,Office Supplies,Paper,Southworth 25% Cotton Linen-Finish Paper & Envelopes,21.744,3,0.2,6.795,2017-06-24,2017-06-29
8/3/2014,8/5/2014,First Class,BS-11755,Bruce Stewart,Consumer,United States,Denver,Colorado,80219,West,Furniture,Tables,BoxOffice By Design Rectangular and Half-Moon Meeting Room Tables,218.75,2,0.5,-161.875,2014-08-03,2014-08-05
8/3/2014,8/5/2014,First Class,BS-11755,Bruce Stewart,Consumer,United States,Denver,Colorado,80219,West,Office Supplies,Appliances,"Bravo II Megaboss 12-Amp Hard Body Upright, Replacement Belts, 2 Belts per Pack",2.6,1,0.2,0.2925,2014-08-03,2014-08-05
12/17/2017,12/21/2017,Second Class,LC-17140,Logan Currie,Consumer,United States,Dallas,Texas,75220,Central,Office Supplies,Appliances,Eureka Sanitaire  Commercial Upright,66.284,2,0.8,-178.9668,2017-12-17,2017-12-21
6/3/2017,6/7/2017,Standard Class,HK-14890,Heather Kirkland,Corporate,United States,Franklin,Tennessee,37064,South,Furniture,Furnishings,"Eldon 200 Class Desk Accessories, Burgundy",35.168,7,0.2,9.6712,2017-06-03,2017-06-07
12/9/2017,12/14/2017,Standard Class,LE-16810,Laurel Elliston,Consumer,United States,Whittier,California,90604,West,Technology,Phones,Nortel Business Series Terminal T7208 Digital phone,444.768,4,0.2,44.4768,2017-12-09,2017-12-14
12/1/2017,12/7/2017,Standard Class,JH-15985,Joseph Holt,Consumer,United States,Saginaw,Michigan,48601,Central,Office Supplies,Storage,"Tennsco Lockers, Gray",83.92,4,0.0,5.8744,2017-12-01,2017-12-07
12/1/2017,12/7/2017,Standard Class,JH-15985,Joseph Holt,Consumer,United States,Saginaw,Michigan,48601,Central,Technology,Phones,Panasonic KX-TG6844B Expandable Digital Cordless Telephone,131.98,2,0.0,35.6346,2017-12-01,2017-12-07
12/1/2017,12/7/2017,Standard Class,JH-15985,Joseph Holt,Consumer,United States,Saginaw,Michigan,48601,Central,Office Supplies,Binders,"Avery Durable Slant Ring Binders, No Labels",15.92,4,0.0,7.4824,2017-12-01,2017-12-07
12/1/2017,12/7/2017,Standard Class,JH-15985,Joseph Holt,Consumer,United States,Saginaw,Michigan,48601,Central,Office Supplies,Fasteners,"Advantus Push Pins, Aluminum Head",52.29,9,0.0,16.2099,2017-12-01,2017-12-07
12/1/2017,12/7/2017,Standard Class,JH-15985,Joseph Holt,Consumer,United States,Saginaw,Michigan,48601,Central,Office Supplies,Storage,"Gould Plastics 18-Pocket Panel Bin, 34w x 5-1/4d x 20-1/2h",91.99,1,0.0,3.6796,2017-12-01,2017-12-07
2/9/2015,2/13/2015,Second Class,MS-17980,Michael Stewart,Corporate,United States,Dallas,Texas,75220,Central,Technology,Accessories,Memorex Micro Travel Drive 8 GB,20.8,2,0.2,6.5,2015-02-09,2015-02-13
1/2/2015,1/9/2015,Standard Class,VW-21775,Victoria Wilson,Corporate,United States,Medina,Ohio,44256,East,Office Supplies,Labels,Avery 505,23.68,2,0.2,8.88,2015-01-02,2015-01-09
1/2/2015,1/9/2015,Standard Class,VW-21775,Victoria Wilson,Corporate,United States,Medina,Ohio,44256,East,Furniture,Bookcases,O'Sullivan 2-Door Barrister Bookcase in Odessa Pine,452.45,5,0.5,-244.323,2015-01-02,2015-01-09
1/2/2015,1/9/2015,Standard Class,VW-21775,Victoria Wilson,Corporate,United States,Medina,Ohio,44256,East,Technology,Phones,Speck Products Candyshell Flip Case,62.982,3,0.4,-14.6958,2015-01-02,2015-01-09
1/2/2015,1/9/2015,Standard Class,VW-21775,Victoria Wilson,Corporate,United States,Medina,Ohio,44256,East,Technology,Machines,Cisco 9971 IP Video Phone Charcoal,1188.0,9,0.7,-950.4,2015-01-02,2015-01-09
1/2/2015,1/9/2015,Standard Class,VW-21775,Victoria Wilson,Corporate,United States,Medina,Ohio,44256,East,Technology,Accessories,Sony Micro Vault Click 16 GB USB 2.0 Flash Drive,89.584,2,0.2,4.4792,2015-01-02,2015-01-09
10/28/2016,11/1/2016,Standard Class,JH-15910,Jonathan Howell,Consumer,United States,Los Angeles,California,90032,West,Office Supplies,Storage,"Personal Filing Tote with Lid, Black/Gray",93.06,6,0.0,26.0568,2016-10-28,2016-11-01
10/28/2016,11/1/2016,Standard Class,JH-15910,Jonathan Howell,Consumer,United States,Los Angeles,California,90032,West,Technology,Phones,Adtran 1202752G1,302.376,3,0.2,22.6782,2016-10-28,2016-11-01
12/24/2015,12/27/2015,First Class,JB-15925,Joni Blumstein,Consumer,United States,Dublin,Ohio,43017,East,Office Supplies,Fasteners,OIC Bulk Pack Metal Binder Clips,5.584,2,0.2,1.8148,2015-12-24,2015-12-27
12/24/2015,12/27/2015,First Class,JB-15925,Joni Blumstein,Consumer,United States,Dublin,Ohio,43017,East,Office Supplies,Paper,"While You Were Out Pads, 50 per Pad, 4 x 5 1/4, Green Cycle",22.704,6,0.2,8.2302,2015-12-24,2015-12-27
12/24/2015,12/27/2015,First Class,JB-15925,Joni Blumstein,Consumer,United States,Dublin,Ohio,43017,East,Office Supplies,Binders,Ibico Standard Transparent Covers,19.776,4,0.7,-13.8432,2015-12-24,2015-12-27
12/24/2015,12/27/2015,First Class,JB-15925,Joni Blumstein,Consumer,United States,Dublin,Ohio,43017,East,Furniture,Furnishings,"Executive Impressions 14"" Two-Color Numerals Wall Clock",72.704,4,0.2,19.0848,2015-12-24,2015-12-27
12/24/2015,12/27/2015,First Class,JB-15925,Joni Blumstein,Consumer,United States,Dublin,Ohio,43017,East,Technology,Machines,Swingline SM12-08 MicroCut Jam Free Shredder,479.988,4,0.7,-383.9904,2015-12-24,2015-12-27
12/24/2015,12/27/2015,First Class,JB-15925,Joni Blumstein,Consumer,United States,Dublin,Ohio,43017,East,Office Supplies,Art,Stanley Bostitch Contemporary Electric Pencil Sharpeners,27.168,2,0.2,2.7168,2015-12-24,2015-12-27
8/9/2015,8/16/2015,Standard Class,DS-13180,David Smith,Corporate,United States,Detroit,Michigan,48227,Central,Office Supplies,Art,"Sanford Uni-Blazer View Highlighters, Chisel Tip, Yellow",2.2,1,0.0,0.968,2015-08-09,2015-08-16
8/9/2015,8/16/2015,Standard Class,DS-13180,David Smith,Corporate,United States,Detroit,Michigan,48227,Central,Furniture,Tables,Bevis 36 x 72 Conference Tables,622.45,5,0.0,136.939,2015-08-09,2015-08-16
8/9/2015,8/16/2015,Standard Class,DS-13180,David Smith,Corporate,United States,Detroit,Michigan,48227,Central,Office Supplies,Storage,Rogers Deluxe File Chest,21.98,1,0.0,0.2198,2015-08-09,2015-08-16
2/28/2015,3/4/2015,Standard Class,VD-21670,Valerie Dominguez,Consumer,United States,Columbia,Tennessee,38401,South,Furniture,Chairs,Global Low Back Tilter Chair,161.568,2,0.2,-28.2744,2015-02-28,2015-03-04
2/28/2015,3/4/2015,Standard Class,VD-21670,Valerie Dominguez,Consumer,United States,Columbia,Tennessee,38401,South,Furniture,Chairs,"Global Push Button Manager's Chair, Indigo",389.696,8,0.2,43.8408,2015-02-28,2015-03-04
9/13/2014,9/17/2014,Standard Class,EA-14035,Erin Ashbrook,Corporate,United States,Charlotte,North Carolina,28205,South,Office Supplies,Binders,GBC Instant Index System for Binding Systems,18.648,7,0.7,-12.432,2014-09-13,2014-09-17
4/7/2017,4/12/2017,Standard Class,CS-12400,Christopher Schild,Home Office,United States,Tampa,Florida,33614,South,Furniture,Tables,Bush Advantage Collection Round Conference Table,233.86,2,0.45,-102.048,2017-04-07,2017-04-12
4/7/2017,4/12/2017,Standard Class,CS-12400,Christopher Schild,Home Office,United States,Tampa,Florida,33614,South,Furniture,Tables,Bretford Rectangular Conference Table Tops,620.6145,3,0.45,-248.2458,2017-04-07,2017-04-12
4/7/2017,4/12/2017,Standard Class,CS-12400,Christopher Schild,Home Office,United States,Tampa,Florida,33614,South,Office Supplies,Binders,GBC Instant Index System for Binding Systems,5.328,2,0.7,-3.552,2017-04-07,2017-04-12
4/7/2017,4/12/2017,Standard Class,CS-12400,Christopher Schild,Home Office,United States,Tampa,Florida,33614,South,Furniture,Furnishings,"Tenex Contemporary Contur Chairmats for Low and Medium Pile Carpet, Computer, 39"" x 49""",258.072,3,0.2,0.0,2017-04-07,2017-04-12
4/7/2017,4/12/2017,Standard Class,CS-12400,Christopher Schild,Home Office,United States,Tampa,Florida,33614,South,Technology,Accessories,Logitech P710e Mobile Speakerphone,617.976,3,0.2,-7.7247,2017-04-07,2017-04-12
11/12/2017,11/16/2017,Standard Class,DB-13120,David Bremer,Corporate,United States,Santa Clara,California,95051,West,Office Supplies,Paper,Xerox 4200 Series MultiUse Premium Copy Paper (20Lb. and 84 Bright),10.56,2,0.0,4.752,2017-11-12,2017-11-16
6/4/2016,6/9/2016,Second Class,KL-16645,Ken Lonsdale,Consumer,United States,Chicago,Illinois,60610,Central,Office Supplies,Paper,Xerox 1957,25.92,5,0.2,9.396,2016-06-04,2016-06-09
6/4/2016,6/9/2016,Second Class,KL-16645,Ken Lonsdale,Consumer,United States,Chicago,Illinois,60610,Central,Furniture,Furnishings,Luxo Professional Fluorescent Magnifier Lamp with Clamp-Mount Base,419.68,5,0.6,-356.728,2016-06-04,2016-06-09
6/4/2016,6/9/2016,Second Class,KL-16645,Ken Lonsdale,Consumer,United States,Chicago,Illinois,60610,Central,Furniture,Furnishings,Staple-based wall hangings,11.688,3,0.6,-4.6752,2016-06-04,2016-06-09
6/4/2016,6/9/2016,Second Class,KL-16645,Ken Lonsdale,Consumer,United States,Chicago,Illinois,60610,Central,Technology,Phones,PureGear Roll-On Screen Protector,31.984,2,0.2,11.1944,2016-06-04,2016-06-09
6/4/2016,6/9/2016,Second Class,KL-16645,Ken Lonsdale,Consumer,United States,Chicago,Illinois,60610,Central,Furniture,Tables,KI Conference Tables,177.225,5,0.5,-120.513,2016-06-04,2016-06-09
6/4/2016,6/9/2016,Second Class,KL-16645,Ken Lonsdale,Consumer,United States,Chicago,Illinois,60610,Central,Furniture,Furnishings,Eldon 100 Class Desk Accessories,4.044,3,0.6,-2.8308,2016-06-04,2016-06-09
6/4/2016,6/9/2016,Second Class,KL-16645,Ken Lonsdale,Consumer,United States,Chicago,Illinois,60610,Central,Office Supplies,Art,"Binney & Smith Crayola Metallic Colored Pencils, 8-Color Set",7.408,2,0.2,1.2038,2016-06-04,2016-06-09
6/1/2014,6/6/2014,Second Class,DW-13480,Dianna Wilson,Home Office,United States,Lakeville,Minnesota,55044,Central,Furniture,Chairs,Global Deluxe High-Back Manager's Chair,2001.86,7,0.0,580.5394,2014-06-01,2014-06-06
6/1/2014,6/6/2014,Second Class,DW-13480,Dianna Wilson,Home Office,United States,Lakeville,Minnesota,55044,Central,Office Supplies,Storage,Safco Steel Mobile File Cart,166.72,2,0.0,41.68,2014-06-01,2014-06-06
6/1/2014,6/6/2014,Second Class,DW-13480,Dianna Wilson,Home Office,United States,Lakeville,Minnesota,55044,Central,Office Supplies,Paper,"Adams Telephone Message Book w/Frequently-Called Numbers Space, 400 Messages per Book",47.88,6,0.0,23.94,2014-06-01,2014-06-06
6/1/2014,6/6/2014,Second Class,DW-13480,Dianna Wilson,Home Office,United States,Lakeville,Minnesota,55044,Central,Office Supplies,Appliances,Honeywell Enviracaire Portable HEPA Air Cleaner for 17' x 22' Room,1503.25,5,0.0,496.0725,2014-06-01,2014-06-06
6/1/2014,6/6/2014,Second Class,DW-13480,Dianna Wilson,Home Office,United States,Lakeville,Minnesota,55044,Central,Office Supplies,Paper,Xerox 205,25.92,4,0.0,12.4416,2014-06-01,2014-06-06
12/10/2016,12/15/2016,Second Class,LH-17155,Logan Haushalter,Consumer,United States,San Francisco,California,94109,West,Furniture,Chairs,"Global Leather Highback Executive Chair with Pneumatic Height Adjustment, Black",321.568,2,0.2,28.1372,2016-12-10,2016-12-15
9/11/2016,9/17/2016,Standard Class,KC-16540,Kelly Collister,Consumer,United States,San Diego,California,92037,West,Office Supplies,Paper,"Wirebound Message Books, Two 4 1/4"" x 5"" Forms per Page",7.61,1,0.0,3.5767,2016-09-11,2016-09-17
9/11/2016,9/17/2016,Standard Class,KC-16540,Kelly Collister,Consumer,United States,San Diego,California,92037,West,Technology,Accessories,Logitech P710e Mobile Speakerphone,3347.37,13,0.0,636.0003,2016-09-11,2016-09-17
12/10/2016,12/13/2016,First Class,DL-13315,Delfina Latchford,Consumer,United States,New York City,New York,10024,East,Office Supplies,Storage,"Fellowes Personal Hanging Folder Files, Navy",80.58,6,0.0,22.5624,2016-12-10,2016-12-13
12/10/2016,12/13/2016,First Class,DL-13315,Delfina Latchford,Consumer,United States,New York City,New York,10024,East,Office Supplies,Envelopes,Tyvek Side-Opening Peel & Seel Expanding Envelopes,361.92,4,0.0,162.864,2016-12-10,2016-12-13
11/28/2015,12/4/2015,Standard Class,DR-12880,Dan Reichenbach,Corporate,United States,Chicago,Illinois,60623,Central,Furniture,Furnishings,Eldon 100 Class Desk Accessories,12.132,9,0.6,-8.4924,2015-11-28,2015-12-04
11/28/2015,12/4/2015,Standard Class,DR-12880,Dan Reichenbach,Corporate,United States,Chicago,Illinois,60623,Central,Office Supplies,Storage,"Belkin 19"" Vented Equipment Shelf, Black",82.368,2,0.2,-19.5624,2015-11-28,2015-12-04
11/28/2015,12/4/2015,Standard Class,DR-12880,Dan Reichenbach,Corporate,United States,Chicago,Illinois,60623,Central,Office Supplies,Storage,"Tenex Personal Project File with Scoop Front Design, Black",53.92,5,0.2,4.044,2015-11-28,2015-12-04
11/28/2015,12/4/2015,Standard Class,DR-12880,Dan Reichenbach,Corporate,United States,Chicago,Illinois,60623,Central,Technology,Phones,Logitech Mobile Speakerphone P710e - speaker phone,647.904,6,0.2,56.6916,2015-11-28,2015-12-04
12/1/2017,12/3/2017,Second Class,CC-12670,Craig Carreira,Consumer,United States,New York City,New York,10009,East,Technology,Accessories,Sabrent 4-Port USB 2.0 Hub,20.37,3,0.0,6.9258,2017-12-01,2017-12-03
12/1/2017,12/3/2017,Second Class,CC-12670,Craig Carreira,Consumer,United States,New York City,New York,10009,East,Office Supplies,Storage,Safco Industrial Shelving,221.55,3,0.0,6.6465,2017-12-01,2017-12-03
12/1/2017,12/3/2017,Second Class,CC-12670,Craig Carreira,Consumer,United States,New York City,New York,10009,East,Office Supplies,Binders,Acco 3-Hole Punch,17.52,5,0.2,6.132,2017-12-01,2017-12-03
6/8/2017,6/12/2017,Standard Class,Dl-13600,Dorris liebe,Corporate,United States,Pasadena,Texas,77506,Central,Office Supplies,Appliances,Eureka Disposable Bags for Sanitaire Vibra Groomer I Upright Vac,1.624,2,0.8,-4.466,2017-06-08,2017-06-12
9/19/2014,9/21/2014,Second Class,SB-20290,Sean Braxton,Corporate,United States,Houston,Texas,77036,Central,Technology,Machines,Lexmark MX611dhe Monochrome Laser Printer,3059.982,3,0.4,-509.997,2014-09-19,2014-09-21
9/19/2014,9/21/2014,Second Class,SB-20290,Sean Braxton,Corporate,United States,Houston,Texas,77036,Central,Technology,Machines,Xerox WorkCentre 6505DN Laser Multifunction Printer,2519.958,7,0.4,-251.9958,2014-09-19,2014-09-21
6/6/2016,6/13/2016,Standard Class,RC-19825,Roy Collins,Consumer,United States,Chicago,Illinois,60610,Central,Technology,Phones,Cisco Small Business SPA 502G VoIP phone,328.224,4,0.2,28.7196,2016-06-06,2016-06-13
11/10/2015,11/15/2015,Standard Class,AH-10210,Alan Hwang,Consumer,United States,Brentwood,California,94513,West,Technology,Accessories,Microsoft Sculpt Comfort Mouse,79.9,2,0.0,35.156,2015-11-10,2015-11-15
6/16/2017,6/20/2017,Standard Class,CB-12535,Claudia Bergmann,Corporate,United States,Chapel Hill,North Carolina,27514,South,Office Supplies,Art,"Quartet Omega Colored Chalk, 12/Pack",14.016,3,0.2,4.7304,2017-06-16,2017-06-20
1/22/2016,1/28/2016,Standard Class,PG-18895,Paul Gonzalez,Consumer,United States,Morristown,New Jersey,7960,East,Office Supplies,Fasteners,Bagged Rubber Bands,7.56,6,0.0,0.3024,2016-01-22,2016-01-28
12/9/2017,12/13/2017,Standard Class,CA-12310,Christine Abelman,Corporate,United States,Cincinnati,Ohio,45231,East,Office Supplies,Storage,Safco Commercial Shelving,37.208,1,0.2,-7.4416,2017-12-09,2017-12-13
12/9/2017,12/13/2017,Standard Class,CA-12310,Christine Abelman,Corporate,United States,Cincinnati,Ohio,45231,East,Office Supplies,Envelopes,"Recycled Interoffice Envelopes with String and Button Closure, 10 x 13",57.576,3,0.2,21.591,2017-12-09,2017-12-13
12/28/2017,1/2/2018,Second Class,KH-16690,Kristen Hastings,Corporate,United States,San Francisco,California,94110,West,Office Supplies,Storage,Adjustable Depth Letter/Legal Cart,725.84,4,0.0,210.4936,2017-12-28,2018-01-02
7/30/2015,7/31/2015,First Class,HA-14920,Helen Andreada,Consumer,United States,San Francisco,California,94109,West,Technology,Accessories,Logitech 910-002974 M325 Wireless Mouse for Web Scrolling,209.93,7,0.0,92.3692,2015-07-30,2015-07-31
7/30/2015,7/31/2015,First Class,HA-14920,Helen Andreada,Consumer,United States,San Francisco,California,94109,West,Furniture,Furnishings,Regeneration Desk Collection,5.28,3,0.0,2.3232,2015-07-30,2015-07-31
7/30/2015,7/31/2015,First Class,HA-14920,Helen Andreada,Consumer,United States,San Francisco,California,94109,West,Office Supplies,Binders,Presstex Flexible Ring Binders,10.92,3,0.2,4.095,2015-07-30,2015-07-31
9/16/2017,9/17/2017,First Class,BB-10990,Barry Blumstein,Corporate,United States,Inglewood,California,90301,West,Office Supplies,Paper,"Ampad Gold Fibre Wirebound Steno Books, 6"" x 9"", Gregg Ruled",8.82,2,0.0,4.0572,2017-09-16,2017-09-17
9/16/2017,9/17/2017,First Class,BB-10990,Barry Blumstein,Corporate,United States,Inglewood,California,90301,West,Office Supplies,Art,Newell 330,5.98,1,0.0,1.5548,2017-09-16,2017-09-17
10/13/2017,10/17/2017,Standard Class,AG-10495,Andrew Gjertsen,Corporate,United States,Philadelphia,Pennsylvania,19140,East,Office Supplies,Paper,"Post-it Important Message Note Pad, Neon Colors, 50 Sheets/Pad",11.648,2,0.2,4.0768,2017-10-13,2017-10-17
10/13/2017,10/17/2017,Standard Class,AG-10495,Andrew Gjertsen,Corporate,United States,Philadelphia,Pennsylvania,19140,East,Office Supplies,Paper,"Adams Write n' Stick Phone Message Book, 11"" X 5 1/4"", 200 Messages",18.176,4,0.2,5.9072,2017-10-13,2017-10-17
10/13/2017,10/17/2017,Standard Class,AG-10495,Andrew Gjertsen,Corporate,United States,Philadelphia,Pennsylvania,19140,East,Office Supplies,Storage,Eldon Simplefile Box Office,59.712,6,0.2,5.9712,2017-10-13,2017-10-17
10/13/2017,10/17/2017,Standard Class,AG-10495,Andrew Gjertsen,Corporate,United States,Philadelphia,Pennsylvania,19140,East,Office Supplies,Labels,Avery 489,24.84,3,0.2,8.694,2017-10-13,2017-10-17
9/26/2015,9/28/2015,Second Class,SC-20725,Steven Cartwright,Consumer,United States,Houston,Texas,77070,Central,Office Supplies,Binders,Round Ring Binders,2.08,5,0.8,-3.432,2015-09-26,2015-09-28
9/26/2015,9/28/2015,Second Class,SC-20725,Steven Cartwright,Consumer,United States,Houston,Texas,77070,Central,Technology,Phones,Bose SoundLink Bluetooth Speaker,1114.4,7,0.2,376.11,2015-09-26,2015-09-28
11/2/2015,11/6/2015,Standard Class,JO-15280,Jas O'Carroll,Consumer,United States,Los Angeles,California,90004,West,Furniture,Tables,"Bevis Round Bullnose 29"" High Table Top",1038.84,5,0.2,51.942,2015-11-02,2015-11-06
9/26/2015,10/2/2015,Standard Class,TB-21520,Tracy Blumstein,Consumer,United States,Portland,Oregon,97206,West,Office Supplies,Paper,Easy-staple paper,141.76,5,0.2,47.844,2015-09-26,2015-10-02
9/26/2015,10/2/2015,Standard Class,TB-21520,Tracy Blumstein,Consumer,United States,Portland,Oregon,97206,West,Technology,Accessories,Microsoft Arc Touch Mouse,239.8,5,0.2,47.96,2015-09-26,2015-10-02
9/26/2015,10/2/2015,Standard Class,TB-21520,Tracy Blumstein,Consumer,United States,Portland,Oregon,97206,West,Office Supplies,Paper,Xerox 216,31.104,6,0.2,10.8864,2015-09-26,2015-10-02
12/18/2016,12/20/2016,Second Class,AH-10195,Alan Haines,Corporate,United States,Tamarac,Florida,33319,South,Office Supplies,Binders,GBC VeloBinder Electric Binding Machine,254.058,7,0.7,-169.372,2016-12-18,2016-12-20
12/18/2016,12/20/2016,Second Class,AH-10195,Alan Haines,Corporate,United States,Tamarac,Florida,33319,South,Office Supplies,Appliances,"Acco 7-Outlet Masterpiece Power Center, Wihtout Fax/Phone Line Protection",194.528,2,0.2,24.316,2016-12-18,2016-12-20
12/18/2016,12/20/2016,Second Class,AH-10195,Alan Haines,Corporate,United States,Tamarac,Florida,33319,South,Office Supplies,Supplies,Premier Automatic Letter Opener,961.48,5,0.2,-204.3145,2016-12-18,2016-12-20
11/20/2016,11/24/2016,Second Class,NZ-18565,Nick Zandusky,Home Office,United States,Columbus,Ohio,43229,East,Office Supplies,Fasteners,Advantus SlideClip Paper Clips,19.096,7,0.2,6.6836,2016-11-20,2016-11-24
11/20/2016,11/24/2016,Second Class,NZ-18565,Nick Zandusky,Home Office,United States,Columbus,Ohio,43229,East,Office Supplies,Labels,Avery 512,18.496,8,0.2,6.2424,2016-11-20,2016-11-24
11/20/2016,11/24/2016,Second Class,NZ-18565,Nick Zandusky,Home Office,United States,Columbus,Ohio,43229,East,Technology,Accessories,Logitech Wireless Gaming Headset G930,255.984,2,0.2,54.3966,2016-11-20,2016-11-24
11/20/2016,11/24/2016,Second Class,NZ-18565,Nick Zandusky,Home Office,United States,Columbus,Ohio,43229,East,Furniture,Bookcases,"Bush Westfield Collection Bookcases, Medium Cherry Finish",86.97,3,0.5,-48.7032,2016-11-20,2016-11-24
12/26/2014,12/28/2014,First Class,KL-16555,Kelly Lampkin,Corporate,United States,Colorado Springs,Colorado,80906,West,Furniture,Furnishings,"Howard Miller 13"" Diameter Goldtone Round Wall Clock",300.416,8,0.2,78.8592,2014-12-26,2014-12-28
12/26/2014,12/28/2014,First Class,KL-16555,Kelly Lampkin,Corporate,United States,Colorado Springs,Colorado,80906,West,Furniture,Chairs,Global Deluxe Office Fabric Chairs,230.352,3,0.2,20.1558,2014-12-26,2014-12-28
12/26/2014,12/28/2014,First Class,KL-16555,Kelly Lampkin,Corporate,United States,Colorado Springs,Colorado,80906,West,Furniture,Furnishings,Eldon ClusterMat Chair Mat with Cordless Antistatic Protection,218.352,3,0.2,-24.5646,2014-12-26,2014-12-28
12/26/2014,12/28/2014,First Class,KL-16555,Kelly Lampkin,Corporate,United States,Colorado Springs,Colorado,80906,West,Office Supplies,Binders,Ibico Laser Imprintable Binding System Covers,78.6,5,0.7,-62.88,2014-12-26,2014-12-28
12/26/2014,12/28/2014,First Class,KL-16555,Kelly Lampkin,Corporate,United States,Colorado Springs,Colorado,80906,West,Office Supplies,Fasteners,"Vinyl Coated Wire Paper Clips in Organizer Box, 800/Box",27.552,3,0.2,9.2988,2014-12-26,2014-12-28
10/28/2016,11/3/2016,Standard Class,JD-15895,Jonathan Doherty,Corporate,United States,Belleville,New Jersey,7109,East,Office Supplies,Paper,Xerox 223,32.4,5,0.0,15.552,2016-10-28,2016-11-03
10/28/2016,11/3/2016,Standard Class,JD-15895,Jonathan Doherty,Corporate,United States,Belleville,New Jersey,7109,East,Office Supplies,Storage,"Tennsco Stur-D-Stor Boltless Shelving, 5 Shelves, 24"" Deep, Sand",1082.48,8,0.0,10.8248,2016-10-28,2016-11-03
10/28/2016,11/3/2016,Standard Class,JD-15895,Jonathan Doherty,Corporate,United States,Belleville,New Jersey,7109,East,Office Supplies,Paper,Xerox 1939,56.91,3,0.0,27.3168,2016-10-28,2016-11-03
10/28/2016,11/3/2016,Standard Class,JD-15895,Jonathan Doherty,Corporate,United States,Belleville,New Jersey,7109,East,Furniture,Furnishings,"Floodlight Indoor Halogen Bulbs, 1 Bulb per Pack, 60 Watts",77.6,4,0.0,38.024,2016-10-28,2016-11-03
10/28/2016,11/3/2016,Standard Class,JD-15895,Jonathan Doherty,Corporate,United States,Belleville,New Jersey,7109,East,Office Supplies,Binders,Avery Premier Heavy-Duty Binder with Round Locking Rings,14.28,1,0.0,6.5688,2016-10-28,2016-11-03
11/19/2017,11/23/2017,Standard Class,JH-15910,Jonathan Howell,Consumer,United States,Chicago,Illinois,60623,Central,Furniture,Tables,BPI Conference Tables,219.075,3,0.5,-131.445,2017-11-19,2017-11-23
5/4/2015,5/9/2015,Second Class,AS-10225,Alan Schoenberger,Corporate,United States,New York City,New York,10024,East,Furniture,Furnishings,Electrix 20W Halogen Replacement Bulb for Zoom-In Desk Lamp,26.8,2,0.0,12.864,2015-05-04,2015-05-09
12/30/2014,1/4/2015,Standard Class,KB-16600,Ken Brennan,Corporate,United States,Taylor,Michigan,48180,Central,Office Supplies,Art,Newell 350,9.84,3,0.0,2.8536,2014-12-30,2015-01-04
6/1/2014,6/6/2014,Standard Class,CR-12625,Corey Roper,Home Office,United States,Lakewood,New Jersey,8701,East,Office Supplies,Binders,"GBC Clear Cover, 8-1/2 x 11, unpunched, 25 covers per pack",45.48,3,0.0,20.9208,2014-06-01,2014-06-06
6/1/2014,6/6/2014,Standard Class,CR-12625,Corey Roper,Home Office,United States,Lakewood,New Jersey,8701,East,Office Supplies,Art,Boston Heavy-Duty Trimline Electric Pencil Sharpeners,289.2,6,0.0,83.868,2014-06-01,2014-06-06
4/15/2017,4/17/2017,First Class,SH-20395,Shahid Hopkins,Consumer,United States,Arlington,Virginia,22204,South,Office Supplies,Art,Faber Castell Col-Erase Pencils,4.89,1,0.0,2.0049,2017-04-15,2017-04-17
9/12/2016,9/14/2016,Second Class,BP-11185,Ben Peterman,Corporate,United States,Arvada,Colorado,80004,West,Furniture,Furnishings,C-Line Cubicle Keepers Polyproplyene Holder With Velcro Backings,15.136,4,0.2,3.5948,2016-09-12,2016-09-14
9/12/2016,9/14/2016,Second Class,BP-11185,Ben Peterman,Corporate,United States,Arvada,Colorado,80004,West,Furniture,Chairs,Hon 4070 Series Pagoda Armless Upholstered Stacking Chairs,466.768,2,0.2,52.5114,2016-09-12,2016-09-14
9/12/2016,9/14/2016,Second Class,BP-11185,Ben Peterman,Corporate,United States,Arvada,Colorado,80004,West,Furniture,Furnishings,"Eldon Expressions Desk Accessory, Wood Photo Frame, Mahogany",15.232,1,0.2,1.7136,2016-09-12,2016-09-14
9/12/2016,9/14/2016,Second Class,BP-11185,Ben Peterman,Corporate,United States,Arvada,Colorado,80004,West,Office Supplies,Labels,Avery 509,6.264,3,0.2,2.0358,2016-09-12,2016-09-14
9/27/2014,10/3/2014,Standard Class,TS-21205,Thomas Seio,Corporate,United States,Hackensack,New Jersey,7601,East,Furniture,Furnishings,"Deflect-o SuperTray Unbreakable Stackable Tray, Letter, Black",87.54,3,0.0,37.6422,2014-09-27,2014-10-03
8/9/2014,8/16/2014,Standard Class,AG-10525,Andy Gerbode,Corporate,United States,Saint Petersburg,Florida,33710,South,Technology,Phones,AT&T 1070 Corded Phone,178.384,2,0.2,22.298,2014-08-09,2014-08-16
8/9/2014,8/16/2014,Standard Class,AG-10525,Andy Gerbode,Corporate,United States,Saint Petersburg,Florida,33710,South,Office Supplies,Paper,Xerox 21,15.552,3,0.2,5.4432,2014-08-09,2014-08-16
12/28/2014,12/30/2014,First Class,SP-20860,Sung Pak,Corporate,United States,Philadelphia,Pennsylvania,19143,East,Office Supplies,Art,"Boston School Pro Electric Pencil Sharpener, 1670",99.136,4,0.2,8.6744,2014-12-28,2014-12-30
11/4/2014,11/9/2014,Standard Class,NM-18445,Nathan Mautz,Home Office,United States,New York City,New York,10024,East,Furniture,Chairs,DMI Arturo Collection Mission-style Design Wood Chair,135.882,1,0.1,24.1568,2014-11-04,2014-11-09
11/4/2014,11/9/2014,Standard Class,NM-18445,Nathan Mautz,Home Office,United States,New York City,New York,10024,East,Technology,Machines,Canon imageCLASS MF7460 Monochrome Digital Laser Multifunction Copier,3991.98,2,0.0,1995.99,2014-11-04,2014-11-09
11/4/2014,11/9/2014,Standard Class,NM-18445,Nathan Mautz,Home Office,United States,New York City,New York,10024,East,Technology,Phones,Panasonic Kx-TS550,275.94,6,0.0,80.0226,2014-11-04,2014-11-09
11/4/2014,11/9/2014,Standard Class,NM-18445,Nathan Mautz,Home Office,United States,New York City,New York,10024,East,Technology,Accessories,NETGEAR N750 Dual Band Wi-Fi Gigabit Router,360.0,4,0.0,129.6,2014-11-04,2014-11-09
11/4/2014,11/9/2014,Standard Class,NM-18445,Nathan Mautz,Home Office,United States,New York City,New York,10024,East,Office Supplies,Storage,"Trav-L-File Heavy-Duty Shuttle II, Black",43.57,1,0.0,13.071,2014-11-04,2014-11-09
9/19/2014,9/24/2014,Standard Class,FA-14230,Frank Atkinson,Corporate,United States,Long Beach,California,90805,West,Office Supplies,Fasteners,OIC Binder Clips,7.16,2,0.0,3.58,2014-09-19,2014-09-24
4/23/2016,4/27/2016,Standard Class,GK-14620,Grace Kelly,Corporate,United States,Hesperia,California,92345,West,Office Supplies,Binders,Ibico Laser Imprintable Binding System Covers,251.52,6,0.2,81.744,2016-04-23,2016-04-27
4/23/2016,4/27/2016,Standard Class,GK-14620,Grace Kelly,Corporate,United States,Hesperia,California,92345,West,Technology,Accessories,Logitech Wireless Headset h800,99.99,1,0.0,34.9965,2016-04-23,2016-04-27
11/3/2017,11/5/2017,Second Class,DJ-13510,Don Jones,Corporate,United States,Murfreesboro,Tennessee,37130,South,Furniture,Furnishings,Telescoping Adjustable Floor Lamp,15.992,1,0.2,0.9995,2017-11-03,2017-11-05
8/30/2016,9/1/2016,First Class,PO-18850,Patrick O'Brill,Consumer,United States,Philadelphia,Pennsylvania,19143,East,Technology,Phones,Aastra 57i VoIP phone,290.898,3,0.4,-67.8762,2016-08-30,2016-09-01
8/30/2016,9/1/2016,First Class,PO-18850,Patrick O'Brill,Consumer,United States,Philadelphia,Pennsylvania,19143,East,Office Supplies,Storage,"File Shuttle II and Handi-File, Black",54.224,2,0.2,3.389,2016-08-30,2016-09-01
8/30/2016,9/1/2016,First Class,PO-18850,Patrick O'Brill,Consumer,United States,Philadelphia,Pennsylvania,19143,East,Furniture,Chairs,Hon 2090 Pillow Soft Series Mid Back Swivel/Tilt Chairs,786.744,4,0.3,-258.5016,2016-08-30,2016-09-01
8/30/2016,9/1/2016,First Class,PO-18850,Patrick O'Brill,Consumer,United States,Philadelphia,Pennsylvania,19143,East,Office Supplies,Labels,Round Specialty Laser Printer Labels,100.24,10,0.2,33.831,2016-08-30,2016-09-01
8/30/2016,9/1/2016,First Class,PO-18850,Patrick O'Brill,Consumer,United States,Philadelphia,Pennsylvania,19143,East,Office Supplies,Binders,GBC Premium Transparent Covers with Diagonal Lined Pattern,37.764,6,0.7,-27.6936,2016-08-30,2016-09-01
4/25/2016,4/29/2016,Second Class,JL-15850,John Lucas,Consumer,United States,Philadelphia,Pennsylvania,19134,East,Technology,Phones,AT&T 841000 Phone,82.8,2,0.4,-20.7,2016-04-25,2016-04-29
4/25/2016,4/29/2016,Second Class,JL-15850,John Lucas,Consumer,United States,Philadelphia,Pennsylvania,19134,East,Office Supplies,Binders,Ibico Recycled Grain-Textured Covers,20.724,2,0.7,-13.816,2016-04-25,2016-04-29
4/25/2016,4/29/2016,Second Class,JL-15850,John Lucas,Consumer,United States,Philadelphia,Pennsylvania,19134,East,Office Supplies,Binders,Wilson Jones Custom Binder Spines & Labels,4.896,3,0.7,-3.4272,2016-04-25,2016-04-29
9/1/2015,9/4/2015,Second Class,DB-13615,Doug Bickford,Consumer,United States,Los Angeles,California,90045,West,Office Supplies,Binders,Storex Dura Pro Binders,4.752,1,0.2,1.6038,2015-09-01,2015-09-04
9/1/2015,9/4/2015,Second Class,DB-13615,Doug Bickford,Consumer,United States,Los Angeles,California,90045,West,Technology,Copiers,Hewlett Packard LaserJet 3310 Copier,959.984,2,0.2,335.9944,2015-09-01,2015-09-04
9/1/2015,9/4/2015,Second Class,DB-13615,Doug Bickford,Consumer,United States,Los Angeles,California,90045,West,Office Supplies,Binders,Avery Non-Stick Binders,14.368,4,0.2,4.49,2015-09-01,2015-09-04
7/12/2014,7/17/2014,Standard Class,AC-10420,Alyssa Crouse,Corporate,United States,San Francisco,California,94122,West,Office Supplies,Binders,Tuff Stuff Recycled Round Ring Binders,7.712,2,0.2,2.7956,2014-07-12,2014-07-17
7/12/2014,7/17/2014,Standard Class,AC-10420,Alyssa Crouse,Corporate,United States,San Francisco,California,94122,West,Furniture,Tables,Hon 5100 Series Wood Tables,698.352,3,0.2,-17.4588,2014-07-12,2014-07-17
6/22/2015,6/26/2015,Second Class,KL-16645,Ken Lonsdale,Consumer,United States,Layton,Utah,84041,West,Office Supplies,Fasteners,"OIC Binder Clips, Mini, 1/4"" Capacity, Black",4.96,4,0.0,2.3312,2015-06-22,2015-06-26
4/13/2014,4/17/2014,Second Class,JD-15895,Jonathan Doherty,Corporate,United States,Philadelphia,Pennsylvania,19140,East,Office Supplies,Art,Newell 314,17.856,4,0.2,1.116,2014-04-13,2014-04-17
4/13/2014,4/17/2014,Second Class,JD-15895,Jonathan Doherty,Corporate,United States,Philadelphia,Pennsylvania,19140,East,Office Supplies,Binders,Fellowes PB200 Plastic Comb Binding Machine,509.97,10,0.7,-407.976,2014-04-13,2014-04-17
4/13/2014,4/17/2014,Second Class,JD-15895,Jonathan Doherty,Corporate,United States,Philadelphia,Pennsylvania,19140,East,Office Supplies,Fasteners,Staples,30.992,13,0.2,10.0724,2014-04-13,2014-04-17
4/13/2014,4/17/2014,Second Class,JD-15895,Jonathan Doherty,Corporate,United States,Philadelphia,Pennsylvania,19140,East,Technology,Phones,"Square Credit Card Reader, 4 1/2"" x 4 1/2"" x 1"", White",71.928,12,0.4,8.3916,2014-04-13,2014-04-17
12/20/2015,12/24/2015,Standard Class,CS-12130,Chad Sievert,Consumer,United States,Austin,Texas,78745,Central,Office Supplies,Storage,Fellowes Super Stor/Drawer,88.8,4,0.2,-2.22,2015-12-20,2015-12-24
6/15/2017,6/19/2017,Standard Class,CC-12550,Clay Cheatham,Consumer,United States,San Francisco,California,94122,West,Technology,Phones,Anker 36W 4-Port USB Wall Charger Travel Power Adapter for iPhone 5s 5c 5,47.976,3,0.2,4.7976,2017-06-15,2017-06-19
7/8/2017,7/12/2017,Standard Class,TD-20995,Tamara Dahlen,Consumer,United States,Lowell,Massachusetts,1852,East,Office Supplies,Art,"Binney & Smith inkTank Erasable Desk Highlighter, Chisel Tip, Yellow, 12/Box",7.56,3,0.0,3.0996,2017-07-08,2017-07-12
7/8/2017,7/12/2017,Standard Class,TD-20995,Tamara Dahlen,Consumer,United States,Lowell,Massachusetts,1852,East,Office Supplies,Paper,Easy-staple paper,24.56,2,0.0,11.5432,2017-07-08,2017-07-12
7/8/2017,7/12/2017,Standard Class,TD-20995,Tamara Dahlen,Consumer,United States,Lowell,Massachusetts,1852,East,Office Supplies,Art,"BIC Brite Liner Highlighters, Chisel Tip",12.96,2,0.0,4.1472,2017-07-08,2017-07-12
9/1/2016,9/3/2016,First Class,AB-10060,Adam Bellavance,Home Office,United States,New York City,New York,10009,East,Technology,Accessories,Sabrent 4-Port USB 2.0 Hub,6.79,1,0.0,2.3086,2016-09-01,2016-09-03
9/1/2016,9/3/2016,First Class,AB-10060,Adam Bellavance,Home Office,United States,New York City,New York,10009,East,Office Supplies,Paper,Xerox 1881,24.56,2,0.0,11.5432,2016-09-01,2016-09-03
9/1/2016,9/3/2016,First Class,AB-10060,Adam Bellavance,Home Office,United States,New York City,New York,10009,East,Office Supplies,Binders,Acco Hanging Data Binders,3.048,1,0.2,1.0668,2016-09-01,2016-09-03
9/1/2016,9/3/2016,First Class,AB-10060,Adam Bellavance,Home Office,United States,New York City,New York,10009,East,Office Supplies,Paper,Xerox 1881,49.12,4,0.0,23.0864,2016-09-01,2016-09-03
9/1/2016,9/3/2016,First Class,AB-10060,Adam Bellavance,Home Office,United States,New York City,New York,10009,East,Office Supplies,Binders,GBC DocuBind P400 Electric Binding System,4355.168,4,0.2,1415.4296,2016-09-01,2016-09-03
4/8/2016,4/13/2016,Standard Class,JL-15505,Jeremy Lonsdale,Consumer,United States,New York City,New York,10035,East,Furniture,Bookcases,Sauder Barrister Bookcases,388.704,6,0.2,-4.8588,2016-04-08,2016-04-13
4/8/2016,4/13/2016,Standard Class,JL-15505,Jeremy Lonsdale,Consumer,United States,New York City,New York,10035,East,Office Supplies,Envelopes,"#10 Gummed Flap White Envelopes, 100/Box",8.26,2,0.0,3.7996,2016-04-08,2016-04-13
4/8/2016,4/13/2016,Standard Class,JL-15505,Jeremy Lonsdale,Consumer,United States,New York City,New York,10035,East,Office Supplies,Art,"Dixon Prang Watercolor Pencils, 10-Color Set with Brush",17.04,4,0.0,6.9864,2016-04-08,2016-04-13
4/8/2016,4/13/2016,Standard Class,JL-15505,Jeremy Lonsdale,Consumer,United States,New York City,New York,10035,East,Office Supplies,Paper,"Adams Phone Message Book, 200 Message Capacity, 8 1/16 x 11",34.4,5,0.0,15.824,2016-04-08,2016-04-13
4/23/2016,4/28/2016,Standard Class,HK-14890,Heather Kirkland,Corporate,United States,Charlotte,North Carolina,28205,South,Office Supplies,Paper,Southworth 25% Cotton Linen-Finish Paper & Envelopes,36.24,5,0.2,11.325,2016-04-23,2016-04-28
3/8/2017,3/11/2017,First Class,VB-21745,Victoria Brennan,Corporate,United States,Columbus,Georgia,31907,South,Office Supplies,Appliances,Belkin 8 Outlet SurgeMaster II Gold Surge Protector with Phone Protection,647.84,8,0.0,168.4384,2017-03-08,2017-03-11
3/8/2017,3/11/2017,First Class,VB-21745,Victoria Brennan,Corporate,United States,Columbus,Georgia,31907,South,Office Supplies,Labels,"Avery Address/Shipping Labels for Typewriters, 4"" x 2""",20.7,2,0.0,9.936,2017-03-08,2017-03-11
9/25/2017,10/1/2017,Standard Class,KW-16435,Katrina Willman,Consumer,United States,New York City,New York,10009,East,Office Supplies,Labels,"Avery Address/Shipping Labels for Typewriters, 4"" x 2""",20.7,2,0.0,9.936,2017-09-25,2017-10-01
9/25/2017,10/1/2017,Standard Class,KW-16435,Katrina Willman,Consumer,United States,New York City,New York,10009,East,Furniture,Chairs,Global Ergonomic Managers Chair,488.646,3,0.1,86.8704,2017-09-25,2017-10-01
9/25/2017,10/1/2017,Standard Class,KW-16435,Katrina Willman,Consumer,United States,New York City,New York,10009,East,Office Supplies,Art,Newell 333,5.56,2,0.0,1.4456,2017-09-25,2017-10-01
9/25/2017,10/1/2017,Standard Class,KW-16435,Katrina Willman,Consumer,United States,New York City,New York,10009,East,Furniture,Furnishings,Eldon Wave Desk Accessories,47.12,8,0.0,20.7328,2017-09-25,2017-10-01
9/24/2014,9/29/2014,Standard Class,JD-16060,Julia Dunbar,Consumer,United States,San Francisco,California,94109,West,Office Supplies,Storage,"Gould Plastics 9-Pocket Panel Bin, 18-3/8w x 5-1/4d x 20-1/2h, Black",211.96,4,0.0,8.4784,2014-09-24,2014-09-29
10/21/2016,10/21/2016,Same Day,MK-17905,Michael Kennedy,Corporate,United States,Manchester,Connecticut,6040,East,Office Supplies,Binders,Wilson Jones Snap Scratch Pad Binder Tool for Ring Binders,23.2,4,0.0,10.44,2016-10-21,2016-10-21
10/21/2016,10/21/2016,Same Day,MK-17905,Michael Kennedy,Corporate,United States,Manchester,Connecticut,6040,East,Office Supplies,Supplies,Staple remover,7.36,2,0.0,0.1472,2016-10-21,2016-10-21
10/21/2016,10/21/2016,Same Day,MK-17905,Michael Kennedy,Corporate,United States,Manchester,Connecticut,6040,East,Office Supplies,Storage,Pizazz Global Quick File,104.79,7,0.0,29.3412,2016-10-21,2016-10-21
10/21/2016,10/21/2016,Same Day,MK-17905,Michael Kennedy,Corporate,United States,Manchester,Connecticut,6040,East,Furniture,Bookcases,"Atlantic Metals Mobile 3-Shelf Bookcases, Custom Colors",1043.92,4,0.0,271.4192,2016-10-21,2016-10-21
5/29/2017,6/4/2017,Standard Class,GT-14755,Guy Thornton,Consumer,United States,Harlingen,Texas,78550,Central,Office Supplies,Paper,Xerox 1930,25.92,5,0.2,9.396,2017-05-29,2017-06-04
5/29/2017,6/4/2017,Standard Class,GT-14755,Guy Thornton,Consumer,United States,Harlingen,Texas,78550,Central,Office Supplies,Storage,File Shuttle I and Handi-File,53.424,3,0.2,4.6746,2017-05-29,2017-06-04
7/23/2014,7/27/2014,Standard Class,AG-10900,Arthur Gainer,Consumer,United States,Tucson,Arizona,85705,West,Office Supplies,Binders,Wilson Jones Custom Binder Spines & Labels,8.16,5,0.7,-5.712,2014-07-23,2014-07-27
7/23/2014,7/27/2014,Standard Class,AG-10900,Arthur Gainer,Consumer,United States,Tucson,Arizona,85705,West,Technology,Accessories,NETGEAR AC1750 Dual Band Gigabit Smart WiFi Router,1023.936,8,0.2,179.1888,2014-07-23,2014-07-27
7/23/2014,7/27/2014,Standard Class,AG-10900,Arthur Gainer,Consumer,United States,Tucson,Arizona,85705,West,Office Supplies,Art,Newell 324,9.24,1,0.2,0.924,2014-07-23,2014-07-27
7/23/2014,7/27/2014,Standard Class,AG-10900,Arthur Gainer,Consumer,United States,Tucson,Arizona,85705,West,Technology,Accessories,Microsoft Natural Keyboard Elite,479.04,10,0.2,-29.94,2014-07-23,2014-07-27
9/28/2016,10/1/2016,First Class,MM-18280,Muhammed MacIntyre,Corporate,United States,Quincy,Illinois,62301,Central,Office Supplies,Paper,Xerox 1960,99.136,4,0.2,30.98,2016-09-28,2016-10-01
8/27/2017,9/1/2017,Standard Class,AR-10405,Allen Rosenblatt,Corporate,United States,Franklin,Massachusetts,2038,East,Furniture,Tables,"Office Impressions End Table, 20-1/2""H x 24""W x 20""D",1488.424,7,0.3,-297.6848,2017-08-27,2017-09-01
4/28/2015,5/5/2015,Standard Class,RA-19915,Russell Applegate,Consumer,United States,Houston,Texas,77095,Central,Office Supplies,Appliances,Holmes Odor Grabber,8.652,3,0.8,-20.3322,2015-04-28,2015-05-05
4/28/2015,5/5/2015,Standard Class,RA-19915,Russell Applegate,Consumer,United States,Houston,Texas,77095,Central,Office Supplies,Storage,Akro-Mils 12-Gallon Tote,23.832,3,0.2,2.6811,2015-04-28,2015-05-05
4/28/2015,5/5/2015,Standard Class,RA-19915,Russell Applegate,Consumer,United States,Houston,Texas,77095,Central,Office Supplies,Binders,"GBC Twin Loop Wire Binding Elements, 9/16"" Spine, Black",12.176,4,0.8,-18.8728,2015-04-28,2015-05-05
10/28/2016,10/29/2016,First Class,AS-10285,Alejandro Savely,Corporate,United States,San Francisco,California,94109,West,Office Supplies,Paper,Southworth Structures Collection,50.96,7,0.0,25.48,2016-10-28,2016-10-29
10/28/2016,10/29/2016,First Class,AS-10285,Alejandro Savely,Corporate,United States,San Francisco,California,94109,West,Office Supplies,Binders,"Square Ring Data Binders, Rigid 75 Pt. Covers, 11"" x 14-7/8""",49.536,3,0.2,17.3376,2016-10-28,2016-10-29
6/26/2015,6/29/2015,Second Class,LA-16780,Laura Armstrong,Corporate,United States,Taylor,Michigan,48180,Central,Technology,Accessories,Sony 32GB Class 10 Micro SDHC R40 Memory Card,41.9,2,0.0,8.799,2015-06-26,2015-06-29
11/27/2015,12/2/2015,Standard Class,DO-13435,Denny Ordway,Consumer,United States,Pembroke Pines,Florida,33024,South,Furniture,Tables,"Hon Practical Foundations 30 x 60 Training Table, Light Gray/Charcoal",375.4575,3,0.45,-157.0095,2015-11-27,2015-12-02
11/27/2015,12/2/2015,Standard Class,DO-13435,Denny Ordway,Consumer,United States,Pembroke Pines,Florida,33024,South,Technology,Accessories,Logitech Media Keyboard K200,83.976,3,0.2,-1.0497,2015-11-27,2015-12-02
12/3/2015,12/7/2015,Standard Class,DK-13225,Dean Katz,Corporate,United States,Philadelphia,Pennsylvania,19140,East,Technology,Machines,Lexmark MarkNet N8150 Wireless Print Server,482.34,4,0.7,-337.638,2015-12-03,2015-12-07
12/3/2015,12/7/2015,Standard Class,DK-13225,Dean Katz,Corporate,United States,Philadelphia,Pennsylvania,19140,East,Furniture,Furnishings,3M Hangers With Command Adhesive,2.96,1,0.2,0.777,2015-12-03,2015-12-07
11/24/2014,11/26/2014,First Class,NG-18430,Nathan Gelder,Consumer,United States,Cincinnati,Ohio,45231,East,Office Supplies,Art,Crayola Colored Pencils,2.624,1,0.2,0.4264,2014-11-24,2014-11-26
12/11/2017,12/15/2017,Standard Class,MV-18190,Mike Vittorini,Consumer,United States,New York City,New York,10009,East,Office Supplies,Binders,"Angle-D Binders with Locking Rings, Label Holders",23.36,4,0.2,7.884,2017-12-11,2017-12-15
12/11/2017,12/15/2017,Standard Class,MV-18190,Mike Vittorini,Consumer,United States,New York City,New York,10009,East,Technology,Accessories,Logitech LS21 Speaker System - PC Multimedia - 2.1-CH - Wired,39.98,2,0.0,13.5932,2017-12-11,2017-12-15
9/21/2014,9/23/2014,Second Class,JG-15115,Jack Garza,Consumer,United States,Des Moines,Washington,98198,West,Technology,Phones,Nortel Meridian M3904 Professional Digital phone,246.384,2,0.2,27.7182,2014-09-21,2014-09-23
9/21/2014,9/23/2014,Second Class,JG-15115,Jack Garza,Consumer,United States,Des Moines,Washington,98198,West,Technology,Copiers,Canon PC1080F Personal Copier,1799.97,3,0.0,701.9883,2014-09-21,2014-09-23
6/7/2014,6/10/2014,Second Class,BP-11095,Bart Pistole,Corporate,United States,Peoria,Illinois,61604,Central,Office Supplies,Binders,Wilson Jones Century Plastic Molded Ring Binders,12.462,3,0.8,-20.5623,2014-06-07,2014-06-10
6/30/2017,7/5/2017,Standard Class,VP-21730,Victor Preis,Home Office,United States,Las Vegas,Nevada,89115,West,Office Supplies,Binders,Tuf-Vin Binders,75.792,3,0.2,25.5798,2017-06-30,2017-07-05
10/17/2017,10/19/2017,Second Class,SS-20140,Saphhira Shifley,Corporate,United States,Warwick,Rhode Island,2886,East,Office Supplies,Storage,2300 Heavy-Duty Transfer File Systems by Perma,49.96,2,0.0,9.4924,2017-10-17,2017-10-19
10/17/2017,10/19/2017,Second Class,SS-20140,Saphhira Shifley,Corporate,United States,Warwick,Rhode Island,2886,East,Office Supplies,Paper,Xerox 1958,12.96,2,0.0,6.2208,2017-10-17,2017-10-19
10/31/2015,11/4/2015,Standard Class,HP-14815,Harold Pawlan,Home Office,United States,Jackson,Michigan,49201,Central,Office Supplies,Supplies,"Acme 10"" Easy Grip Assistive Scissors",70.12,4,0.0,21.036,2015-10-31,2015-11-04
9/8/2016,9/10/2016,Second Class,AG-10675,Anna Gayman,Consumer,United States,Houston,Texas,77036,Central,Office Supplies,Storage,Super Decoflex Portable Personal File,35.952,3,0.2,3.5952,2016-09-08,2016-09-10
9/8/2016,9/10/2016,Second Class,AG-10675,Anna Gayman,Consumer,United States,Houston,Texas,77036,Central,Furniture,Bookcases,"Riverside Palais Royal Lawyers Bookcase, Royale Cherry Finish",2396.2656,4,0.32,-317.1528,2016-09-08,2016-09-10
9/8/2016,9/10/2016,Second Class,AG-10675,Anna Gayman,Consumer,United States,Houston,Texas,77036,Central,Office Supplies,Storage,"Contico 72""H Heavy-Duty Storage System",131.136,4,0.2,-32.784,2016-09-08,2016-09-10
9/8/2016,9/10/2016,Second Class,AG-10675,Anna Gayman,Consumer,United States,Houston,Texas,77036,Central,Technology,Accessories,Sony 64GB Class 10 Micro SDHC R40 Memory Card,57.584,2,0.2,0.7198,2016-09-08,2016-09-10
12/24/2014,12/26/2014,First Class,LF-17185,Luke Foster,Consumer,United States,Miami,Florida,33180,South,Office Supplies,Paper,Xerox 1974,9.568,2,0.2,3.4684,2014-12-24,2014-12-26
4/16/2014,4/20/2014,Standard Class,SP-20650,Stephanie Phelps,Corporate,United States,Wilmington,North Carolina,28403,South,Office Supplies,Art,"Avery Hi-Liter EverBold Pen Style Fluorescent Highlighters, 4/Pack",39.072,6,0.2,9.768,2014-04-16,2014-04-20
12/24/2017,12/29/2017,Standard Class,RF-19840,Roy Französisch,Consumer,United States,New York City,New York,10024,East,Office Supplies,Appliances,Staple holder,35.91,3,0.0,9.6957,2017-12-24,2017-12-29
12/8/2017,12/12/2017,Standard Class,KH-16510,Keith Herrera,Consumer,United States,San Francisco,California,94110,West,Technology,Accessories,Sony 64GB Class 10 Micro SDHC R40 Memory Card,179.95,5,0.0,37.7895,2017-12-08,2017-12-12
12/8/2017,12/12/2017,Standard Class,KH-16510,Keith Herrera,Consumer,United States,San Francisco,California,94110,West,Technology,Copiers,Sharp AL-1530CS Digital Copier,1199.976,3,0.2,434.9913,2017-12-08,2017-12-12
12/8/2017,12/12/2017,Standard Class,KH-16510,Keith Herrera,Consumer,United States,San Francisco,California,94110,West,Office Supplies,Paper,"Wirebound Message Book, 4 per Page",27.15,5,0.0,13.3035,2017-12-08,2017-12-12
12/8/2017,12/12/2017,Standard Class,KH-16510,Keith Herrera,Consumer,United States,San Francisco,California,94110,West,Furniture,Tables,"Bevis Round Conference Table Top, X-Base",1004.024,7,0.2,-112.9527,2017-12-08,2017-12-12
12/8/2017,12/12/2017,Standard Class,KH-16510,Keith Herrera,Consumer,United States,San Francisco,California,94110,West,Office Supplies,Paper,"Wirebound Service Call Books, 5 1/2"" x 4""",9.68,1,0.0,4.6464,2017-12-08,2017-12-12
12/8/2017,12/12/2017,Standard Class,KH-16510,Keith Herrera,Consumer,United States,San Francisco,California,94110,West,Office Supplies,Labels,Self-Adhesive Removable Labels,28.35,9,0.0,13.608,2017-12-08,2017-12-12
12/8/2017,12/12/2017,Standard Class,KH-16510,Keith Herrera,Consumer,United States,San Francisco,California,94110,West,Office Supplies,Paper,Xerox 1908,55.98,1,0.0,27.4302,2017-12-08,2017-12-12
12/8/2017,12/12/2017,Standard Class,KH-16510,Keith Herrera,Consumer,United States,San Francisco,California,94110,West,Furniture,Bookcases,O'Sullivan 4-Shelf Bookcase in Odessa Pine,1336.829,13,0.15,31.4548,2017-12-08,2017-12-12
12/8/2017,12/12/2017,Standard Class,KH-16510,Keith Herrera,Consumer,United States,San Francisco,California,94110,West,Furniture,Chairs,Novimex High-Tech Fabric Mesh Task Chair,113.568,2,0.2,-18.4548,2017-12-08,2017-12-12
11/3/2017,11/7/2017,Standard Class,KC-16675,Kimberly Carter,Corporate,United States,Seattle,Washington,98105,West,Office Supplies,Paper,Xerox 191,139.86,7,0.0,65.7342,2017-11-03,2017-11-07
11/3/2017,11/7/2017,Standard Class,KC-16675,Kimberly Carter,Corporate,United States,Seattle,Washington,98105,West,Furniture,Chairs,Global Deluxe Office Fabric Chairs,307.136,4,0.2,26.8744,2017-11-03,2017-11-07
6/24/2017,6/28/2017,Standard Class,CJ-12010,Caroline Jumper,Consumer,United States,Huntington Beach,California,92646,West,Office Supplies,Art,Bulldog Vacuum Base Pencil Sharpener,95.92,8,0.0,25.8984,2017-06-24,2017-06-28
4/14/2016,4/18/2016,Standard Class,PB-19150,Philip Brown,Consumer,United States,Los Angeles,California,90004,West,Furniture,Chairs,Bevis Steel Folding Chairs,383.8,5,0.2,38.38,2016-04-14,2016-04-18
11/6/2017,11/10/2017,Standard Class,VB-21745,Victoria Brennan,Corporate,United States,Richmond,Kentucky,40475,South,Office Supplies,Paper,Xerox 1987,5.78,1,0.0,2.8322,2017-11-06,2017-11-10
3/4/2017,3/9/2017,Standard Class,SP-20860,Sung Pak,Corporate,United States,Los Angeles,California,90045,West,Office Supplies,Art,American Pencil,9.32,4,0.0,2.7028,2017-03-04,2017-03-09
3/4/2017,3/9/2017,Standard Class,SP-20860,Sung Pak,Corporate,United States,Los Angeles,California,90045,West,Office Supplies,Envelopes,"White Envelopes, White Envelopes with Clear Poly Window",15.25,1,0.0,7.015,2017-03-04,2017-03-09
6/22/2014,6/25/2014,First Class,JE-15745,Joel Eaton,Consumer,United States,Louisville,Colorado,80027,West,Technology,Accessories,KeyTronic 6101 Series - Keyboard - Black,196.752,6,0.2,56.5662,2014-06-22,2014-06-25
10/19/2017,10/23/2017,Standard Class,MP-17965,Michael Paige,Corporate,United States,Lawrence,Massachusetts,1841,East,Furniture,Furnishings,"Westinghouse Mesh Shade Clip-On Gooseneck Lamp, Black",56.56,4,0.0,14.7056,2017-10-19,2017-10-23
10/19/2017,10/23/2017,Standard Class,MP-17965,Michael Paige,Corporate,United States,Lawrence,Massachusetts,1841,East,Office Supplies,Storage,Crate-A-Files,32.7,3,0.0,8.502,2017-10-19,2017-10-23
8/21/2017,8/23/2017,Second Class,NF-18385,Natalie Fritzler,Consumer,United States,Jackson,Mississippi,39212,South,Furniture,Chairs,Hon Multipurpose Stacking Arm Chairs,866.4,4,0.0,225.264,2017-08-21,2017-08-23
11/23/2017,11/26/2017,Second Class,JM-15265,Janet Molinari,Corporate,United States,Canton,Michigan,48187,Central,Furniture,Furnishings,Coloredge Poster Frame,28.4,2,0.0,11.076,2017-11-23,2017-11-26
11/23/2017,11/26/2017,Second Class,JM-15265,Janet Molinari,Corporate,United States,Canton,Michigan,48187,Central,Office Supplies,Binders,GBC VeloBinder Manual Binding System,287.92,8,0.0,138.2016,2017-11-23,2017-11-26
9/12/2014,9/13/2014,First Class,SD-20485,Shirley Daniels,Home Office,United States,New Rochelle,New York,10801,East,Technology,Machines,"Epson WorkForce WF-2530 All-in-One Printer, Copier Scanner",69.99,1,0.0,30.0957,2014-09-12,2014-09-13
10/1/2017,10/8/2017,Standard Class,KH-16630,Ken Heidel,Corporate,United States,San Antonio,Texas,78207,Central,Office Supplies,Art,Design Ebony Sketching Pencil,6.672,6,0.2,0.5004,2017-10-01,2017-10-08
4/15/2016,4/21/2016,Standard Class,RB-19795,Ross Baird,Home Office,United States,Gastonia,North Carolina,28052,South,Office Supplies,Binders,GBC ProClick 150 Presentation Binding System,189.588,2,0.7,-145.3508,2016-04-15,2016-04-21
4/15/2016,4/21/2016,Standard Class,RB-19795,Ross Baird,Home Office,United States,Gastonia,North Carolina,28052,South,Technology,Accessories,Imation Secure+ Hardware Encrypted USB 2.0 Flash Drive; 16GB,408.744,7,0.2,76.6395,2016-04-15,2016-04-21
4/15/2016,4/21/2016,Standard Class,RB-19795,Ross Baird,Home Office,United States,Gastonia,North Carolina,28052,South,Technology,Accessories,Imation Secure+ Hardware Encrypted USB 2.0 Flash Drive; 16GB,291.96,5,0.2,54.7425,2016-04-15,2016-04-21
4/15/2016,4/21/2016,Standard Class,RB-19795,Ross Baird,Home Office,United States,Gastonia,North Carolina,28052,South,Office Supplies,Storage,Woodgrain Magazine Files by Perma,4.768,2,0.2,-0.7748,2016-04-15,2016-04-21
6/6/2016,6/7/2016,First Class,DB-13060,Dave Brooks,Consumer,United States,Lowell,Massachusetts,1852,East,Office Supplies,Storage,Letter Size Cart,714.3,5,0.0,207.147,2016-06-06,2016-06-07
12/19/2014,12/25/2014,Standard Class,MK-18160,Mike Kennedy,Consumer,United States,Jacksonville,Florida,32216,South,Office Supplies,Binders,Insertable Tab Post Binder Dividers,4.812,2,0.7,-3.6892,2014-12-19,2014-12-25
12/19/2014,12/25/2014,Standard Class,MK-18160,Mike Kennedy,Consumer,United States,Jacksonville,Florida,32216,South,Technology,Accessories,Belkin QODE FastFit Bluetooth Keyboard,247.8,5,0.2,-18.585,2014-12-19,2014-12-25
6/12/2016,6/14/2016,Second Class,PO-19180,Philisse Overcash,Home Office,United States,Chicago,Illinois,60623,Central,Technology,Machines,"Canon Color ImageCLASS MF8580Cdw Wireless Laser All-In-One Printer, Copier, Scanner",1007.979,3,0.3,43.1991,2016-06-12,2016-06-14
6/12/2016,6/14/2016,Second Class,PO-19180,Philisse Overcash,Home Office,United States,Chicago,Illinois,60623,Central,Office Supplies,Paper,Xerox 1908,313.488,7,0.2,113.6394,2016-06-12,2016-06-14
9/15/2017,9/19/2017,Standard Class,BB-11545,Brenda Bowman,Corporate,United States,Houston,Texas,77070,Central,Office Supplies,Paper,Xerox 1897,31.872,8,0.2,11.5536,2017-09-15,2017-09-19
1/20/2017,1/23/2017,Second Class,CV-12805,Cynthia Voltz,Corporate,United States,New York City,New York,10024,East,Furniture,Chairs,Global Deluxe Steno Chair,207.846,3,0.1,2.3094,2017-01-20,2017-01-23
9/5/2016,9/7/2016,Second Class,PK-19075,Pete Kriz,Consumer,United States,Detroit,Michigan,48227,Central,Furniture,Furnishings,Aluminum Document Frame,12.22,1,0.0,3.666,2016-09-05,2016-09-07
9/5/2016,9/7/2016,Second Class,PK-19075,Pete Kriz,Consumer,United States,Detroit,Michigan,48227,Central,Office Supplies,Storage,Fellowes Bankers Box Staxonsteel Drawer File/Stacking System,194.94,3,0.0,23.3928,2016-09-05,2016-09-07
9/5/2016,9/7/2016,Second Class,PK-19075,Pete Kriz,Consumer,United States,Detroit,Michigan,48227,Central,Office Supplies,Storage,Eldon Mobile Mega Data Cart  Mega Stackable  Add-On Trays,70.95,3,0.0,20.5755,2016-09-05,2016-09-07
9/5/2016,9/7/2016,Second Class,PK-19075,Pete Kriz,Consumer,United States,Detroit,Michigan,48227,Central,Office Supplies,Paper,"Xerox Color Copier Paper, 11"" x 17"", Ream",91.36,4,0.0,42.0256,2016-09-05,2016-09-07
9/5/2016,9/7/2016,Second Class,PK-19075,Pete Kriz,Consumer,United States,Detroit,Michigan,48227,Central,Furniture,Chairs,Office Star - Ergonomically Designed Knee Chair,242.94,3,0.0,29.1528,2016-09-05,2016-09-07
9/5/2016,9/7/2016,Second Class,PK-19075,Pete Kriz,Consumer,United States,Detroit,Michigan,48227,Central,Office Supplies,Labels,Avery 520,22.05,7,0.0,10.584,2016-09-05,2016-09-07
3/20/2017,3/25/2017,Second Class,TB-21595,Troy Blackwell,Consumer,United States,Columbus,Indiana,47201,Central,Furniture,Furnishings,"GE General Purpose, Extra Long Life, Showcase & Floodlight Incandescent Bulbs",2.91,1,0.0,1.3677,2017-03-20,2017-03-25
4/1/2016,4/3/2016,Second Class,RB-19360,Raymond Buch,Consumer,United States,Auburn,New York,13021,East,Office Supplies,Art,Newell 345,59.52,3,0.0,15.4752,2016-04-01,2016-04-03
4/1/2016,4/3/2016,Second Class,RB-19360,Raymond Buch,Consumer,United States,Auburn,New York,13021,East,Office Supplies,Storage,Fellowes Bankers Box Recycled Super Stor/Drawer,161.94,3,0.0,9.7164,2016-04-01,2016-04-03
4/1/2016,4/3/2016,Second Class,RB-19360,Raymond Buch,Consumer,United States,Auburn,New York,13021,East,Office Supplies,Art,Boston 1645 Deluxe Heavier-Duty Electric Pencil Sharpener,263.88,6,0.0,71.2476,2016-04-01,2016-04-03
4/1/2016,4/3/2016,Second Class,RB-19360,Raymond Buch,Consumer,United States,Auburn,New York,13021,East,Office Supplies,Art,50 Colored Long Pencils,30.48,3,0.0,7.9248,2016-04-01,2016-04-03
4/1/2016,4/3/2016,Second Class,RB-19360,Raymond Buch,Consumer,United States,Auburn,New York,13021,East,Office Supplies,Art,Newell 342,9.84,3,0.0,2.8536,2016-04-01,2016-04-03
4/1/2016,4/3/2016,Second Class,RB-19360,Raymond Buch,Consumer,United States,Auburn,New York,13021,East,Technology,Phones,Belkin Grip Candy Sheer Case / Cover for iPhone 5 and 5S,35.12,4,0.0,9.1312,2016-04-01,2016-04-03
10/20/2017,10/24/2017,Standard Class,EB-13705,Ed Braxton,Corporate,United States,Akron,Ohio,44312,East,Furniture,Tables,Chromcraft Rectangular Conference Tables,284.364,2,0.4,-75.8304,2017-10-20,2017-10-24
10/20/2017,10/24/2017,Standard Class,EB-13705,Ed Braxton,Corporate,United States,Akron,Ohio,44312,East,Office Supplies,Storage,Deluxe Rollaway Locking File with Drawer,665.408,2,0.2,66.5408,2017-10-20,2017-10-24
12/13/2016,12/17/2016,Standard Class,KH-16630,Ken Heidel,Corporate,United States,Norman,Oklahoma,73071,Central,Technology,Accessories,Memorex Mini Travel Drive 16 GB USB 2.0 Flash Drive,63.88,4,0.0,24.9132,2016-12-13,2016-12-17
2/12/2014,2/18/2014,Standard Class,SC-20095,Sanjit Chand,Consumer,United States,Concord,California,94521,West,Furniture,Chairs,"Global Geo Office Task Chair, Gray",129.568,2,0.2,-24.294,2014-02-12,2014-02-18
9/26/2016,10/1/2016,Standard Class,NF-18385,Natalie Fritzler,Consumer,United States,Decatur,Illinois,62521,Central,Furniture,Chairs,Hon 4700 Series Mobuis Mid-Back Task Chairs with Adjustable Arms,747.558,3,0.3,-96.1146,2016-09-26,2016-10-01
9/26/2016,10/1/2016,Standard Class,NF-18385,Natalie Fritzler,Consumer,United States,Decatur,Illinois,62521,Central,Office Supplies,Envelopes,Staple envelope,8.928,2,0.2,3.348,2016-09-26,2016-10-01
12/15/2015,12/22/2015,Standard Class,JH-15985,Joseph Holt,Consumer,United States,Seattle,Washington,98115,West,Office Supplies,Appliances,3M Office Air Cleaner,103.92,4,0.0,36.372,2015-12-15,2015-12-22
12/15/2015,12/22/2015,Standard Class,JH-15985,Joseph Holt,Consumer,United States,Seattle,Washington,98115,West,Technology,Accessories,Logitech G700s Rechargeable Gaming Mouse,899.91,9,0.0,377.9622,2015-12-15,2015-12-22
12/15/2015,12/22/2015,Standard Class,JH-15985,Joseph Holt,Consumer,United States,Seattle,Washington,98115,West,Office Supplies,Binders,Acco D-Ring Binder w/DublLock,51.312,3,0.2,18.6006,2015-12-15,2015-12-22
4/22/2016,4/29/2016,Standard Class,TN-21040,Tanja Norvell,Home Office,United States,Phoenix,Arizona,85023,West,Furniture,Furnishings,Eldon Wave Desk Accessories,23.56,5,0.2,7.068,2016-04-22,2016-04-29
4/22/2016,4/29/2016,Standard Class,TN-21040,Tanja Norvell,Home Office,United States,Phoenix,Arizona,85023,West,Furniture,Tables,Bush Advantage Collection Racetrack Conference Table,1272.63,6,0.5,-814.4832,2016-04-22,2016-04-29
4/22/2016,4/29/2016,Standard Class,TN-21040,Tanja Norvell,Home Office,United States,Phoenix,Arizona,85023,West,Office Supplies,Binders,Poly Designer Cover & Back,28.485,5,0.7,-20.889,2016-04-22,2016-04-29
4/22/2016,4/29/2016,Standard Class,TN-21040,Tanja Norvell,Home Office,United States,Phoenix,Arizona,85023,West,Office Supplies,Supplies,Premier Electric Letter Opener,185.376,2,0.2,-34.758,2016-04-22,2016-04-29
4/22/2016,4/29/2016,Standard Class,TN-21040,Tanja Norvell,Home Office,United States,Phoenix,Arizona,85023,West,Office Supplies,Appliances,"Fellowes Premier Superior Surge Suppressor, 10-Outlet, With Phone and Remote",78.272,2,0.2,5.8704,2016-04-22,2016-04-29
1/17/2015,1/24/2015,Standard Class,JS-15940,Joni Sundaresam,Home Office,United States,Park Ridge,Illinois,60068,Central,Furniture,Furnishings,Eldon ClusterMat Chair Mat with Cordless Antistatic Protection,254.744,7,0.6,-312.0614,2015-01-17,2015-01-24
3/31/2017,4/4/2017,Standard Class,DS-13180,David Smith,Corporate,United States,Amarillo,Texas,79109,Central,Furniture,Bookcases,Bush Mission Pointe Library,205.3328,2,0.32,-36.2352,2017-03-31,2017-04-04
12/16/2016,12/20/2016,Second Class,CC-12670,Craig Carreira,Consumer,United States,Chicago,Illinois,60610,Central,Office Supplies,Binders,Cardinal Hold-It CD Pocket,4.788,3,0.8,-7.9002,2016-12-16,2016-12-20
12/20/2015,12/24/2015,Standard Class,MH-17785,Maya Herman,Corporate,United States,Lindenhurst,New York,11757,East,Office Supplies,Paper,"Eaton Premium Continuous-Feed Paper, 25% Cotton, Letter Size, White, 1000 Shts/Box",55.48,1,0.0,26.6304,2015-12-20,2015-12-24
11/9/2014,11/11/2014,Second Class,JP-15520,Jeremy Pistek,Consumer,United States,San Francisco,California,94110,West,Office Supplies,Storage,SAFCO Boltless Steel Shelving,340.92,3,0.0,3.4092,2014-11-09,2014-11-11
11/9/2014,11/11/2014,Second Class,JP-15520,Jeremy Pistek,Consumer,United States,San Francisco,California,94110,West,Furniture,Bookcases,"Sauder Mission Library with Doors, Fruitwood Finish",222.666,2,0.15,10.4784,2014-11-09,2014-11-11
11/9/2014,11/11/2014,Second Class,JP-15520,Jeremy Pistek,Consumer,United States,San Francisco,California,94110,West,Technology,Phones,Samsung Galaxy Note 3,703.968,4,0.2,87.996,2014-11-09,2014-11-11
11/9/2014,11/11/2014,Second Class,JP-15520,Jeremy Pistek,Consumer,United States,San Francisco,California,94110,West,Office Supplies,Storage,"Decoflex Hanging Personal Folder File, Blue",92.52,6,0.0,24.9804,2014-11-09,2014-11-11
11/9/2014,11/11/2014,Second Class,JP-15520,Jeremy Pistek,Consumer,United States,San Francisco,California,94110,West,Office Supplies,Paper,"Recycled Desk Saver Line ""While You Were Out"" Book, 5 1/2"" X 4""",62.65,7,0.0,28.819,2014-11-09,2014-11-11
11/9/2014,11/11/2014,Second Class,JP-15520,Jeremy Pistek,Consumer,United States,San Francisco,California,94110,West,Office Supplies,Paper,Xerox 1912,94.85,5,0.0,45.528,2014-11-09,2014-11-11
7/12/2016,7/19/2016,Standard Class,KH-16690,Kristen Hastings,Corporate,United States,Los Angeles,California,90008,West,Technology,Phones,Cisco SPA525G2 IP Phone - Wireless,95.76,6,0.2,7.182,2016-07-12,2016-07-19
10/27/2016,11/2/2016,Standard Class,JE-15475,Jeremy Ellison,Consumer,United States,Troy,New York,12180,East,Furniture,Furnishings,Electrix 20W Halogen Replacement Bulb for Zoom-In Desk Lamp,40.2,3,0.0,19.296,2016-10-27,2016-11-02
6/26/2016,7/2/2016,Standard Class,JG-15805,John Grady,Corporate,United States,New York City,New York,10024,East,Office Supplies,Art,Prang Colored Pencils,14.7,5,0.0,6.615,2016-06-26,2016-07-02
6/26/2016,7/2/2016,Standard Class,JG-15805,John Grady,Corporate,United States,New York City,New York,10024,East,Office Supplies,Storage,"Fellowes Strictly Business Drawer File, Letter/Legal Size",704.25,5,0.0,84.51,2016-06-26,2016-07-02
10/6/2014,10/10/2014,Standard Class,XP-21865,Xylona Preis,Consumer,United States,San Diego,California,92024,West,Technology,Accessories,Imation USB 2.0 Swivel Flash Drive USB flash drive - 4 GB - Pink,9.09,3,0.0,1.9089,2014-10-06,2014-10-10
7/22/2014,7/27/2014,Standard Class,EM-14065,Erin Mull,Consumer,United States,New York City,New York,10024,East,Office Supplies,Art,"Premium Writing Pencils, Soft, #2 by Central Association for the Blind",5.96,2,0.0,1.6688,2014-07-22,2014-07-27
7/22/2014,7/27/2014,Standard Class,EM-14065,Erin Mull,Consumer,United States,New York City,New York,10024,East,Technology,Accessories,Logitech G602 Wireless Gaming Mouse,159.98,2,0.0,57.5928,2014-07-22,2014-07-27
6/10/2017,6/13/2017,First Class,MT-18070,Michelle Tran,Home Office,United States,Los Angeles,California,90045,West,Office Supplies,Labels,Alphabetical Labels for Top Tab Filing,29.6,2,0.0,14.8,2017-06-10,2017-06-13
6/10/2017,6/13/2017,First Class,MT-18070,Michelle Tran,Home Office,United States,Los Angeles,California,90045,West,Furniture,Bookcases,O'Sullivan Living Dimensions 2-Shelf Bookcases,514.165,5,0.15,-30.245,2017-06-10,2017-06-13
6/10/2017,6/13/2017,First Class,MT-18070,Michelle Tran,Home Office,United States,Los Angeles,California,90045,West,Technology,Phones,iHome FM Clock Radio with Lightning Dock,279.96,5,0.2,17.4975,2017-06-10,2017-06-13
10/29/2014,10/31/2014,First Class,SA-20830,Sue Ann Reed,Consumer,United States,Chicago,Illinois,60610,Central,Technology,Phones,Apple iPhone 5S,2735.952,6,0.2,341.994,2014-10-29,2014-10-31
6/9/2014,6/13/2014,Second Class,CW-11905,Carl Weiss,Home Office,United States,Huntsville,Texas,77340,Central,Technology,Phones,Square Credit Card Reader,7.992,1,0.2,0.5994,2014-06-09,2014-06-13
6/9/2014,6/13/2014,Second Class,CW-11905,Carl Weiss,Home Office,United States,Huntsville,Texas,77340,Central,Technology,Accessories,Logitech M510 Wireless Mouse,63.984,2,0.2,10.3974,2014-06-09,2014-06-13
6/9/2014,6/13/2014,Second Class,CW-11905,Carl Weiss,Home Office,United States,Huntsville,Texas,77340,Central,Office Supplies,Art,Boston 1645 Deluxe Heavier-Duty Electric Pencil Sharpener,70.368,2,0.2,6.1572,2014-06-09,2014-06-13
9/14/2014,9/19/2014,Standard Class,AJ-10960,Astrea Jones,Consumer,United States,Rochester,New York,14609,East,Office Supplies,Storage,Fellowes Officeware Wire Shelving,449.15,5,0.0,8.983,2014-09-14,2014-09-19
9/14/2014,9/19/2014,Standard Class,AJ-10960,Astrea Jones,Consumer,United States,Rochester,New York,14609,East,Office Supplies,Envelopes,Colored Envelopes,11.07,3,0.0,5.0922,2014-09-14,2014-09-19
5/9/2016,5/14/2016,Standard Class,SS-20590,Sonia Sunley,Consumer,United States,Seattle,Washington,98115,West,Technology,Accessories,Sony Micro Vault Click 8 GB USB 2.0 Flash Drive,93.98,2,0.0,13.1572,2016-05-09,2016-05-14
3/18/2016,3/21/2016,Second Class,RO-19780,Rose O'Brian,Consumer,United States,Memphis,Tennessee,38109,South,Furniture,Tables,Balt Solid Wood Rectangular Table,189.882,3,0.4,-94.941,2016-03-18,2016-03-21
12/27/2015,12/31/2015,Standard Class,MD-17350,Maribeth Dona,Consumer,United States,Fayetteville,Arkansas,72701,South,Office Supplies,Envelopes,"Strathmore #10 Envelopes, Ultimate White",105.42,2,0.0,51.6558,2015-12-27,2015-12-31
7/25/2016,7/31/2016,Standard Class,SC-20095,Sanjit Chand,Consumer,United States,Costa Mesa,California,92627,West,Office Supplies,Binders,Clear Mylar Reinforcing Strips,119.616,8,0.2,40.3704,2016-07-25,2016-07-31
7/25/2016,7/31/2016,Standard Class,SC-20095,Sanjit Chand,Consumer,United States,Costa Mesa,California,92627,West,Furniture,Furnishings,"Howard Miller 14-1/2"" Diameter Chrome Round Wall Clock",255.76,4,0.0,81.8432,2016-07-25,2016-07-31
7/25/2016,7/31/2016,Standard Class,SC-20095,Sanjit Chand,Consumer,United States,Costa Mesa,California,92627,West,Furniture,Chairs,DMI Arturo Collection Mission-style Design Wood Chair,241.568,2,0.2,18.1176,2016-07-25,2016-07-31
7/25/2016,7/31/2016,Standard Class,SC-20095,Sanjit Chand,Consumer,United States,Costa Mesa,California,92627,West,Furniture,Furnishings,Deflect-O Glasstique Clear Desk Accessories,69.3,9,0.0,22.869,2016-07-25,2016-07-31
5/30/2016,6/4/2016,Standard Class,MY-17380,Maribeth Yedwab,Corporate,United States,Parker,Colorado,80134,West,Office Supplies,Binders,Vinyl Sectional Post Binders,22.62,2,0.7,-15.08,2016-05-30,2016-06-04
5/30/2016,6/4/2016,Standard Class,MY-17380,Maribeth Yedwab,Corporate,United States,Parker,Colorado,80134,West,Office Supplies,Binders,GBC Standard Therm-A-Bind Covers,14.952,2,0.7,-11.9616,2016-05-30,2016-06-04
5/30/2016,6/4/2016,Standard Class,MY-17380,Maribeth Yedwab,Corporate,United States,Parker,Colorado,80134,West,Furniture,Chairs,Global Troy Executive Leather Low-Back Tilter,801.568,2,0.2,50.098,2016-05-30,2016-06-04
5/30/2016,6/4/2016,Standard Class,MY-17380,Maribeth Yedwab,Corporate,United States,Parker,Colorado,80134,West,Office Supplies,Binders,Storex Flexible Poly Binders with Double Pockets,2.376,3,0.7,-1.9008,2016-05-30,2016-06-04
5/30/2016,6/4/2016,Standard Class,MY-17380,Maribeth Yedwab,Corporate,United States,Parker,Colorado,80134,West,Office Supplies,Paper,"White Dual Perf Computer Printout Paper, 2700 Sheets, 1 Part, Heavyweight, 20 lbs., 14 7/8 x 11",32.792,1,0.2,11.8871,2016-05-30,2016-06-04
11/12/2017,11/15/2017,Second Class,EB-13705,Ed Braxton,Corporate,United States,New York City,New York,10024,East,Office Supplies,Binders,"Avery Durable Slant Ring Binders, No Labels",15.92,5,0.2,5.373,2017-11-12,2017-11-15
3/16/2015,3/22/2015,Standard Class,CM-12385,Christopher Martinez,Consumer,United States,Atlanta,Georgia,30318,South,Office Supplies,Art,Rogers Handheld Barrel Pencil Sharpener,2.74,1,0.0,0.7398,2015-03-16,2015-03-22
3/16/2015,3/22/2015,Standard Class,CM-12385,Christopher Martinez,Consumer,United States,Atlanta,Georgia,30318,South,Office Supplies,Art,Newell 344,8.34,3,0.0,2.1684,2015-03-16,2015-03-22
3/16/2015,3/22/2015,Standard Class,CM-12385,Christopher Martinez,Consumer,United States,Atlanta,Georgia,30318,South,Office Supplies,Storage,Personal File Boxes with Fold-Down Carry Handle,46.74,3,0.0,11.685,2015-03-16,2015-03-22
3/16/2015,3/22/2015,Standard Class,CM-12385,Christopher Martinez,Consumer,United States,Atlanta,Georgia,30318,South,Office Supplies,Binders,Fellowes PB500 Electric Punch Plastic Comb Binding Machine with Manual Bind,6354.95,5,0.0,3177.475,2015-03-16,2015-03-22
11/26/2017,11/27/2017,First Class,LS-17245,Lynn Smith,Consumer,United States,Gladstone,Missouri,64118,Central,Furniture,Furnishings,Executive Impressions Supervisor Wall Clock,126.3,3,0.0,40.416,2017-11-26,2017-11-27
11/26/2017,11/27/2017,First Class,LS-17245,Lynn Smith,Consumer,United States,Gladstone,Missouri,64118,Central,Technology,Accessories,SanDisk Cruzer 32 GB USB Flash Drive,38.04,2,0.0,12.1728,2017-11-26,2017-11-27
10/20/2016,10/23/2016,First Class,LF-17185,Luke Foster,Consumer,United States,Newark,Ohio,43055,East,Office Supplies,Art,"Premium Writing Pencils, Soft, #2 by Central Association for the Blind",7.152,3,0.2,0.7152,2016-10-20,2016-10-23
12/21/2017,12/25/2017,Standard Class,BN-11515,Bradley Nguyen,Consumer,United States,Los Angeles,California,90049,West,Office Supplies,Art,Newell 327,6.63,3,0.0,1.7901,2017-12-21,2017-12-25
12/21/2017,12/25/2017,Standard Class,BN-11515,Bradley Nguyen,Consumer,United States,Los Angeles,California,90049,West,Office Supplies,Art,Newell 317,5.88,2,0.0,1.7052,2017-12-21,2017-12-25
1/22/2017,1/27/2017,Standard Class,AD-10180,Alan Dominguez,Home Office,United States,Great Falls,Montana,59405,West,Technology,Copiers,Canon Image Class D660 Copier,2999.95,5,0.0,1379.977,2017-01-22,2017-01-27
1/22/2017,1/27/2017,Standard Class,AD-10180,Alan Dominguez,Home Office,United States,Great Falls,Montana,59405,West,Office Supplies,Storage,Advantus Rolling Storage Box,51.45,3,0.0,13.8915,2017-01-22,2017-01-27
1/22/2017,1/27/2017,Standard Class,AD-10180,Alan Dominguez,Home Office,United States,Great Falls,Montana,59405,West,Office Supplies,Paper,Great White Multi-Use Recycled Paper (20Lb. and 84 Bright),11.96,2,0.0,5.382,2017-01-22,2017-01-27
1/22/2017,1/27/2017,Standard Class,AD-10180,Alan Dominguez,Home Office,United States,Great Falls,Montana,59405,West,Office Supplies,Storage,Tennsco Single-Tier Lockers,1126.02,3,0.0,56.301,2017-01-22,2017-01-27
3/22/2015,3/26/2015,Standard Class,DB-13210,Dean Braden,Consumer,United States,Houston,Texas,77041,Central,Technology,Accessories,"Verbatim 25 GB 6x Blu-ray Single Layer Recordable Disc, 25/Pack",18.392,1,0.2,5.2877,2015-03-22,2015-03-26
3/22/2015,3/26/2015,Standard Class,DB-13210,Dean Braden,Consumer,United States,Houston,Texas,77041,Central,Office Supplies,Storage,Carina Double Wide Media Storage Towers in Natural & Black,129.568,2,0.2,-25.9136,2015-03-22,2015-03-26
3/22/2015,3/26/2015,Standard Class,DB-13210,Dean Braden,Consumer,United States,Houston,Texas,77041,Central,Office Supplies,Binders,XtraLife ClearVue Slant-D Ring Binders by Cardinal,14.112,9,0.8,-21.168,2015-03-22,2015-03-26
1/23/2017,1/25/2017,First Class,MC-17605,Matt Connell,Corporate,United States,Detroit,Michigan,48234,Central,Furniture,Tables,Balt Solid Wood Rectangular Table,210.98,2,0.0,21.098,2017-01-23,2017-01-25
5/21/2016,5/23/2016,First Class,LH-17155,Logan Haushalter,Consumer,United States,Los Angeles,California,90032,West,Technology,Phones,Motorola HK250 Universal Bluetooth Headset,55.176,3,0.2,-12.4146,2016-05-21,2016-05-23
5/21/2016,5/23/2016,First Class,LH-17155,Logan Haushalter,Consumer,United States,Los Angeles,California,90032,West,Technology,Accessories,Imation 16GB Mini TravelDrive USB 2.0 Flash Drive,66.26,2,0.0,27.1666,2016-05-21,2016-05-23
12/26/2015,1/2/2016,Standard Class,BD-11605,Brian Dahlen,Consumer,United States,Lawrence,Massachusetts,1841,East,Office Supplies,Fasteners,Staples,22.2,5,0.0,10.434,2015-12-26,2016-01-02
10/21/2017,10/26/2017,Standard Class,PH-18790,Patricia Hirasaki,Home Office,United States,Lakeland,Florida,33801,South,Furniture,Chairs,Global Commerce Series High-Back Swivel/Tilt Chairs,683.952,3,0.2,42.747,2017-10-21,2017-10-26
10/21/2017,10/26/2017,Standard Class,PH-18790,Patricia Hirasaki,Home Office,United States,Lakeland,Florida,33801,South,Furniture,Furnishings,"Eldon Expressions Desk Accessory, Wood Photo Frame, Mahogany",45.696,3,0.2,5.1408,2017-10-21,2017-10-26
9/3/2015,9/7/2015,Standard Class,MG-18145,Mike Gockenbach,Consumer,United States,Philadelphia,Pennsylvania,19134,East,Office Supplies,Storage,Eldon Gobal File Keepers,36.336,3,0.2,-7.2672,2015-09-03,2015-09-07
9/3/2015,9/7/2015,Standard Class,MG-18145,Mike Gockenbach,Consumer,United States,Philadelphia,Pennsylvania,19134,East,Office Supplies,Supplies,Martin Yale Chadless Opener Electric Letter Opener,666.248,1,0.2,-149.9058,2015-09-03,2015-09-07
9/3/2015,9/7/2015,Standard Class,MG-18145,Mike Gockenbach,Consumer,United States,Philadelphia,Pennsylvania,19134,East,Office Supplies,Envelopes,"White Business Envelopes with Contemporary Seam, Recycled White Business Envelopes",52.512,6,0.2,19.692,2015-09-03,2015-09-07
11/7/2015,11/9/2015,Second Class,KB-16240,Karen Bern,Corporate,United States,Los Angeles,California,90036,West,Furniture,Chairs,Safco Contoured Stacking Chairs,190.72,1,0.2,11.92,2015-11-07,2015-11-09
9/7/2017,9/11/2017,Standard Class,JC-15340,Jasper Cacioppo,Consumer,United States,Los Angeles,California,90032,West,Furniture,Furnishings,Tenex Chairmats For Use With Carpeted Floors,47.94,3,0.0,2.397,2017-09-07,2017-09-11
5/29/2016,6/1/2016,Second Class,RL-19615,Rob Lucas,Consumer,United States,Montgomery,Alabama,36116,South,Technology,Phones,Panasonic KX-TG9471B,979.95,5,0.0,274.386,2016-05-29,2016-06-01
5/29/2016,6/1/2016,Second Class,RL-19615,Rob Lucas,Consumer,United States,Montgomery,Alabama,36116,South,Office Supplies,Binders,Presstex Flexible Ring Binders,22.75,5,0.0,11.375,2016-05-29,2016-06-01
7/10/2016,7/16/2016,Standard Class,AA-10375,Allen Armold,Consumer,United States,Mesa,Arizona,85204,West,Office Supplies,Storage,Sterilite Officeware Hinged File Box,16.768,2,0.2,1.4672,2016-07-10,2016-07-16
9/3/2017,9/8/2017,Second Class,EP-13915,Emily Phan,Consumer,United States,Chicago,Illinois,60653,Central,Office Supplies,Binders,"Premier Elliptical Ring Binder, Black",42.616,7,0.8,-68.1856,2017-09-03,2017-09-08
12/3/2015,12/8/2015,Standard Class,MP-17470,Mark Packer,Home Office,United States,New York City,New York,10009,East,Office Supplies,Binders,Cardinal Poly Pocket Divider Pockets for Ring Binders,10.752,4,0.2,3.36,2015-12-03,2015-12-08
12/7/2015,12/11/2015,Standard Class,DK-12985,Darren Koutras,Consumer,United States,Henderson,Kentucky,42420,South,Office Supplies,Appliances,Eureka The Boss Cordless Rechargeable Stick Vac,152.94,3,0.0,41.2938,2015-12-07,2015-12-11
12/7/2015,12/11/2015,Standard Class,DK-12985,Darren Koutras,Consumer,United States,Henderson,Kentucky,42420,South,Furniture,Chairs,"Situations Contoured Folding Chairs, 4/Set",283.92,4,0.0,70.98,2015-12-07,2015-12-11
2/1/2014,2/3/2014,First Class,BD-11500,Bradley Drucker,Consumer,United States,Green Bay,Wisconsin,54302,Central,Technology,Accessories,Enermax Aurora Lite Keyboard,468.9,6,0.0,206.316,2014-02-01,2014-02-03
7/14/2016,7/17/2016,First Class,ES-14080,Erin Smith,Corporate,United States,Tucson,Arizona,85705,West,Technology,Phones,LG Electronics Tone+ HBS-730 Bluetooth Headset,380.864,8,0.2,38.0864,2016-07-14,2016-07-17
12/18/2015,12/23/2015,Standard Class,LM-17065,Liz MacKendrick,Consumer,United States,Springfield,Ohio,45503,East,Office Supplies,Storage,Fellowes Officeware Wire Shelving,646.776,9,0.2,-145.5246,2015-12-18,2015-12-23
5/11/2014,5/16/2014,Standard Class,PG-18895,Paul Gonzalez,Consumer,United States,Fort Worth,Texas,76106,Central,Technology,Accessories,SanDisk Cruzer 64 GB USB Flash Drive,58.112,2,0.2,7.264,2014-05-11,2014-05-16
5/11/2014,5/16/2014,Standard Class,PG-18895,Paul Gonzalez,Consumer,United States,Fort Worth,Texas,76106,Central,Technology,Phones,Xblue XB-1670-86 X16 Small Office Telephone - Titanium,100.792,1,0.2,6.2995,2014-05-11,2014-05-16
5/11/2014,5/16/2014,Standard Class,PG-18895,Paul Gonzalez,Consumer,United States,Fort Worth,Texas,76106,Central,Furniture,Furnishings,"Deflect-o EconoMat Studded, No Bevel Mat for Low Pile Carpeting",66.112,4,0.6,-84.2928,2014-05-11,2014-05-16
11/19/2017,11/22/2017,First Class,AS-10135,Adrian Shami,Home Office,United States,New York City,New York,10035,East,Office Supplies,Binders,Avery Printable Repositionable Plastic Tabs,41.28,6,0.2,13.932,2017-11-19,2017-11-22
11/19/2017,11/22/2017,First Class,AS-10135,Adrian Shami,Home Office,United States,New York City,New York,10035,East,Office Supplies,Paper,Xerox 1898,13.36,2,0.0,6.4128,2017-11-19,2017-11-22
11/15/2015,11/17/2015,Second Class,DK-13225,Dean Katz,Corporate,United States,Chicago,Illinois,60653,Central,Office Supplies,Storage,Home/Office Personal File Carts,250.272,9,0.2,15.642,2015-11-15,2015-11-17
11/15/2015,11/17/2015,Second Class,DK-13225,Dean Katz,Corporate,United States,Chicago,Illinois,60653,Central,Office Supplies,Binders,Flexible Leather- Look Classic Collection Ring Binder,11.364,3,0.8,-17.046,2015-11-15,2015-11-17
11/15/2015,11/17/2015,Second Class,DK-13225,Dean Katz,Corporate,United States,Chicago,Illinois,60653,Central,Office Supplies,Supplies,Staple remover,8.72,5,0.2,-1.744,2015-11-15,2015-11-17
4/15/2016,4/17/2016,Second Class,BD-11320,Bill Donatelli,Consumer,United States,San Francisco,California,94110,West,Furniture,Chairs,HON 5400 Series Task Chairs for Big and Tall,1121.568,2,0.2,0.0,2016-04-15,2016-04-17
9/11/2017,9/12/2017,First Class,RC-19960,Ryan Crowe,Consumer,United States,Jacksonville,Florida,32216,South,Furniture,Furnishings,"Howard Miller 11-1/2"" Diameter Grantwood Wall Clock",34.504,1,0.2,6.0382,2017-09-11,2017-09-12
11/24/2017,11/28/2017,Standard Class,GT-14710,Greg Tran,Consumer,United States,Houston,Texas,77070,Central,Office Supplies,Fasteners,Advantus T-Pin Paper Clips,10.824,3,0.2,2.5707,2017-11-24,2017-11-28
6/29/2017,7/3/2017,Second Class,DK-13225,Dean Katz,Corporate,United States,Anaheim,California,92804,West,Office Supplies,Storage,Tennsco 16-Compartment Lockers with Coat Rack,1295.78,2,0.0,310.9872,2017-06-29,2017-07-03
3/3/2014,3/7/2014,Second Class,AJ-10945,Ashley Jarboe,Consumer,United States,Wilmington,North Carolina,28403,South,Office Supplies,Art,Zebra Zazzle Fluorescent Highlighters,19.456,4,0.2,3.4048,2014-03-03,2014-03-07
6/10/2016,6/15/2016,Standard Class,OT-18730,Olvera Toch,Consumer,United States,Los Angeles,California,90045,West,Office Supplies,Labels,Avery 473,20.7,2,0.0,9.936,2016-06-10,2016-06-15
6/10/2016,6/15/2016,Standard Class,OT-18730,Olvera Toch,Consumer,United States,Los Angeles,California,90045,West,Furniture,Tables,Bretford Just In Time Height-Adjustable Multi-Task Work Tables,1335.68,4,0.2,-217.048,2016-06-10,2016-06-15
6/10/2016,6/15/2016,Standard Class,OT-18730,Olvera Toch,Consumer,United States,Los Angeles,California,90045,West,Office Supplies,Paper,Xerox 226,32.4,5,0.0,15.552,2016-06-10,2016-06-15
11/20/2017,11/22/2017,Second Class,LP-17080,Liz Pelletier,Consumer,United States,San Francisco,California,94110,West,Furniture,Furnishings,Coloredge Poster Frame,42.6,3,0.0,16.614,2017-11-20,2017-11-22
11/20/2017,11/22/2017,Second Class,LP-17080,Liz Pelletier,Consumer,United States,San Francisco,California,94110,West,Office Supplies,Binders,"GBC Prepunched Paper, 19-Hole, for Binding Systems, 24-lb",84.056,7,0.2,27.3182,2017-11-20,2017-11-22
9/14/2014,9/18/2014,Second Class,CA-12775,Cynthia Arntzen,Consumer,United States,Tampa,Florida,33614,South,Office Supplies,Appliances,"Sanitaire Vibra Groomer IR Commercial Upright Vacuum, Replacement Belts",13.0,5,0.2,1.3,2014-09-14,2014-09-18
9/14/2014,9/18/2014,Second Class,CA-12775,Cynthia Arntzen,Consumer,United States,Tampa,Florida,33614,South,Furniture,Furnishings,Advantus Panel Wall Acrylic Frame,13.128,3,0.2,3.7743,2014-09-14,2014-09-18
12/7/2015,12/9/2015,First Class,JF-15490,Jeremy Farry,Consumer,United States,Seattle,Washington,98105,West,Office Supplies,Fasteners,"Alliance Big Bands Rubber Bands, 12/Pack",3.96,2,0.0,0.0,2015-12-07,2015-12-09
12/7/2015,12/9/2015,First Class,JF-15490,Jeremy Farry,Consumer,United States,Seattle,Washington,98105,West,Office Supplies,Labels,Avery 509,2.61,1,0.0,1.2006,2015-12-07,2015-12-09
12/7/2017,12/10/2017,First Class,FP-14320,Frank Preis,Consumer,United States,Los Angeles,California,90008,West,Technology,Phones,Cisco SPA301,374.376,3,0.2,46.797,2017-12-07,2017-12-10
10/1/2017,10/8/2017,Standard Class,EB-13840,Ellis Ballard,Corporate,United States,Seattle,Washington,98105,West,Office Supplies,Paper,Personal Creations Ink Jet Cards and Labels,91.84,8,0.0,45.0016,2017-10-01,2017-10-08
10/1/2017,10/8/2017,Standard Class,EB-13840,Ellis Ballard,Corporate,United States,Seattle,Washington,98105,West,Office Supplies,Binders,"GBC White Gloss Covers, Plain Front",81.088,7,0.2,27.3672,2017-10-01,2017-10-08
10/1/2017,10/8/2017,Standard Class,EB-13840,Ellis Ballard,Corporate,United States,Seattle,Washington,98105,West,Office Supplies,Paper,Xerox 222,19.44,3,0.0,9.3312,2017-10-01,2017-10-08
10/1/2017,10/8/2017,Standard Class,EB-13840,Ellis Ballard,Corporate,United States,Seattle,Washington,98105,West,Furniture,Chairs,Hon Every-Day Series Multi-Task Chairs,451.152,3,0.2,0.0,2017-10-01,2017-10-08
12/28/2017,1/4/2018,Standard Class,JF-15415,Jennifer Ferguson,Consumer,United States,New York City,New York,10024,East,Office Supplies,Labels,Avery 473,72.45,7,0.0,34.776,2017-12-28,2018-01-04
12/28/2017,1/4/2018,Standard Class,JF-15415,Jennifer Ferguson,Consumer,United States,New York City,New York,10024,East,Office Supplies,Fasteners,OIC Bulk Pack Metal Binder Clips,13.96,4,0.0,6.4216,2017-12-28,2018-01-04
12/28/2017,1/4/2018,Standard Class,JF-15415,Jennifer Ferguson,Consumer,United States,New York City,New York,10024,East,Office Supplies,Binders,Storex Dura Pro Binders,33.264,7,0.2,11.2266,2017-12-28,2018-01-04
12/28/2017,1/4/2018,Standard Class,JF-15415,Jennifer Ferguson,Consumer,United States,New York City,New York,10024,East,Technology,Phones,Cush Cases Heavy Duty Rugged Cover Case for Samsung Galaxy S5 - Purple,14.85,3,0.0,4.0095,2017-12-28,2018-01-04
11/3/2016,11/7/2016,Standard Class,SF-20200,Sarah Foster,Consumer,United States,Marysville,Washington,98270,West,Office Supplies,Art,Newell 332,8.82,3,0.0,2.3814,2016-11-03,2016-11-07
9/18/2015,9/22/2015,Second Class,TG-21640,Trudy Glocke,Consumer,United States,Long Beach,California,90805,West,Office Supplies,Paper,Personal Creations Ink Jet Cards and Labels,160.72,14,0.0,78.7528,2015-09-18,2015-09-22
9/18/2015,9/22/2015,Second Class,TG-21640,Trudy Glocke,Consumer,United States,Long Beach,California,90805,West,Office Supplies,Paper,Rediform S.O.S. Phone Message Books,19.92,4,0.0,9.7608,2015-09-18,2015-09-22
9/18/2015,9/22/2015,Second Class,TG-21640,Trudy Glocke,Consumer,United States,Long Beach,California,90805,West,Office Supplies,Supplies,Acme Value Line Scissors,7.3,2,0.0,2.19,2015-09-18,2015-09-22
7/20/2017,7/26/2017,Standard Class,CS-11950,Carlos Soltero,Consumer,United States,Chicago,Illinois,60610,Central,Office Supplies,Storage,"Trav-L-File Heavy-Duty Shuttle II, Black",69.712,2,0.2,8.714,2017-07-20,2017-07-26
7/20/2017,7/26/2017,Standard Class,CS-11950,Carlos Soltero,Consumer,United States,Chicago,Illinois,60610,Central,Furniture,Furnishings,"Contract Clock, 14"", Brown",8.792,1,0.6,-5.7148,2017-07-20,2017-07-26
9/10/2015,9/14/2015,Standard Class,CC-12145,Charles Crestani,Consumer,United States,Los Angeles,California,90004,West,Office Supplies,Supplies,Martin-Yale Premier Letter Opener,51.52,4,0.0,1.5456,2015-09-10,2015-09-14
12/1/2017,12/5/2017,Standard Class,DV-13465,Dianna Vittorini,Consumer,United States,Denver,Colorado,80219,West,Technology,Phones,GE 30524EE4,470.376,3,0.2,52.9173,2017-12-01,2017-12-05
12/1/2017,12/5/2017,Standard Class,DV-13465,Dianna Vittorini,Consumer,United States,Denver,Colorado,80219,West,Technology,Phones,AT&T SB67148 SynJ,105.584,2,0.2,9.2386,2017-12-01,2017-12-05
12/1/2017,12/5/2017,Standard Class,DV-13465,Dianna Vittorini,Consumer,United States,Denver,Colorado,80219,West,Office Supplies,Appliances,Fellowes Basic Home/Office Series Surge Protectors,31.152,3,0.2,3.5046,2017-12-01,2017-12-05
12/1/2017,12/5/2017,Standard Class,DV-13465,Dianna Vittorini,Consumer,United States,Denver,Colorado,80219,West,Office Supplies,Binders,Recycled Pressboard Report Cover with Reinforced Top Hinge,6.783,7,0.7,-4.7481,2017-12-01,2017-12-05
12/1/2017,12/5/2017,Standard Class,DV-13465,Dianna Vittorini,Consumer,United States,Denver,Colorado,80219,West,Technology,Phones,Jabra BIZ 2300 Duo QD Duo Corded Headset,406.368,4,0.2,30.4776,2017-12-01,2017-12-05
7/3/2015,7/9/2015,Standard Class,BD-11725,Bruce Degenhardt,Consumer,United States,Richmond,Kentucky,40475,South,Furniture,Chairs,Novimex High-Tech Fabric Mesh Task Chair,70.98,1,0.0,4.9686,2015-07-03,2015-07-09
7/3/2015,7/9/2015,Standard Class,BD-11725,Bruce Degenhardt,Consumer,United States,Richmond,Kentucky,40475,South,Office Supplies,Labels,"Dot Matrix Printer Tape Reel Labels, White, 5000/Box",294.93,3,0.0,144.5157,2015-07-03,2015-07-09
3/20/2016,3/24/2016,Standard Class,ZC-21910,Zuschuss Carroll,Consumer,United States,Salem,Oregon,97301,West,Technology,Phones,i.Sound Portable Power - 8000 mAh,84.784,2,0.2,-20.1362,2016-03-20,2016-03-24
3/20/2016,3/24/2016,Standard Class,ZC-21910,Zuschuss Carroll,Consumer,United States,Salem,Oregon,97301,West,Office Supplies,Paper,Xerox 225,20.736,4,0.2,7.2576,2016-03-20,2016-03-24
3/20/2016,3/24/2016,Standard Class,ZC-21910,Zuschuss Carroll,Consumer,United States,Salem,Oregon,97301,West,Office Supplies,Binders,Clear Mylar Reinforcing Strips,16.821,3,0.7,-12.8961,2016-03-20,2016-03-24
3/20/2016,3/24/2016,Standard Class,ZC-21910,Zuschuss Carroll,Consumer,United States,Salem,Oregon,97301,West,Office Supplies,Paper,Xerox 1894,10.368,2,0.2,3.6288,2016-03-20,2016-03-24
1/9/2014,1/13/2014,Standard Class,MS-17830,Melanie Seite,Consumer,United States,Laredo,Texas,78041,Central,Office Supplies,Art,Newell 312,9.344,2,0.2,1.168,2014-01-09,2014-01-13
1/9/2014,1/13/2014,Standard Class,MS-17830,Melanie Seite,Consumer,United States,Laredo,Texas,78041,Central,Technology,Accessories,Memorex Micro Travel Drive 8 GB,31.2,3,0.2,9.75,2014-01-09,2014-01-13
8/8/2014,8/15/2014,Standard Class,LR-16915,Lena Radford,Consumer,United States,San Diego,California,92024,West,Office Supplies,Appliances,Fellowes Superior 10 Outlet Split Surge Protector,76.12,2,0.0,22.0748,2014-08-08,2014-08-15
8/8/2014,8/15/2014,Standard Class,LR-16915,Lena Radford,Consumer,United States,San Diego,California,92024,West,Technology,Copiers,Sharp AL-1530CS Digital Copier,1199.976,3,0.2,434.9913,2014-08-08,2014-08-15
8/8/2014,8/15/2014,Standard Class,LR-16915,Lena Radford,Consumer,United States,San Diego,California,92024,West,Technology,Phones,AT&T 1070 Corded Phone,445.96,5,0.2,55.745,2014-08-08,2014-08-15
8/8/2014,8/15/2014,Standard Class,LR-16915,Lena Radford,Consumer,United States,San Diego,California,92024,West,Furniture,Furnishings,Dana Halogen Swing-Arm Architect Lamp,327.76,8,0.0,91.7728,2014-08-08,2014-08-15
7/14/2016,7/16/2016,First Class,TP-21130,Theone Pippenger,Consumer,United States,Philadelphia,Pennsylvania,19134,East,Office Supplies,Supplies,Acme Stainless Steel Office Snips,11.632,2,0.2,1.0178,2016-07-14,2016-07-16
7/16/2016,7/21/2016,Standard Class,CK-12205,Chloris Kastensmidt,Consumer,United States,Philadelphia,Pennsylvania,19120,East,Technology,Phones,Mophie Juice Pack Helium for iPhone,143.982,3,0.4,-28.7964,2016-07-16,2016-07-21
7/16/2016,7/21/2016,Standard Class,CK-12205,Chloris Kastensmidt,Consumer,United States,Philadelphia,Pennsylvania,19120,East,Technology,Phones,GE 2-Jack Phone Line Splitter,494.376,4,0.4,-115.3544,2016-07-16,2016-07-21
7/16/2016,7/21/2016,Standard Class,CK-12205,Chloris Kastensmidt,Consumer,United States,Philadelphia,Pennsylvania,19120,East,Office Supplies,Supplies,Acme Value Line Scissors,5.84,2,0.2,0.73,2016-07-16,2016-07-21
3/15/2014,3/19/2014,Standard Class,AS-10240,Alan Shonely,Consumer,United States,Tampa,Florida,33614,South,Office Supplies,Storage,"Hot File 7-Pocket, Floor Stand",142.776,1,0.2,17.847,2014-03-15,2014-03-19
3/15/2014,3/19/2014,Standard Class,AS-10240,Alan Shonely,Consumer,United States,Tampa,Florida,33614,South,Furniture,Furnishings,"Eldon Expressions Desk Accessory, Wood Photo Frame, Mahogany",45.696,3,0.2,5.1408,2014-03-15,2014-03-19
3/15/2014,3/19/2014,Standard Class,AS-10240,Alan Shonely,Consumer,United States,Tampa,Florida,33614,South,Office Supplies,Binders,Insertable Tab Post Binder Dividers,7.218,3,0.7,-5.5338,2014-03-15,2014-03-19
3/15/2014,3/19/2014,Standard Class,AS-10240,Alan Shonely,Consumer,United States,Tampa,Florida,33614,South,Office Supplies,Binders,GBC VeloBinder Manual Binding System,43.188,4,0.7,-31.6712,2014-03-15,2014-03-19
3/15/2014,3/19/2014,Standard Class,AS-10240,Alan Shonely,Consumer,United States,Tampa,Florida,33614,South,Office Supplies,Paper,Xerox 1889,131.904,3,0.2,47.8152,2014-03-15,2014-03-19
5/23/2014,5/27/2014,Standard Class,AR-10510,Andrew Roberts,Consumer,United States,Philadelphia,Pennsylvania,19134,East,Office Supplies,Binders,Angle-D Ring Binders,3.282,2,0.7,-2.6256,2014-05-23,2014-05-27
5/23/2014,5/27/2014,Standard Class,AR-10510,Andrew Roberts,Consumer,United States,Philadelphia,Pennsylvania,19134,East,Office Supplies,Art,Newell 317,21.168,9,0.2,2.3814,2014-05-23,2014-05-27
5/23/2014,5/27/2014,Standard Class,AR-10510,Andrew Roberts,Consumer,United States,Philadelphia,Pennsylvania,19134,East,Technology,Phones,Motorola L804,55.188,2,0.4,-10.1178,2014-05-23,2014-05-27
4/28/2016,5/1/2016,First Class,NB-18655,Nona Balk,Corporate,United States,Dallas,Texas,75217,Central,Technology,Phones,Nortel Meridian M3904 Professional Digital phone,369.576,3,0.2,41.5773,2016-04-28,2016-05-01
4/28/2016,5/1/2016,First Class,NB-18655,Nona Balk,Corporate,United States,Dallas,Texas,75217,Central,Office Supplies,Labels,Avery 493,15.712,4,0.2,5.6956,2016-04-28,2016-05-01
9/11/2016,9/13/2016,Second Class,GD-14590,Giulietta Dortch,Corporate,United States,Philadelphia,Pennsylvania,19143,East,Office Supplies,Paper,Xerox 1972,8.448,2,0.2,2.64,2016-09-11,2016-09-13
9/11/2016,9/13/2016,Second Class,GD-14590,Giulietta Dortch,Corporate,United States,Philadelphia,Pennsylvania,19143,East,Technology,Phones,Cisco 8x8 Inc. 6753i IP Business Phone System,728.946,9,0.4,-157.9383,2016-09-11,2016-09-13
11/14/2017,11/17/2017,Second Class,CK-12595,Clytie Kelty,Consumer,United States,Grove City,Ohio,43123,East,Technology,Phones,PureGear Roll-On Screen Protector,119.94,10,0.4,15.992,2017-11-14,2017-11-17
11/14/2017,11/17/2017,Second Class,CK-12595,Clytie Kelty,Consumer,United States,Grove City,Ohio,43123,East,Office Supplies,Binders,Prestige Round Ring Binders,3.648,2,0.7,-2.7968,2017-11-14,2017-11-17
8/18/2017,8/23/2017,Second Class,NG-18355,Nat Gilpin,Corporate,United States,New York City,New York,10011,East,Furniture,Furnishings,"DAX Metal Frame, Desktop, Stepped-Edge",40.48,2,0.0,15.7872,2017-08-18,2017-08-23
8/18/2017,8/23/2017,Second Class,NG-18355,Nat Gilpin,Corporate,United States,New York City,New York,10011,East,Furniture,Furnishings,"DAX Value U-Channel Document Frames, Easel Back",9.94,2,0.0,3.0814,2017-08-18,2017-08-23
8/18/2017,8/23/2017,Second Class,NG-18355,Nat Gilpin,Corporate,United States,New York City,New York,10011,East,Office Supplies,Binders,Recycled Easel Ring Binders,107.424,9,0.2,33.57,2017-08-18,2017-08-23
8/18/2017,8/23/2017,Second Class,NG-18355,Nat Gilpin,Corporate,United States,New York City,New York,10011,East,Technology,Phones,Grandstream GXP1160 VoIP phone,37.91,1,0.0,10.9939,2017-08-18,2017-08-23
8/18/2017,8/23/2017,Second Class,NG-18355,Nat Gilpin,Corporate,United States,New York City,New York,10011,East,Furniture,Furnishings,"Seth Thomas 14"" Putty-Colored Wall Clock",88.02,3,0.0,27.2862,2017-08-18,2017-08-23
12/26/2014,12/31/2014,Standard Class,CA-12265,Christina Anderson,Consumer,United States,Chicago,Illinois,60610,Central,Office Supplies,Binders,"Cardinal Slant-D Ring Binder, Heavy Gauge Vinyl",8.69,5,0.8,-14.773,2014-12-26,2014-12-31
11/29/2015,12/3/2015,Standard Class,SF-20965,Sylvia Foulston,Corporate,United States,Dearborn,Michigan,48126,Central,Furniture,Chairs,"Global Manager's Adjustable Task Chair, Storm",301.96,2,0.0,87.5684,2015-11-29,2015-12-03
11/29/2015,12/3/2015,Standard Class,SF-20965,Sylvia Foulston,Corporate,United States,Dearborn,Michigan,48126,Central,Office Supplies,Appliances,Honeywell Enviracaire Portable HEPA Air Cleaner for up to 10 x 16 Room,555.21,5,0.1,178.901,2015-11-29,2015-12-03
11/29/2015,12/3/2015,Standard Class,SF-20965,Sylvia Foulston,Corporate,United States,Dearborn,Michigan,48126,Central,Office Supplies,Storage,"Mini 13-1/2 Capacity Data Binder Rack, Pearl",523.48,4,0.0,130.87,2015-11-29,2015-12-03
11/29/2015,12/3/2015,Standard Class,SF-20965,Sylvia Foulston,Corporate,United States,Dearborn,Michigan,48126,Central,Office Supplies,Art,"BOSTON Model 1800 Electric Pencil Sharpeners, Putty/Woodgrain",161.82,9,0.0,46.9278,2015-11-29,2015-12-03
9/15/2017,9/19/2017,Standard Class,MO-17800,Meg O'Connel,Home Office,United States,New York City,New York,10009,East,Furniture,Furnishings,"Master Caster Door Stop, Brown",35.56,7,0.0,12.0904,2017-09-15,2017-09-19
5/19/2017,5/23/2017,Standard Class,AT-10735,Annie Thurman,Consumer,United States,Seattle,Washington,98115,West,Office Supplies,Appliances,Belkin Premiere Surge Master II 8-outlet surge protector,97.16,2,0.0,28.1764,2017-05-19,2017-05-23
12/17/2017,12/21/2017,Standard Class,LC-17140,Logan Currie,Consumer,United States,San Francisco,California,94122,West,Office Supplies,Binders,"Acco Pressboard Covers with Storage Hooks, 9 1/2"" x 11"", Executive Red",15.24,5,0.2,5.1435,2017-12-17,2017-12-21
12/17/2017,12/21/2017,Standard Class,LC-17140,Logan Currie,Consumer,United States,San Francisco,California,94122,West,Office Supplies,Paper,"Ampad Gold Fibre Wirebound Steno Books, 6"" x 9"", Gregg Ruled",13.23,3,0.0,6.0858,2017-12-17,2017-12-21
12/11/2016,12/13/2016,Second Class,FM-14380,Fred McMath,Consumer,United States,Aurora,Colorado,80013,West,Office Supplies,Storage,Tennsco Regal Shelving Units,243.384,3,0.2,-51.7191,2016-12-11,2016-12-13
12/11/2016,12/13/2016,Second Class,FM-14380,Fred McMath,Consumer,United States,Aurora,Colorado,80013,West,Technology,Accessories,Imation 32GB Pocket Pro USB 3.0 Flash Drive - 32 GB - Black - 1 P ...,119.8,5,0.2,29.95,2016-12-11,2016-12-13
12/11/2016,12/13/2016,Second Class,FM-14380,Fred McMath,Consumer,United States,Aurora,Colorado,80013,West,Technology,Phones,Jabra SPEAK 410,300.768,4,0.2,30.0768,2016-12-11,2016-12-13
9/24/2017,9/26/2017,Second Class,BD-11605,Brian Dahlen,Consumer,United States,Miami,Florida,33180,South,Technology,Accessories,"Verbatim 25 GB 6x Blu-ray Single Layer Recordable Disc, 1/Pack",17.88,3,0.2,2.4585,2017-09-24,2017-09-26
9/24/2017,9/26/2017,Second Class,BD-11605,Brian Dahlen,Consumer,United States,Miami,Florida,33180,South,Office Supplies,Labels,"Dot Matrix Printer Tape Reel Labels, White, 5000/Box",235.944,3,0.2,85.5297,2017-09-24,2017-09-26
10/4/2015,10/9/2015,Second Class,DJ-13420,Denny Joy,Corporate,United States,Warner Robins,Georgia,31088,South,Furniture,Chairs,Office Star - Mesh Screen back chair with Vinyl seat,392.94,3,0.0,43.2234,2015-10-04,2015-10-09
8/15/2016,8/21/2016,Standard Class,ME-17725,Max Engle,Consumer,United States,Aurora,Colorado,80013,West,Office Supplies,Binders,Premium Transparent Presentation Covers by GBC,18.882,3,0.7,-13.8468,2016-08-15,2016-08-21
8/15/2016,8/21/2016,Standard Class,ME-17725,Max Engle,Consumer,United States,Aurora,Colorado,80013,West,Office Supplies,Appliances,Tripp Lite TLP810NET Broadband Surge for Modem/Fax,122.328,3,0.2,12.2328,2016-08-15,2016-08-21
5/20/2016,5/25/2016,Standard Class,RB-19465,Rick Bensley,Home Office,United States,Vallejo,California,94591,West,Furniture,Furnishings,Luxo Professional Fluorescent Magnifier Lamp with Clamp-Mount Base,1049.2,5,0.0,272.792,2016-05-20,2016-05-25
5/20/2016,5/25/2016,Standard Class,RB-19465,Rick Bensley,Home Office,United States,Vallejo,California,94591,West,Office Supplies,Binders,Wilson Jones Turn Tabs Binder Tool for Ring Binders,15.424,4,0.2,5.0128,2016-05-20,2016-05-25
12/18/2016,12/22/2016,Standard Class,JD-16150,Justin Deggeller,Corporate,United States,Minneapolis,Minnesota,55407,Central,Furniture,Furnishings,Eldon 200 Class Desk Accessories,18.84,3,0.0,6.0288,2016-12-18,2016-12-22
7/30/2017,8/3/2017,Second Class,JL-15835,John Lee,Consumer,United States,Mission Viejo,California,92691,West,Office Supplies,Storage,Economy Rollaway Files,330.4,2,0.0,85.904,2017-07-30,2017-08-03
7/30/2017,8/3/2017,Second Class,JL-15835,John Lee,Consumer,United States,Mission Viejo,California,92691,West,Office Supplies,Labels,Avery 480,26.25,7,0.0,12.6,2017-07-30,2017-08-03
6/10/2017,6/15/2017,Standard Class,SC-20305,Sean Christensen,Consumer,United States,Rochester Hills,Michigan,48307,Central,Technology,Accessories,Imation 16GB Mini TravelDrive USB 2.0 Flash Drive,132.52,4,0.0,54.3332,2017-06-10,2017-06-15
7/21/2017,7/25/2017,Standard Class,TW-21025,Tamara Willingham,Home Office,United States,Plainfield,New Jersey,7060,East,Office Supplies,Paper,Xerox 1993,6.48,1,0.0,3.1752,2017-07-21,2017-07-25
12/30/2017,1/5/2018,Standard Class,CC-12430,Chuck Clark,Home Office,United States,Columbus,Indiana,47201,Central,Office Supplies,Appliances,"Eureka The Boss Plus 12-Amp Hard Box Upright Vacuum, Red",209.3,2,0.0,56.511,2017-12-30,2018-01-05
4/1/2016,4/8/2016,Standard Class,BB-10990,Barry Blumstein,Corporate,United States,Sierra Vista,Arizona,85635,West,Office Supplies,Fasteners,Staples,31.56,5,0.2,9.8625,2016-04-01,2016-04-08
4/1/2016,4/8/2016,Standard Class,BB-10990,Barry Blumstein,Corporate,United States,Sierra Vista,Arizona,85635,West,Office Supplies,Appliances,Belkin F9H710-06 7 Outlet SurgeMaster Surge Protector,30.144,2,0.2,3.0144,2016-04-01,2016-04-08
12/11/2016,12/16/2016,Second Class,AR-10825,Anthony Rawles,Corporate,United States,Vancouver,Washington,98661,West,Furniture,Furnishings,3M Hangers With Command Adhesive,14.8,4,0.0,6.068,2016-12-11,2016-12-16
12/11/2016,12/16/2016,Second Class,AR-10825,Anthony Rawles,Corporate,United States,Vancouver,Washington,98661,West,Technology,Phones,AT&T TR1909W,302.376,3,0.2,22.6782,2016-12-11,2016-12-16
12/11/2016,12/16/2016,Second Class,AR-10825,Anthony Rawles,Corporate,United States,Vancouver,Washington,98661,West,Technology,Accessories,First Data FD10 PIN Pad,316.0,4,0.0,31.6,2016-12-11,2016-12-16
10/23/2016,10/29/2016,Standard Class,SR-20740,Steven Roelle,Home Office,United States,New York City,New York,10024,East,Office Supplies,Paper,"Snap-A-Way Black Print Carbonless Ruled Speed Letter, Triplicate",379.4,10,0.0,178.318,2016-10-23,2016-10-29
6/19/2017,6/23/2017,Standard Class,AR-10405,Allen Rosenblatt,Corporate,United States,New York City,New York,10035,East,Office Supplies,Paper,Xerox 1943,97.82,2,0.0,45.9754,2017-06-19,2017-06-23
6/19/2017,6/23/2017,Standard Class,AR-10405,Allen Rosenblatt,Corporate,United States,New York City,New York,10035,East,Technology,Accessories,Sony 16GB Class 10 Micro SDHC R40 Memory Card,103.12,8,0.0,10.312,2017-06-19,2017-06-23
8/22/2016,8/28/2016,Standard Class,CR-12730,Craig Reiter,Consumer,United States,Columbus,Ohio,43229,East,Office Supplies,Appliances,Tripp Lite Isotel 8 Ultra 8 Outlet Metal Surge,113.552,2,0.2,8.5164,2016-08-22,2016-08-28
8/22/2016,8/28/2016,Standard Class,CR-12730,Craig Reiter,Consumer,United States,Columbus,Ohio,43229,East,Office Supplies,Binders,Avery Durable Poly Binders,3.318,2,0.7,-2.6544,2016-08-22,2016-08-28
8/22/2016,8/28/2016,Standard Class,CR-12730,Craig Reiter,Consumer,United States,Columbus,Ohio,43229,East,Office Supplies,Envelopes,Airmail Envelopes,134.288,2,0.2,45.3222,2016-08-22,2016-08-28
9/19/2016,9/19/2016,Same Day,EH-14125,Eugene Hildebrand,Home Office,United States,Aurora,Illinois,60505,Central,Furniture,Chairs,Global Troy Executive Leather Low-Back Tilter,701.372,2,0.3,-50.098,2016-09-19,2016-09-19
9/19/2016,9/19/2016,Same Day,EH-14125,Eugene Hildebrand,Home Office,United States,Aurora,Illinois,60505,Central,Office Supplies,Binders,Avery Binding System Hidden Tab Executive Style Index Sets,2.308,2,0.8,-3.462,2016-09-19,2016-09-19
8/24/2015,8/28/2015,Standard Class,CB-12025,Cassandra Brandow,Consumer,United States,Arlington,Texas,76017,Central,Office Supplies,Storage,"Hot File 7-Pocket, Floor Stand",999.432,7,0.2,124.929,2015-08-24,2015-08-28
8/24/2015,8/28/2015,Standard Class,CB-12025,Cassandra Brandow,Consumer,United States,Arlington,Texas,76017,Central,Office Supplies,Storage,Space Solutions Commercial Steel Shelving,724.08,14,0.2,-135.765,2015-08-24,2015-08-28
8/24/2015,8/28/2015,Standard Class,CB-12025,Cassandra Brandow,Consumer,United States,Arlington,Texas,76017,Central,Furniture,Tables,Hon Racetrack Conference Tables,918.785,5,0.3,-118.1295,2015-08-24,2015-08-28
8/24/2015,8/28/2015,Standard Class,CB-12025,Cassandra Brandow,Consumer,United States,Arlington,Texas,76017,Central,Office Supplies,Binders,"Avery Durable Plastic 1"" Binders",2.724,3,0.8,-4.2222,2015-08-24,2015-08-28
3/26/2016,3/30/2016,Standard Class,SP-20545,Sibella Parks,Corporate,United States,New York City,New York,10011,East,Office Supplies,Storage,"Gould Plastics 18-Pocket Panel Bin, 34w x 5-1/4d x 20-1/2h",459.95,5,0.0,18.398,2016-03-26,2016-03-30
11/4/2016,11/4/2016,Same Day,RC-19825,Roy Collins,Consumer,United States,Louisville,Kentucky,40214,South,Office Supplies,Fasteners,"OIC Colored Binder Clips, Assorted Sizes",10.74,3,0.0,5.2626,2016-11-04,2016-11-04
6/8/2017,6/10/2017,Second Class,TH-21235,Tiffany House,Corporate,United States,Dallas,Texas,75081,Central,Office Supplies,Supplies,Acme Tagit Stainless Steel Antibacterial Scissors,23.76,3,0.2,2.079,2017-06-08,2017-06-10
6/8/2017,6/10/2017,Second Class,TH-21235,Tiffany House,Corporate,United States,Dallas,Texas,75081,Central,Office Supplies,Paper,Easy-staple paper,85.056,3,0.2,28.7064,2017-06-08,2017-06-10
6/8/2017,6/10/2017,Second Class,TH-21235,Tiffany House,Corporate,United States,Dallas,Texas,75081,Central,Technology,Phones,ClearOne Communications CHAT 70 OC Speaker Phone,381.576,3,0.2,28.6182,2017-06-08,2017-06-10
12/24/2014,12/26/2014,First Class,RP-19390,Resi Pölking,Consumer,United States,Cleveland,Ohio,44105,East,Furniture,Furnishings,"Master Giant Foot Doorstop, Safety Yellow",30.36,5,0.2,8.7285,2014-12-24,2014-12-26
6/9/2017,6/13/2017,Standard Class,MO-17800,Meg O'Connel,Home Office,United States,Chicago,Illinois,60653,Central,Furniture,Furnishings,12-1/2 Diameter Round Wall Clock,23.976,3,0.6,-14.3856,2017-06-09,2017-06-13
6/9/2017,6/13/2017,Standard Class,MO-17800,Meg O'Connel,Home Office,United States,Chicago,Illinois,60653,Central,Furniture,Tables,"Chromcraft Bull-Nose Wood Round Conference Table Top, Wood Base",108.925,1,0.5,-71.8905,2017-06-09,2017-06-13
6/9/2017,6/13/2017,Standard Class,MO-17800,Meg O'Connel,Home Office,United States,Chicago,Illinois,60653,Central,Office Supplies,Paper,"Adams Telephone Message Book W/Dividers/Space For Phone Numbers, 5 1/4""X8 1/2"", 200/Messages",36.352,8,0.2,11.36,2017-06-09,2017-06-13
6/15/2017,6/22/2017,Standard Class,TD-20995,Tamara Dahlen,Consumer,United States,Quincy,Illinois,62301,Central,Office Supplies,Art,Newell 331,19.56,5,0.2,1.7115,2017-06-15,2017-06-22
12/5/2017,12/8/2017,First Class,RB-19570,Rob Beeghly,Consumer,United States,Columbus,Indiana,47201,Central,Office Supplies,Appliances,Kensington 6 Outlet Guardian Standard Surge Protector,61.44,3,0.0,16.5888,2017-12-05,2017-12-08
12/5/2017,12/8/2017,First Class,RB-19570,Rob Beeghly,Consumer,United States,Columbus,Indiana,47201,Central,Office Supplies,Paper,"Southworth 100% Résumé Paper, 24lb.",38.9,5,0.0,17.505,2017-12-05,2017-12-08
12/5/2017,12/8/2017,First Class,RB-19570,Rob Beeghly,Consumer,United States,Columbus,Indiana,47201,Central,Technology,Accessories,Imation 16GB Mini TravelDrive USB 2.0 Flash Drive,99.39,3,0.0,40.7499,2017-12-05,2017-12-08
3/18/2017,3/23/2017,Standard Class,CD-11980,Carol Darley,Consumer,United States,Tyler,Texas,75701,Central,Office Supplies,Appliances,Hoover Portapower Portable Vacuum,2.688,3,0.8,-7.392,2017-03-18,2017-03-23
3/18/2017,3/23/2017,Standard Class,CD-11980,Carol Darley,Consumer,United States,Tyler,Texas,75701,Central,Technology,Accessories,"Verbatim 25 GB 6x Blu-ray Single Layer Recordable Disc, 10/Pack",27.816,3,0.2,4.5201,2017-03-18,2017-03-23
3/18/2017,3/23/2017,Standard Class,CD-11980,Carol Darley,Consumer,United States,Tyler,Texas,75701,Central,Furniture,Furnishings,"Howard Miller 13-1/2"" Diameter Rosebrook Wall Clock",82.524,3,0.6,-41.262,2017-03-18,2017-03-23
3/18/2017,3/23/2017,Standard Class,CD-11980,Carol Darley,Consumer,United States,Tyler,Texas,75701,Central,Office Supplies,Binders,Ibico Hi-Tech Manual Binding System,182.994,3,0.8,-320.2395,2017-03-18,2017-03-23
11/19/2016,11/24/2016,Standard Class,DJ-13630,Doug Jacobs,Consumer,United States,New York City,New York,10024,East,Office Supplies,Binders,Avery Hanging File Binders,14.352,3,0.2,4.6644,2016-11-19,2016-11-24
11/19/2016,11/24/2016,Standard Class,DJ-13630,Doug Jacobs,Consumer,United States,New York City,New York,10024,East,Office Supplies,Storage,Fellowes Neat Ideas Storage Cubes,64.96,2,0.0,2.5984,2016-11-19,2016-11-24
11/19/2016,11/24/2016,Standard Class,DJ-13630,Doug Jacobs,Consumer,United States,New York City,New York,10024,East,Office Supplies,Storage,Advantus Rolling Storage Box,68.6,4,0.0,18.522,2016-11-19,2016-11-24
11/4/2017,11/4/2017,Same Day,GT-14635,Grant Thornton,Corporate,United States,Burlington,North Carolina,27217,South,Technology,Machines,Cubify CubeX 3D Printer Triple Head Print,7999.98,4,0.5,-3839.9904,2017-11-04,2017-11-04
11/4/2017,11/4/2017,Same Day,GT-14635,Grant Thornton,Corporate,United States,Burlington,North Carolina,27217,South,Office Supplies,Appliances,"Eureka The Boss Plus 12-Amp Hard Box Upright Vacuum, Red",167.44,2,0.2,14.651,2017-11-04,2017-11-04
7/5/2014,7/8/2014,First Class,MC-17845,Michael Chen,Consumer,United States,Jackson,Mississippi,39212,South,Technology,Accessories,NETGEAR AC1750 Dual Band Gigabit Smart WiFi Router,479.97,3,0.0,163.1898,2014-07-05,2014-07-08
7/5/2014,7/8/2014,First Class,MC-17845,Michael Chen,Consumer,United States,Jackson,Mississippi,39212,South,Office Supplies,Labels,Avery 516,14.62,2,0.0,6.8714,2014-07-05,2014-07-08
7/5/2014,7/8/2014,First Class,MC-17845,Michael Chen,Consumer,United States,Jackson,Mississippi,39212,South,Office Supplies,Paper,Xerox 1995,19.44,3,0.0,9.3312,2014-07-05,2014-07-08
12/25/2017,12/29/2017,Standard Class,RA-19285,Ralph Arnett,Consumer,United States,New York City,New York,10035,East,Furniture,Bookcases,"Bush Andora Bookcase, Maple/Graphite Gray Finish",191.984,2,0.2,4.7996,2017-12-25,2017-12-29
6/21/2014,6/23/2014,Second Class,NP-18325,Naresj Patel,Consumer,United States,Waynesboro,Virginia,22980,South,Furniture,Furnishings,Luxo Professional Magnifying Clamp-On Fluorescent Lamps,104.01,1,0.0,14.5614,2014-06-21,2014-06-23
6/21/2014,6/23/2014,Second Class,NP-18325,Naresj Patel,Consumer,United States,Waynesboro,Virginia,22980,South,Technology,Phones,Konftel 250 Conference phone - Charcoal black,284.82,1,0.0,74.0532,2014-06-21,2014-06-23
6/21/2014,6/23/2014,Second Class,NP-18325,Naresj Patel,Consumer,United States,Waynesboro,Virginia,22980,South,Office Supplies,Storage,Recycled Eldon Regeneration Jumbo File,36.84,3,0.0,10.3152,2014-06-21,2014-06-23
3/28/2015,4/2/2015,Standard Class,AB-10165,Alan Barnes,Consumer,United States,Los Angeles,California,90036,West,Technology,Accessories,Imation Bio 8GB USB Flash Drive Imation Corp,166.24,1,0.0,24.936,2015-03-28,2015-04-02
3/28/2015,4/2/2015,Standard Class,AB-10165,Alan Barnes,Consumer,United States,Los Angeles,California,90036,West,Office Supplies,Paper,Xerox 1977,33.4,5,0.0,16.032,2015-03-28,2015-04-02
5/14/2015,5/17/2015,First Class,JO-15550,Jesus Ocampo,Home Office,United States,Chester,Pennsylvania,19013,East,Office Supplies,Art,"Boston School Pro Electric Pencil Sharpener, 1670",198.272,8,0.2,17.3488,2015-05-14,2015-05-17
5/14/2015,5/17/2015,First Class,JO-15550,Jesus Ocampo,Home Office,United States,Chester,Pennsylvania,19013,East,Office Supplies,Labels,Avery 490,47.36,4,0.2,17.76,2015-05-14,2015-05-17
5/14/2015,5/17/2015,First Class,JO-15550,Jesus Ocampo,Home Office,United States,Chester,Pennsylvania,19013,East,Office Supplies,Envelopes,Jet-Pak Recycled Peel 'N' Seal Padded Mailers,200.984,7,0.2,62.8075,2015-05-14,2015-05-17
5/14/2015,5/17/2015,First Class,JO-15550,Jesus Ocampo,Home Office,United States,Chester,Pennsylvania,19013,East,Office Supplies,Labels,"Avery 4027 File Folder Labels for Dot Matrix Printers, 5000 Labels per Box, White",97.696,4,0.2,31.7512,2015-05-14,2015-05-17
5/14/2015,5/17/2015,First Class,JO-15550,Jesus Ocampo,Home Office,United States,Chester,Pennsylvania,19013,East,Office Supplies,Art,"Binney & Smith Crayola Metallic Crayons, 16-Color Pack",2.696,1,0.2,0.8088,2015-05-14,2015-05-17
5/14/2015,5/17/2015,First Class,JO-15550,Jesus Ocampo,Home Office,United States,Chester,Pennsylvania,19013,East,Office Supplies,Binders,GBC Linen Binding Covers,18.588,2,0.7,-13.6312,2015-05-14,2015-05-17
5/14/2015,5/17/2015,First Class,JO-15550,Jesus Ocampo,Home Office,United States,Chester,Pennsylvania,19013,East,Office Supplies,Binders,Wilson Jones Custom Binder Spines & Labels,4.896,3,0.7,-3.4272,2015-05-14,2015-05-17
9/2/2017,9/8/2017,Standard Class,Dl-13600,Dorris liebe,Corporate,United States,Cleveland,Ohio,44105,East,Furniture,Furnishings,"Eldon 200 Class Desk Accessories, Burgundy",15.072,3,0.2,4.1448,2017-09-02,2017-09-08
11/4/2016,11/8/2016,Second Class,AS-10285,Alejandro Savely,Corporate,United States,Seattle,Washington,98103,West,Furniture,Furnishings,"Tenex ""The Solids"" Textured Chair Mats",209.88,3,0.0,35.6796,2016-11-04,2016-11-08
4/9/2015,4/14/2015,Standard Class,JK-15370,Jay Kimmel,Consumer,United States,Long Beach,California,90805,West,Furniture,Tables,Laminate Occasional Tables,369.912,3,0.2,-13.8717,2015-04-09,2015-04-14
9/12/2014,9/17/2014,Standard Class,BN-11470,Brad Norvell,Corporate,United States,Cary,North Carolina,27511,South,Office Supplies,Paper,Xerox 220,10.368,2,0.2,3.6288,2014-09-12,2014-09-17
9/12/2014,9/17/2014,Standard Class,BN-11470,Brad Norvell,Corporate,United States,Cary,North Carolina,27511,South,Office Supplies,Appliances,Fellowes 8 Outlet Superior Workstation Surge Protector,166.84,5,0.2,18.7695,2014-09-12,2014-09-17
9/12/2014,9/17/2014,Standard Class,BN-11470,Brad Norvell,Corporate,United States,Cary,North Carolina,27511,South,Technology,Accessories,SanDisk Cruzer 32 GB USB Flash Drive,15.216,1,0.2,2.2824,2014-09-12,2014-09-17
12/2/2014,12/4/2014,First Class,DP-13165,David Philippe,Consumer,United States,New York City,New York,10035,East,Technology,Accessories,Logitech 910-002974 M325 Wireless Mouse for Web Scrolling,119.96,4,0.0,52.7824,2014-12-02,2014-12-04
12/2/2014,12/4/2014,First Class,DP-13165,David Philippe,Consumer,United States,New York City,New York,10035,East,Furniture,Bookcases,O'Sullivan Living Dimensions 5-Shelf Bookcases,883.92,5,0.2,-110.49,2014-12-02,2014-12-04
12/2/2014,12/4/2014,First Class,DP-13165,David Philippe,Consumer,United States,New York City,New York,10035,East,Office Supplies,Binders,"Angle-D Binders with Locking Rings, Label Holders",46.72,8,0.2,15.768,2014-12-02,2014-12-04
4/5/2014,4/7/2014,First Class,TH-21550,Tracy Hopkins,Home Office,United States,New York City,New York,10035,East,Office Supplies,Paper,"Eaton Premium Continuous-Feed Paper, 25% Cotton, Letter Size, White, 1000 Shts/Box",55.48,1,0.0,26.6304,2014-04-05,2014-04-07
9/3/2017,9/7/2017,Standard Class,AP-10915,Arthur Prichep,Consumer,United States,Palm Coast,Florida,32137,South,Office Supplies,Envelopes,"#10- 4 1/8"" x 9 1/2"" Security-Tint Envelopes",24.448,4,0.2,8.8624,2017-09-03,2017-09-07
5/19/2017,5/24/2017,Standard Class,RS-19765,Roland Schwarz,Corporate,United States,Mount Vernon,New York,10550,East,Office Supplies,Appliances,Bionaire Personal Warm Mist Humidifier/Vaporizer,281.34,6,0.0,109.7226,2017-05-19,2017-05-24
5/19/2017,5/24/2017,Standard Class,RS-19765,Roland Schwarz,Corporate,United States,Mount Vernon,New York,10550,East,Technology,Phones,Nortel Meridian M3904 Professional Digital phone,307.98,2,0.0,89.3142,2017-05-19,2017-05-24
5/19/2017,5/24/2017,Standard Class,RS-19765,Roland Schwarz,Corporate,United States,Mount Vernon,New York,10550,East,Technology,Accessories,Logitech Wireless Performance Mouse MX for PC and Mac,299.97,3,0.0,113.9886,2017-05-19,2017-05-24
7/1/2014,7/6/2014,Second Class,Dl-13600,Dorris liebe,Corporate,United States,Seattle,Washington,98105,West,Office Supplies,Binders,Cardinal Holdit Business Card Pockets,19.92,5,0.2,6.972,2014-07-01,2014-07-06
1/11/2014,1/14/2014,First Class,SV-20365,Seth Vernon,Consumer,United States,Dover,Delaware,19901,East,Furniture,Furnishings,"DAX Value U-Channel Document Frames, Easel Back",9.94,2,0.0,3.0814,2014-01-11,2014-01-14
9/24/2017,9/29/2017,Standard Class,KC-16540,Kelly Collister,Consumer,United States,Newark,Ohio,43055,East,Furniture,Furnishings,"Howard Miller 13"" Diameter Pewter Finish Round Wall Clock",103.056,3,0.2,24.4758,2017-09-24,2017-09-29
6/2/2014,6/7/2014,Standard Class,CK-12325,Christine Kargatis,Home Office,United States,Orem,Utah,84057,West,Office Supplies,Binders,GBC Standard Therm-A-Bind Covers,59.808,3,0.2,19.4376,2014-06-02,2014-06-07
6/2/2014,6/7/2014,Standard Class,CK-12325,Christine Kargatis,Home Office,United States,Orem,Utah,84057,West,Furniture,Furnishings,Aluminum Document Frame,73.32,6,0.0,21.996,2014-06-02,2014-06-07
2/13/2016,2/18/2016,Standard Class,RD-19810,Ross DeVincentis,Home Office,United States,Los Angeles,California,90045,West,Office Supplies,Paper,Tops Green Bar Computer Printout Paper,146.82,3,0.0,73.41,2016-02-13,2016-02-18
12/15/2016,12/19/2016,Standard Class,MP-17965,Michael Paige,Corporate,United States,Detroit,Michigan,48205,Central,Furniture,Tables,Chromcraft Bull-Nose Wood Oval Conference Tables & Bases,1652.94,3,0.0,231.4116,2016-12-15,2016-12-19
12/15/2016,12/19/2016,Standard Class,MP-17965,Michael Paige,Corporate,United States,Detroit,Michigan,48205,Central,Office Supplies,Storage,"Recycled Data-Pak for Archival Bound Computer Printouts, 12-1/2 x 12-1/2 x 16",296.37,3,0.0,80.0199,2016-12-15,2016-12-19
10/7/2014,10/13/2014,Standard Class,MR-17545,Mathew Reese,Home Office,United States,Philadelphia,Pennsylvania,19140,East,Furniture,Furnishings,"Seth Thomas 16"" Steel Case Clock",129.92,5,0.2,21.112,2014-10-07,2014-10-13
7/7/2016,7/12/2016,Standard Class,SC-20695,Steve Chapman,Corporate,United States,Hialeah,Florida,33012,South,Office Supplies,Supplies,Acme Softgrip Scissors,45.584,7,0.2,5.1282,2016-07-07,2016-07-12
9/16/2017,9/20/2017,Standard Class,JF-15355,Jay Fein,Consumer,United States,Austin,Texas,78745,Central,Office Supplies,Envelopes,"Manila Recycled Extra-Heavyweight Clasp Envelopes, 6"" x 9""",17.568,2,0.2,6.3684,2017-09-16,2017-09-20
9/16/2017,9/20/2017,Standard Class,JF-15355,Jay Fein,Consumer,United States,Austin,Texas,78745,Central,Technology,Phones,ClearSounds CSC500 Amplified Spirit Phone Corded phone,55.992,1,0.2,5.5992,2017-09-16,2017-09-20
12/3/2016,12/6/2016,First Class,EG-13900,Emily Grady,Consumer,United States,Oceanside,New York,11572,East,Office Supplies,Paper,Xerox 1964,182.72,8,0.0,84.0512,2016-12-03,2016-12-06
12/3/2016,12/6/2016,First Class,EG-13900,Emily Grady,Consumer,United States,Oceanside,New York,11572,East,Furniture,Tables,"Bevis Traditional Conference Table Top, Plinth Base",400.032,2,0.4,-153.3456,2016-12-03,2016-12-06
12/3/2016,12/6/2016,First Class,EG-13900,Emily Grady,Consumer,United States,Oceanside,New York,11572,East,Office Supplies,Storage,"Personal Folder Holder, Ebony",33.63,3,0.0,10.089,2016-12-03,2016-12-06
12/3/2016,12/6/2016,First Class,EG-13900,Emily Grady,Consumer,United States,Oceanside,New York,11572,East,Furniture,Chairs,"Global Leather Highback Executive Chair with Pneumatic Height Adjustment, Black",542.646,3,0.1,102.4998,2016-12-03,2016-12-06
12/3/2016,12/6/2016,First Class,EG-13900,Emily Grady,Consumer,United States,Oceanside,New York,11572,East,Office Supplies,Labels,Avery 520,6.3,2,0.0,3.024,2016-12-03,2016-12-06
1/21/2017,1/25/2017,Standard Class,DS-13030,Darrin Sayre,Home Office,United States,Seattle,Washington,98115,West,Office Supplies,Storage,Carina Double Wide Media Storage Towers in Natural & Black,242.94,3,0.0,9.7176,2017-01-21,2017-01-25
1/21/2017,1/25/2017,Standard Class,DS-13030,Darrin Sayre,Home Office,United States,Seattle,Washington,98115,West,Technology,Accessories,Logitech Illuminated - Keyboard,179.97,3,0.0,86.3856,2017-01-21,2017-01-25
1/21/2017,1/25/2017,Standard Class,DS-13030,Darrin Sayre,Home Office,United States,Seattle,Washington,98115,West,Office Supplies,Binders,Wilson Jones Century Plastic Molded Ring Binders,99.696,6,0.2,33.6474,2017-01-21,2017-01-25
1/21/2017,1/25/2017,Standard Class,DS-13030,Darrin Sayre,Home Office,United States,Seattle,Washington,98115,West,Office Supplies,Binders,Wilson Jones Leather-Like Binders with DublLock Round Rings,27.936,4,0.2,9.4284,2017-01-21,2017-01-25
1/21/2017,1/25/2017,Standard Class,DS-13030,Darrin Sayre,Home Office,United States,Seattle,Washington,98115,West,Furniture,Bookcases,O'Sullivan Cherrywood Estates Traditional Bookcase,84.98,1,0.0,18.6956,2017-01-21,2017-01-25
1/21/2017,1/25/2017,Standard Class,DS-13030,Darrin Sayre,Home Office,United States,Seattle,Washington,98115,West,Office Supplies,Binders,Acco Translucent Poly Ring Binders,18.72,5,0.2,6.552,2017-01-21,2017-01-25
9/8/2014,9/12/2014,Standard Class,GZ-14470,Gary Zandusky,Consumer,United States,San Francisco,California,94110,West,Technology,Accessories,Logitech Wireless Touch Keyboard K400,49.98,2,0.0,8.4966,2014-09-08,2014-09-12
1/4/2014,1/8/2014,Standard Class,PO-19195,Phillina Ober,Home Office,United States,Naperville,Illinois,60540,Central,Office Supplies,Labels,Avery 508,11.784,3,0.2,4.2717,2014-01-04,2014-01-08
1/4/2014,1/8/2014,Standard Class,PO-19195,Phillina Ober,Home Office,United States,Naperville,Illinois,60540,Central,Office Supplies,Storage,SAFCO Boltless Steel Shelving,272.736,3,0.2,-64.7748,2014-01-04,2014-01-08
1/4/2014,1/8/2014,Standard Class,PO-19195,Phillina Ober,Home Office,United States,Naperville,Illinois,60540,Central,Office Supplies,Binders,GBC Standard Plastic Binding Systems Combs,3.54,2,0.8,-5.487,2014-01-04,2014-01-08
8/27/2016,9/1/2016,Standard Class,SS-20875,Sung Shariari,Consumer,United States,Dallas,Texas,75220,Central,Office Supplies,Supplies,Martin-Yale Premier Letter Opener,51.52,5,0.2,-10.948,2016-08-27,2016-09-01
8/27/2016,9/1/2016,Standard Class,SS-20875,Sung Shariari,Consumer,United States,Dallas,Texas,75220,Central,Office Supplies,Paper,"Ampad Gold Fibre Wirebound Steno Books, 6"" x 9"", Gregg Ruled",3.528,1,0.2,1.1466,2016-08-27,2016-09-01
8/27/2016,9/1/2016,Standard Class,SS-20875,Sung Shariari,Consumer,United States,Dallas,Texas,75220,Central,Office Supplies,Paper,Xerox 196,4.624,1,0.2,1.6762,2016-08-27,2016-09-01
8/27/2016,9/1/2016,Standard Class,SS-20875,Sung Shariari,Consumer,United States,Dallas,Texas,75220,Central,Office Supplies,Supplies,"Fiskars 8"" Scissors, 2/Pack",55.168,4,0.2,6.2064,2016-08-27,2016-09-01
5/27/2014,5/27/2014,Same Day,MH-17785,Maya Herman,Corporate,United States,San Diego,California,92105,West,Furniture,Tables,KI Conference Tables,567.12,10,0.2,-28.356,2014-05-27,2014-05-27
5/27/2014,5/27/2014,Same Day,MH-17785,Maya Herman,Corporate,United States,San Diego,California,92105,West,Office Supplies,Storage,Fellowes Officeware Wire Shelving,359.32,4,0.0,7.1864,2014-05-27,2014-05-27
3/20/2016,3/22/2016,Second Class,PB-19105,Peter Bühler,Consumer,United States,Evanston,Illinois,60201,Central,Technology,Phones,Belkin iPhone and iPad Lightning Cable,11.992,1,0.2,0.8994,2016-03-20,2016-03-22
10/2/2017,10/6/2017,Standard Class,RF-19735,Roland Fjeld,Consumer,United States,Trenton,Michigan,48183,Central,Office Supplies,Binders,GBC Durable Plastic Covers,58.05,3,0.0,26.703,2017-10-02,2017-10-06
10/2/2017,10/6/2017,Standard Class,RF-19735,Roland Fjeld,Consumer,United States,Trenton,Michigan,48183,Central,Furniture,Furnishings,Nu-Dell Leatherette Frames,157.74,11,0.0,56.7864,2017-10-02,2017-10-06
10/2/2017,10/6/2017,Standard Class,RF-19735,Roland Fjeld,Consumer,United States,Trenton,Michigan,48183,Central,Office Supplies,Art,"Avery Hi-Liter EverBold Pen Style Fluorescent Highlighters, 4/Pack",56.98,7,0.0,22.792,2017-10-02,2017-10-06
10/2/2017,10/6/2017,Standard Class,RF-19735,Roland Fjeld,Consumer,United States,Trenton,Michigan,48183,Central,Office Supplies,Binders,Avery Durable Binders,2.88,1,0.0,1.4112,2017-10-02,2017-10-06
4/7/2016,4/9/2016,First Class,YC-21895,Yoseph Carroll,Corporate,United States,San Francisco,California,94110,West,Technology,Copiers,Hewlett Packard 610 Color Digital Copier / Printer,1199.976,3,0.2,374.9925,2016-04-07,2016-04-09
12/7/2015,12/12/2015,Standard Class,MS-17830,Melanie Seite,Consumer,United States,Los Angeles,California,90036,West,Furniture,Furnishings,12-1/2 Diameter Round Wall Clock,79.92,4,0.0,28.7712,2015-12-07,2015-12-12
9/18/2016,9/22/2016,Standard Class,NB-18655,Nona Balk,Corporate,United States,Jacksonville,Florida,32216,South,Furniture,Tables,Chromcraft Round Conference Tables,383.438,4,0.45,-167.3184,2016-09-18,2016-09-22
12/29/2014,1/2/2015,Standard Class,DC-13285,Debra Catini,Consumer,United States,Cottage Grove,Minnesota,55016,Central,Office Supplies,Storage,Recycled Eldon Regeneration Jumbo File,24.56,2,0.0,6.8768,2014-12-29,2015-01-02
12/29/2014,1/2/2015,Standard Class,DC-13285,Debra Catini,Consumer,United States,Cottage Grove,Minnesota,55016,Central,Technology,Accessories,Imation 32GB Pocket Pro USB 3.0 Flash Drive - 32 GB - Black - 1 P ...,119.8,4,0.0,47.92,2014-12-29,2015-01-02
7/23/2017,7/28/2017,Standard Class,CP-12340,Christine Phan,Corporate,United States,New York City,New York,10009,East,Office Supplies,Binders,Angle-D Ring Binders,13.128,3,0.2,4.2666,2017-07-23,2017-07-28
9/18/2017,9/22/2017,Standard Class,BF-11020,Barry Französisch,Corporate,United States,Green Bay,Wisconsin,54302,Central,Office Supplies,Paper,"Adams Telephone Message Book W/Dividers/Space For Phone Numbers, 5 1/4""X8 1/2"", 200/Messages",22.72,4,0.0,10.224,2017-09-18,2017-09-22
8/31/2015,9/5/2015,Standard Class,AR-10510,Andrew Roberts,Consumer,United States,Los Angeles,California,90004,West,Office Supplies,Paper,Xerox 226,58.32,9,0.0,27.9936,2015-08-31,2015-09-05
11/3/2017,11/7/2017,Standard Class,JC-16105,Julie Creighton,Corporate,United States,Atlanta,Georgia,30318,South,Office Supplies,Labels,Avery 476,12.39,3,0.0,5.6994,2017-11-03,2017-11-07
2/8/2015,2/13/2015,Standard Class,LH-17020,Lisa Hazard,Consumer,United States,Columbus,Ohio,43229,East,Technology,Phones,JBL Micro Wireless Portable Bluetooth Speaker,107.982,3,0.4,-26.9955,2015-02-08,2015-02-13
1/13/2014,1/15/2014,Second Class,CS-12250,Chris Selesnick,Corporate,United States,Bossier City,Louisiana,71111,South,Office Supplies,Envelopes,Staple envelope,11.36,2,0.0,5.3392,2014-01-13,2014-01-15
1/13/2014,1/15/2014,Second Class,CS-12250,Chris Selesnick,Corporate,United States,Bossier City,Louisiana,71111,South,Office Supplies,Envelopes,Brown Kraft Recycled Envelopes,50.94,3,0.0,25.47,2014-01-13,2014-01-15
1/13/2014,1/15/2014,Second Class,CS-12250,Chris Selesnick,Corporate,United States,Bossier City,Louisiana,71111,South,Technology,Accessories,Plantronics S12 Corded Telephone Headset System,646.74,6,0.0,258.696,2014-01-13,2014-01-15
1/13/2014,1/15/2014,Second Class,CS-12250,Chris Selesnick,Corporate,United States,Bossier City,Louisiana,71111,South,Office Supplies,Binders,3-ring staple pack,5.64,3,0.0,2.7072,2014-01-13,2014-01-15
1/13/2014,1/15/2014,Second Class,CS-12250,Chris Selesnick,Corporate,United States,Bossier City,Louisiana,71111,South,Office Supplies,Storage,Fellowes Stor/Drawer Steel Plus Storage Drawers,572.58,6,0.0,34.3548,2014-01-13,2014-01-15
5/14/2014,5/20/2014,Standard Class,AJ-10795,Anthony Johnson,Corporate,United States,Saint Petersburg,Florida,33710,South,Furniture,Furnishings,Electrix Halogen Magnifier Lamp,310.88,2,0.2,23.316,2014-05-14,2014-05-20
5/19/2016,5/24/2016,Standard Class,LE-16810,Laurel Elliston,Consumer,United States,Arlington,Virginia,22204,South,Furniture,Chairs,Hon 4070 Series Pagoda Round Back Stacking Chairs,641.96,2,0.0,179.7488,2016-05-19,2016-05-24
1/30/2017,2/5/2017,Standard Class,BV-11245,Benjamin Venier,Corporate,United States,Des Moines,Iowa,50315,Central,Office Supplies,Binders,Cardinal EasyOpen D-Ring Binders,18.28,2,0.0,9.14,2017-01-30,2017-02-05
1/30/2017,2/5/2017,Standard Class,BV-11245,Benjamin Venier,Corporate,United States,Des Moines,Iowa,50315,Central,Technology,Phones,AT&T 841000 Phone,207.0,3,0.0,51.75,2017-01-30,2017-02-05
1/30/2017,2/5/2017,Standard Class,BV-11245,Benjamin Venier,Corporate,United States,Des Moines,Iowa,50315,Central,Office Supplies,Binders,GBC Instant Report Kit,32.35,5,0.0,16.175,2017-01-30,2017-02-05
1/30/2017,2/5/2017,Standard Class,BV-11245,Benjamin Venier,Corporate,United States,Des Moines,Iowa,50315,Central,Office Supplies,Binders,DXL Angle-View Binders with Locking Rings by Samsill,7.71,1,0.0,3.4695,2017-01-30,2017-02-05
1/30/2017,2/5/2017,Standard Class,BV-11245,Benjamin Venier,Corporate,United States,Des Moines,Iowa,50315,Central,Office Supplies,Art,Boston 19500 Mighty Mite Electric Pencil Sharpener,40.3,2,0.0,10.881,2017-01-30,2017-02-05
1/30/2017,2/5/2017,Standard Class,BV-11245,Benjamin Venier,Corporate,United States,Des Moines,Iowa,50315,Central,Furniture,Furnishings,"C-Line Magnetic Cubicle Keepers, Clear Polypropylene",34.58,7,0.0,14.5236,2017-01-30,2017-02-05
6/29/2014,7/6/2014,Standard Class,DL-12865,Dan Lawera,Consumer,United States,Cincinnati,Ohio,45231,East,Office Supplies,Art,"Dixon My First Ticonderoga Pencil, #2",32.76,7,0.2,3.6855,2014-06-29,2014-07-06
8/21/2015,8/23/2015,First Class,NZ-18565,Nick Zandusky,Home Office,United States,San Francisco,California,94110,West,Furniture,Chairs,Hon GuestStacker Chair,544.008,3,0.2,40.8006,2015-08-21,2015-08-23
8/21/2015,8/23/2015,First Class,NZ-18565,Nick Zandusky,Home Office,United States,San Francisco,California,94110,West,Office Supplies,Paper,Xerox 191,59.94,3,0.0,28.1718,2015-08-21,2015-08-23
8/21/2015,8/23/2015,First Class,NZ-18565,Nick Zandusky,Home Office,United States,San Francisco,California,94110,West,Office Supplies,Paper,Xerox 1974,23.92,4,0.0,11.7208,2015-08-21,2015-08-23
8/21/2015,8/23/2015,First Class,NZ-18565,Nick Zandusky,Home Office,United States,San Francisco,California,94110,West,Office Supplies,Paper,Xerox 1927,4.28,1,0.0,1.926,2015-08-21,2015-08-23
10/3/2015,10/6/2015,Second Class,BM-11785,Bryan Mills,Consumer,United States,Columbus,Ohio,43229,East,Office Supplies,Binders,Acco D-Ring Binder w/DublLock,32.07,5,0.7,-22.449,2015-10-03,2015-10-06
10/3/2015,10/6/2015,Second Class,BM-11785,Bryan Mills,Consumer,United States,Columbus,Ohio,43229,East,Technology,Accessories,Imation 8gb Micro Traveldrive Usb 2.0 Flash Drive,24.0,2,0.2,-2.7,2015-10-03,2015-10-06
10/3/2015,10/6/2015,Second Class,BM-11785,Bryan Mills,Consumer,United States,Columbus,Ohio,43229,East,Furniture,Bookcases,"Safco Value Mate Series Steel Bookcases, Baked Enamel Finish on Steel, Gray",35.49,1,0.5,-15.6156,2015-10-03,2015-10-06
10/3/2015,10/6/2015,Second Class,BM-11785,Bryan Mills,Consumer,United States,Columbus,Ohio,43229,East,Technology,Accessories,Microsoft Natural Ergonomic Keyboard 4000,47.984,2,0.2,0.5998,2015-10-03,2015-10-06
5/23/2015,5/28/2015,Standard Class,EA-14035,Erin Ashbrook,Corporate,United States,Columbia,South Carolina,29203,South,Office Supplies,Envelopes,Cameo Buff Policy Envelopes,186.69,3,0.0,87.7443,2015-05-23,2015-05-28
3/17/2017,3/21/2017,Second Class,CL-12565,Clay Ludtke,Consumer,United States,Lancaster,California,93534,West,Office Supplies,Binders,Heavy-Duty E-Z-D Binders,17.456,2,0.2,5.8914,2017-03-17,2017-03-21
12/12/2015,12/16/2015,Standard Class,LT-17110,Liz Thompson,Consumer,United States,Lancaster,California,93534,West,Furniture,Chairs,"Lifetime Advantage Folding Chairs, 4/Carton",348.928,2,0.2,34.8928,2015-12-12,2015-12-16
6/26/2015,6/30/2015,Standard Class,SA-20830,Sue Ann Reed,Consumer,United States,Richmond,Virginia,23223,South,Office Supplies,Binders,GBC VeloBinder Manual Binding System,143.96,4,0.0,69.1008,2015-06-26,2015-06-30
6/26/2015,6/30/2015,Standard Class,SA-20830,Sue Ann Reed,Consumer,United States,Richmond,Virginia,23223,South,Office Supplies,Storage,"Decoflex Hanging Personal Folder File, Blue",15.42,1,0.0,4.1634,2015-06-26,2015-06-30
6/26/2015,6/30/2015,Standard Class,SA-20830,Sue Ann Reed,Consumer,United States,Richmond,Virginia,23223,South,Office Supplies,Binders,"Acco PRESSTEX Data Binder with Storage Hooks, Dark Blue, 9 1/2"" X 11""",43.04,8,0.0,21.0896,2015-06-26,2015-06-30
6/26/2015,6/30/2015,Standard Class,SA-20830,Sue Ann Reed,Consumer,United States,Richmond,Virginia,23223,South,Furniture,Chairs,Office Star - Contemporary Task Swivel Chair,332.94,3,0.0,79.9056,2015-06-26,2015-06-30
5/20/2016,5/20/2016,Same Day,JK-15730,Joe Kamberova,Consumer,United States,Asheville,North Carolina,28806,South,Technology,Phones,Cisco Unified IP Phone 7945G VoIP phone,1363.96,5,0.2,85.2475,2016-05-20,2016-05-20
9/20/2014,9/26/2014,Standard Class,ES-14020,Erica Smith,Consumer,United States,San Francisco,California,94110,West,Office Supplies,Labels,Avery 499,9.96,2,0.0,4.5816,2014-09-20,2014-09-26
9/20/2014,9/26/2014,Standard Class,ES-14020,Erica Smith,Consumer,United States,San Francisco,California,94110,West,Office Supplies,Paper,"Wirebound Message Book, 4 per Page",21.72,4,0.0,10.6428,2014-09-20,2014-09-26
9/21/2017,9/26/2017,Standard Class,RH-19495,Rick Hansen,Consumer,United States,Rochester,Minnesota,55901,Central,Office Supplies,Binders,Avery Durable Binders,20.16,7,0.0,9.8784,2017-09-21,2017-09-26
12/24/2015,12/26/2015,First Class,DB-13120,David Bremer,Corporate,United States,Rochester,New York,14609,East,Office Supplies,Paper,Xerox 1887,132.79,7,0.0,63.7392,2015-12-24,2015-12-26
12/24/2015,12/26/2015,First Class,DB-13120,David Bremer,Corporate,United States,Rochester,New York,14609,East,Office Supplies,Paper,Xerox 1967,12.96,2,0.0,6.2208,2015-12-24,2015-12-26
12/24/2015,12/26/2015,First Class,DB-13120,David Bremer,Corporate,United States,Rochester,New York,14609,East,Office Supplies,Labels,Smead Alpha-Z Color-Coded Second Alphabetical Labels and Starter Set,21.56,7,0.0,10.3488,2015-12-24,2015-12-26
11/27/2015,12/3/2015,Standard Class,CD-11920,Carlos Daly,Consumer,United States,Lake Elsinore,California,92530,West,Furniture,Chairs,"Situations Contoured Folding Chairs, 4/Set",283.92,5,0.2,17.745,2015-11-27,2015-12-03
2/20/2017,2/23/2017,First Class,HW-14935,Helen Wasserman,Corporate,United States,San Diego,California,92105,West,Furniture,Furnishings,"Executive Impressions 14"" Contract Wall Clock",22.23,1,0.0,7.3359,2017-02-20,2017-02-23
2/20/2017,2/23/2017,First Class,HW-14935,Helen Wasserman,Corporate,United States,San Diego,California,92105,West,Technology,Phones,Logitech Mobile Speakerphone P710e - speaker phone,215.968,2,0.2,18.8972,2017-02-20,2017-02-23
8/18/2016,8/23/2016,Second Class,HW-14935,Helen Wasserman,Corporate,United States,New York City,New York,10024,East,Office Supplies,Appliances,Belkin 7 Outlet SurgeMaster II,355.32,9,0.0,99.4896,2016-08-18,2016-08-23
3/12/2016,3/17/2016,Standard Class,MC-18130,Mike Caudle,Corporate,United States,Monroe,Louisiana,71203,South,Office Supplies,Paper,Xerox 218,12.96,2,0.0,6.2208,2016-03-12,2016-03-17
4/22/2017,4/24/2017,First Class,GM-14440,Gary McGarr,Consumer,United States,San Francisco,California,94122,West,Furniture,Furnishings,"Eldon Stackable Tray, Side-Load, Legal, Smoke",18.28,2,0.0,6.2152,2017-04-22,2017-04-24
11/1/2014,11/7/2014,Standard Class,RA-19915,Russell Applegate,Consumer,United States,Denver,Colorado,80219,West,Office Supplies,Art,Model L Table or Wall-Mount Pencil Sharpener,43.176,3,0.2,4.3176,2014-11-01,2014-11-07
11/1/2014,11/7/2014,Standard Class,RA-19915,Russell Applegate,Consumer,United States,Denver,Colorado,80219,West,Technology,Phones,ClearOne CHATAttach 160 - speaker phone,1983.968,4,0.2,247.996,2014-11-01,2014-11-07
2/3/2015,2/5/2015,First Class,AA-10375,Allen Armold,Consumer,United States,Omaha,Nebraska,68104,Central,Furniture,Furnishings,Coloredge Poster Frame,28.4,2,0.0,11.076,2015-02-03,2015-02-05
2/3/2015,2/5/2015,First Class,AA-10375,Allen Armold,Consumer,United States,Omaha,Nebraska,68104,Central,Technology,Accessories,Kensington SlimBlade Notebook Wireless Mouse with Nano Receiver ,149.97,3,0.0,50.9898,2015-02-03,2015-02-05
10/13/2014,10/15/2014,First Class,ZC-21910,Zuschuss Carroll,Consumer,United States,Edmonds,Washington,98026,West,Office Supplies,Art,Newell 32,11.52,4,0.0,3.2256,2014-10-13,2014-10-15
10/13/2014,10/15/2014,First Class,ZC-21910,Zuschuss Carroll,Consumer,United States,Edmonds,Washington,98026,West,Furniture,Tables,"Bevis Round Bullnose 29"" High Table Top",1298.55,5,0.0,311.652,2014-10-13,2014-10-15
10/13/2014,10/15/2014,First Class,ZC-21910,Zuschuss Carroll,Consumer,United States,Edmonds,Washington,98026,West,Office Supplies,Appliances,Belkin F9G930V10-GRY 9 Outlet Surge,213.92,4,0.0,62.0368,2014-10-13,2014-10-15
10/13/2014,10/15/2014,First Class,ZC-21910,Zuschuss Carroll,Consumer,United States,Edmonds,Washington,98026,West,Technology,Accessories,Sony 16GB Class 10 Micro SDHC R40 Memory Card,25.78,2,0.0,2.578,2014-10-13,2014-10-15
5/14/2017,5/14/2017,Same Day,PJ-19015,Pauline Johnson,Consumer,United States,Santa Ana,California,92704,West,Furniture,Furnishings,"Eldon Stackable Tray, Side-Load, Legal, Smoke",18.28,2,0.0,6.2152,2017-05-14,2017-05-14
5/14/2017,5/14/2017,Same Day,PJ-19015,Pauline Johnson,Consumer,United States,Santa Ana,California,92704,West,Technology,Accessories,Razer Tiamat Over Ear 7.1 Surround Sound PC Gaming Headset,1399.93,7,0.0,601.9699,2017-05-14,2017-05-14
3/20/2015,3/23/2015,First Class,BW-11110,Bart Watters,Corporate,United States,Milwaukee,Wisconsin,53209,Central,Office Supplies,Paper,Xerox 205,51.84,8,0.0,24.8832,2015-03-20,2015-03-23
9/15/2016,9/19/2016,Standard Class,DB-13210,Dean Braden,Consumer,United States,Philadelphia,Pennsylvania,19140,East,Office Supplies,Paper,Xerox 1968,5.344,1,0.2,1.8704,2016-09-15,2016-09-19
6/28/2014,7/2/2014,Standard Class,CA-12775,Cynthia Arntzen,Consumer,United States,Philadelphia,Pennsylvania,19140,East,Office Supplies,Paper,Xerox 1995,41.472,8,0.2,14.5152,2014-06-28,2014-07-02
6/28/2014,7/2/2014,Standard Class,CA-12775,Cynthia Arntzen,Consumer,United States,Philadelphia,Pennsylvania,19140,East,Office Supplies,Binders,Self-Adhesive Ring Binder Labels,3.168,3,0.7,-2.4288,2014-06-28,2014-07-02
6/28/2014,7/2/2014,Standard Class,CA-12775,Cynthia Arntzen,Consumer,United States,Philadelphia,Pennsylvania,19140,East,Furniture,Chairs,Global Leather Executive Chair,1228.465,5,0.3,0.0,2014-06-28,2014-07-02
6/28/2014,7/2/2014,Standard Class,CA-12775,Cynthia Arntzen,Consumer,United States,Philadelphia,Pennsylvania,19140,East,Office Supplies,Binders,GBC Recycled Grain Textured Covers,31.086,3,0.7,-22.7964,2014-06-28,2014-07-02
6/28/2014,7/2/2014,Standard Class,CA-12775,Cynthia Arntzen,Consumer,United States,Philadelphia,Pennsylvania,19140,East,Office Supplies,Paper,Xerox 1941,335.52,4,0.2,117.432,2014-06-28,2014-07-02
6/20/2017,6/27/2017,Standard Class,TR-21325,Toby Ritter,Consumer,United States,Belleville,New Jersey,7109,East,Technology,Accessories,Razer Kraken PRO Over Ear PC and Music Headset,239.97,3,0.0,71.991,2017-06-20,2017-06-27
6/20/2017,6/27/2017,Standard Class,TR-21325,Toby Ritter,Consumer,United States,Belleville,New Jersey,7109,East,Office Supplies,Labels,Avery 508,9.82,2,0.0,4.8118,2017-06-20,2017-06-27
5/9/2014,5/15/2014,Standard Class,PG-18820,Patrick Gardner,Consumer,United States,San Francisco,California,94110,West,Technology,Accessories,Kingston Digital DataTraveler 32GB USB 2.0,67.8,4,0.0,4.068,2014-05-09,2014-05-15
5/9/2014,5/15/2014,Standard Class,PG-18820,Patrick Gardner,Consumer,United States,San Francisco,California,94110,West,Technology,Accessories,Sony Micro Vault Click 16 GB USB 2.0 Flash Drive,167.97,3,0.0,40.3128,2014-05-09,2014-05-15
8/21/2017,8/28/2017,Standard Class,GT-14710,Greg Tran,Consumer,United States,Lakeville,Minnesota,55044,Central,Office Supplies,Fasteners,Advantus Plastic Paper Clips,35.0,7,0.0,16.8,2017-08-21,2017-08-28
8/21/2017,8/28/2017,Standard Class,GT-14710,Greg Tran,Consumer,United States,Lakeville,Minnesota,55044,Central,Office Supplies,Supplies,Acme Forged Steel Scissors with Black Enamel Handles,37.24,4,0.0,10.7996,2017-08-21,2017-08-28
8/21/2017,8/28/2017,Standard Class,GT-14710,Greg Tran,Consumer,United States,Lakeville,Minnesota,55044,Central,Office Supplies,Envelopes,Security-Tint Envelopes,15.28,2,0.0,7.4872,2017-08-21,2017-08-28
6/16/2017,6/21/2017,Second Class,JE-15745,Joel Eaton,Consumer,United States,Florence,Kentucky,41042,South,Furniture,Chairs,"Global Airflow Leather Mesh Back Chair, Black",301.96,2,0.0,90.588,2017-06-16,2017-06-21
6/16/2017,6/21/2017,Second Class,JE-15745,Joel Eaton,Consumer,United States,Florence,Kentucky,41042,South,Office Supplies,Appliances,"Fellowes Smart Surge Ten-Outlet Protector, Platinum",180.66,3,0.0,50.5848,2017-06-16,2017-06-21
6/16/2017,6/21/2017,Second Class,JE-15745,Joel Eaton,Consumer,United States,Florence,Kentucky,41042,South,Technology,Phones,Pyle PMP37LED,191.98,2,0.0,51.8346,2017-06-16,2017-06-21
6/16/2017,6/21/2017,Second Class,JE-15745,Joel Eaton,Consumer,United States,Florence,Kentucky,41042,South,Technology,Phones,Clarity 53712,65.99,1,0.0,17.1574,2017-06-16,2017-06-21
7/23/2016,7/27/2016,Standard Class,JB-15400,Jennifer Braxton,Corporate,United States,Tampa,Florida,33614,South,Office Supplies,Art,Boston 16801 Nautilus Battery Pencil Sharpener,35.216,2,0.2,2.6412,2016-07-23,2016-07-27
7/23/2016,7/27/2016,Standard Class,JB-15400,Jennifer Braxton,Corporate,United States,Tampa,Florida,33614,South,Office Supplies,Appliances,"Holmes Replacement Filter for HEPA Air Cleaner, Large Room",23.696,2,0.2,6.5164,2016-07-23,2016-07-27
7/23/2016,7/27/2016,Standard Class,JB-15400,Jennifer Braxton,Corporate,United States,Tampa,Florida,33614,South,Technology,Machines,Zebra GX420t Direct Thermal/Thermal Transfer Printer,265.475,1,0.5,-111.4995,2016-07-23,2016-07-27
9/8/2014,9/13/2014,Second Class,LH-17020,Lisa Hazard,Consumer,United States,Tyler,Texas,75701,Central,Office Supplies,Binders,GBC ProClick Punch Binding System,51.184,4,0.8,-79.3352,2014-09-08,2014-09-13
11/4/2017,11/11/2017,Standard Class,JL-15175,James Lanier,Home Office,United States,Columbia,Tennessee,38401,South,Office Supplies,Paper,"Adams Telephone Message Books, 5 1/4 x 11",9.664,2,0.2,3.2616,2017-11-04,2017-11-11
3/7/2016,3/12/2016,Standard Class,EB-13705,Ed Braxton,Corporate,United States,Fort Worth,Texas,76106,Central,Technology,Phones,Belkin Grip Candy Sheer Case / Cover for iPhone 5 and 5S,21.072,3,0.2,1.5804,2016-03-07,2016-03-12
11/20/2015,11/25/2015,Standard Class,BM-11650,Brian Moss,Corporate,United States,New York City,New York,10035,East,Office Supplies,Art,Boston 19500 Mighty Mite Electric Pencil Sharpener,60.45,3,0.0,16.3215,2015-11-20,2015-11-25
11/20/2015,11/25/2015,Standard Class,BM-11650,Brian Moss,Corporate,United States,New York City,New York,10035,East,Office Supplies,Art,Newell 335,11.52,4,0.0,3.3408,2015-11-20,2015-11-25
11/20/2015,11/25/2015,Standard Class,BM-11650,Brian Moss,Corporate,United States,New York City,New York,10035,East,Furniture,Bookcases,O'Sullivan 3-Shelf Heavy-Duty Bookcases,186.048,4,0.2,9.3024,2015-11-20,2015-11-25
11/7/2016,11/9/2016,First Class,EM-14095,Eudokia Martin,Corporate,United States,Los Angeles,California,90036,West,Office Supplies,Binders,Fellowes Binding Cases,37.44,4,0.2,11.7,2016-11-07,2016-11-09
11/7/2016,11/9/2016,First Class,EM-14095,Eudokia Martin,Corporate,United States,Los Angeles,California,90036,West,Office Supplies,Binders,Ibico Plastic and Wire Spiral Binding Combs,26.976,4,0.2,8.7672,2016-11-07,2016-11-09
11/7/2016,11/9/2016,First Class,EM-14095,Eudokia Martin,Corporate,United States,Los Angeles,California,90036,West,Office Supplies,Supplies,Acme Preferred Stainless Steel Scissors,11.36,2,0.0,3.2944,2016-11-07,2016-11-09
11/7/2016,11/9/2016,First Class,EM-14095,Eudokia Martin,Corporate,United States,Los Angeles,California,90036,West,Office Supplies,Labels,Avery 486,14.62,2,0.0,6.8714,2016-11-07,2016-11-09
10/13/2015,10/17/2015,Standard Class,AF-10885,Art Foster,Consumer,United States,Louisville,Kentucky,40214,South,Technology,Phones,I Need's 3d Hello Kitty Hybrid Silicone Case Cover for HTC One X 4g with 3d Hello Kitty Stylus Pen Green/pink,83.72,7,0.0,23.4416,2015-10-13,2015-10-17
10/13/2015,10/17/2015,Standard Class,AF-10885,Art Foster,Consumer,United States,Louisville,Kentucky,40214,South,Furniture,Chairs,Global Deluxe Office Fabric Chairs,287.94,3,0.0,77.7438,2015-10-13,2015-10-17
1/1/2017,1/6/2017,Standard Class,GA-14725,Guy Armstrong,Consumer,United States,Lorain,Ohio,44052,East,Furniture,Furnishings,"Linden 10"" Round Wall Clock, Black",48.896,4,0.2,8.5568,2017-01-01,2017-01-06
2/7/2014,2/12/2014,Standard Class,CK-12760,Cyma Kinney,Corporate,United States,Linden,New Jersey,7036,East,Technology,Accessories,Maxell DVD-RAM Discs,115.36,7,0.0,49.6048,2014-02-07,2014-02-12
6/20/2016,6/25/2016,Second Class,DP-13105,Dave Poirier,Corporate,United States,Salinas,California,93905,West,Office Supplies,Art,DIXON Oriole Pencils,5.16,2,0.0,1.3416,2016-06-20,2016-06-25
6/20/2016,6/25/2016,Second Class,DP-13105,Dave Poirier,Corporate,United States,Salinas,California,93905,West,Office Supplies,Paper,Xerox 202,38.88,6,0.0,18.6624,2016-06-20,2016-06-25
5/28/2016,6/4/2016,Standard Class,VD-21670,Valerie Dominguez,Consumer,United States,Jackson,Mississippi,39212,South,Office Supplies,Art,"Boston School Pro Electric Pencil Sharpener, 1670",185.88,6,0.0,50.1876,2016-05-28,2016-06-04
2/19/2016,2/24/2016,Standard Class,GT-14710,Greg Tran,Consumer,United States,New York City,New York,10035,East,Furniture,Furnishings,"Executive Impressions 14"" Contract Wall Clock",44.46,2,0.0,14.6718,2016-02-19,2016-02-24
2/19/2016,2/24/2016,Standard Class,GT-14710,Greg Tran,Consumer,United States,New York City,New York,10035,East,Office Supplies,Storage,Carina Double Wide Media Storage Towers in Natural & Black,242.94,3,0.0,9.7176,2016-02-19,2016-02-24
8/3/2014,8/8/2014,Standard Class,BK-11260,Berenike Kampe,Consumer,United States,New York City,New York,10035,East,Office Supplies,Paper,Xerox 1884,39.96,2,0.0,18.7812,2014-08-03,2014-08-08
8/3/2014,8/8/2014,Standard Class,BK-11260,Berenike Kampe,Consumer,United States,New York City,New York,10035,East,Office Supplies,Supplies,Acme Box Cutter Scissors,102.3,10,0.0,26.598,2014-08-03,2014-08-08
8/3/2014,8/8/2014,Standard Class,BK-11260,Berenike Kampe,Consumer,United States,New York City,New York,10035,East,Office Supplies,Storage,Staple magnet,21.36,2,0.0,5.7672,2014-08-03,2014-08-08
4/10/2017,4/15/2017,Standard Class,SJ-20125,Sanjit Jacobs,Home Office,United States,New Brunswick,New Jersey,8901,East,Office Supplies,Paper,"Wirebound Message Books, Two 4 1/4"" x 5"" Forms per Page",7.61,1,0.0,3.5767,2017-04-10,2017-04-15
4/10/2017,4/15/2017,Standard Class,SJ-20125,Sanjit Jacobs,Home Office,United States,New Brunswick,New Jersey,8901,East,Office Supplies,Fasteners,OIC Binder Clips,7.16,2,0.0,3.58,2017-04-10,2017-04-15
6/9/2014,6/16/2014,Standard Class,CM-12445,Chuck Magee,Consumer,United States,San Francisco,California,94122,West,Office Supplies,Supplies,Staple remover,7.36,2,0.0,0.1472,2014-06-09,2014-06-16
6/9/2014,6/16/2014,Standard Class,CM-12445,Chuck Magee,Consumer,United States,San Francisco,California,94122,West,Office Supplies,Art,Deluxe Chalkboard Eraser Cleaner,23.1,2,0.0,10.626,2014-06-09,2014-06-16
1/5/2016,1/7/2016,Second Class,AJ-10795,Anthony Johnson,Corporate,United States,Jacksonville,Florida,32216,South,Technology,Accessories,Logitech MX Performance Wireless Mouse,191.472,6,0.2,40.6878,2016-01-05,2016-01-07
1/5/2016,1/7/2016,Second Class,AJ-10795,Anthony Johnson,Corporate,United States,Jacksonville,Florida,32216,South,Office Supplies,Art,Newell 337,5.248,2,0.2,0.5904,2016-01-05,2016-01-07
1/5/2016,1/7/2016,Second Class,AJ-10795,Anthony Johnson,Corporate,United States,Jacksonville,Florida,32216,South,Technology,Phones,"Logitech B530 USB Headset - headset - Full size, Binaural",59.184,2,0.2,5.1786,2016-01-05,2016-01-07
1/10/2014,1/15/2014,Standard Class,AJ-10780,Anthony Jacobs,Corporate,United States,Springfield,Virginia,22153,South,Office Supplies,Labels,Avery 482,2.89,1,0.0,1.3583,2014-01-10,2014-01-15
1/10/2014,1/15/2014,Standard Class,AJ-10780,Anthony Jacobs,Corporate,United States,Springfield,Virginia,22153,South,Furniture,Furnishings,"Howard Miller 11-1/2"" Diameter Ridgewood Wall Clock",51.94,1,0.0,21.2954,2014-01-10,2014-01-15
9/29/2016,10/2/2016,First Class,LS-16945,Linda Southworth,Corporate,United States,Philadelphia,Pennsylvania,19140,East,Office Supplies,Labels,Avery 483,15.936,4,0.2,5.1792,2016-09-29,2016-10-02
4/6/2014,4/10/2014,Standard Class,GP-14740,Guy Phonely,Corporate,United States,Lancaster,Pennsylvania,17602,East,Office Supplies,Binders,Large Capacity Hanging Post Binders,44.91,6,0.7,-35.928,2014-04-06,2014-04-10
9/3/2016,9/5/2016,First Class,PK-18910,Paul Knutson,Home Office,United States,Philadelphia,Pennsylvania,19143,East,Office Supplies,Binders,GBC Ibimaster 500 Manual ProClick Binding System,1141.47,5,0.7,-760.98,2016-09-03,2016-09-05
9/3/2016,9/5/2016,First Class,PK-18910,Paul Knutson,Home Office,United States,Philadelphia,Pennsylvania,19143,East,Technology,Phones,Cisco SPA301,280.782,3,0.4,-46.797,2016-09-03,2016-09-05
10/19/2015,10/20/2015,First Class,TB-21520,Tracy Blumstein,Consumer,United States,Concord,New Hampshire,3301,East,Office Supplies,Paper,Southworth 100% Cotton The Best Paper,34.44,3,0.0,17.22,2015-10-19,2015-10-20
12/10/2014,12/15/2014,Standard Class,SM-20005,Sally Matthias,Consumer,United States,New York City,New York,10009,East,Office Supplies,Paper,"Adams Write n' Stick Phone Message Book, 11"" X 5 1/4"", 200 Messages",11.36,2,0.0,5.2256,2014-12-10,2014-12-15
12/10/2014,12/15/2014,Standard Class,SM-20005,Sally Matthias,Consumer,United States,New York City,New York,10009,East,Office Supplies,Binders,Poly Designer Cover & Back,106.344,7,0.2,37.2204,2014-12-10,2014-12-15
8/25/2017,8/29/2017,Standard Class,GA-14725,Guy Armstrong,Consumer,United States,Charlotte,North Carolina,28205,South,Office Supplies,Paper,Xerox 1910,192.16,5,0.2,67.256,2017-08-25,2017-08-29
1/17/2016,1/21/2016,Standard Class,CC-12430,Chuck Clark,Home Office,United States,Concord,New Hampshire,3301,East,Furniture,Furnishings,"Tenex Contemporary Contur Chairmats for Low and Medium Pile Carpet, Computer, 39"" x 49""",322.59,3,0.0,64.518,2016-01-17,2016-01-21
1/17/2016,1/21/2016,Standard Class,CC-12430,Chuck Clark,Home Office,United States,Concord,New Hampshire,3301,East,Technology,Accessories,Logitech 910-002974 M325 Wireless Mouse for Web Scrolling,29.99,1,0.0,13.1956,2016-01-17,2016-01-21
1/17/2016,1/21/2016,Standard Class,CC-12430,Chuck Clark,Home Office,United States,Concord,New Hampshire,3301,East,Technology,Accessories,Logitech G19 Programmable Gaming Keyboard,371.97,3,0.0,66.9546,2016-01-17,2016-01-21
9/17/2014,9/21/2014,Standard Class,AG-10765,Anthony Garverick,Home Office,United States,Philadelphia,Pennsylvania,19120,East,Office Supplies,Binders,"Acco Pressboard Covers with Storage Hooks, 14 7/8"" x 11"", Light Blue",5.892,4,0.7,-4.1244,2014-09-17,2014-09-21
11/30/2017,12/2/2017,Second Class,HP-14815,Harold Pawlan,Home Office,United States,New York City,New York,10024,East,Office Supplies,Binders,Lock-Up Easel 'Spel-Binder',68.472,3,0.2,23.1093,2017-11-30,2017-12-02
11/30/2017,12/2/2017,Second Class,HP-14815,Harold Pawlan,Home Office,United States,New York City,New York,10024,East,Furniture,Chairs,SAFCO Arco Folding Chair,1242.9,5,0.1,262.39,2017-11-30,2017-12-02
10/9/2015,10/13/2015,Standard Class,DK-13090,Dave Kipp,Consumer,United States,Springfield,Virginia,22153,South,Office Supplies,Storage,"Decoflex Hanging Personal Folder File, Blue",30.84,2,0.0,8.3268,2015-10-09,2015-10-13
12/23/2017,12/23/2017,Same Day,GZ-14470,Gary Zandusky,Consumer,United States,San Francisco,California,94109,West,Office Supplies,Art,"Binney & Smith Crayola Metallic Crayons, 16-Color Pack",13.48,4,0.0,5.9312,2017-12-23,2017-12-23
10/22/2016,10/24/2016,First Class,PM-19135,Peter McVee,Home Office,United States,Detroit,Michigan,48227,Central,Furniture,Furnishings,Eldon 200 Class Desk Accessories,31.4,5,0.0,10.048,2016-10-22,2016-10-24
4/29/2014,5/4/2014,Standard Class,LL-16840,Lauren Leatherbury,Consumer,United States,Rochester,New York,14609,East,Furniture,Furnishings,Dax Clear Box Frame,17.46,2,0.0,5.9364,2014-04-29,2014-05-04
4/25/2015,4/28/2015,Second Class,JS-15595,Jill Stevenson,Corporate,United States,Los Angeles,California,90045,West,Office Supplies,Binders,Fellowes Black Plastic Comb Bindings,13.944,3,0.2,4.5318,2015-04-25,2015-04-28
6/26/2017,7/2/2017,Standard Class,OT-18730,Olvera Toch,Consumer,United States,San Diego,California,92105,West,Office Supplies,Storage,Eldon Shelf Savers Cubes and Bins,83.76,12,0.0,1.6752,2017-06-26,2017-07-02
10/14/2017,10/19/2017,Standard Class,EL-13735,Ed Ludwig,Home Office,United States,Columbia,Maryland,21044,East,Office Supplies,Binders,"Acco PRESSTEX Data Binder with Storage Hooks, Dark Blue, 14 7/8"" X 11""",37.66,7,0.0,18.4534,2017-10-14,2017-10-19
12/9/2014,12/16/2014,Standard Class,CK-12760,Cyma Kinney,Corporate,United States,San Francisco,California,94122,West,Office Supplies,Paper,Xerox 1987,34.68,6,0.0,16.9932,2014-12-09,2014-12-16
6/20/2017,6/26/2017,Standard Class,JE-15475,Jeremy Ellison,Consumer,United States,New Rochelle,New York,10801,East,Technology,Accessories,Anker Ultrathin Bluetooth Wireless Keyboard Aluminum Cover with Stand ,149.95,5,0.0,14.995,2017-06-20,2017-06-26
6/20/2017,6/26/2017,Standard Class,JE-15475,Jeremy Ellison,Consumer,United States,New Rochelle,New York,10801,East,Office Supplies,Binders,Acco D-Ring Binder w/DublLock,51.312,3,0.2,18.6006,2017-06-20,2017-06-26
6/26/2017,6/27/2017,First Class,TH-21550,Tracy Hopkins,Home Office,United States,Detroit,Michigan,48227,Central,Office Supplies,Paper,"Ampad Poly Cover Wirebound Steno Book, 6"" x 9"" Assorted Colors, Gregg Ruled",4.54,1,0.0,2.043,2017-06-26,2017-06-27
6/26/2017,6/27/2017,First Class,TH-21550,Tracy Hopkins,Home Office,United States,Detroit,Michigan,48227,Central,Office Supplies,Art,Fluorescent Highlighters by Dixon,15.92,4,0.0,5.4128,2017-06-26,2017-06-27
6/26/2017,6/27/2017,First Class,TH-21550,Tracy Hopkins,Home Office,United States,Detroit,Michigan,48227,Central,Technology,Phones,Nortel Networks T7316 E Nt8 B27,543.92,8,0.0,135.98,2017-06-26,2017-06-27
11/10/2016,11/12/2016,First Class,PC-18745,Pamela Coakley,Corporate,United States,San Francisco,California,94122,West,Office Supplies,Storage,File Shuttle I and Handi-File,155.82,7,0.0,42.0714,2016-11-10,2016-11-12
11/10/2016,11/12/2016,First Class,PC-18745,Pamela Coakley,Corporate,United States,San Francisco,California,94122,West,Office Supplies,Binders,Binding Machine Supplies,70.008,3,0.2,24.5028,2016-11-10,2016-11-12
10/3/2016,10/6/2016,Second Class,HL-15040,Hunter Lopez,Consumer,United States,Houston,Texas,77095,Central,Office Supplies,Envelopes,Staple envelope,15.648,2,0.2,5.0856,2016-10-03,2016-10-06
9/9/2014,9/15/2014,Standard Class,MS-17365,Maribeth Schnelling,Consumer,United States,Detroit,Michigan,48227,Central,Office Supplies,Labels,Alphabetical Labels for Top Tab Filing,103.6,7,0.0,51.8,2014-09-09,2014-09-15
10/29/2017,10/31/2017,Second Class,GB-14530,George Bell,Corporate,United States,Auburn,New York,13021,East,Office Supplies,Paper,Things To Do Today Pad,46.96,8,0.0,22.5408,2017-10-29,2017-10-31
4/10/2016,4/12/2016,First Class,JR-16210,Justin Ritter,Corporate,United States,Springfield,Ohio,45503,East,Office Supplies,Binders,Wilson Jones Hanging Recycled Pressboard Data Binders,8.904,2,0.7,-6.5296,2016-04-10,2016-04-12
11/11/2017,11/13/2017,First Class,TD-20995,Tamara Dahlen,Consumer,United States,Garland,Texas,75043,Central,Office Supplies,Labels,Permanent Self-Adhesive File Folder Labels for Typewriters by Universal,10.44,5,0.2,3.393,2017-11-11,2017-11-13
11/11/2017,11/13/2017,First Class,TD-20995,Tamara Dahlen,Consumer,United States,Garland,Texas,75043,Central,Office Supplies,Binders,Deluxe Heavy-Duty Vinyl Round Ring Binder,18.336,4,0.8,-32.088,2017-11-11,2017-11-13
9/15/2017,9/17/2017,First Class,DB-13060,Dave Brooks,Consumer,United States,Chicago,Illinois,60653,Central,Technology,Phones,Avaya 5420 Digital phone,323.976,3,0.2,20.2485,2017-09-15,2017-09-17
4/8/2016,4/12/2016,Standard Class,LC-17140,Logan Currie,Consumer,United States,Los Angeles,California,90032,West,Office Supplies,Paper,Xerox 1923,20.04,3,0.0,9.6192,2016-04-08,2016-04-12
4/8/2016,4/12/2016,Standard Class,LC-17140,Logan Currie,Consumer,United States,Los Angeles,California,90032,West,Office Supplies,Storage,Fellowes Neat Ideas Storage Cubes,64.96,2,0.0,2.5984,2016-04-08,2016-04-12
4/8/2016,4/12/2016,Standard Class,LC-17140,Logan Currie,Consumer,United States,Los Angeles,California,90032,West,Office Supplies,Paper,Xerox 1931,12.96,2,0.0,6.2208,2016-04-08,2016-04-12
12/30/2017,1/3/2018,Standard Class,PO-18865,Patrick O'Donnell,Consumer,United States,New York City,New York,10009,East,Furniture,Bookcases,"Bush Westfield Collection Bookcases, Fully Assembled",323.136,4,0.2,12.1176,2017-12-30,2018-01-03
12/30/2017,1/3/2018,Standard Class,PO-18865,Patrick O'Donnell,Consumer,United States,New York City,New York,10009,East,Technology,Phones,Gear Head AU3700S Headset,90.93,7,0.0,2.7279,2017-12-30,2018-01-03
12/30/2017,1/3/2018,Standard Class,PO-18865,Patrick O'Donnell,Consumer,United States,New York City,New York,10009,East,Office Supplies,Binders,Wilson Jones Legal Size Ring Binders,52.776,3,0.2,19.791,2017-12-30,2018-01-03
9/2/2017,9/7/2017,Standard Class,BE-11335,Bill Eplett,Home Office,United States,Jackson,Michigan,49201,Central,Technology,Phones,Polycom CX600 IP Phone VoIP phone,1199.8,4,0.0,323.946,2017-09-02,2017-09-07
9/2/2017,9/7/2017,Standard Class,BE-11335,Bill Eplett,Home Office,United States,Jackson,Michigan,49201,Central,Technology,Accessories,Maxell iVDR EX 500GB Cartridge,1928.78,7,0.0,829.3754,2017-09-02,2017-09-07
9/2/2017,9/7/2017,Standard Class,BE-11335,Bill Eplett,Home Office,United States,Jackson,Michigan,49201,Central,Office Supplies,Storage,Fellowes High-Stak Drawer Files,352.38,2,0.0,81.0474,2017-09-02,2017-09-07
5/31/2015,6/7/2015,Standard Class,SC-20050,Sample Company A,Home Office,United States,Norwich,Connecticut,6360,East,Furniture,Furnishings,3M Hangers With Command Adhesive,22.2,6,0.0,9.102,2015-05-31,2015-06-07
11/27/2017,11/29/2017,First Class,BM-11650,Brian Moss,Corporate,United States,Milwaukee,Wisconsin,53209,Central,Furniture,Furnishings,"Howard Miller 13"" Diameter Goldtone Round Wall Clock",46.94,1,0.0,19.2454,2017-11-27,2017-11-29
11/27/2017,11/29/2017,First Class,BM-11650,Brian Moss,Corporate,United States,Milwaukee,Wisconsin,53209,Central,Technology,Accessories,Memorex Mini Travel Drive 16 GB USB 2.0 Flash Drive,143.73,9,0.0,56.0547,2017-11-27,2017-11-29
6/15/2014,6/21/2014,Standard Class,KL-16555,Kelly Lampkin,Corporate,United States,San Antonio,Texas,78207,Central,Furniture,Tables,"Lesro Sheffield Collection Coffee Table, End Table, Center Table, Corner Table",99.918,2,0.3,-18.5562,2014-06-15,2014-06-21
6/15/2014,6/21/2014,Standard Class,KL-16555,Kelly Lampkin,Corporate,United States,San Antonio,Texas,78207,Central,Furniture,Chairs,Global Commerce Series High-Back Swivel/Tilt Chairs,797.944,4,0.3,-56.996,2014-06-15,2014-06-21
6/15/2014,6/21/2014,Standard Class,KL-16555,Kelly Lampkin,Corporate,United States,San Antonio,Texas,78207,Central,Office Supplies,Binders,Avery Premier Heavy-Duty Binder with Round Locking Rings,8.568,3,0.8,-14.5656,2014-06-15,2014-06-21
3/5/2016,3/11/2016,Standard Class,RW-19630,Rob Williams,Corporate,United States,Dallas,Texas,75220,Central,Office Supplies,Envelopes,Cameo Buff Policy Envelopes,149.352,3,0.2,50.4063,2016-03-05,2016-03-11
3/5/2016,3/11/2016,Standard Class,RW-19630,Rob Williams,Corporate,United States,Dallas,Texas,75220,Central,Office Supplies,Storage,Acco Perma 4000 Stacking Storage Drawers,12.992,1,0.2,-0.812,2016-03-05,2016-03-11
12/5/2014,12/12/2014,Standard Class,RC-19825,Roy Collins,Consumer,United States,Alexandria,Virginia,22304,South,Office Supplies,Storage,Recycled Eldon Regeneration Jumbo File,24.56,2,0.0,6.8768,2014-12-05,2014-12-12
4/11/2015,4/15/2015,Standard Class,SE-20110,Sanjit Engle,Consumer,United States,New York City,New York,10009,East,Technology,Accessories,Maxell 4.7GB DVD-R,85.14,3,0.0,34.9074,2015-04-11,2015-04-15
4/11/2015,4/15/2015,Standard Class,SE-20110,Sanjit Engle,Consumer,United States,New York City,New York,10009,East,Technology,Phones,OtterBox Commuter Series Case - iPhone 5 & 5s,21.99,1,0.0,10.5552,2015-04-11,2015-04-15
4/11/2015,4/15/2015,Standard Class,SE-20110,Sanjit Engle,Consumer,United States,New York City,New York,10009,East,Office Supplies,Appliances,Kensington 4 Outlet MasterPiece Compact Power Control Center,406.6,5,0.0,113.848,2015-04-11,2015-04-15
9/15/2016,9/20/2016,Standard Class,AH-10075,Adam Hart,Corporate,United States,New York City,New York,10011,East,Office Supplies,Binders,GBC DocuBind 300 Electric Binding Machine,841.568,2,0.2,294.5488,2016-09-15,2016-09-20
9/13/2014,9/16/2014,First Class,JM-15535,Jessica Myrick,Consumer,United States,Philadelphia,Pennsylvania,19143,East,Office Supplies,Paper,Xerox 1985,15.552,3,0.2,5.4432,2014-09-13,2014-09-16
9/13/2014,9/16/2014,First Class,JM-15535,Jessica Myrick,Consumer,United States,Philadelphia,Pennsylvania,19143,East,Technology,Accessories,Hypercom P1300 Pinpad,252.0,5,0.2,53.55,2014-09-13,2014-09-16
10/5/2015,10/9/2015,Standard Class,JJ-15760,Joel Jenkins,Home Office,United States,Springfield,Virginia,22153,South,Office Supplies,Art,Newell 324,46.2,4,0.0,12.936,2015-10-05,2015-10-09
10/5/2015,10/9/2015,Standard Class,JJ-15760,Joel Jenkins,Home Office,United States,Springfield,Virginia,22153,South,Office Supplies,Appliances,Holmes Odor Grabber,28.84,2,0.0,9.5172,2015-10-05,2015-10-09
4/14/2017,4/17/2017,First Class,AB-10165,Alan Barnes,Consumer,United States,Toledo,Ohio,43615,East,Office Supplies,Art,Zebra Zazzle Fluorescent Highlighters,14.592,3,0.2,2.5536,2017-04-14,2017-04-17
4/14/2017,4/17/2017,First Class,AB-10165,Alan Barnes,Consumer,United States,Toledo,Ohio,43615,East,Office Supplies,Art,"Sanford Prismacolor Professional Thick Lead Art Pencils, 36-Color Set",89.856,3,0.2,21.3408,2017-04-14,2017-04-17
4/14/2017,4/17/2017,First Class,AB-10165,Alan Barnes,Consumer,United States,Toledo,Ohio,43615,East,Office Supplies,Paper,Xerox 196,13.872,3,0.2,5.0286,2017-04-14,2017-04-17
9/2/2017,9/6/2017,Standard Class,RK-19300,Ralph Kennedy,Consumer,United States,Philadelphia,Pennsylvania,19140,East,Office Supplies,Paper,"RSVP Cards & Envelopes, Blank White, 8-1/2"" X 11"", 24 Cards/25 Envelopes/Set",12.192,3,0.2,4.1148,2017-09-02,2017-09-06
6/20/2016,6/24/2016,Standard Class,CG-12040,Catherine Glotzbach,Home Office,United States,Philadelphia,Pennsylvania,19120,East,Office Supplies,Paper,"Wirebound Message Books, 2 7/8"" x 5"", 3 Forms per Page",45.056,8,0.2,15.2064,2016-06-20,2016-06-24
6/20/2016,6/24/2016,Standard Class,CG-12040,Catherine Glotzbach,Home Office,United States,Philadelphia,Pennsylvania,19120,East,Office Supplies,Binders,JM Magazine Binder,29.718,6,0.7,-21.7932,2016-06-20,2016-06-24
6/20/2016,6/24/2016,Standard Class,CG-12040,Catherine Glotzbach,Home Office,United States,Philadelphia,Pennsylvania,19120,East,Office Supplies,Paper,Xerox 202,15.552,3,0.2,5.4432,2016-06-20,2016-06-24
6/20/2016,6/24/2016,Standard Class,CG-12040,Catherine Glotzbach,Home Office,United States,Philadelphia,Pennsylvania,19120,East,Office Supplies,Appliances,Sanyo 2.5 Cubic Foot Mid-Size Office Refrigerators,447.696,2,0.2,33.5772,2016-06-20,2016-06-24
11/5/2017,11/6/2017,First Class,RA-19885,Ruben Ausman,Corporate,United States,Farmington,New Mexico,87401,West,Technology,Accessories,NETGEAR AC1750 Dual Band Gigabit Smart WiFi Router,159.99,1,0.0,54.3966,2017-11-05,2017-11-06
12/13/2015,12/17/2015,Standard Class,RP-19270,Rachel Payne,Corporate,United States,Riverside,California,92503,West,Office Supplies,Paper,Xerox 213,12.96,2,0.0,6.2208,2015-12-13,2015-12-17
12/13/2015,12/17/2015,Standard Class,RP-19270,Rachel Payne,Corporate,United States,Riverside,California,92503,West,Office Supplies,Appliances,Fellowes 8 Outlet Superior Workstation Surge Protector w/o Phone/Fax/Modem Protection,134.48,4,0.0,34.9648,2015-12-13,2015-12-17
6/19/2016,6/20/2016,First Class,KC-16255,Karen Carlisle,Corporate,United States,San Francisco,California,94110,West,Office Supplies,Paper,"Message Book, Standard Line ""While You Were Out"", 5 1/2"" X 4"", 200 Sets/Book",17.12,2,0.0,8.0464,2016-06-19,2016-06-20
12/13/2016,12/20/2016,Standard Class,RW-19630,Rob Williams,Corporate,United States,Torrance,California,90503,West,Office Supplies,Binders,"Acco Pressboard Covers with Storage Hooks, 14 7/8"" x 11"", Dark Blue",6.096,2,0.2,2.2098,2016-12-13,2016-12-20
12/13/2016,12/20/2016,Standard Class,RW-19630,Rob Williams,Corporate,United States,Torrance,California,90503,West,Furniture,Tables,Bretford CR4500 Series Slim Rectangular Table,1114.272,4,0.2,41.7852,2016-12-13,2016-12-20
5/29/2015,6/3/2015,Standard Class,JL-15850,John Lucas,Consumer,United States,Seattle,Washington,98105,West,Office Supplies,Paper,Xerox 1894,32.4,5,0.0,15.552,2015-05-29,2015-06-03
5/29/2015,6/3/2015,Standard Class,JL-15850,John Lucas,Consumer,United States,Seattle,Washington,98105,West,Office Supplies,Storage,Standard Rollaway File with Lock,540.57,3,0.0,140.5482,2015-05-29,2015-06-03
5/29/2015,6/3/2015,Standard Class,JL-15850,John Lucas,Consumer,United States,Seattle,Washington,98105,West,Office Supplies,Binders,"Avery Trapezoid Extra Heavy Duty 4"" Binders",167.76,5,0.2,62.91,2015-05-29,2015-06-03
7/26/2015,7/28/2015,First Class,CA-12775,Cynthia Arntzen,Consumer,United States,Mesa,Arizona,85204,West,Furniture,Tables,Bevis Boat-Shaped Conference Table,393.165,3,0.5,-204.4458,2015-07-26,2015-07-28
11/28/2017,12/2/2017,Standard Class,RB-19795,Ross Baird,Home Office,United States,Philadelphia,Pennsylvania,19120,East,Furniture,Furnishings,"Deflect-o RollaMat Studded, Beveled Mat for Medium Pile Carpeting",516.488,7,0.2,-12.9122,2017-11-28,2017-12-02
11/28/2017,12/2/2017,Standard Class,RB-19795,Ross Baird,Home Office,United States,Philadelphia,Pennsylvania,19120,East,Furniture,Furnishings,Luxo Professional Fluorescent Magnifier Lamp with Clamp-Mount Base,1007.232,6,0.2,75.5424,2017-11-28,2017-12-02
11/28/2017,12/2/2017,Standard Class,RB-19795,Ross Baird,Home Office,United States,Philadelphia,Pennsylvania,19120,East,Furniture,Tables,"Riverside Furniture Oval Coffee Table, Oval End Table, End Table with Drawer",2065.32,12,0.4,-619.596,2017-11-28,2017-12-02
11/28/2017,12/2/2017,Standard Class,RB-19795,Ross Baird,Home Office,United States,Philadelphia,Pennsylvania,19120,East,Office Supplies,Paper,Xerox 210,15.552,3,0.2,5.4432,2017-11-28,2017-12-02
11/28/2017,12/2/2017,Standard Class,RB-19795,Ross Baird,Home Office,United States,Philadelphia,Pennsylvania,19120,East,Office Supplies,Paper,Xerox 4200 Series MultiUse Premium Copy Paper (20Lb. and 84 Bright),25.344,6,0.2,7.92,2017-11-28,2017-12-02
4/3/2017,4/7/2017,Standard Class,KH-16360,Katherine Hughes,Consumer,United States,Philadelphia,Pennsylvania,19143,East,Furniture,Furnishings,Staple-based wall hangings,25.472,4,0.2,7.6416,2017-04-03,2017-04-07
12/28/2017,1/1/2018,Standard Class,GH-14665,Greg Hansen,Consumer,United States,Round Rock,Texas,78664,Central,Office Supplies,Art,Stanley Bostitch Contemporary Electric Pencil Sharpeners,27.168,2,0.2,2.7168,2017-12-28,2018-01-01
12/28/2017,1/1/2018,Standard Class,GH-14665,Greg Hansen,Consumer,United States,Round Rock,Texas,78664,Central,Furniture,Bookcases,"Bush Westfield Collection Bookcases, Medium Cherry Finish",78.8528,2,0.32,-11.596,2017-12-28,2018-01-01
11/30/2017,12/4/2017,Standard Class,SW-20275,Scott Williamson,Consumer,United States,Jackson,Mississippi,39212,South,Office Supplies,Storage,Home/Office Personal File Carts,173.8,5,0.0,43.45,2017-11-30,2017-12-04
5/15/2017,5/18/2017,Second Class,JA-15970,Joseph Airdo,Consumer,United States,Phoenix,Arizona,85023,West,Technology,Phones,"Logitech B530 USB Headset - headset - Full size, Binaural",29.592,1,0.2,2.5893,2017-05-15,2017-05-18
5/15/2017,5/18/2017,Second Class,JA-15970,Joseph Airdo,Consumer,United States,Phoenix,Arizona,85023,West,Office Supplies,Binders,Avery Durable Slant Ring Binders,4.752,2,0.7,-3.168,2017-05-15,2017-05-18
5/15/2017,5/18/2017,Second Class,JA-15970,Joseph Airdo,Consumer,United States,Phoenix,Arizona,85023,West,Office Supplies,Paper,"Universal Ultra Bright White Copier/Laser Paper, 8 1/2"" x 11"", Ream",15.552,3,0.2,5.6376,2017-05-15,2017-05-18
9/22/2015,9/22/2015,Same Day,DL-12925,Daniel Lacy,Consumer,United States,Oceanside,California,92054,West,Furniture,Furnishings,Luxo Professional Combination Clamp-On Lamps,204.6,2,0.0,53.196,2015-09-22,2015-09-22
11/14/2017,11/19/2017,Standard Class,LW-16990,Lindsay Williams,Corporate,United States,San Francisco,California,94110,West,Furniture,Chairs,"Global Leather Highback Executive Chair with Pneumatic Height Adjustment, Black",321.568,2,0.2,28.1372,2017-11-14,2017-11-19
11/27/2015,12/1/2015,Standard Class,TB-21190,Thomas Brumley,Home Office,United States,Fayetteville,Arkansas,72701,South,Office Supplies,Binders,Zipper Ring Binder Pockets,6.24,2,0.0,3.0576,2015-11-27,2015-12-01
9/1/2016,9/4/2016,First Class,CV-12805,Cynthia Voltz,Corporate,United States,San Francisco,California,94110,West,Office Supplies,Envelopes,"White Business Envelopes with Contemporary Seam, Recycled White Business Envelopes",21.88,2,0.0,10.94,2016-09-01,2016-09-04
9/22/2014,9/24/2014,Second Class,MS-17365,Maribeth Schnelling,Consumer,United States,Boca Raton,Florida,33433,South,Office Supplies,Labels,Avery File Folder Labels,4.608,2,0.2,1.6704,2014-09-22,2014-09-24
4/9/2017,4/11/2017,First Class,BS-11800,Bryan Spruell,Home Office,United States,New York City,New York,10011,East,Office Supplies,Labels,Color-Coded Legal Exhibit Labels,9.82,2,0.0,4.8118,2017-04-09,2017-04-11
4/9/2017,4/11/2017,First Class,BS-11800,Bryan Spruell,Home Office,United States,New York City,New York,10011,East,Office Supplies,Art,Bulldog Vacuum Base Pencil Sharpener,35.97,3,0.0,9.7119,2017-04-09,2017-04-11
4/9/2017,4/11/2017,First Class,BS-11800,Bryan Spruell,Home Office,United States,New York City,New York,10011,East,Office Supplies,Paper,Xerox 212,12.96,2,0.0,6.2208,2017-04-09,2017-04-11
4/9/2017,4/11/2017,First Class,BS-11800,Bryan Spruell,Home Office,United States,New York City,New York,10011,East,Office Supplies,Paper,Computer Printout Paper with Letter-Trim Fine Perforations,191.6,4,0.0,91.968,2017-04-09,2017-04-11
4/9/2017,4/11/2017,First Class,BS-11800,Bryan Spruell,Home Office,United States,New York City,New York,10011,East,Office Supplies,Labels,Avery File Folder Labels,8.64,3,0.0,4.2336,2017-04-09,2017-04-11
4/9/2017,4/11/2017,First Class,BS-11800,Bryan Spruell,Home Office,United States,New York City,New York,10011,East,Office Supplies,Storage,Office Impressions Heavy Duty Welded Shelving & Multimedia Storage Drawers,501.81,3,0.0,0.0,2017-04-09,2017-04-11
1/16/2014,1/18/2014,Second Class,DL-13315,Delfina Latchford,Consumer,United States,Philadelphia,Pennsylvania,19134,East,Furniture,Furnishings,DAX Black Cherry Wood-Tone Poster Frame,127.104,6,0.2,28.5984,2014-01-16,2014-01-18
1/16/2014,1/18/2014,Second Class,DL-13315,Delfina Latchford,Consumer,United States,Philadelphia,Pennsylvania,19134,East,Technology,Phones,AT&T 841000 Phone,124.2,3,0.4,-31.05,2014-01-16,2014-01-18
1/16/2014,1/18/2014,Second Class,DL-13315,Delfina Latchford,Consumer,United States,Philadelphia,Pennsylvania,19134,East,Office Supplies,Binders,GBC Linen Binding Covers,18.588,2,0.7,-13.6312,2014-01-16,2014-01-18
1/16/2014,1/18/2014,Second Class,DL-13315,Delfina Latchford,Consumer,United States,Philadelphia,Pennsylvania,19134,East,Office Supplies,Labels,Round Specialty Laser Printer Labels,30.072,3,0.2,10.1493,2014-01-16,2014-01-18
10/5/2017,10/8/2017,Second Class,PO-19195,Phillina Ober,Home Office,United States,New York City,New York,10011,East,Technology,Phones,Motorola HK250 Universal Bluetooth Headset,160.93,7,0.0,3.2186,2017-10-05,2017-10-08
10/5/2017,10/8/2017,Second Class,PO-19195,Phillina Ober,Home Office,United States,New York City,New York,10011,East,Office Supplies,Binders,Tuf-Vin Binders,75.792,3,0.2,25.5798,2017-10-05,2017-10-08
7/9/2017,7/15/2017,Standard Class,TD-20995,Tamara Dahlen,Consumer,United States,Portland,Oregon,97206,West,Office Supplies,Binders,Wilson Jones Easy Flow II Sheet Lifters,1.08,2,0.7,-0.792,2017-07-09,2017-07-15
1/7/2017,1/10/2017,First Class,BW-11110,Bart Watters,Corporate,United States,Detroit,Michigan,48205,Central,Technology,Machines,Lexmark MX611dhe Monochrome Laser Printer,3059.982,2,0.1,679.996,2017-01-07,2017-01-10
5/30/2016,5/31/2016,First Class,RW-19690,Robert Waldorf,Consumer,United States,Wilmington,North Carolina,28403,South,Office Supplies,Binders,Angle-D Ring Binders,3.282,2,0.7,-2.6256,2016-05-30,2016-05-31
12/9/2015,12/12/2015,First Class,KB-16600,Ken Brennan,Corporate,United States,Columbus,Indiana,47201,Central,Office Supplies,Paper,Xerox 188,34.02,3,0.0,16.6698,2015-12-09,2015-12-12
10/3/2016,10/8/2016,Standard Class,EB-13870,Emily Burns,Consumer,United States,New York City,New York,10035,East,Furniture,Chairs,Office Star - Contemporary Task Swivel Chair,599.292,6,0.1,93.2232,2016-10-03,2016-10-08
11/11/2014,11/14/2014,Second Class,TZ-21580,Tracy Zic,Consumer,United States,Louisville,Colorado,80027,West,Office Supplies,Art,"BIC Brite Liner Grip Highlighters, Assorted, 5/Pack",3.392,1,0.2,0.8056,2014-11-11,2014-11-14
11/11/2014,11/14/2014,Second Class,TZ-21580,Tracy Zic,Consumer,United States,Louisville,Colorado,80027,West,Technology,Phones,Samsung Galaxy S III - 16GB - pebble blue (T-Mobile),559.984,2,0.2,55.9984,2014-11-11,2014-11-14
11/11/2014,11/14/2014,Second Class,TZ-21580,Tracy Zic,Consumer,United States,Louisville,Colorado,80027,West,Furniture,Chairs,"Global Airflow Leather Mesh Back Chair, Black",603.92,5,0.2,75.49,2014-11-11,2014-11-14
9/29/2017,10/5/2017,Standard Class,AS-10630,Ann Steele,Home Office,United States,Pasadena,Texas,77506,Central,Office Supplies,Labels,Avery 499,7.968,2,0.2,2.5896,2017-09-29,2017-10-05
9/29/2017,10/5/2017,Standard Class,AS-10630,Ann Steele,Home Office,United States,Pasadena,Texas,77506,Central,Office Supplies,Envelopes,"#10- 4 1/8"" x 9 1/2"" Recycled Envelopes",27.968,4,0.2,9.4392,2017-09-29,2017-10-05
9/29/2017,10/5/2017,Standard Class,AS-10630,Ann Steele,Home Office,United States,Pasadena,Texas,77506,Central,Technology,Machines,Wasp CCD Handheld Bar Code Reader,336.51,3,0.4,44.868,2017-09-29,2017-10-05
3/10/2015,3/10/2015,Same Day,TS-21340,Toby Swindell,Consumer,United States,Houston,Texas,77041,Central,Office Supplies,Binders,Acco Suede Grain Vinyl Round Ring Binder,1.112,2,0.8,-1.8904,2015-03-10,2015-03-10
5/21/2017,5/26/2017,Standard Class,JG-15805,John Grady,Corporate,United States,Auburn,New York,13021,East,Furniture,Furnishings,Luxo Professional Magnifying Clamp-On Fluorescent Lamps,520.05,5,0.0,72.807,2017-05-21,2017-05-26
5/21/2017,5/26/2017,Standard Class,JG-15805,John Grady,Corporate,United States,Auburn,New York,13021,East,Office Supplies,Art,Bulldog Table or Wall-Mount Pencil Sharpener,17.97,3,0.0,5.2113,2017-05-21,2017-05-26
3/29/2015,3/31/2015,Second Class,SL-20155,Sara Luxemburg,Home Office,United States,Jacksonville,Florida,32216,South,Furniture,Chairs,Hon 4070 Series Pagoda Armless Upholstered Stacking Chairs,1166.92,5,0.2,131.2785,2015-03-29,2015-03-31
9/9/2016,9/11/2016,First Class,TS-21610,Troy Staebel,Consumer,United States,New York City,New York,10024,East,Office Supplies,Binders,Cardinal EasyOpen D-Ring Binders,14.624,2,0.2,5.484,2016-09-09,2016-09-11
8/26/2016,8/27/2016,First Class,RF-19735,Roland Fjeld,Consumer,United States,San Jose,California,95123,West,Office Supplies,Fasteners,Advantus SlideClip Paper Clips,10.23,3,0.0,4.9104,2016-08-26,2016-08-27
8/26/2016,8/27/2016,First Class,RF-19735,Roland Fjeld,Consumer,United States,San Jose,California,95123,West,Office Supplies,Paper,Xerox 1979,154.9,5,0.0,69.705,2016-08-26,2016-08-27
5/21/2014,5/25/2014,Standard Class,MW-18235,Mitch Willingham,Corporate,United States,Virginia Beach,Virginia,23464,South,Office Supplies,Binders,Fellowes PB300 Plastic Comb Binding Machine,2715.93,7,0.0,1276.4871,2014-05-21,2014-05-25
5/21/2014,5/25/2014,Standard Class,MW-18235,Mitch Willingham,Corporate,United States,Virginia Beach,Virginia,23464,South,Technology,Phones,Plantronics Voyager Pro Legend,617.97,3,0.0,173.0316,2014-05-21,2014-05-25
10/28/2015,11/3/2015,Standard Class,RD-19585,Rob Dowd,Consumer,United States,Henderson,Kentucky,42420,South,Office Supplies,Envelopes,Laser & Ink Jet Business Envelopes,10.67,1,0.0,4.9082,2015-10-28,2015-11-03
10/28/2015,11/3/2015,Standard Class,RD-19585,Rob Dowd,Consumer,United States,Henderson,Kentucky,42420,South,Office Supplies,Storage,Portable Personal File Box,36.63,3,0.0,9.8901,2015-10-28,2015-11-03
10/28/2015,11/3/2015,Standard Class,RD-19585,Rob Dowd,Consumer,United States,Henderson,Kentucky,42420,South,Furniture,Furnishings,Magna Visual Magnetic Picture Hangers,24.1,5,0.0,9.158,2015-10-28,2015-11-03
10/28/2015,11/3/2015,Standard Class,RD-19585,Rob Dowd,Consumer,United States,Henderson,Kentucky,42420,South,Furniture,Furnishings,C-Line Cubicle Keepers Polyproplyene Holder With Velcro Backings,33.11,7,0.0,12.9129,2015-10-28,2015-11-03
11/13/2016,11/17/2016,Standard Class,FM-14290,Frank Merwin,Home Office,United States,Vancouver,Washington,98661,West,Office Supplies,Art,Boston 16801 Nautilus Battery Pencil Sharpener,44.02,2,0.0,11.4452,2016-11-13,2016-11-17
7/31/2015,7/31/2015,Same Day,RH-19495,Rick Hansen,Consumer,United States,New York City,New York,10024,East,Technology,Accessories,Plantronics CS510 - Over-the-Head monaural Wireless Headset System,2309.65,7,0.0,762.1845,2015-07-31,2015-07-31
7/31/2015,7/31/2015,Same Day,RH-19495,Rick Hansen,Consumer,United States,New York City,New York,10024,East,Furniture,Tables,"Bevis Round Bullnose 29"" High Table Top",1090.782,7,0.4,-290.8752,2015-07-31,2015-07-31
7/31/2015,7/31/2015,Same Day,RH-19495,Rick Hansen,Consumer,United States,New York City,New York,10024,East,Office Supplies,Paper,Xerox 212,19.44,3,0.0,9.3312,2015-07-31,2015-07-31
8/27/2015,8/31/2015,Standard Class,RA-19945,Ryan Akin,Consumer,United States,Murrieta,California,92563,West,Office Supplies,Storage,Fellowes Super Stor/Drawer Files,484.65,3,0.0,92.0835,2015-08-27,2015-08-31
11/13/2015,11/17/2015,Standard Class,JK-15730,Joe Kamberova,Consumer,United States,Jacksonville,North Carolina,28540,South,Office Supplies,Paper,Xerox 1910,115.296,3,0.2,40.3536,2015-11-13,2015-11-17
11/6/2015,11/9/2015,First Class,MT-17815,Meg Tillman,Consumer,United States,Scottsdale,Arizona,85254,West,Office Supplies,Envelopes,"Redi-Strip #10 Envelopes, 4 1/8 x 9 1/2",7.08,3,0.2,2.478,2015-11-06,2015-11-09
11/6/2015,11/9/2015,First Class,MT-17815,Meg Tillman,Consumer,United States,Scottsdale,Arizona,85254,West,Office Supplies,Binders,UniKeep View Case Binders,4.401,3,0.7,-3.5208,2015-11-06,2015-11-09
12/26/2017,1/1/2018,Standard Class,PO-18850,Patrick O'Brill,Consumer,United States,Burlington,Iowa,52601,Central,Office Supplies,Paper,"Recycled Desk Saver Line ""While You Were Out"" Book, 5 1/2"" X 4""",44.75,5,0.0,20.585,2017-12-26,2018-01-01
8/1/2017,8/3/2017,First Class,AT-10735,Annie Thurman,Consumer,United States,Chicago,Illinois,60653,Central,Technology,Phones,JBL Micro Wireless Portable Bluetooth Speaker,95.984,2,0.2,5.999,2017-08-01,2017-08-03
11/24/2014,11/26/2014,First Class,VG-21790,Vivek Gonzalez,Consumer,United States,San Diego,California,92037,West,Furniture,Furnishings,"Eldon Delta Triangular Chair Mat, 52"" x 58"", Clear",151.72,4,0.0,27.3096,2014-11-24,2014-11-26
6/17/2017,6/21/2017,Second Class,PF-19165,Philip Fox,Consumer,United States,Olympia,Washington,98502,West,Furniture,Furnishings,"Howard Miller 13-3/4"" Diameter Brushed Chrome Round Wall Clock",155.25,3,0.0,46.575,2017-06-17,2017-06-21
6/17/2017,6/21/2017,Second Class,PF-19165,Philip Fox,Consumer,United States,Olympia,Washington,98502,West,Office Supplies,Storage,Project Tote Personal File,14.03,1,0.0,4.0687,2017-06-17,2017-06-21
12/21/2015,12/24/2015,Second Class,JS-15880,John Stevenson,Consumer,United States,Seattle,Washington,98103,West,Furniture,Tables,Bevis 36 x 72 Conference Tables,1618.37,13,0.0,356.0414,2015-12-21,2015-12-24
12/21/2015,12/24/2015,Second Class,JS-15880,John Stevenson,Consumer,United States,Seattle,Washington,98103,West,Technology,Accessories,Enermax Acrylux Wireless Keyboard,99.6,1,0.0,36.852,2015-12-21,2015-12-24
9/17/2015,9/19/2015,Second Class,MO-17800,Meg O'Connel,Home Office,United States,Los Angeles,California,90036,West,Office Supplies,Paper,Xerox 216,32.4,5,0.0,15.552,2015-09-17,2015-09-19
7/6/2015,7/10/2015,Standard Class,KM-16225,Kalyca Meade,Corporate,United States,New York City,New York,10011,East,Furniture,Furnishings,G.E. Halogen Desk Lamp Bulbs,13.96,2,0.0,6.7008,2015-07-06,2015-07-10
7/6/2015,7/10/2015,Standard Class,KM-16225,Kalyca Meade,Corporate,United States,New York City,New York,10011,East,Furniture,Furnishings,"Howard Miller 11-1/2"" Diameter Ridgewood Wall Clock",155.82,3,0.0,63.8862,2015-07-06,2015-07-10
7/6/2015,7/10/2015,Standard Class,KM-16225,Kalyca Meade,Corporate,United States,New York City,New York,10011,East,Technology,Phones,OtterBox Commuter Series Case - Samsung Galaxy S4,124.95,5,0.0,2.499,2015-07-06,2015-07-10
7/6/2015,7/10/2015,Standard Class,KM-16225,Kalyca Meade,Corporate,United States,New York City,New York,10011,East,Office Supplies,Storage,Iceberg Mobile Mega Data/Printer Cart ,601.65,5,0.0,156.429,2015-07-06,2015-07-10
4/27/2015,5/3/2015,Standard Class,GT-14710,Greg Tran,Consumer,United States,Washington,District of Columbia,20016,East,Office Supplies,Art,Staples in misc. colors,22.74,3,0.0,8.8686,2015-04-27,2015-05-03
4/27/2015,5/3/2015,Standard Class,GT-14710,Greg Tran,Consumer,United States,Washington,District of Columbia,20016,East,Furniture,Chairs,Global Comet Stacking Arm Chair,1267.53,3,0.0,316.8825,2015-04-27,2015-05-03
4/27/2015,5/3/2015,Standard Class,GT-14710,Greg Tran,Consumer,United States,Washington,District of Columbia,20016,East,Technology,Machines,Cisco SPA525G2 5-Line IP Phone,1379.92,8,0.0,648.5624,2015-04-27,2015-05-03
6/16/2015,6/20/2015,Standard Class,PB-19150,Philip Brown,Consumer,United States,Philadelphia,Pennsylvania,19134,East,Office Supplies,Envelopes,Peel & Seel Envelopes,6.208,2,0.2,2.1728,2015-06-16,2015-06-20
12/17/2017,12/20/2017,First Class,HR-14770,Hallie Redmond,Home Office,United States,Los Angeles,California,90045,West,Office Supplies,Binders,GBC Plastic Binding Combs,11.808,2,0.2,4.2804,2017-12-17,2017-12-20
1/11/2016,1/13/2016,Second Class,DE-13255,Deanra Eno,Home Office,United States,Springfield,Ohio,45503,East,Office Supplies,Paper,Xerox 2,15.552,3,0.2,5.4432,2016-01-11,2016-01-13
1/11/2016,1/13/2016,Second Class,DE-13255,Deanra Eno,Home Office,United States,Springfield,Ohio,45503,East,Office Supplies,Paper,Xerox 1935,63.312,3,0.2,20.5764,2016-01-11,2016-01-13
1/11/2016,1/13/2016,Second Class,DE-13255,Deanra Eno,Home Office,United States,Springfield,Ohio,45503,East,Technology,Phones,Cyber Acoustics AC-202b Speech Recognition Stereo Headset,15.588,2,0.4,-9.8724,2016-01-11,2016-01-13
7/11/2014,7/15/2014,Standard Class,LA-16780,Laura Armstrong,Corporate,United States,Hackensack,New Jersey,7601,East,Office Supplies,Paper,Easy-staple paper,177.2,5,0.0,83.284,2014-07-11,2014-07-15
7/11/2014,7/15/2014,Standard Class,LA-16780,Laura Armstrong,Corporate,United States,Hackensack,New Jersey,7601,East,Technology,Phones,Cisco SPA508G,197.97,3,0.0,57.4113,2014-07-11,2014-07-15
7/11/2014,7/15/2014,Standard Class,LA-16780,Laura Armstrong,Corporate,United States,Hackensack,New Jersey,7601,East,Furniture,Chairs,Global Commerce Series High-Back Swivel/Tilt Chairs,854.94,3,0.0,213.735,2014-07-11,2014-07-15
7/11/2014,7/15/2014,Standard Class,LA-16780,Laura Armstrong,Corporate,United States,Hackensack,New Jersey,7601,East,Furniture,Furnishings,9-3/4 Diameter Round Wall Clock,124.11,9,0.0,52.1262,2014-07-11,2014-07-15
7/11/2014,7/15/2014,Standard Class,LA-16780,Laura Armstrong,Corporate,United States,Hackensack,New Jersey,7601,East,Office Supplies,Labels,Avery 514,14.4,5,0.0,7.056,2014-07-11,2014-07-15
11/20/2016,11/22/2016,First Class,AG-10390,Allen Goldenen,Consumer,United States,Cincinnati,Ohio,45231,East,Office Supplies,Paper,Southworth 25% Cotton Granite Paper & Envelopes,15.696,3,0.2,5.1012,2016-11-20,2016-11-22
11/20/2016,11/22/2016,First Class,AG-10390,Allen Goldenen,Consumer,United States,Cincinnati,Ohio,45231,East,Office Supplies,Binders,Acco 3-Hole Punch,2.628,2,0.7,-1.9272,2016-11-20,2016-11-22
11/20/2016,11/22/2016,First Class,AG-10390,Allen Goldenen,Consumer,United States,Cincinnati,Ohio,45231,East,Office Supplies,Binders,Avery Recycled Flexi-View Covers for Binding Systems,14.427,3,0.7,-10.5798,2016-11-20,2016-11-22
4/22/2016,4/26/2016,Standard Class,EL-13735,Ed Ludwig,Home Office,United States,Jefferson City,Missouri,65109,Central,Furniture,Furnishings,Eldon Advantage Chair Mats for Low to Medium Pile Carpets,86.62,2,0.0,8.662,2016-04-22,2016-04-26
6/13/2015,6/14/2015,First Class,JJ-15445,Jennifer Jackson,Consumer,United States,Los Angeles,California,90004,West,Office Supplies,Binders,Aluminum Screw Posts,36.624,3,0.2,13.734,2015-06-13,2015-06-14
11/20/2017,11/21/2017,First Class,JH-15430,Jennifer Halladay,Consumer,United States,Burlington,North Carolina,27217,South,Office Supplies,Art,Newell 336,23.968,7,0.2,2.6964,2017-11-20,2017-11-21
11/20/2017,11/21/2017,First Class,JH-15430,Jennifer Halladay,Consumer,United States,Burlington,North Carolina,27217,South,Office Supplies,Art,Staples in misc. colors,28.728,3,0.2,1.7955,2017-11-20,2017-11-21
3/20/2016,3/24/2016,Standard Class,RD-19660,Robert Dilbeck,Home Office,United States,Saint Peters,Missouri,63376,Central,Furniture,Tables,Chromcraft Round Conference Tables,697.16,4,0.0,146.4036,2016-03-20,2016-03-24
9/6/2016,9/9/2016,Second Class,MO-17500,Mary O'Rourke,Consumer,United States,New York City,New York,10035,East,Technology,Accessories,Maxell 4.7GB DVD+RW 3/Pack,31.86,2,0.0,11.151,2016-09-06,2016-09-09
9/6/2016,9/9/2016,Second Class,MO-17500,Mary O'Rourke,Consumer,United States,New York City,New York,10035,East,Furniture,Bookcases,"Atlantic Metals Mobile 5-Shelf Bookcases, Custom Colors",722.352,3,0.2,90.294,2016-09-06,2016-09-09
7/9/2017,7/12/2017,First Class,NS-18640,Noel Staavos,Corporate,United States,Chicago,Illinois,60610,Central,Office Supplies,Art,"Quartet Alpha White Chalk, 12/Pack",8.84,5,0.2,2.9835,2017-07-09,2017-07-12
7/9/2017,7/12/2017,First Class,NS-18640,Noel Staavos,Corporate,United States,Chicago,Illinois,60610,Central,Office Supplies,Appliances,Belkin F9S820V06 8 Outlet Surge,58.464,9,0.8,-146.16,2017-07-09,2017-07-12
10/12/2017,10/16/2017,Standard Class,SN-20710,Steve Nguyen,Home Office,United States,Rockford,Illinois,61107,Central,Furniture,Chairs,"Global Stack Chair without Arms, Black",254.604,14,0.3,-18.186,2017-10-12,2017-10-16
3/8/2016,3/13/2016,Standard Class,ZC-21910,Zuschuss Carroll,Consumer,United States,Miami,Florida,33142,South,Technology,Phones,Cisco Unified IP Phone 7945G VoIP phone,1363.96,5,0.2,85.2475,2016-03-08,2016-03-13
3/8/2016,3/13/2016,Standard Class,ZC-21910,Zuschuss Carroll,Consumer,United States,Miami,Florida,33142,South,Furniture,Furnishings,"Deflect-o DuraMat Lighweight, Studded, Beveled Mat for Low Pile Carpeting",102.36,3,0.2,-3.8385,2016-03-08,2016-03-13
5/27/2014,6/1/2014,Second Class,LC-16885,Lena Creighton,Consumer,United States,San Francisco,California,94109,West,Technology,Phones,Plantronics HL10 Handset Lifter,1113.504,12,0.2,125.2692,2014-05-27,2014-06-01
5/27/2014,6/1/2014,Second Class,LC-16885,Lena Creighton,Consumer,United States,San Francisco,California,94109,West,Technology,Accessories,Logitech Wireless Performance Mouse MX for PC and Mac,99.99,1,0.0,37.9962,2014-05-27,2014-06-01
7/3/2015,7/5/2015,First Class,DG-13300,Deirdre Greer,Corporate,United States,Philadelphia,Pennsylvania,19134,East,Furniture,Furnishings,Eldon Antistatic Chair Mats for Low to Medium Pile Carpets,168.464,2,0.2,-29.4812,2015-07-03,2015-07-05
7/3/2015,7/5/2015,First Class,DG-13300,Deirdre Greer,Corporate,United States,Philadelphia,Pennsylvania,19134,East,Office Supplies,Paper,"Important Message Pads, 50 4-1/4 x 5-1/2 Forms per Pad",6.72,2,0.2,2.436,2015-07-03,2015-07-05
7/3/2015,7/5/2015,First Class,DG-13300,Deirdre Greer,Corporate,United States,Philadelphia,Pennsylvania,19134,East,Furniture,Furnishings,"Howard Miller 12"" Round Wall Clock",282.888,9,0.2,56.5776,2015-07-03,2015-07-05
4/4/2015,4/8/2015,Standard Class,NF-18595,Nicole Fjeld,Home Office,United States,New York City,New York,10009,East,Office Supplies,Art,DIXON Ticonderoga Erasable Checking Pencils,11.16,2,0.0,4.3524,2015-04-04,2015-04-08
4/4/2015,4/8/2015,Standard Class,NF-18595,Nicole Fjeld,Home Office,United States,New York City,New York,10009,East,Furniture,Furnishings,Eldon Advantage Foldable Chair Mats for Low Pile Carpets,108.4,2,0.0,22.764,2015-04-04,2015-04-08
4/4/2015,4/8/2015,Standard Class,NF-18595,Nicole Fjeld,Home Office,United States,New York City,New York,10009,East,Office Supplies,Binders,GBC Prestige Therm-A-Bind Covers,82.344,3,0.2,27.7911,2015-04-04,2015-04-08
4/4/2015,4/8/2015,Standard Class,NF-18595,Nicole Fjeld,Home Office,United States,New York City,New York,10009,East,Office Supplies,Binders,Avery Round Ring Poly Binders,9.088,4,0.2,3.2944,2015-04-04,2015-04-08
12/10/2017,12/17/2017,Standard Class,BP-11185,Ben Peterman,Corporate,United States,San Diego,California,92037,West,Office Supplies,Binders,Avery Hole Reinforcements,19.936,4,0.2,7.2268,2017-12-10,2017-12-17
12/10/2017,12/17/2017,Standard Class,BP-11185,Ben Peterman,Corporate,United States,San Diego,California,92037,West,Office Supplies,Binders,"Wilson Jones Ledger-Size, Piano-Hinge Binder, 2"", Blue",65.568,2,0.2,22.9488,2017-12-10,2017-12-17
11/24/2016,12/1/2016,Standard Class,MG-17650,Matthew Grinstein,Home Office,United States,Philadelphia,Pennsylvania,19143,East,Office Supplies,Fasteners,Stockwell Gold Paper Clips,4.416,3,0.2,1.6008,2016-11-24,2016-12-01
3/23/2015,3/29/2015,Standard Class,JD-16060,Julia Dunbar,Consumer,United States,Houston,Texas,77095,Central,Furniture,Chairs,Global Deluxe Steno Chair,107.772,2,0.3,-29.2524,2015-03-23,2015-03-29
4/16/2015,4/21/2015,Standard Class,TS-21160,Theresa Swint,Corporate,United States,Toledo,Ohio,43615,East,Office Supplies,Appliances,Belkin F9H710-06 7 Outlet SurgeMaster Surge Protector,45.216,3,0.2,4.5216,2015-04-16,2015-04-21
4/16/2015,4/21/2015,Standard Class,TS-21160,Theresa Swint,Corporate,United States,Toledo,Ohio,43615,East,Office Supplies,Fasteners,"Super Bands, 12/Pack",10.416,7,0.2,-2.2134,2015-04-16,2015-04-21
4/16/2015,4/21/2015,Standard Class,TS-21160,Theresa Swint,Corporate,United States,Toledo,Ohio,43615,East,Office Supplies,Art,Crayola Colored Pencils,7.872,3,0.2,1.2792,2015-04-16,2015-04-21
4/16/2015,4/21/2015,Standard Class,TS-21160,Theresa Swint,Corporate,United States,Toledo,Ohio,43615,East,Technology,Phones,Plantronics 81402,118.782,3,0.4,-27.7158,2015-04-16,2015-04-21
4/16/2015,4/21/2015,Standard Class,TS-21160,Theresa Swint,Corporate,United States,Toledo,Ohio,43615,East,Office Supplies,Fasteners,Assorted Color Push Pins,1.448,1,0.2,0.2353,2015-04-16,2015-04-21
4/16/2015,4/21/2015,Standard Class,TS-21160,Theresa Swint,Corporate,United States,Toledo,Ohio,43615,East,Office Supplies,Binders,"GBC Velobind Prepunched Cover Sets, Regency Series",55.47,5,0.7,-46.225,2015-04-16,2015-04-21
10/1/2016,10/2/2016,First Class,BD-11620,Brian DeCherney,Consumer,United States,San Francisco,California,94122,West,Furniture,Chairs,"Global Value Mid-Back Manager's Chair, Gray",194.848,4,0.2,12.178,2016-10-01,2016-10-02
9/28/2017,9/30/2017,Second Class,CM-12160,Charles McCrossin,Consumer,United States,Brownsville,Texas,78521,Central,Office Supplies,Supplies,Staple remover,1.744,1,0.2,-0.3488,2017-09-28,2017-09-30
7/25/2015,7/29/2015,Standard Class,RB-19795,Ross Baird,Home Office,United States,Philadelphia,Pennsylvania,19143,East,Office Supplies,Binders,GBC Premium Transparent Covers with Diagonal Lined Pattern,25.176,4,0.7,-18.4624,2015-07-25,2015-07-29
11/20/2015,11/26/2015,Standard Class,SN-20560,Skye Norling,Home Office,United States,Los Angeles,California,90008,West,Office Supplies,Art,Newell 333,19.46,7,0.0,5.0596,2015-11-20,2015-11-26
4/28/2016,5/2/2016,Standard Class,EH-14005,Erica Hernandez,Home Office,United States,Denver,Colorado,80219,West,Office Supplies,Paper,Xerox 1881,29.472,3,0.2,9.9468,2016-04-28,2016-05-02
11/14/2017,11/19/2017,Standard Class,FO-14305,Frank Olsen,Consumer,United States,New York City,New York,10035,East,Office Supplies,Binders,3M Organizer Strips,8.64,2,0.2,3.024,2017-11-14,2017-11-19
11/12/2016,11/19/2016,Standard Class,MS-17710,Maurice Satty,Consumer,United States,Mesa,Arizona,85204,West,Office Supplies,Binders,Avery Durable Slant Ring Binders With Label Holder,6.27,5,0.7,-4.598,2016-11-12,2016-11-19
11/12/2016,11/19/2016,Standard Class,MS-17710,Maurice Satty,Consumer,United States,Mesa,Arizona,85204,West,Office Supplies,Binders,Round Ring Binders,4.368,7,0.7,-3.3488,2016-11-12,2016-11-19
11/12/2016,11/19/2016,Standard Class,MS-17710,Maurice Satty,Consumer,United States,Mesa,Arizona,85204,West,Technology,Accessories,Micropad Numeric Keypads,31.984,2,0.2,1.999,2016-11-12,2016-11-19
9/29/2016,9/30/2016,First Class,CC-12100,Chad Cunningham,Home Office,United States,Columbus,Indiana,47201,Central,Office Supplies,Art,Newell 328,40.88,7,0.0,10.6288,2016-09-29,2016-09-30
9/23/2017,9/25/2017,Second Class,DW-13540,Don Weiss,Consumer,United States,Seattle,Washington,98105,West,Office Supplies,Appliances,Belkin 8 Outlet SurgeMaster II Gold Surge Protector,119.96,2,0.0,33.5888,2017-09-23,2017-09-25
9/23/2017,9/25/2017,Second Class,DW-13540,Don Weiss,Consumer,United States,Seattle,Washington,98105,West,Office Supplies,Storage,Sterilite Officeware Hinged File Box,31.44,3,0.0,8.4888,2017-09-23,2017-09-25
9/23/2017,9/25/2017,Second Class,DW-13540,Don Weiss,Consumer,United States,Seattle,Washington,98105,West,Office Supplies,Binders,Avery Printable Repositionable Plastic Tabs,6.88,1,0.2,2.322,2017-09-23,2017-09-25
11/29/2015,12/4/2015,Standard Class,BT-11395,Bill Tyler,Corporate,United States,Detroit,Michigan,48227,Central,Office Supplies,Paper,Easy-staple paper,19.92,4,0.0,9.3624,2015-11-29,2015-12-04
11/29/2015,12/4/2015,Standard Class,BT-11395,Bill Tyler,Corporate,United States,Detroit,Michigan,48227,Central,Furniture,Chairs,"Global High-Back Leather Tilter, Burgundy",1106.91,9,0.0,121.7601,2015-11-29,2015-12-04
3/1/2016,3/5/2016,Standard Class,KD-16270,Karen Daniels,Consumer,United States,Yonkers,New York,10701,East,Furniture,Tables,Chromcraft Round Conference Tables,836.592,8,0.4,-264.9208,2016-03-01,2016-03-05
3/1/2016,3/5/2016,Standard Class,KD-16270,Karen Daniels,Consumer,United States,Yonkers,New York,10701,East,Office Supplies,Paper,Easy-staple paper,26.38,1,0.0,12.1348,2016-03-01,2016-03-05
3/1/2016,3/5/2016,Standard Class,KD-16270,Karen Daniels,Consumer,United States,Yonkers,New York,10701,East,Office Supplies,Storage,Adjustable Depth Letter/Legal Cart,362.92,2,0.0,105.2468,2016-03-01,2016-03-05
3/1/2016,3/5/2016,Standard Class,KD-16270,Karen Daniels,Consumer,United States,Yonkers,New York,10701,East,Technology,Machines,Ativa V4110MDD Micro-Cut Shredder,4899.93,7,0.0,2400.9657,2016-03-01,2016-03-05
8/12/2016,8/12/2016,Same Day,LC-16870,Lena Cacioppo,Consumer,United States,Des Moines,Iowa,50315,Central,Office Supplies,Paper,Xerox 224,6.48,1,0.0,3.1104,2016-08-12,2016-08-12
8/15/2016,8/20/2016,Second Class,CY-12745,Craig Yedwab,Corporate,United States,Oakland,California,94601,West,Technology,Phones,Nokia Lumia 521 (T-Mobile),71.976,3,0.2,7.1976,2016-08-15,2016-08-20
8/15/2016,8/20/2016,Second Class,CY-12745,Craig Yedwab,Corporate,United States,Oakland,California,94601,West,Office Supplies,Labels,Avery 488,3.15,1,0.0,1.512,2016-08-15,2016-08-20
6/4/2017,6/10/2017,Standard Class,LW-16990,Lindsay Williams,Corporate,United States,Monroe,North Carolina,28110,South,Furniture,Furnishings,Telescoping Adjustable Floor Lamp,31.984,2,0.2,1.999,2017-06-04,2017-06-10
6/4/2017,6/10/2017,Standard Class,LW-16990,Lindsay Williams,Corporate,United States,Monroe,North Carolina,28110,South,Technology,Phones,Innergie mMini Combo Duo USB Travel Charging Kit,71.984,2,0.2,25.1944,2017-06-04,2017-06-10
12/6/2015,12/13/2015,Standard Class,NP-18325,Naresj Patel,Consumer,United States,San Diego,California,92105,West,Office Supplies,Art,Stanley Contemporary Battery Pencil Sharpeners,120.15,9,0.0,33.642,2015-12-06,2015-12-13
12/6/2015,12/13/2015,Standard Class,NP-18325,Naresj Patel,Consumer,United States,San Diego,California,92105,West,Technology,Phones,AT&T 1080 Corded phone,219.184,2,0.2,19.1786,2015-12-06,2015-12-13
12/27/2015,12/31/2015,Standard Class,BT-11485,Brad Thomas,Home Office,United States,Clinton,Maryland,20735,East,Office Supplies,Paper,Xerox 1950,28.9,5,0.0,14.161,2015-12-27,2015-12-31
12/27/2015,12/31/2015,Standard Class,BT-11485,Brad Thomas,Home Office,United States,Clinton,Maryland,20735,East,Office Supplies,Appliances,Kensington 7 Outlet MasterPiece Power Center,355.96,2,0.0,103.2284,2015-12-27,2015-12-31
1/21/2017,1/26/2017,Standard Class,PS-19045,Penelope Sewall,Home Office,United States,Charlotte,North Carolina,28205,South,Office Supplies,Storage,"Fellowes Mobile File Cart, Black",348.208,7,0.2,30.4682,2017-01-21,2017-01-26
1/21/2017,1/26/2017,Standard Class,PS-19045,Penelope Sewall,Home Office,United States,Charlotte,North Carolina,28205,South,Office Supplies,Binders,GBC Recycled VeloBinder Covers,35.784,7,0.7,-28.6272,2017-01-21,2017-01-26
6/25/2014,6/28/2014,First Class,NS-18640,Noel Staavos,Corporate,United States,Los Angeles,California,90049,West,Furniture,Tables,Hon 4060 Series Tables,447.84,5,0.2,11.196,2014-06-25,2014-06-28
6/14/2016,6/17/2016,First Class,PV-18985,Paul Van Hugh,Home Office,United States,San Francisco,California,94122,West,Office Supplies,Art,Newell 326,7.04,4,0.0,2.0416,2016-06-14,2016-06-17
6/14/2016,6/17/2016,First Class,PV-18985,Paul Van Hugh,Home Office,United States,San Francisco,California,94122,West,Furniture,Furnishings,"GE General Purpose, Extra Long Life, Showcase & Floodlight Incandescent Bulbs",8.73,3,0.0,4.1031,2016-06-14,2016-06-17
6/14/2016,6/17/2016,First Class,PV-18985,Paul Van Hugh,Home Office,United States,San Francisco,California,94122,West,Technology,Accessories,Logitech ClearChat Comfort/USB Headset H390,29.29,1,0.0,9.6657,2016-06-14,2016-06-17
6/14/2016,6/17/2016,First Class,PV-18985,Paul Van Hugh,Home Office,United States,San Francisco,California,94122,West,Office Supplies,Art,Newell 346,8.64,3,0.0,2.5056,2016-06-14,2016-06-17
4/21/2017,4/27/2017,Standard Class,RP-19390,Resi Pölking,Consumer,United States,Houston,Texas,77041,Central,Office Supplies,Binders,Avery Non-Stick Binders,2.694,3,0.8,-4.7145,2017-04-21,2017-04-27
4/21/2017,4/27/2017,Standard Class,RP-19390,Resi Pölking,Consumer,United States,Houston,Texas,77041,Central,Office Supplies,Binders,UniKeep View Case Binders,2.934,3,0.8,-4.9878,2017-04-21,2017-04-27
10/21/2016,10/27/2016,Standard Class,NM-18520,Neoma Murray,Consumer,United States,Riverside,California,92503,West,Office Supplies,Paper,"Rediform Wirebound ""Phone Memo"" Message Book, 11 x 5-3/4",22.92,3,0.0,11.2308,2016-10-21,2016-10-27
11/19/2016,11/24/2016,Standard Class,EH-13945,Eric Hoffmann,Consumer,United States,Houston,Texas,77041,Central,Office Supplies,Storage,"Tennsco Lockers, Gray",100.704,6,0.2,-16.3644,2016-11-19,2016-11-24
11/19/2016,11/24/2016,Standard Class,EH-13945,Eric Hoffmann,Consumer,United States,Houston,Texas,77041,Central,Furniture,Furnishings,"GE General Purpose, Extra Long Life, Showcase & Floodlight Incandescent Bulbs",2.328,2,0.6,-0.7566,2016-11-19,2016-11-24
11/19/2016,11/24/2016,Standard Class,EH-13945,Eric Hoffmann,Consumer,United States,Houston,Texas,77041,Central,Office Supplies,Binders,"GBC Standard Recycled Report Covers, Clear Plastic Sheets",10.78,5,0.8,-17.248,2016-11-19,2016-11-24
11/19/2016,11/24/2016,Standard Class,EH-13945,Eric Hoffmann,Consumer,United States,Houston,Texas,77041,Central,Office Supplies,Fasteners,Staples,58.368,12,0.2,21.888,2016-11-19,2016-11-24
11/19/2016,11/24/2016,Standard Class,EH-13945,Eric Hoffmann,Consumer,United States,Houston,Texas,77041,Central,Office Supplies,Envelopes,"Recycled Interoffice Envelopes with Re-Use-A-Seal Closure, 10 x 13",40.968,3,0.2,13.8267,2016-11-19,2016-11-24
11/19/2016,11/24/2016,Standard Class,EH-13945,Eric Hoffmann,Consumer,United States,Houston,Texas,77041,Central,Technology,Phones,invisibleSHIELD by ZAGG Smudge-Free Screen Protector,71.96,5,0.2,25.186,2016-11-19,2016-11-24
11/19/2016,11/24/2016,Standard Class,EH-13945,Eric Hoffmann,Consumer,United States,Houston,Texas,77041,Central,Office Supplies,Paper,Xerox 1905,10.368,2,0.2,3.6288,2016-11-19,2016-11-24
11/19/2016,11/24/2016,Standard Class,EH-13945,Eric Hoffmann,Consumer,United States,Houston,Texas,77041,Central,Office Supplies,Binders,Avery Hidden Tab Dividers for Binding Systems,1.192,2,0.8,-2.0264,2016-11-19,2016-11-24
12/18/2017,12/23/2017,Second Class,RA-19915,Russell Applegate,Consumer,United States,Encinitas,California,92024,West,Office Supplies,Binders,Binding Machine Supplies,46.672,2,0.2,16.3352,2017-12-18,2017-12-23
12/18/2017,12/23/2017,Second Class,RA-19915,Russell Applegate,Consumer,United States,Encinitas,California,92024,West,Furniture,Bookcases,"Bush Saratoga Collection 5-Shelf Bookcase, Hanover Cherry, *Special Order",119.833,1,0.15,-12.6882,2017-12-18,2017-12-23
12/18/2017,12/23/2017,Second Class,RA-19915,Russell Applegate,Consumer,United States,Encinitas,California,92024,West,Technology,Accessories,Logitech Illuminated - Keyboard,119.98,2,0.0,57.5904,2017-12-18,2017-12-23
7/22/2016,7/24/2016,Second Class,DL-13495,Dionis Lloyd,Corporate,United States,San Francisco,California,94110,West,Office Supplies,Labels,Self-Adhesive Removable Labels,6.3,2,0.0,3.024,2016-07-22,2016-07-24
9/4/2015,9/8/2015,Standard Class,CS-12355,Christine Sundaresam,Consumer,United States,Roswell,Georgia,30076,South,Office Supplies,Paper,Xerox 1908,279.9,5,0.0,137.151,2015-09-04,2015-09-08
9/4/2015,9/8/2015,Standard Class,CS-12355,Christine Sundaresam,Consumer,United States,Roswell,Georgia,30076,South,Technology,Accessories,Logitech G19 Programmable Gaming Keyboard,619.95,5,0.0,111.591,2015-09-04,2015-09-08
9/4/2015,9/8/2015,Standard Class,CS-12355,Christine Sundaresam,Consumer,United States,Roswell,Georgia,30076,South,Office Supplies,Paper,"Ampad Evidence Wirebond Steno Books, 6"" x 9""",4.36,2,0.0,2.0492,2015-09-04,2015-09-08
9/4/2015,9/8/2015,Standard Class,CS-12355,Christine Sundaresam,Consumer,United States,Roswell,Georgia,30076,South,Office Supplies,Envelopes,Security-Tint Envelopes,15.28,2,0.0,7.4872,2015-09-04,2015-09-08
1/20/2014,1/26/2014,Standard Class,HL-15040,Hunter Lopez,Consumer,United States,Jonesboro,Arkansas,72401,South,Technology,Phones,Apple iPhone 5C,699.93,7,0.0,181.9818,2014-01-20,2014-01-26
1/20/2014,1/26/2014,Standard Class,HL-15040,Hunter Lopez,Consumer,United States,Jonesboro,Arkansas,72401,South,Office Supplies,Art,Newell 351,22.96,7,0.0,6.6584,2014-01-20,2014-01-26
1/20/2014,1/26/2014,Standard Class,HL-15040,Hunter Lopez,Consumer,United States,Jonesboro,Arkansas,72401,South,Furniture,Furnishings,"Eldon Expressions Desk Accessory, Wood Pencil Holder, Oak",38.6,4,0.0,11.58,2014-01-20,2014-01-26
1/20/2014,1/26/2014,Standard Class,HL-15040,Hunter Lopez,Consumer,United States,Jonesboro,Arkansas,72401,South,Office Supplies,Art,Newell 327,6.63,3,0.0,1.7901,2014-01-20,2014-01-26
1/20/2014,1/26/2014,Standard Class,HL-15040,Hunter Lopez,Consumer,United States,Jonesboro,Arkansas,72401,South,Office Supplies,Envelopes,Staple envelope,23.34,3,0.0,10.9698,2014-01-20,2014-01-26
1/20/2014,1/26/2014,Standard Class,HL-15040,Hunter Lopez,Consumer,United States,Jonesboro,Arkansas,72401,South,Furniture,Chairs,Hon 4700 Series Mobuis Mid-Back Task Chairs with Adjustable Arms,1067.94,3,0.0,224.2674,2014-01-20,2014-01-26
3/2/2015,3/7/2015,Standard Class,PA-19060,Pete Armstrong,Home Office,United States,Richmond,Indiana,47374,Central,Office Supplies,Art,50 Colored Long Pencils,10.16,1,0.0,2.6416,2015-03-02,2015-03-07
3/2/2015,3/7/2015,Standard Class,PA-19060,Pete Armstrong,Home Office,United States,Richmond,Indiana,47374,Central,Office Supplies,Envelopes,Brown Kraft Recycled Envelopes,101.88,6,0.0,50.94,2015-03-02,2015-03-07
4/12/2016,4/16/2016,Standard Class,BD-11605,Brian Dahlen,Consumer,United States,Springfield,Virginia,22153,South,Furniture,Tables,KI Adjustable-Height Table,343.92,4,0.0,75.6624,2016-04-12,2016-04-16
4/12/2016,4/16/2016,Standard Class,BD-11605,Brian Dahlen,Consumer,United States,Springfield,Virginia,22153,South,Office Supplies,Paper,Xerox 1945,40.99,1,0.0,20.0851,2016-04-12,2016-04-16
4/12/2016,4/16/2016,Standard Class,BD-11605,Brian Dahlen,Consumer,United States,Springfield,Virginia,22153,South,Office Supplies,Envelopes,Globe Weis Peel & Seel First Class Envelopes,63.9,5,0.0,28.755,2016-04-12,2016-04-16
12/6/2016,12/7/2016,First Class,GG-14650,Greg Guthrie,Corporate,United States,Antioch,California,94509,West,Office Supplies,Paper,Xerox 216,19.44,3,0.0,9.3312,2016-12-06,2016-12-07
6/5/2016,6/9/2016,Standard Class,JS-15940,Joni Sundaresam,Home Office,United States,Philadelphia,Pennsylvania,19134,East,Office Supplies,Storage,"Eldon Base for stackable storage shelf, platinum",124.608,4,0.2,-23.364,2016-06-05,2016-06-09
6/5/2016,6/9/2016,Standard Class,JS-15940,Joni Sundaresam,Home Office,United States,Philadelphia,Pennsylvania,19134,East,Office Supplies,Labels,Avery 502,7.56,3,0.2,2.646,2016-06-05,2016-06-09
12/11/2016,12/11/2016,Same Day,LR-16915,Lena Radford,Consumer,United States,Homestead,Florida,33030,South,Office Supplies,Storage,Steel Personal Filing/Posting Tote,85.224,3,0.2,7.4571,2016-12-11,2016-12-11
11/12/2016,11/15/2016,Second Class,FH-14275,Frank Hawley,Corporate,United States,La Porte,Indiana,46350,Central,Office Supplies,Envelopes,"Tyvek  Top-Opening Peel & Seel  Envelopes, Gray",287.52,8,0.0,129.384,2016-11-12,2016-11-15
11/12/2016,11/15/2016,Second Class,FH-14275,Frank Hawley,Corporate,United States,La Porte,Indiana,46350,Central,Office Supplies,Appliances,Belkin F9H710-06 7 Outlet SurgeMaster Surge Protector,37.68,2,0.0,10.5504,2016-11-12,2016-11-15
11/12/2016,11/15/2016,Second Class,FH-14275,Frank Hawley,Corporate,United States,La Porte,Indiana,46350,Central,Office Supplies,Paper,Xerox 1896,19.98,2,0.0,8.991,2016-11-12,2016-11-15
11/12/2016,11/15/2016,Second Class,FH-14275,Frank Hawley,Corporate,United States,La Porte,Indiana,46350,Central,Office Supplies,Art,Newell 332,20.58,7,0.0,5.5566,2016-11-12,2016-11-15
11/12/2016,11/15/2016,Second Class,FH-14275,Frank Hawley,Corporate,United States,La Porte,Indiana,46350,Central,Office Supplies,Binders,Cardinal Slant-D Ring Binders,17.38,2,0.0,8.69,2016-11-12,2016-11-15
9/29/2014,10/3/2014,Standard Class,AP-10915,Arthur Prichep,Consumer,United States,Los Angeles,California,90045,West,Furniture,Furnishings,Luxo Professional Combination Clamp-On Lamps,204.6,2,0.0,53.196,2014-09-29,2014-10-03
9/29/2014,10/3/2014,Standard Class,AP-10915,Arthur Prichep,Consumer,United States,Los Angeles,California,90045,West,Office Supplies,Fasteners,Stockwell Push Pins,8.72,4,0.0,2.8776,2014-09-29,2014-10-03
9/29/2014,10/3/2014,Standard Class,AP-10915,Arthur Prichep,Consumer,United States,Los Angeles,California,90045,West,Office Supplies,Paper,Xerox 223,6.48,1,0.0,3.1104,2014-09-29,2014-10-03
9/29/2014,10/3/2014,Standard Class,AP-10915,Arthur Prichep,Consumer,United States,Los Angeles,California,90045,West,Technology,Machines,Star Micronics TSP800 TSP847IIU Receipt Printer,686.32,2,0.2,223.054,2014-09-29,2014-10-03
9/29/2014,10/3/2014,Standard Class,AP-10915,Arthur Prichep,Consumer,United States,Los Angeles,California,90045,West,Office Supplies,Storage,"Fellowes Mobile File Cart, Black",62.18,1,0.0,16.7886,2014-09-29,2014-10-03
4/4/2015,4/4/2015,Same Day,NC-18340,Nat Carroll,Consumer,United States,Lansing,Michigan,48911,Central,Office Supplies,Appliances,Hoover Shoulder Vac Commercial Portable Vacuum,644.076,2,0.1,107.346,2015-04-04,2015-04-04
4/4/2015,4/4/2015,Same Day,NC-18340,Nat Carroll,Consumer,United States,Lansing,Michigan,48911,Central,Office Supplies,Fasteners,Staples,5.84,2,0.0,2.628,2015-04-04,2015-04-04
4/4/2015,4/4/2015,Same Day,NC-18340,Nat Carroll,Consumer,United States,Lansing,Michigan,48911,Central,Office Supplies,Binders,Acco Expandable Hanging Binders,12.76,2,0.0,5.8696,2015-04-04,2015-04-04
4/4/2015,4/4/2015,Same Day,NC-18340,Nat Carroll,Consumer,United States,Lansing,Michigan,48911,Central,Technology,Phones,Shocksock Galaxy S4 Armband,10.95,1,0.0,0.438,2015-04-04,2015-04-04
4/4/2015,4/4/2015,Same Day,NC-18340,Nat Carroll,Consumer,United States,Lansing,Michigan,48911,Central,Technology,Copiers,Brother DCP1000 Digital 3 in 1 Multifunction Machine,599.98,2,0.0,209.993,2015-04-04,2015-04-04
5/8/2015,5/14/2015,Standard Class,CB-12535,Claudia Bergmann,Corporate,United States,Cuyahoga Falls,Ohio,44221,East,Furniture,Furnishings,"Eldon Regeneration Recycled Desk Accessories, Smoke",8.352,6,0.2,1.2528,2015-05-08,2015-05-14
12/31/2016,1/6/2017,Standard Class,KL-16555,Kelly Lampkin,Corporate,United States,Reno,Nevada,89502,West,Office Supplies,Art,"Crayola Anti Dust Chalk, 12/Pack",3.64,2,0.0,1.638,2016-12-31,2017-01-06
12/31/2016,1/6/2017,Standard Class,KL-16555,Kelly Lampkin,Corporate,United States,Reno,Nevada,89502,West,Office Supplies,Binders,Lock-Up Easel 'Spel-Binder',159.768,7,0.2,53.9217,2016-12-31,2017-01-06
12/20/2014,12/21/2014,First Class,PS-19045,Penelope Sewall,Home Office,United States,Harrisonburg,Virginia,22801,South,Office Supplies,Storage,"SAFCO Commercial Wire Shelving, 72h",122.48,2,0.0,0.0,2014-12-20,2014-12-21
12/20/2014,12/21/2014,First Class,PS-19045,Penelope Sewall,Home Office,United States,Harrisonburg,Virginia,22801,South,Furniture,Tables,"Chromcraft 48"" x 96"" Racetrack Double Pedestal Table",2244.48,7,0.0,493.7856,2014-12-20,2014-12-21
12/20/2014,12/21/2014,First Class,PS-19045,Penelope Sewall,Home Office,United States,Harrisonburg,Virginia,22801,South,Office Supplies,Binders,Wilson Jones Century Plastic Molded Ring Binders,62.31,3,0.0,29.2857,2014-12-20,2014-12-21
12/20/2014,12/21/2014,First Class,PS-19045,Penelope Sewall,Home Office,United States,Harrisonburg,Virginia,22801,South,Furniture,Tables,"Hon Practical Foundations 30 x 60 Training Table, Light Gray/Charcoal",455.1,2,0.0,100.122,2014-12-20,2014-12-21
7/2/2016,7/7/2016,Second Class,GB-14530,George Bell,Corporate,United States,Los Angeles,California,90004,West,Furniture,Chairs,Hon Deluxe Fabric Upholstered Stacking Chairs,195.184,1,0.2,19.5184,2016-07-02,2016-07-07
6/29/2017,7/4/2017,Standard Class,AA-10315,Alex Avila,Consumer,United States,Minneapolis,Minnesota,55407,Central,Office Supplies,Appliances,"Belkin 325VA UPS Surge Protector, 6'",362.94,3,0.0,90.735,2017-06-29,2017-07-04
6/29/2017,7/4/2017,Standard Class,AA-10315,Alex Avila,Consumer,United States,Minneapolis,Minnesota,55407,Central,Office Supplies,Binders,Avery Binding System Hidden Tab Executive Style Index Sets,11.54,2,0.0,5.77,2017-06-29,2017-07-04
9/1/2014,9/5/2014,Second Class,LT-16765,Larry Tron,Consumer,United States,Escondido,California,92025,West,Office Supplies,Art,"BOSTON Model 1800 Electric Pencil Sharpeners, Putty/Woodgrain",53.94,3,0.0,15.6426,2014-09-01,2014-09-05
3/3/2014,3/8/2014,Standard Class,AP-10720,Anne Pryor,Home Office,United States,New York City,New York,10035,East,Technology,Phones,PowerGen Dual USB Car Charger,9.99,1,0.0,4.5954,2014-03-03,2014-03-08
3/3/2014,3/8/2014,Standard Class,AP-10720,Anne Pryor,Home Office,United States,New York City,New York,10035,East,Office Supplies,Binders,Ibico Laser Imprintable Binding System Covers,125.76,3,0.2,40.872,2014-03-03,2014-03-08
3/3/2014,3/8/2014,Standard Class,AP-10720,Anne Pryor,Home Office,United States,New York City,New York,10035,East,Office Supplies,Binders,"Cardinal HOLDit! Binder Insert Strips,Extra Strips",25.32,5,0.2,9.1785,2014-03-03,2014-03-08
5/4/2014,5/8/2014,Standard Class,PM-18940,Paul MacIntyre,Consumer,United States,Jackson,Michigan,49201,Central,Office Supplies,Binders,Fellowes Binding Cases,46.8,4,0.0,21.06,2014-05-04,2014-05-08
11/2/2015,11/2/2015,Same Day,KC-16540,Kelly Collister,Consumer,United States,Seattle,Washington,98115,West,Technology,Accessories,Logitech K350 2.4Ghz Wireless Keyboard,447.93,9,0.0,49.2723,2015-11-02,2015-11-02
12/8/2017,12/10/2017,Second Class,DL-13315,Delfina Latchford,Consumer,United States,New York City,New York,10035,East,Furniture,Furnishings,"C-Line Cubicle Keepers Polyproplyene Holder w/Velcro Back, 8-1/2x11, 25/Bx",109.48,2,0.0,33.9388,2017-12-08,2017-12-10
12/8/2017,12/10/2017,Second Class,DL-13315,Delfina Latchford,Consumer,United States,New York City,New York,10035,East,Office Supplies,Storage,Safco Industrial Wire Shelving System,272.94,3,0.0,0.0,2017-12-08,2017-12-10
12/8/2017,12/10/2017,Second Class,DL-13315,Delfina Latchford,Consumer,United States,New York City,New York,10035,East,Office Supplies,Paper,Xerox 1996,19.44,3,0.0,9.3312,2017-12-08,2017-12-10
12/8/2017,12/10/2017,Second Class,DL-13315,Delfina Latchford,Consumer,United States,New York City,New York,10035,East,Office Supplies,Storage,Iris Project Case,31.92,4,0.0,8.2992,2017-12-08,2017-12-10
3/10/2014,3/14/2014,Standard Class,SW-20275,Scott Williamson,Consumer,United States,Royal Oak,Michigan,48073,Central,Office Supplies,Paper,"Geographics Note Cards, Blank, White, 8 1/2"" x 11""",22.38,2,0.0,10.7424,2014-03-10,2014-03-14
4/21/2014,4/25/2014,Standard Class,AA-10375,Allen Armold,Consumer,United States,Los Angeles,California,90008,West,Office Supplies,Binders,ACCOHIDE Binder by Acco,16.52,5,0.2,5.5755,2014-04-21,2014-04-25
10/22/2015,10/26/2015,Standard Class,LT-17110,Liz Thompson,Consumer,United States,Bloomington,Illinois,61701,Central,Office Supplies,Binders,GBC Instant Report Kit,5.176,4,0.8,-7.764,2015-10-22,2015-10-26
8/22/2015,8/25/2015,First Class,DP-13105,Dave Poirier,Corporate,United States,New York City,New York,10035,East,Office Supplies,Binders,"Avery 3 1/2"" Diskette Storage Pages, 10/Pack",50.112,6,0.2,16.2864,2015-08-22,2015-08-25
8/29/2016,9/3/2016,Standard Class,AB-10060,Adam Bellavance,Home Office,United States,Concord,New Hampshire,3301,East,Office Supplies,Supplies,Acme Forged Steel Scissors with Black Enamel Handles,27.93,3,0.0,8.0997,2016-08-29,2016-09-03
12/27/2014,12/30/2014,Second Class,AT-10435,Alyssa Tate,Home Office,United States,Los Angeles,California,90004,West,Office Supplies,Labels,Staple-on labels,11.56,4,0.0,5.4332,2014-12-27,2014-12-30
12/1/2016,12/5/2016,Standard Class,JE-15745,Joel Eaton,Consumer,United States,Rockville,Maryland,20852,East,Furniture,Chairs,Harbour Creations Steel Folding Chair,172.5,2,0.0,51.75,2016-12-01,2016-12-05
12/1/2016,12/5/2016,Standard Class,JE-15745,Joel Eaton,Consumer,United States,Rockville,Maryland,20852,East,Technology,Phones,JBL Micro Wireless Portable Bluetooth Speaker,179.97,3,0.0,44.9925,2016-12-01,2016-12-05
4/24/2016,4/27/2016,Second Class,CA-12055,Cathy Armstrong,Home Office,United States,Houston,Texas,77070,Central,Technology,Accessories,Plantronics S12 Corded Telephone Headset System,258.696,3,0.2,64.674,2016-04-24,2016-04-27
6/21/2014,6/25/2014,Standard Class,DB-13060,Dave Brooks,Consumer,United States,Lakewood,New Jersey,8701,East,Technology,Phones,Wireless Extenders zBoost YX545 SOHO Signal Booster,1322.93,7,0.0,357.1911,2014-06-21,2014-06-25
6/21/2014,6/25/2014,Standard Class,DB-13060,Dave Brooks,Consumer,United States,Lakewood,New Jersey,8701,East,Office Supplies,Art,"OIC #2 Pencils, Medium Soft",3.76,2,0.0,1.0904,2014-06-21,2014-06-25
1/14/2017,1/15/2017,First Class,RB-19570,Rob Beeghly,Consumer,United States,Jacksonville,North Carolina,28540,South,Office Supplies,Envelopes,"Tyvek  Top-Opening Peel & Seel Envelopes, Plain White",21.744,1,0.2,7.3386,2017-01-14,2017-01-15
1/14/2017,1/15/2017,First Class,RB-19570,Rob Beeghly,Consumer,United States,Jacksonville,North Carolina,28540,South,Technology,Phones,Sannysis Cute Owl Design Soft Skin Case Cover for Samsung Galaxy S4,7.92,5,0.2,0.693,2017-01-14,2017-01-15
11/24/2014,11/30/2014,Standard Class,HR-14830,Harold Ryan,Corporate,United States,Seattle,Washington,98103,West,Office Supplies,Binders,Peel & Stick Add-On Corner Pockets,12.096,7,0.2,4.2336,2014-11-24,2014-11-30
11/24/2014,11/30/2014,Standard Class,HR-14830,Harold Ryan,Corporate,United States,Seattle,Washington,98103,West,Office Supplies,Storage,"Carina 42""Hx23 3/4""W Media Storage Unit",485.88,6,0.0,9.7176,2014-11-24,2014-11-30
11/24/2014,11/30/2014,Standard Class,HR-14830,Harold Ryan,Corporate,United States,Seattle,Washington,98103,West,Office Supplies,Paper,Xerox 220,25.92,4,0.0,12.4416,2014-11-24,2014-11-30
11/24/2014,11/30/2014,Standard Class,HR-14830,Harold Ryan,Corporate,United States,Seattle,Washington,98103,West,Office Supplies,Storage,"Recycled Data-Pak for Archival Bound Computer Printouts, 12-1/2 x 12-1/2 x 16",197.58,2,0.0,53.3466,2014-11-24,2014-11-30
2/26/2017,2/28/2017,Second Class,BT-11530,Bradley Talbott,Home Office,United States,Los Angeles,California,90036,West,Office Supplies,Appliances,Kensington 6 Outlet Guardian Standard Surge Protector,81.92,4,0.0,22.1184,2017-02-26,2017-02-28
2/26/2017,2/28/2017,Second Class,BT-11530,Bradley Talbott,Home Office,United States,Los Angeles,California,90036,West,Technology,Phones,Toshiba IPT2010-SD IP Telephone,889.536,8,0.2,66.7152,2017-02-26,2017-02-28
2/26/2017,2/28/2017,Second Class,BT-11530,Bradley Talbott,Home Office,United States,Los Angeles,California,90036,West,Furniture,Chairs,GuestStacker Chair with Chrome Finish Legs,892.224,3,0.2,89.2224,2017-02-26,2017-02-28
2/26/2017,2/28/2017,Second Class,BT-11530,Bradley Talbott,Home Office,United States,Los Angeles,California,90036,West,Office Supplies,Paper,Xerox 1908,223.92,4,0.0,109.7208,2017-02-26,2017-02-28
2/26/2017,2/28/2017,Second Class,BT-11530,Bradley Talbott,Home Office,United States,Los Angeles,California,90036,West,Office Supplies,Paper,Xerox 1924,23.12,4,0.0,11.3288,2017-02-26,2017-02-28
9/15/2015,9/15/2015,Same Day,NG-18355,Nat Gilpin,Corporate,United States,Coral Springs,Florida,33065,South,Office Supplies,Paper,Xerox 21,15.552,3,0.2,5.4432,2015-09-15,2015-09-15
9/15/2015,9/15/2015,Same Day,NG-18355,Nat Gilpin,Corporate,United States,Coral Springs,Florida,33065,South,Furniture,Furnishings,Ultra Door Push Plate,15.712,4,0.2,2.5532,2015-09-15,2015-09-15
9/15/2015,9/15/2015,Same Day,NG-18355,Nat Gilpin,Corporate,United States,Coral Springs,Florida,33065,South,Office Supplies,Storage,"Decoflex Hanging Personal Folder File, Blue",24.672,2,0.2,2.1588,2015-09-15,2015-09-15
9/15/2015,9/15/2015,Same Day,NG-18355,Nat Gilpin,Corporate,United States,Coral Springs,Florida,33065,South,Furniture,Furnishings,"Tenex ""The Solids"" Textured Chair Mats",55.968,1,0.2,-2.0988,2015-09-15,2015-09-15
4/8/2016,4/12/2016,Standard Class,ZC-21910,Zuschuss Carroll,Consumer,United States,Houston,Texas,77041,Central,Technology,Accessories,Kensington Orbit Wireless Mobile Trackball for PC and Mac,431.928,9,0.2,64.7892,2016-04-08,2016-04-12
4/8/2016,4/12/2016,Standard Class,ZC-21910,Zuschuss Carroll,Consumer,United States,Houston,Texas,77041,Central,Furniture,Chairs,Global Chrome Stack Chair,95.984,4,0.3,-4.1136,2016-04-08,2016-04-12
4/8/2016,4/12/2016,Standard Class,ZC-21910,Zuschuss Carroll,Consumer,United States,Houston,Texas,77041,Central,Office Supplies,Binders,GBC DocuBind P400 Electric Binding System,1088.792,4,0.8,-1850.9464,2016-04-08,2016-04-12
7/18/2016,7/24/2016,Standard Class,LS-16945,Linda Southworth,Corporate,United States,Denver,Colorado,80219,West,Furniture,Chairs,Hon GuestStacker Chair,544.008,3,0.2,40.8006,2016-07-18,2016-07-24
7/18/2016,7/24/2016,Standard Class,LS-16945,Linda Southworth,Corporate,United States,Denver,Colorado,80219,West,Office Supplies,Binders,Round Ring Binders,1.872,3,0.7,-1.4352,2016-07-18,2016-07-24
7/18/2016,7/24/2016,Standard Class,LS-16945,Linda Southworth,Corporate,United States,Denver,Colorado,80219,West,Furniture,Chairs,Hon 4700 Series Mobuis Mid-Back Task Chairs with Adjustable Arms,854.352,3,0.2,10.6794,2016-07-18,2016-07-24
7/18/2016,7/24/2016,Standard Class,LS-16945,Linda Southworth,Corporate,United States,Denver,Colorado,80219,West,Office Supplies,Storage,"Sauder Facets Collection Locker/File Cabinet, Sky Alder Finish",593.568,2,0.2,0.0,2016-07-18,2016-07-24
7/18/2016,7/24/2016,Standard Class,LS-16945,Linda Southworth,Corporate,United States,Denver,Colorado,80219,West,Office Supplies,Storage,"Fellowes Strictly Business Drawer File, Letter/Legal Size",338.04,3,0.2,-33.804,2016-07-18,2016-07-24
8/1/2017,8/4/2017,First Class,LH-16750,Larry Hughes,Consumer,United States,Charlotte,North Carolina,28205,South,Technology,Phones,Nortel Networks T7316 E Nt8 B27,271.96,5,0.2,16.9975,2017-08-01,2017-08-04
7/14/2016,7/18/2016,Second Class,SW-20755,Steven Ward,Corporate,United States,New York City,New York,10009,East,Office Supplies,Storage,"Personal Folder Holder, Ebony",11.21,1,0.0,3.363,2016-07-14,2016-07-18
7/14/2016,7/18/2016,Second Class,SW-20755,Steven Ward,Corporate,United States,New York City,New York,10009,East,Office Supplies,Binders,Acco Hanging Data Binders,9.144,3,0.2,3.2004,2016-07-14,2016-07-18
7/14/2016,7/18/2016,Second Class,SW-20755,Steven Ward,Corporate,United States,New York City,New York,10009,East,Office Supplies,Fasteners,Ideal Clamps,14.07,7,0.0,6.8943,2016-07-14,2016-07-18
7/14/2016,7/18/2016,Second Class,SW-20755,Steven Ward,Corporate,United States,New York City,New York,10009,East,Office Supplies,Art,Newell 315,41.86,7,0.0,10.465,2016-07-14,2016-07-18
7/14/2016,7/18/2016,Second Class,SW-20755,Steven Ward,Corporate,United States,New York City,New York,10009,East,Office Supplies,Binders,Pressboard Data Binders by Wilson Jones,8.544,2,0.2,2.8836,2016-07-14,2016-07-18
7/14/2016,7/18/2016,Second Class,SW-20755,Steven Ward,Corporate,United States,New York City,New York,10009,East,Furniture,Bookcases,O'Sullivan 2-Door Barrister Bookcase in Odessa Pine,579.136,4,0.2,21.7176,2016-07-14,2016-07-18
9/9/2017,9/13/2017,Standard Class,SP-20620,Stefania Perrino,Corporate,United States,Philadelphia,Pennsylvania,19134,East,Furniture,Chairs,Global Low Back Tilter Chair,141.372,2,0.3,-48.4704,2017-09-09,2017-09-13
9/9/2017,9/13/2017,Standard Class,SP-20620,Stefania Perrino,Corporate,United States,Philadelphia,Pennsylvania,19134,East,Office Supplies,Binders,Wilson Jones Standard D-Ring Binders,3.036,2,0.7,-2.3276,2017-09-09,2017-09-13
9/9/2017,9/13/2017,Standard Class,SP-20620,Stefania Perrino,Corporate,United States,Philadelphia,Pennsylvania,19134,East,Office Supplies,Binders,"GBC Prepunched Paper, 19-Hole, for Binding Systems, 24-lb",4.503,1,0.7,-3.6024,2017-09-09,2017-09-13
9/9/2017,9/13/2017,Standard Class,SP-20620,Stefania Perrino,Corporate,United States,Philadelphia,Pennsylvania,19134,East,Office Supplies,Art,"Quartet Omega Colored Chalk, 12/Pack",4.672,1,0.2,1.5768,2017-09-09,2017-09-13
9/9/2017,9/13/2017,Standard Class,SP-20620,Stefania Perrino,Corporate,United States,Philadelphia,Pennsylvania,19134,East,Technology,Accessories,Microsoft Sculpt Comfort Mouse,95.88,3,0.2,28.764,2017-09-09,2017-09-13
9/9/2017,9/13/2017,Standard Class,SP-20620,Stefania Perrino,Corporate,United States,Philadelphia,Pennsylvania,19134,East,Furniture,Furnishings,"Eldon Expressions Punched Metal & Wood Desk Accessories, Pewter & Cherry",17.024,2,0.2,1.7024,2017-09-09,2017-09-13
9/9/2017,9/13/2017,Standard Class,SP-20620,Stefania Perrino,Corporate,United States,Philadelphia,Pennsylvania,19134,East,Technology,Accessories,Plantronics S12 Corded Telephone Headset System,258.696,3,0.2,64.674,2017-09-09,2017-09-13
9/9/2017,9/13/2017,Standard Class,SP-20620,Stefania Perrino,Corporate,United States,Philadelphia,Pennsylvania,19134,East,Technology,Phones,Samsung Galaxy Note 2,1931.958,7,0.4,-386.3916,2017-09-09,2017-09-13
7/12/2014,7/16/2014,Standard Class,BF-11170,Ben Ferrer,Home Office,United States,Los Angeles,California,90036,West,Office Supplies,Storage,Fellowes Super Stor/Drawer,249.75,9,0.0,44.955,2014-07-12,2014-07-16
7/12/2014,7/16/2014,Standard Class,BF-11170,Ben Ferrer,Home Office,United States,Los Angeles,California,90036,West,Technology,Phones,GE DSL Phone Line Filter,255.936,8,0.2,28.7928,2014-07-12,2014-07-16
12/4/2016,12/5/2016,First Class,BM-11140,Becky Martin,Consumer,United States,New York City,New York,10024,East,Furniture,Furnishings,"Eldon Delta Triangular Chair Mat, 52"" x 58"", Clear",113.79,3,0.0,20.4822,2016-12-04,2016-12-05
12/4/2016,12/5/2016,First Class,BM-11140,Becky Martin,Consumer,United States,New York City,New York,10024,East,Technology,Accessories,Enermax Aurora Lite Keyboard,78.15,1,0.0,34.386,2016-12-04,2016-12-05
12/4/2016,12/5/2016,First Class,BM-11140,Becky Martin,Consumer,United States,New York City,New York,10024,East,Office Supplies,Binders,Peel & Stick Add-On Corner Pockets,1.728,1,0.2,0.6048,2016-12-04,2016-12-05
12/4/2016,12/5/2016,First Class,BM-11140,Becky Martin,Consumer,United States,New York City,New York,10024,East,Office Supplies,Paper,Easy-staple paper,40.56,4,0.0,19.8744,2016-12-04,2016-12-05
12/4/2016,12/5/2016,First Class,BM-11140,Becky Martin,Consumer,United States,New York City,New York,10024,East,Office Supplies,Storage,Carina Media Storage Towers in Natural & Black,182.94,3,0.0,3.6588,2016-12-04,2016-12-05
12/4/2016,12/5/2016,First Class,BM-11140,Becky Martin,Consumer,United States,New York City,New York,10024,East,Office Supplies,Storage,Fellowes Econo/Stor Drawers,193.86,2,0.0,11.6316,2016-12-04,2016-12-05
11/6/2017,11/11/2017,Standard Class,ZC-21910,Zuschuss Carroll,Consumer,United States,Los Angeles,California,90045,West,Office Supplies,Envelopes,"#10- 4 1/8"" x 9 1/2"" Security-Tint Envelopes",15.28,2,0.0,7.4872,2017-11-06,2017-11-11
11/6/2017,11/11/2017,Standard Class,ZC-21910,Zuschuss Carroll,Consumer,United States,Los Angeles,California,90045,West,Furniture,Furnishings,Dax Clear Box Frame,8.73,1,0.0,2.9682,2017-11-06,2017-11-11
11/6/2017,11/11/2017,Standard Class,ZC-21910,Zuschuss Carroll,Consumer,United States,Los Angeles,California,90045,West,Office Supplies,Art,SANFORD Liquid Accent Tank-Style Highlighters,5.68,2,0.0,1.7608,2017-11-06,2017-11-11
10/31/2015,11/2/2015,Second Class,KT-16480,Kean Thornton,Consumer,United States,Buffalo,New York,14215,East,Office Supplies,Art,Design Ebony Sketching Pencil,2.78,2,0.0,0.7228,2015-10-31,2015-11-02
10/31/2015,11/2/2015,Second Class,KT-16480,Kean Thornton,Consumer,United States,Buffalo,New York,14215,East,Office Supplies,Envelopes,"Blue String-Tie & Button Interoffice Envelopes, 10 x 13",79.96,2,0.0,35.982,2015-10-31,2015-11-02
5/30/2016,6/1/2016,First Class,BG-11695,Brooke Gillingham,Corporate,United States,Cincinnati,Ohio,45231,East,Technology,Copiers,Canon Imageclass D680 Copier / Fax,839.988,2,0.4,69.999,2016-05-30,2016-06-01
10/28/2016,10/28/2016,Same Day,PG-18820,Patrick Gardner,Consumer,United States,Boynton Beach,Florida,33437,South,Furniture,Furnishings,24-Hour Round Wall Clock,47.952,3,0.2,13.7862,2016-10-28,2016-10-28
10/28/2016,10/28/2016,Same Day,PG-18820,Patrick Gardner,Consumer,United States,Boynton Beach,Florida,33437,South,Office Supplies,Binders,Large Capacity Hanging Post Binders,37.425,5,0.7,-29.94,2016-10-28,2016-10-28
10/28/2016,10/28/2016,Same Day,PG-18820,Patrick Gardner,Consumer,United States,Boynton Beach,Florida,33437,South,Furniture,Furnishings,Eldon Radial Chair Mat for Low to Medium Pile Carpets,63.968,2,0.2,0.0,2016-10-28,2016-10-28
10/28/2016,10/28/2016,Same Day,PG-18820,Patrick Gardner,Consumer,United States,Boynton Beach,Florida,33437,South,Furniture,Furnishings,"Howard Miller 13-1/2"" Diameter Rosebrook Wall Clock",165.048,3,0.2,41.262,2016-10-28,2016-10-28
8/11/2014,8/15/2014,Standard Class,GM-14680,Greg Matthias,Consumer,United States,Seattle,Washington,98105,West,Furniture,Furnishings,"Eldon Image Series Desk Accessories, Ebony",12.35,1,0.0,5.434,2014-08-11,2014-08-15
8/11/2014,8/15/2014,Standard Class,GM-14680,Greg Matthias,Consumer,United States,Seattle,Washington,98105,West,Office Supplies,Art,Sanford 52201 APSCO Electric Pencil Sharpener,40.97,1,0.0,10.6522,2014-08-11,2014-08-15
8/11/2014,8/15/2014,Standard Class,GM-14680,Greg Matthias,Consumer,United States,Seattle,Washington,98105,West,Office Supplies,Fasteners,"Vinyl Coated Wire Paper Clips in Organizer Box, 800/Box",22.96,2,0.0,10.7912,2014-08-11,2014-08-15
8/29/2016,9/4/2016,Standard Class,MO-17800,Meg O'Connel,Home Office,United States,New York City,New York,10024,East,Technology,Phones,Samsung Replacement EH64AVFWE Premium Headset,22.0,4,0.0,5.5,2016-08-29,2016-09-04
2/15/2016,2/22/2016,Standard Class,PG-18820,Patrick Gardner,Consumer,United States,New York City,New York,10009,East,Office Supplies,Binders,GBC DocuBind P100 Manual Binding Machine,398.352,3,0.2,124.485,2016-02-15,2016-02-22
2/15/2016,2/22/2016,Standard Class,PG-18820,Patrick Gardner,Consumer,United States,New York City,New York,10009,East,Office Supplies,Fasteners,Advantus Push Pins,8.72,4,0.0,3.5752,2016-02-15,2016-02-22
5/14/2017,5/21/2017,Standard Class,EJ-14155,Eva Jacobs,Consumer,United States,Gulfport,Mississippi,39503,South,Office Supplies,Envelopes,Fashion Color Clasp Envelopes,48.69,9,0.0,23.8581,2017-05-14,2017-05-21
12/12/2014,12/14/2014,Second Class,NP-18700,Nora Preis,Consumer,United States,Fresno,California,93727,West,Furniture,Tables,Hon Non-Folding Utility Tables,764.688,6,0.2,95.586,2014-12-12,2014-12-14
12/12/2014,12/14/2014,Second Class,NP-18700,Nora Preis,Consumer,United States,Fresno,California,93727,West,Furniture,Tables,Bretford Rectangular Conference Table Tops,3610.848,12,0.2,135.4068,2014-12-12,2014-12-14
12/12/2014,12/14/2014,Second Class,NP-18700,Nora Preis,Consumer,United States,Fresno,California,93727,West,Furniture,Bookcases,Bestar Classic Bookcase,254.9745,3,0.15,11.9988,2014-12-12,2014-12-14
12/18/2017,12/24/2017,Standard Class,DJ-13630,Doug Jacobs,Consumer,United States,New York City,New York,10009,East,Office Supplies,Art,Staples in misc. colors,38.82,6,0.0,17.469,2017-12-18,2017-12-24
12/18/2017,12/24/2017,Standard Class,DJ-13630,Doug Jacobs,Consumer,United States,New York City,New York,10009,East,Furniture,Chairs,Office Star - Contemporary Swivel Chair with Padded Adjustable Arms and Flex Back,1141.938,9,0.1,139.5702,2017-12-18,2017-12-24
12/18/2017,12/24/2017,Standard Class,DJ-13630,Doug Jacobs,Consumer,United States,New York City,New York,10009,East,Office Supplies,Appliances,Kensington 7 Outlet MasterPiece HOMEOFFICE Power Control Center,1704.56,13,0.0,511.368,2017-12-18,2017-12-24
12/18/2017,12/24/2017,Standard Class,DJ-13630,Doug Jacobs,Consumer,United States,New York City,New York,10009,East,Office Supplies,Art,Sanford Pocket Accent Highlighters,3.2,2,0.0,1.376,2017-12-18,2017-12-24
7/4/2015,7/9/2015,Standard Class,IM-15070,Irene Maddox,Consumer,United States,Milwaukee,Wisconsin,53209,Central,Technology,Phones,Mitel MiVoice 5330e IP Phone,1099.96,4,0.0,285.9896,2015-07-04,2015-07-09
3/10/2017,3/14/2017,Standard Class,MH-18115,Mick Hernandez,Home Office,United States,Chester,Pennsylvania,19013,East,Office Supplies,Art,Newell 337,5.248,2,0.2,0.5904,2017-03-10,2017-03-14
3/10/2017,3/14/2017,Standard Class,MH-18115,Mick Hernandez,Home Office,United States,Chester,Pennsylvania,19013,East,Technology,Phones,Cisco SPA525G2 IP Phone - Wireless,35.91,3,0.4,-8.379,2017-03-10,2017-03-14
3/10/2017,3/14/2017,Standard Class,MH-18115,Mick Hernandez,Home Office,United States,Chester,Pennsylvania,19013,East,Furniture,Furnishings,Westinghouse Clip-On Gooseneck Lamps,6.696,1,0.2,0.5022,2017-03-10,2017-03-14
3/10/2017,3/14/2017,Standard Class,MH-18115,Mick Hernandez,Home Office,United States,Chester,Pennsylvania,19013,East,Furniture,Furnishings,Howard Miller Distant Time Traveler Alarm Clock,43.872,2,0.2,11.5164,2017-03-10,2017-03-14
12/24/2016,12/28/2016,Second Class,RB-19795,Ross Baird,Home Office,United States,Charlotte,North Carolina,28205,South,Office Supplies,Binders,GBC Linen Binding Covers,27.882,3,0.7,-20.4468,2016-12-24,2016-12-28
12/24/2016,12/28/2016,Second Class,RB-19795,Ross Baird,Home Office,United States,Charlotte,North Carolina,28205,South,Office Supplies,Storage,Tennsco Double-Tier Lockers,540.048,3,0.2,-47.2542,2016-12-24,2016-12-28
12/24/2016,12/28/2016,Second Class,RB-19795,Ross Baird,Home Office,United States,Charlotte,North Carolina,28205,South,Technology,Accessories,Microsoft Sculpt Comfort Mouse,255.68,8,0.2,76.704,2016-12-24,2016-12-28
10/23/2017,10/27/2017,Standard Class,JR-15700,Jocasta Rupert,Consumer,United States,Jacksonville,Florida,32216,South,Technology,Phones,Wilson SignalBoost 841262 DB PRO Amplifier Kit,863.88,3,0.2,107.985,2017-10-23,2017-10-27
10/28/2016,11/4/2016,Standard Class,SM-20950,Suzanne McNair,Corporate,United States,Greenville,North Carolina,27834,South,Office Supplies,Binders,"XtraLife ClearVue Slant-D Ring Binder, White, 3""",17.616,4,0.7,-14.0928,2016-10-28,2016-11-04
7/7/2017,7/9/2017,Second Class,CS-12355,Christine Sundaresam,Consumer,United States,Long Beach,New York,11561,East,Office Supplies,Binders,Wilson Jones Active Use Binders,17.472,3,0.2,6.3336,2017-07-07,2017-07-09
10/1/2016,10/2/2016,First Class,CC-12220,Chris Cortes,Consumer,United States,La Porte,Indiana,46350,Central,Technology,Phones,Plantronics Cordless Phone Headset with In-line Volume - M214C,69.9,2,0.0,18.873,2016-10-01,2016-10-02
10/1/2016,10/2/2016,First Class,CC-12220,Chris Cortes,Consumer,United States,La Porte,Indiana,46350,Central,Furniture,Furnishings,Westinghouse Clip-On Gooseneck Lamps,41.85,5,0.0,10.881,2016-10-01,2016-10-02
9/2/2017,9/7/2017,Standard Class,PF-19225,Phillip Flathmann,Consumer,United States,San Francisco,California,94122,West,Office Supplies,Art,Pencil and Crayon Sharpener,6.57,3,0.0,1.7739,2017-09-02,2017-09-07
12/24/2014,12/29/2014,Standard Class,JC-16105,Julie Creighton,Corporate,United States,Los Angeles,California,90045,West,Office Supplies,Storage,Letter Size Cart,142.86,1,0.0,41.4294,2014-12-24,2014-12-29
12/24/2014,12/29/2014,Standard Class,JC-16105,Julie Creighton,Corporate,United States,Los Angeles,California,90045,West,Furniture,Chairs,"Global Value Mid-Back Manager's Chair, Gray",292.272,6,0.2,18.267,2014-12-24,2014-12-29
9/23/2017,9/27/2017,Standard Class,BG-11695,Brooke Gillingham,Corporate,United States,Louisville,Colorado,80027,West,Furniture,Furnishings,Aluminum Document Frame,29.328,3,0.2,3.666,2017-09-23,2017-09-27
6/4/2017,6/8/2017,Standard Class,DC-12850,Dan Campbell,Consumer,United States,Florence,Alabama,35630,South,Office Supplies,Paper,"Ampad Phone Message Book, Recycled, 400 Message Capacity, 5 ¾ x 11",12.48,2,0.0,5.616,2017-06-04,2017-06-08
4/21/2016,4/26/2016,Standard Class,SP-20545,Sibella Parks,Corporate,United States,Chicago,Illinois,60623,Central,Office Supplies,Storage,Fellowes Bankers Box Stor/Drawer Steel Plus,102.336,4,0.2,-12.792,2016-04-21,2016-04-26
4/21/2016,4/26/2016,Standard Class,SP-20545,Sibella Parks,Corporate,United States,Chicago,Illinois,60623,Central,Office Supplies,Appliances,Kensington 4 Outlet MasterPiece Compact Power Control Center,48.792,3,0.8,-126.8592,2016-04-21,2016-04-26
4/21/2016,4/26/2016,Standard Class,SP-20545,Sibella Parks,Corporate,United States,Chicago,Illinois,60623,Central,Office Supplies,Binders,"Performers Binder/Pad Holder, Black",44.848,8,0.8,-67.272,2016-04-21,2016-04-26
5/26/2016,5/26/2016,Same Day,MS-17710,Maurice Satty,Consumer,United States,Fort Worth,Texas,76106,Central,Office Supplies,Paper,Xerox 212,10.368,2,0.2,3.6288,2016-05-26,2016-05-26
5/26/2016,5/26/2016,Same Day,MS-17710,Maurice Satty,Consumer,United States,Fort Worth,Texas,76106,Central,Furniture,Chairs,Office Star Flex Back Scooter Chair with White Frame,388.43,5,0.3,-88.784,2016-05-26,2016-05-26
5/26/2016,5/26/2016,Same Day,MS-17710,Maurice Satty,Consumer,United States,Fort Worth,Texas,76106,Central,Office Supplies,Paper,Universal Premium White Copier/Laser Paper (20Lb. and 87 Bright),14.352,3,0.2,5.2026,2016-05-26,2016-05-26
5/26/2016,5/26/2016,Same Day,MS-17710,Maurice Satty,Consumer,United States,Fort Worth,Texas,76106,Central,Technology,Accessories,Logitech G13 Programmable Gameboard with LCD Display,63.992,1,0.2,-7.1991,2016-05-26,2016-05-26
5/2/2016,5/7/2016,Standard Class,BD-11770,Bryan Davis,Consumer,United States,Houston,Texas,77070,Central,Office Supplies,Art,Panasonic KP-380BK Classic Electric Pencil Sharpener,86.352,3,0.2,5.397,2016-05-02,2016-05-07
9/8/2014,9/11/2014,First Class,KC-16255,Karen Carlisle,Corporate,United States,Macon,Georgia,31204,South,Technology,Accessories,Memorex Froggy Flash Drive 4 GB,32.97,3,0.0,12.8583,2014-09-08,2014-09-11
9/8/2014,9/11/2014,First Class,KC-16255,Karen Carlisle,Corporate,United States,Macon,Georgia,31204,South,Technology,Accessories,"Maxell 74 Minute CD-R Spindle, 50/Pack",83.88,4,0.0,30.1968,2014-09-08,2014-09-11
9/5/2016,9/6/2016,First Class,TR-21325,Toby Ritter,Consumer,United States,Cedar Rapids,Iowa,52402,Central,Technology,Phones,Geemarc AmpliPOWER60,278.4,3,0.0,80.736,2016-09-05,2016-09-06
4/9/2017,4/11/2017,First Class,SA-20830,Sue Ann Reed,Consumer,United States,Jacksonville,Florida,32216,South,Office Supplies,Labels,Avery 48,15.12,3,0.2,4.914,2017-04-09,2017-04-11
4/9/2017,4/11/2017,First Class,SA-20830,Sue Ann Reed,Consumer,United States,Jacksonville,Florida,32216,South,Office Supplies,Binders,Avery Arch Ring Binders,17.43,1,0.7,-13.363,2017-04-09,2017-04-11
4/9/2017,4/11/2017,First Class,SA-20830,Sue Ann Reed,Consumer,United States,Jacksonville,Florida,32216,South,Office Supplies,Paper,Xerox 1915,251.64,3,0.2,88.074,2017-04-09,2017-04-11
12/6/2015,12/12/2015,Standard Class,KW-16435,Katrina Willman,Consumer,United States,Austin,Texas,78745,Central,Office Supplies,Binders,Avery Reinforcements for Hole-Punch Pages,2.772,7,0.8,-4.851,2015-12-06,2015-12-12
6/26/2016,7/3/2016,Standard Class,GM-14500,Gene McClure,Consumer,United States,Providence,Rhode Island,2908,East,Office Supplies,Storage,Woodgrain Magazine Files by Perma,14.9,5,0.0,1.043,2016-06-26,2016-07-03
7/4/2015,7/8/2015,Standard Class,AD-10180,Alan Dominguez,Home Office,United States,New York City,New York,10035,East,Office Supplies,Art,Colorific Watercolor Pencils,15.48,3,0.0,4.4892,2015-07-04,2015-07-08
11/22/2016,11/26/2016,Standard Class,TB-21355,Todd Boyes,Corporate,United States,New York City,New York,10009,East,Furniture,Furnishings,Luxo Economy Swing Arm Lamp,39.88,2,0.0,11.1664,2016-11-22,2016-11-26
11/22/2016,11/26/2016,Standard Class,TB-21355,Todd Boyes,Corporate,United States,New York City,New York,10009,East,Office Supplies,Binders,"Acco Pressboard Covers with Storage Hooks, 9 1/2"" x 11"", Executive Red",12.192,4,0.2,4.1148,2016-11-22,2016-11-26
11/22/2016,11/26/2016,Standard Class,TB-21355,Todd Boyes,Corporate,United States,New York City,New York,10009,East,Office Supplies,Art,BIC Liqua Brite Liner,20.82,3,0.0,7.4952,2016-11-22,2016-11-26
11/10/2016,11/12/2016,First Class,CC-12430,Chuck Clark,Home Office,United States,San Francisco,California,94122,West,Office Supplies,Binders,"ACCOHIDE 3-Ring Binder, Blue, 1""",13.216,4,0.2,4.4604,2016-11-10,2016-11-12
11/10/2016,11/12/2016,First Class,CC-12430,Chuck Clark,Home Office,United States,San Francisco,California,94122,West,Office Supplies,Paper,Xerox 1996,32.4,5,0.0,15.552,2016-11-10,2016-11-12
8/27/2015,9/1/2015,Standard Class,PF-19165,Philip Fox,Consumer,United States,San Diego,California,92105,West,Office Supplies,Supplies,Fiskars Softgrip Scissors,32.94,3,0.0,9.2232,2015-08-27,2015-09-01
8/27/2015,9/1/2015,Standard Class,PF-19165,Philip Fox,Consumer,United States,San Diego,California,92105,West,Office Supplies,Paper,Xerox 1973,114.2,5,0.0,52.532,2015-08-27,2015-09-01
8/27/2015,9/1/2015,Standard Class,PF-19165,Philip Fox,Consumer,United States,San Diego,California,92105,West,Office Supplies,Labels,Avery 511,3.08,1,0.0,1.4784,2015-08-27,2015-09-01
5/25/2015,5/29/2015,Standard Class,JH-16180,Justin Hirsh,Consumer,United States,Pueblo,Colorado,81001,West,Office Supplies,Appliances,Kensington 4 Outlet MasterPiece Compact Power Control Center,845.728,13,0.2,84.5728,2015-05-25,2015-05-29
12/30/2017,1/3/2018,Standard Class,EB-13975,Erica Bern,Corporate,United States,Fairfield,California,94533,West,Office Supplies,Binders,"Cardinal Slant-D Ring Binder, Heavy Gauge Vinyl",13.904,2,0.2,4.5188,2017-12-30,2018-01-03
12/30/2017,1/3/2018,Standard Class,EB-13975,Erica Bern,Corporate,United States,Fairfield,California,94533,West,Office Supplies,Binders,GBC Binding covers,20.72,2,0.2,6.475,2017-12-30,2018-01-03
12/8/2016,12/12/2016,Second Class,QJ-19255,Quincy Jones,Corporate,United States,Saint Paul,Minnesota,55106,Central,Technology,Phones,Motorola HK250 Universal Bluetooth Headset,114.95,5,0.0,2.299,2016-12-08,2016-12-12
10/4/2015,10/7/2015,First Class,AA-10315,Alex Avila,Consumer,United States,San Francisco,California,94109,West,Office Supplies,Storage,"Tenex Personal Project File with Scoop Front Design, Black",26.96,2,0.0,7.0096,2015-10-04,2015-10-07
12/23/2016,12/25/2016,Second Class,LC-17140,Logan Currie,Consumer,United States,Springfield,Virginia,22153,South,Furniture,Furnishings,"Electrix Architect's Clamp-On Swing Arm Lamp, Black",572.76,6,0.0,166.1004,2016-12-23,2016-12-25
12/23/2016,12/25/2016,Second Class,LC-17140,Logan Currie,Consumer,United States,Springfield,Virginia,22153,South,Furniture,Furnishings,"Electrix Architect's Clamp-On Swing Arm Lamp, Black",286.38,3,0.0,83.0502,2016-12-23,2016-12-25
9/19/2015,9/24/2015,Second Class,TC-21535,Tracy Collins,Home Office,United States,Arlington,Virginia,22204,South,Furniture,Bookcases,Sauder Cornerstone Collection Library,61.96,2,0.0,4.3372,2015-09-19,2015-09-24
7/3/2017,7/7/2017,Standard Class,CS-12460,Chuck Sachs,Consumer,United States,Columbus,Georgia,31907,South,Furniture,Furnishings,"Westinghouse Floor Lamp with Metal Mesh Shade, Black",23.99,1,0.0,5.5177,2017-07-03,2017-07-07
7/3/2017,7/7/2017,Standard Class,CS-12460,Chuck Sachs,Consumer,United States,Columbus,Georgia,31907,South,Technology,Phones,Pyle PMP37LED,287.97,3,0.0,77.7519,2017-07-03,2017-07-07
7/14/2016,7/16/2016,Second Class,BM-11785,Bryan Mills,Consumer,United States,Houston,Texas,77036,Central,Technology,Phones,Blue Parrot B250XT Professional Grade Wireless Bluetooth Headset with,419.944,7,0.2,52.493,2016-07-14,2016-07-16
6/20/2016,6/21/2016,First Class,RC-19825,Roy Collins,Consumer,United States,Pasadena,California,91104,West,Office Supplies,Paper,Xerox 1898,46.76,7,0.0,22.4448,2016-06-20,2016-06-21
6/20/2016,6/21/2016,First Class,RC-19825,Roy Collins,Consumer,United States,Pasadena,California,91104,West,Office Supplies,Binders,GBC Plastic Binding Combs,17.712,3,0.2,6.4206,2016-06-20,2016-06-21
6/20/2016,6/21/2016,First Class,RC-19825,Roy Collins,Consumer,United States,Pasadena,California,91104,West,Office Supplies,Appliances,Belkin 6 Outlet Metallic Surge Strip,21.78,2,0.0,5.6628,2016-06-20,2016-06-21
6/20/2016,6/21/2016,First Class,RC-19825,Roy Collins,Consumer,United States,Pasadena,California,91104,West,Office Supplies,Storage,Fellowes Bankers Box Recycled Super Stor/Drawer,161.94,3,0.0,9.7164,2016-06-20,2016-06-21
6/20/2016,6/21/2016,First Class,RC-19825,Roy Collins,Consumer,United States,Pasadena,California,91104,West,Furniture,Chairs,Hon Valutask Swivel Chairs,161.568,2,0.2,-8.0784,2016-06-20,2016-06-21
12/9/2016,12/13/2016,Standard Class,FM-14380,Fred McMath,Consumer,United States,Lawrence,Massachusetts,1841,East,Office Supplies,Labels,Avery 517,3.69,1,0.0,1.7343,2016-12-09,2016-12-13
12/9/2016,12/13/2016,Standard Class,FM-14380,Fred McMath,Consumer,United States,Lawrence,Massachusetts,1841,East,Office Supplies,Labels,Avery 477,122.12,4,0.0,56.1752,2016-12-09,2016-12-13
9/24/2016,10/1/2016,Standard Class,PK-19075,Pete Kriz,Consumer,United States,Columbus,Ohio,43229,East,Furniture,Chairs,Office Star - Contemporary Task Swivel Chair,155.372,2,0.3,-13.3176,2016-09-24,2016-10-01
12/18/2016,12/23/2016,Standard Class,HG-14965,Henry Goldwyn,Corporate,United States,Los Angeles,California,90032,West,Office Supplies,Paper,"Eureka Recycled Copy Paper 8 1/2"" x 11"", Ream",38.88,6,0.0,18.6624,2016-12-18,2016-12-23
12/18/2016,12/23/2016,Standard Class,HG-14965,Henry Goldwyn,Corporate,United States,Los Angeles,California,90032,West,Furniture,Furnishings,"Seth Thomas 12"" Clock w/ Goldtone Case",183.84,8,0.0,62.5056,2016-12-18,2016-12-23
12/18/2016,12/23/2016,Standard Class,HG-14965,Henry Goldwyn,Corporate,United States,Los Angeles,California,90032,West,Office Supplies,Supplies,Premier Electric Letter Opener,579.3,5,0.0,28.965,2016-12-18,2016-12-23
12/10/2017,12/14/2017,Standard Class,HA-14920,Helen Andreada,Consumer,United States,Philadelphia,Pennsylvania,19120,East,Technology,Accessories,Memorex Froggy Flash Drive 8 GB,14.2,1,0.2,3.3725,2017-12-10,2017-12-14
7/1/2014,7/5/2014,Standard Class,LW-16825,Laurel Workman,Corporate,United States,Deltona,Florida,32725,South,Technology,Phones,Wilson SignalBoost 841262 DB PRO Amplifier Kit,575.92,2,0.2,71.99,2014-07-01,2014-07-05
7/1/2014,7/5/2014,Standard Class,LW-16825,Laurel Workman,Corporate,United States,Deltona,Florida,32725,South,Office Supplies,Binders,Avery Durable Binders,5.184,6,0.7,-3.6288,2014-07-01,2014-07-05
2/3/2017,2/8/2017,Standard Class,MC-17575,Matt Collins,Consumer,United States,Cincinnati,Ohio,45231,East,Office Supplies,Binders,Fellowes Black Plastic Comb Bindings,5.229,3,0.7,-4.1832,2017-02-03,2017-02-08
2/3/2017,2/8/2017,Standard Class,MC-17575,Matt Collins,Consumer,United States,Cincinnati,Ohio,45231,East,Office Supplies,Storage,"Hot File 7-Pocket, Floor Stand",285.552,2,0.2,35.694,2017-02-03,2017-02-08
3/3/2017,3/8/2017,Standard Class,LP-17095,Liz Preis,Consumer,United States,Murray,Kentucky,42071,South,Office Supplies,Appliances,Acco 6 Outlet Guardian Premium Surge Suppressor,72.8,5,0.0,19.656,2017-03-03,2017-03-08
10/9/2017,10/10/2017,First Class,EB-14170,Evan Bailliet,Consumer,United States,Wilmington,North Carolina,28403,South,Office Supplies,Paper,Avoid Verbal Orders Carbonless Minifold Book,10.816,4,0.2,3.5152,2017-10-09,2017-10-10
9/28/2014,10/3/2014,Standard Class,GZ-14545,George Zrebassa,Corporate,United States,Lawrence,Massachusetts,1841,East,Office Supplies,Storage,"Decoflex Hanging Personal Folder File, Blue",46.26,3,0.0,12.4902,2014-09-28,2014-10-03
5/27/2014,5/30/2014,First Class,LE-16810,Laurel Elliston,Consumer,United States,Chicago,Illinois,60653,Central,Office Supplies,Binders,Fellowes Presentation Covers for Comb Binding Machines,17.46,6,0.8,-30.555,2014-05-27,2014-05-30
6/14/2015,6/18/2015,Standard Class,AD-10180,Alan Dominguez,Home Office,United States,Philadelphia,Pennsylvania,19120,East,Furniture,Furnishings,"Eldon Expressions Punched Metal & Wood Desk Accessories, Pewter & Cherry",51.072,6,0.2,5.1072,2015-06-14,2015-06-18
3/30/2016,4/1/2016,First Class,CP-12085,Cathy Prescott,Corporate,United States,Norwich,Connecticut,6360,East,Office Supplies,Paper,Xerox 188,11.34,1,0.0,5.5566,2016-03-30,2016-04-01
10/15/2017,10/18/2017,Second Class,FG-14260,Frank Gastineau,Home Office,United States,San Francisco,California,94110,West,Office Supplies,Art,Panasonic KP-310 Heavy-Duty Electric Pencil Sharpener,87.92,4,0.0,26.376,2017-10-15,2017-10-18
5/23/2016,5/27/2016,Standard Class,LD-17005,Lisa DeCherney,Consumer,United States,San Francisco,California,94109,West,Furniture,Furnishings,"Eldon Image Series Desk Accessories, Ebony",37.05,3,0.0,16.302,2016-05-23,2016-05-27
6/2/2017,6/6/2017,Standard Class,AB-10255,Alejandro Ballentine,Home Office,United States,Lorain,Ohio,44052,East,Technology,Phones,Cush Cases Heavy Duty Rugged Cover Case for Samsung Galaxy S5 - Purple,2.97,1,0.4,-0.6435,2017-06-02,2017-06-06
6/2/2017,6/6/2017,Standard Class,AB-10255,Alejandro Ballentine,Home Office,United States,Lorain,Ohio,44052,East,Office Supplies,Storage,Advantus Rolling Storage Box,27.44,2,0.2,2.401,2017-06-02,2017-06-06
2/16/2014,2/21/2014,Standard Class,MN-17935,Michael Nguyen,Consumer,United States,Dallas,Texas,75220,Central,Office Supplies,Binders,Wilson Jones Easy Flow II Sheet Lifters,1.08,3,0.8,-1.728,2014-02-16,2014-02-21
2/16/2014,2/21/2014,Standard Class,MN-17935,Michael Nguyen,Consumer,United States,Dallas,Texas,75220,Central,Office Supplies,Appliances,"Holmes Cool Mist Humidifier for the Whole House with 8-Gallon Output per Day, Extended Life Filter",7.96,2,0.8,-13.93,2014-02-16,2014-02-21
5/6/2014,5/10/2014,Standard Class,HP-14815,Harold Pawlan,Home Office,United States,Los Angeles,California,90049,West,Office Supplies,Binders,Wilson Jones Legal Size Ring Binders,140.736,8,0.2,52.776,2014-05-06,2014-05-10
5/16/2016,5/23/2016,Standard Class,JR-15670,Jim Radford,Consumer,United States,Middletown,Connecticut,6457,East,Office Supplies,Storage,"SAFCO Commercial Wire Shelving, Black",552.56,4,0.0,0.0,2016-05-16,2016-05-23
4/2/2017,4/7/2017,Standard Class,JF-15190,Jamie Frazer,Consumer,United States,Los Angeles,California,90008,West,Furniture,Furnishings,Westinghouse Clip-On Gooseneck Lamps,25.11,3,0.0,6.5286,2017-04-02,2017-04-07
3/31/2017,4/2/2017,Second Class,CM-12115,Chad McGuire,Consumer,United States,New York City,New York,10011,East,Furniture,Furnishings,Tensor Computer Mounted Lamp,29.78,2,0.0,8.0406,2017-03-31,2017-04-02
3/31/2017,4/2/2017,Second Class,CM-12115,Chad McGuire,Consumer,United States,New York City,New York,10011,East,Technology,Phones,Polycom SoundPoint IP 450 VoIP phone,677.58,3,0.0,176.1708,2017-03-31,2017-04-02
3/31/2017,4/2/2017,Second Class,CM-12115,Chad McGuire,Consumer,United States,New York City,New York,10011,East,Office Supplies,Paper,"Rediform S.O.S. 1-Up Phone Message Bk, 4-1/4x3-1/16 Bk, 1 Form/Pg, 40 Messages/Bk, 3/Pk",75.04,8,0.0,36.0192,2017-03-31,2017-04-02
1/2/2017,1/4/2017,First Class,AS-10045,Aaron Smayling,Corporate,United States,Jacksonville,North Carolina,28540,South,Technology,Machines,Cisco CP-7937G Unified IP Conference Station Phone,695.7,2,0.5,-27.828,2017-01-02,2017-01-04
1/2/2017,1/4/2017,First Class,AS-10045,Aaron Smayling,Corporate,United States,Jacksonville,North Carolina,28540,South,Office Supplies,Binders,"Avery 3 1/2"" Diskette Storage Pages, 10/Pack",15.66,5,0.7,-12.528,2017-01-02,2017-01-04
1/2/2017,1/4/2017,First Class,AS-10045,Aaron Smayling,Corporate,United States,Jacksonville,North Carolina,28540,South,Office Supplies,Binders,Avery Recycled Flexi-View Covers for Binding Systems,28.854,6,0.7,-21.1596,2017-01-02,2017-01-04
5/28/2015,6/1/2015,Standard Class,KB-16315,Karl Braun,Consumer,United States,Freeport,New York,11520,East,Office Supplies,Art,Boston 16701 Slimline Battery Pencil Sharpener,47.82,3,0.0,14.346,2015-05-28,2015-06-01
5/28/2015,6/1/2015,Standard Class,KB-16315,Karl Braun,Consumer,United States,Freeport,New York,11520,East,Office Supplies,Labels,Avery 494,13.05,5,0.0,6.003,2015-05-28,2015-06-01
3/17/2014,3/24/2014,Standard Class,BN-11515,Bradley Nguyen,Consumer,United States,Lakeville,Minnesota,55044,Central,Office Supplies,Appliances,Bionaire Personal Warm Mist Humidifier/Vaporizer,93.78,2,0.0,36.5742,2014-03-17,2014-03-24
3/17/2014,3/24/2014,Standard Class,BN-11515,Bradley Nguyen,Consumer,United States,Lakeville,Minnesota,55044,Central,Office Supplies,Paper,"Memo Book, 100 Message Capacity, 5 3/8 x 11",47.18,7,0.0,23.59,2014-03-17,2014-03-24
3/17/2014,3/24/2014,Standard Class,BN-11515,Bradley Nguyen,Consumer,United States,Lakeville,Minnesota,55044,Central,Office Supplies,Art,Newell 35,19.68,6,0.0,5.7072,2014-03-17,2014-03-24
3/17/2014,3/24/2014,Standard Class,BN-11515,Bradley Nguyen,Consumer,United States,Lakeville,Minnesota,55044,Central,Office Supplies,Binders,Wilson Jones 14 Line Acrylic Coated Pressboard Data Binders,53.4,10,0.0,25.098,2014-03-17,2014-03-24
3/17/2014,3/24/2014,Standard Class,BN-11515,Bradley Nguyen,Consumer,United States,Lakeville,Minnesota,55044,Central,Office Supplies,Binders,Avery Non-Stick Heavy Duty View Round Locking Ring Binders,35.88,6,0.0,17.2224,2014-03-17,2014-03-24
10/3/2014,10/8/2014,Second Class,BP-11290,Beth Paige,Consumer,United States,Evanston,Illinois,60201,Central,Furniture,Chairs,"Global High-Back Leather Tilter, Burgundy",258.279,3,0.3,-70.1043,2014-10-03,2014-10-08
3/28/2016,3/31/2016,First Class,AS-10045,Aaron Smayling,Corporate,United States,Arlington,Virginia,22204,South,Office Supplies,Storage,Hanging Personal Folder File,31.4,2,0.0,7.85,2016-03-28,2016-03-31
5/4/2017,5/9/2017,Standard Class,LW-16990,Lindsay Williams,Corporate,United States,San Francisco,California,94109,West,Technology,Phones,Motorola L804,183.96,5,0.2,20.6955,2017-05-04,2017-05-09
5/4/2017,5/9/2017,Standard Class,LW-16990,Lindsay Williams,Corporate,United States,San Francisco,California,94109,West,Office Supplies,Paper,Things To Do Today Pad,17.61,3,0.0,8.4528,2017-05-04,2017-05-09
5/4/2017,5/9/2017,Standard Class,LW-16990,Lindsay Williams,Corporate,United States,San Francisco,California,94109,West,Furniture,Tables,Bretford Rectangular Conference Table Tops,300.904,1,0.2,11.2839,2017-05-04,2017-05-09
7/5/2014,7/5/2014,Same Day,DC-12850,Dan Campbell,Consumer,United States,Houston,Texas,77036,Central,Office Supplies,Storage,"Gould Plastics 18-Pocket Panel Bin, 34w x 5-1/4d x 20-1/2h",220.776,3,0.2,-44.1552,2014-07-05,2014-07-05
7/5/2014,7/5/2014,Same Day,DC-12850,Dan Campbell,Consumer,United States,Houston,Texas,77036,Central,Office Supplies,Storage,Fellowes Bankers Box Stor/Drawer Steel Plus,281.424,11,0.2,-35.178,2014-07-05,2014-07-05
5/5/2016,5/7/2016,First Class,ND-18370,Natalie DeCherney,Consumer,United States,Louisville,Kentucky,40214,South,Office Supplies,Paper,Xerox 1909,79.14,3,0.0,36.4044,2016-05-05,2016-05-07
4/26/2017,4/27/2017,First Class,LB-16735,Larry Blacks,Consumer,United States,Fort Worth,Texas,76106,Central,Furniture,Furnishings,"DAX Value U-Channel Document Frames, Easel Back",1.988,1,0.6,-1.4413,2017-04-26,2017-04-27
9/26/2014,10/1/2014,Second Class,KT-16465,Kean Takahito,Consumer,United States,Los Angeles,California,90049,West,Furniture,Chairs,"Leather Task Chair, Black",145.568,2,0.2,0.0,2014-09-26,2014-10-01
10/19/2017,10/25/2017,Standard Class,HM-14860,Harry Marie,Corporate,United States,Philadelphia,Pennsylvania,19120,East,Office Supplies,Art,Boston 16801 Nautilus Battery Pencil Sharpener,123.256,7,0.2,9.2442,2017-10-19,2017-10-25
10/19/2017,10/25/2017,Standard Class,HM-14860,Harry Marie,Corporate,United States,Philadelphia,Pennsylvania,19120,East,Office Supplies,Paper,"It's Hot Message Books with Stickers, 2 3/4"" x 5""",23.68,4,0.2,7.4,2017-10-19,2017-10-25
10/19/2017,10/25/2017,Standard Class,HM-14860,Harry Marie,Corporate,United States,Philadelphia,Pennsylvania,19120,East,Technology,Phones,Digium D40 VoIP phone,309.576,4,0.4,-56.7556,2017-10-19,2017-10-25
11/10/2017,11/11/2017,First Class,AB-10600,Ann Blume,Corporate,United States,Tucson,Arizona,85705,West,Office Supplies,Binders,Cardinal EasyOpen D-Ring Binders,38.388,14,0.7,-25.592,2017-11-10,2017-11-11
11/10/2017,11/11/2017,First Class,AB-10600,Ann Blume,Corporate,United States,Tucson,Arizona,85705,West,Technology,Machines,DYMO CardScan Personal V9 Business Card Scanner,95.994,2,0.7,-63.996,2017-11-10,2017-11-11
11/10/2017,11/11/2017,First Class,AB-10600,Ann Blume,Corporate,United States,Tucson,Arizona,85705,West,Technology,Accessories,Case Logic 2.4GHz Wireless Keyboard,239.952,6,0.2,-35.9928,2017-11-10,2017-11-11
11/10/2017,11/11/2017,First Class,AB-10600,Ann Blume,Corporate,United States,Tucson,Arizona,85705,West,Technology,Phones,Adtran 1202752G1,201.584,2,0.2,15.1188,2017-11-10,2017-11-11
11/10/2017,11/11/2017,First Class,AB-10600,Ann Blume,Corporate,United States,Tucson,Arizona,85705,West,Furniture,Chairs,Hon 2090 Pillow Soft Series Mid Back Swivel/Tilt Chairs,899.136,4,0.2,-146.1096,2017-11-10,2017-11-11
7/8/2017,7/11/2017,First Class,SZ-20035,Sam Zeldin,Home Office,United States,Pico Rivera,California,90660,West,Furniture,Furnishings,"Deflect-o SuperTray Unbreakable Stackable Tray, Letter, Black",145.9,5,0.0,62.737,2017-07-08,2017-07-11
12/24/2015,12/28/2015,Standard Class,JR-15670,Jim Radford,Consumer,United States,Colorado Springs,Colorado,80906,West,Furniture,Bookcases,"Atlantic Metals Mobile 4-Shelf Bookcases, Custom Colors",590.058,7,0.7,-786.744,2015-12-24,2015-12-28
12/24/2015,12/28/2015,Standard Class,JR-15670,Jim Radford,Consumer,United States,Colorado Springs,Colorado,80906,West,Office Supplies,Art,"Dixon My First Ticonderoga Pencil, #2",14.04,3,0.2,1.5795,2015-12-24,2015-12-28
3/7/2017,3/12/2017,Standard Class,MG-17890,Michael Granlund,Home Office,United States,Clinton,Maryland,20735,East,Technology,Accessories,Logitech Desktop MK120 Mouse and keyboard Combo,49.08,3,0.0,4.908,2017-03-07,2017-03-12
4/1/2014,4/6/2014,Second Class,KM-16720,Kunst Miller,Consumer,United States,Vallejo,California,94591,West,Office Supplies,Labels,Avery 490,29.6,2,0.0,14.8,2014-04-01,2014-04-06
4/1/2014,4/6/2014,Second Class,KM-16720,Kunst Miller,Consumer,United States,Vallejo,California,94591,West,Office Supplies,Binders,"Pressboard Data Binder, Crimson, 12"" X 8 1/2""",17.088,4,0.2,5.5536,2014-04-01,2014-04-06
9/14/2015,9/19/2015,Standard Class,CA-12265,Christina Anderson,Consumer,United States,Provo,Utah,84604,West,Furniture,Tables,"Lesro Round Back Collection Coffee Table, End Table",912.75,5,0.0,118.6575,2015-09-14,2015-09-19
8/4/2014,8/9/2014,Second Class,VD-21670,Valerie Dominguez,Consumer,United States,Pleasant Grove,Utah,84062,West,Office Supplies,Appliances,Hoover WindTunnel Plus Canister Vacuum,1089.75,3,0.0,305.13,2014-08-04,2014-08-09
8/4/2014,8/9/2014,Second Class,VD-21670,Valerie Dominguez,Consumer,United States,Pleasant Grove,Utah,84062,West,Office Supplies,Paper,Xerox 1934,447.84,8,0.0,219.4416,2014-08-04,2014-08-09
8/4/2014,8/9/2014,Second Class,VD-21670,Valerie Dominguez,Consumer,United States,Pleasant Grove,Utah,84062,West,Office Supplies,Art,Newell 329,16.4,5,0.0,4.264,2014-08-04,2014-08-09
8/4/2014,8/9/2014,Second Class,VD-21670,Valerie Dominguez,Consumer,United States,Pleasant Grove,Utah,84062,West,Technology,Phones,Panasonic KX T7731-B Digital phone,399.96,5,0.2,34.9965,2014-08-04,2014-08-09
8/4/2014,8/9/2014,Second Class,VD-21670,Valerie Dominguez,Consumer,United States,Pleasant Grove,Utah,84062,West,Office Supplies,Storage,"Safco Wire Cube Shelving System, For Use as 4 or 5 14"" Cubes, Black",158.9,5,0.0,7.945,2014-08-04,2014-08-09
8/4/2014,8/9/2014,Second Class,VD-21670,Valerie Dominguez,Consumer,United States,Pleasant Grove,Utah,84062,West,Office Supplies,Binders,Ibico Standard Transparent Covers,13.184,1,0.2,4.7792,2014-08-04,2014-08-09
9/3/2016,9/9/2016,Standard Class,JK-16120,Julie Kriz,Home Office,United States,Aurora,Illinois,60505,Central,Furniture,Furnishings,"Tenex ""The Solids"" Textured Chair Mats",83.952,3,0.6,-90.2484,2016-09-03,2016-09-09
2/5/2016,2/5/2016,Same Day,PP-18955,Paul Prost,Home Office,United States,Smyrna,Georgia,30080,South,Office Supplies,Storage,"Carina 42""Hx23 3/4""W Media Storage Unit",80.98,1,0.0,1.6196,2016-02-05,2016-02-05
2/5/2016,2/5/2016,Same Day,PP-18955,Paul Prost,Home Office,United States,Smyrna,Georgia,30080,South,Office Supplies,Paper,White Computer Printout Paper by Universal,348.84,9,0.0,170.9316,2016-02-05,2016-02-05
2/5/2016,2/5/2016,Same Day,PP-18955,Paul Prost,Home Office,United States,Smyrna,Georgia,30080,South,Office Supplies,Fasteners,Revere Boxed Rubber Bands by Revere,9.45,5,0.0,0.189,2016-02-05,2016-02-05
2/5/2016,2/5/2016,Same Day,PP-18955,Paul Prost,Home Office,United States,Smyrna,Georgia,30080,South,Furniture,Furnishings,"Eldon 200 Class Desk Accessories, Black",18.84,3,0.0,7.1592,2016-02-05,2016-02-05
2/5/2016,2/5/2016,Same Day,PP-18955,Paul Prost,Home Office,United States,Smyrna,Georgia,30080,South,Furniture,Bookcases,"Bush Andora Bookcase, Maple/Graphite Gray Finish",239.98,2,0.0,52.7956,2016-02-05,2016-02-05
2/5/2016,2/5/2016,Same Day,PP-18955,Paul Prost,Home Office,United States,Smyrna,Georgia,30080,South,Office Supplies,Envelopes,Ames Color-File Green Diamond Border X-ray Mailers,167.96,2,0.0,78.9412,2016-02-05,2016-02-05
2/5/2016,2/5/2016,Same Day,PP-18955,Paul Prost,Home Office,United States,Smyrna,Georgia,30080,South,Technology,Phones,Plantronics Cordless Phone Headset with In-line Volume - M214C,104.85,3,0.0,28.3095,2016-02-05,2016-02-05
2/5/2016,2/5/2016,Same Day,PP-18955,Paul Prost,Home Office,United States,Smyrna,Georgia,30080,South,Technology,Phones,Aastra 57i VoIP phone,484.83,3,0.0,126.0558,2016-02-05,2016-02-05
2/5/2016,2/5/2016,Same Day,PP-18955,Paul Prost,Home Office,United States,Smyrna,Georgia,30080,South,Office Supplies,Paper,"White Dual Perf Computer Printout Paper, 2700 Sheets, 1 Part, Heavyweight, 20 lbs., 14 7/8 x 11",122.97,3,0.0,60.2553,2016-02-05,2016-02-05
2/5/2016,2/5/2016,Same Day,PP-18955,Paul Prost,Home Office,United States,Smyrna,Georgia,30080,South,Office Supplies,Storage,"Belkin 19"" Vented Equipment Shelf, Black",154.44,3,0.0,1.5444,2016-02-05,2016-02-05
2/5/2016,2/5/2016,Same Day,PP-18955,Paul Prost,Home Office,United States,Smyrna,Georgia,30080,South,Office Supplies,Paper,Xerox 1943,342.37,7,0.0,160.9139,2016-02-05,2016-02-05
7/3/2017,7/4/2017,First Class,YS-21880,Yana Sorensen,Corporate,United States,Burlington,North Carolina,27217,South,Office Supplies,Art,4009 Highlighters by Sanford,9.552,3,0.2,1.5522,2017-07-03,2017-07-04
10/9/2017,10/14/2017,Standard Class,CK-12760,Cyma Kinney,Corporate,United States,Aurora,Illinois,60505,Central,Furniture,Tables,"Bevis Oval Conference Table, Walnut",652.45,5,0.5,-430.617,2017-10-09,2017-10-14
10/9/2017,10/14/2017,Standard Class,CK-12760,Cyma Kinney,Corporate,United States,Aurora,Illinois,60505,Central,Furniture,Tables,Hon 61000 Series Interactive Training Tables,66.645,3,0.5,-42.6528,2017-10-09,2017-10-14
11/24/2016,11/26/2016,First Class,NC-18340,Nat Carroll,Consumer,United States,New York City,New York,10035,East,Office Supplies,Binders,"Acco PRESSTEX Data Binder with Storage Hooks, Light Blue, 9 1/2"" X 11""",17.216,4,0.2,6.0256,2016-11-24,2016-11-26
11/24/2016,11/26/2016,First Class,NC-18340,Nat Carroll,Consumer,United States,New York City,New York,10035,East,Office Supplies,Paper,Xerox 196,11.56,2,0.0,5.6644,2016-11-24,2016-11-26
11/24/2016,11/26/2016,First Class,NC-18340,Nat Carroll,Consumer,United States,New York City,New York,10035,East,Technology,Accessories,SanDisk Ultra 32 GB MicroSDHC Class 10 Memory Card,88.4,4,0.0,11.492,2016-11-24,2016-11-26
11/24/2016,11/26/2016,First Class,NC-18340,Nat Carroll,Consumer,United States,New York City,New York,10035,East,Office Supplies,Paper,Xerox 217,6.48,1,0.0,3.1104,2016-11-24,2016-11-26
11/1/2016,11/5/2016,Standard Class,KM-16375,Katherine Murray,Home Office,United States,Salem,Virginia,24153,South,Technology,Phones,"LF Elite 3D Dazzle Designer Hard Case Cover, Lf Stylus Pen and Wiper For Apple Iphone 5c Mini Lite",21.8,2,0.0,6.104,2016-11-01,2016-11-05
11/1/2016,11/5/2016,Standard Class,KM-16375,Katherine Murray,Home Office,United States,Salem,Virginia,24153,South,Office Supplies,Envelopes,Airmail Envelopes,251.79,3,0.0,118.3413,2016-11-01,2016-11-05
4/19/2016,4/25/2016,Standard Class,GM-14455,Gary Mitchum,Home Office,United States,Columbus,Ohio,43229,East,Furniture,Tables,"Bush Andora Conference Table, Maple/Graphite Gray Finish",205.176,2,0.4,-58.1332,2016-04-19,2016-04-25
4/19/2016,4/25/2016,Standard Class,GM-14455,Gary Mitchum,Home Office,United States,Columbus,Ohio,43229,East,Office Supplies,Paper,Xerox 189,419.4,5,0.2,146.79,2016-04-19,2016-04-25
4/6/2014,4/8/2014,First Class,SD-20485,Shirley Daniels,Home Office,United States,Philadelphia,Pennsylvania,19143,East,Office Supplies,Supplies,Martin-Yale Premier Letter Opener,10.304,1,0.2,-2.1896,2014-04-06,2014-04-08
4/6/2014,4/8/2014,First Class,SD-20485,Shirley Daniels,Home Office,United States,Philadelphia,Pennsylvania,19143,East,Furniture,Tables,KI Adjustable-Height Table,154.764,3,0.4,-36.1116,2014-04-06,2014-04-08
4/6/2014,4/8/2014,First Class,SD-20485,Shirley Daniels,Home Office,United States,Philadelphia,Pennsylvania,19143,East,Technology,Accessories,Imation Secure+ Hardware Encrypted USB 2.0 Flash Drive; 16GB,116.784,2,0.2,21.897,2014-04-06,2014-04-08
9/2/2016,9/6/2016,Standard Class,KD-16270,Karen Daniels,Consumer,United States,New York City,New York,10024,East,Office Supplies,Art,Panasonic KP-150 Electric Pencil Sharpener,75.48,2,0.0,19.6248,2016-09-02,2016-09-06
9/2/2016,9/6/2016,Standard Class,KD-16270,Karen Daniels,Consumer,United States,New York City,New York,10024,East,Furniture,Furnishings,Telescoping Adjustable Floor Lamp,39.98,2,0.0,9.995,2016-09-02,2016-09-06
9/25/2016,9/30/2016,Standard Class,AB-10105,Adrian Barton,Consumer,United States,Phoenix,Arizona,85023,West,Furniture,Tables,Bevis Boat-Shaped Conference Table,393.165,3,0.5,-204.4458,2016-09-25,2016-09-30
11/4/2017,11/11/2017,Standard Class,SZ-20035,Sam Zeldin,Home Office,United States,Grand Prairie,Texas,75051,Central,Office Supplies,Labels,Alphabetical Labels for Top Tab Filing,23.68,2,0.2,8.88,2017-11-04,2017-11-11
7/9/2016,7/13/2016,Standard Class,JD-15895,Jonathan Doherty,Corporate,United States,New York City,New York,10035,East,Furniture,Chairs,Hon GuestStacker Chair,408.006,2,0.1,72.5344,2016-07-09,2016-07-13
7/9/2016,7/13/2016,Standard Class,JD-15895,Jonathan Doherty,Corporate,United States,New York City,New York,10035,East,Furniture,Furnishings,"Deflect-o EconoMat Studded, No Bevel Mat for Low Pile Carpeting",165.28,4,0.0,14.8752,2016-07-09,2016-07-13
6/30/2014,7/5/2014,Standard Class,HA-14905,Helen Abelman,Consumer,United States,New York City,New York,10024,East,Office Supplies,Binders,GBC Recycled Regency Composition Covers,334.768,7,0.2,108.7996,2014-06-30,2014-07-05
1/28/2017,1/31/2017,Second Class,BT-11305,Beth Thompson,Home Office,United States,Costa Mesa,California,92627,West,Technology,Accessories,Logitech G13 Programmable Gameboard with LCD Display,239.97,3,0.0,26.3967,2017-01-28,2017-01-31
1/28/2017,1/31/2017,Second Class,BT-11305,Beth Thompson,Home Office,United States,Costa Mesa,California,92627,West,Furniture,Furnishings,"DAX Executive Solid Wood Document Frame, Desktop or Hang, Mahogany, 5 x 7",37.74,3,0.0,12.8316,2017-01-28,2017-01-31
9/21/2015,9/24/2015,First Class,SV-20815,Stuart Van,Corporate,United States,Houston,Texas,77041,Central,Technology,Phones,ShoreTel ShorePhone IP 230 VoIP phone,946.344,7,0.2,118.293,2015-09-21,2015-09-24
9/21/2015,9/24/2015,First Class,SV-20815,Stuart Van,Corporate,United States,Houston,Texas,77041,Central,Technology,Accessories,Hypercom P1300 Pinpad,151.2,3,0.2,32.13,2015-09-21,2015-09-24
9/21/2015,9/24/2015,First Class,SV-20815,Stuart Van,Corporate,United States,Houston,Texas,77041,Central,Furniture,Furnishings,Longer-Life Soft White Bulbs,4.928,4,0.6,-1.4784,2015-09-21,2015-09-24
9/26/2015,9/30/2015,Standard Class,RW-19540,Rick Wilson,Corporate,United States,Mesa,Arizona,85204,West,Office Supplies,Paper,Petty Cash Envelope,86.272,4,0.2,31.2736,2015-09-26,2015-09-30
9/26/2015,9/30/2015,Standard Class,RW-19540,Rick Wilson,Corporate,United States,Mesa,Arizona,85204,West,Office Supplies,Binders,GBC VeloBinder Electric Binding Machine,72.588,2,0.7,-48.392,2015-09-26,2015-09-30
9/26/2015,9/30/2015,Standard Class,RW-19540,Rick Wilson,Corporate,United States,Mesa,Arizona,85204,West,Office Supplies,Appliances,3M Replacement Filter for Office Air Cleaner for 20' x 33' Room,60.672,2,0.2,14.4096,2015-09-26,2015-09-30
9/26/2015,9/30/2015,Standard Class,RW-19540,Rick Wilson,Corporate,United States,Mesa,Arizona,85204,West,Office Supplies,Binders,Lock-Up Easel 'Spel-Binder',77.031,9,0.7,-59.0571,2015-09-26,2015-09-30
9/26/2015,9/30/2015,Standard Class,RW-19540,Rick Wilson,Corporate,United States,Mesa,Arizona,85204,West,Office Supplies,Storage,2300 Heavy-Duty Transfer File Systems by Perma,119.904,6,0.2,-1.4988,2015-09-26,2015-09-30
9/26/2015,9/30/2015,Standard Class,RW-19540,Rick Wilson,Corporate,United States,Mesa,Arizona,85204,West,Technology,Phones,Samsung Rugby III,263.96,5,0.2,23.0965,2015-09-26,2015-09-30
9/26/2015,9/30/2015,Standard Class,RW-19540,Rick Wilson,Corporate,United States,Mesa,Arizona,85204,West,Office Supplies,Storage,SAFCO Boltless Steel Shelving,363.648,4,0.2,-86.3664,2015-09-26,2015-09-30
10/31/2015,11/4/2015,Second Class,DK-12835,Damala Kotsonis,Corporate,United States,Salinas,California,93905,West,Office Supplies,Binders,Prestige Round Ring Binders,9.728,2,0.2,3.2832,2015-10-31,2015-11-04
10/31/2015,11/4/2015,Second Class,DK-12835,Damala Kotsonis,Corporate,United States,Salinas,California,93905,West,Office Supplies,Envelopes,"Redi-Strip #10 Envelopes, 4 1/8 x 9 1/2",14.75,5,0.0,7.08,2015-10-31,2015-11-04
10/31/2015,11/4/2015,Second Class,DK-12835,Damala Kotsonis,Corporate,United States,Salinas,California,93905,West,Office Supplies,Binders,"Acco Four Pocket Poly Ring Binder with Label Holder, Smoke, 1""",29.8,5,0.2,9.3125,2015-10-31,2015-11-04
10/31/2015,11/4/2015,Second Class,DK-12835,Damala Kotsonis,Corporate,United States,Salinas,California,93905,West,Office Supplies,Labels,"Avery 4027 File Folder Labels for Dot Matrix Printers, 5000 Labels per Box, White",427.42,14,0.0,196.6132,2015-10-31,2015-11-04
11/26/2017,11/30/2017,Standard Class,LT-17110,Liz Thompson,Consumer,United States,Columbus,Ohio,43229,East,Technology,Phones,Motorola L804,220.752,8,0.4,-40.4712,2017-11-26,2017-11-30
12/19/2014,12/21/2014,Second Class,IM-15070,Irene Maddox,Consumer,United States,Florence,Alabama,35630,South,Office Supplies,Binders,Canvas Sectional Post Binders,152.76,6,0.0,74.8524,2014-12-19,2014-12-21
12/19/2014,12/21/2014,Second Class,IM-15070,Irene Maddox,Consumer,United States,Florence,Alabama,35630,South,Office Supplies,Supplies,Acme Stainless Steel Office Snips,7.27,1,0.0,1.9629,2014-12-19,2014-12-21
12/19/2014,12/21/2014,Second Class,IM-15070,Irene Maddox,Consumer,United States,Florence,Alabama,35630,South,Furniture,Chairs,High-Back Leather Manager's Chair,1819.86,14,0.0,163.7874,2014-12-19,2014-12-21
12/26/2016,12/30/2016,Standard Class,FP-14320,Frank Preis,Consumer,United States,Seattle,Washington,98105,West,Office Supplies,Paper,Strathmore Photo Mount Cards,33.9,5,0.0,15.594,2016-12-26,2016-12-30
6/20/2017,6/27/2017,Standard Class,ST-20530,Shui Tom,Consumer,United States,Parma,Ohio,44134,East,Office Supplies,Paper,Xerox 203,31.104,6,0.2,10.8864,2017-06-20,2017-06-27
6/20/2017,6/27/2017,Standard Class,ST-20530,Shui Tom,Consumer,United States,Parma,Ohio,44134,East,Office Supplies,Art,Newell 35,5.248,2,0.2,0.5904,2017-06-20,2017-06-27
10/15/2015,10/15/2015,Same Day,JE-15745,Joel Eaton,Consumer,United States,Amarillo,Texas,79109,Central,Technology,Accessories,Plantronics Audio 995 Wireless Stereo Headset,263.88,3,0.2,42.8805,2015-10-15,2015-10-15
10/15/2015,10/15/2015,Same Day,JE-15745,Joel Eaton,Consumer,United States,Amarillo,Texas,79109,Central,Furniture,Chairs,HON 5400 Series Task Chairs for Big and Tall,2453.43,5,0.3,-350.49,2015-10-15,2015-10-15
4/12/2017,4/15/2017,Second Class,BD-11320,Bill Donatelli,Consumer,United States,Providence,Rhode Island,2908,East,Office Supplies,Binders,Storex Dura Pro Binders,29.7,5,0.0,13.365,2017-04-12,2017-04-15
4/12/2017,4/15/2017,Second Class,BD-11320,Bill Donatelli,Consumer,United States,Providence,Rhode Island,2908,East,Office Supplies,Paper,Xerox 1948,39.96,4,0.0,17.982,2017-04-12,2017-04-15
12/19/2017,12/24/2017,Second Class,MM-17920,Michael Moore,Consumer,United States,San Francisco,California,94110,West,Office Supplies,Binders,Deluxe Heavy-Duty Vinyl Round Ring Binder,36.672,2,0.2,11.46,2017-12-19,2017-12-24
8/5/2017,8/8/2017,First Class,PW-19030,Pauline Webber,Corporate,United States,Richmond,Kentucky,40475,South,Office Supplies,Paper,"Adams Phone Message Book, 200 Message Capacity, 8 1/16 x 11",13.76,2,0.0,6.3296,2017-08-05,2017-08-08
10/1/2015,10/6/2015,Standard Class,SC-20440,Shaun Chance,Corporate,United States,Aurora,Colorado,80013,West,Office Supplies,Storage,"Trav-L-File Heavy-Duty Shuttle II, Black",139.424,4,0.2,17.428,2015-10-01,2015-10-06
5/23/2016,5/28/2016,Standard Class,KL-16645,Ken Lonsdale,Consumer,United States,Chicago,Illinois,60623,Central,Technology,Phones,Mitel MiVoice 5330e IP Phone,1979.928,9,0.2,148.4946,2016-05-23,2016-05-28
6/13/2017,6/16/2017,First Class,SD-20485,Shirley Daniels,Home Office,United States,Chicago,Illinois,60653,Central,Office Supplies,Storage,"Belkin 19"" Vented Equipment Shelf, Black",164.736,4,0.2,-39.1248,2017-06-13,2017-06-16
6/13/2017,6/16/2017,First Class,SD-20485,Shirley Daniels,Home Office,United States,Chicago,Illinois,60653,Central,Furniture,Chairs,Global Super Steno Chair,470.302,7,0.3,-87.3418,2017-06-13,2017-06-16
6/13/2017,6/16/2017,First Class,SD-20485,Shirley Daniels,Home Office,United States,Chicago,Illinois,60653,Central,Technology,Phones,OtterBox Defender Series Case - Samsung Galaxy S4,47.984,2,0.2,5.998,2017-06-13,2017-06-16
4/23/2014,4/24/2014,First Class,TS-21160,Theresa Swint,Corporate,United States,Philadelphia,Pennsylvania,19134,East,Office Supplies,Binders,Wilson Jones Suede Grain Vinyl Binders,2.502,3,0.7,-1.7514,2014-04-23,2014-04-24
5/1/2015,5/7/2015,Standard Class,JB-15400,Jennifer Braxton,Corporate,United States,Los Angeles,California,90008,West,Technology,Phones,OtterBox Defender Series Case - iPhone 5c,88.752,3,0.2,11.094,2015-05-01,2015-05-07
7/19/2015,7/20/2015,First Class,TS-21085,Thais Sissman,Consumer,United States,Phoenix,Arizona,85023,West,Office Supplies,Binders,Wilson Jones DublLock D-Ring Binders,2.025,1,0.7,-1.35,2015-07-19,2015-07-20
11/26/2016,11/29/2016,First Class,MC-17425,Mark Cousins,Corporate,United States,Mobile,Alabama,36608,South,Office Supplies,Paper,Easy-staple paper,70.98,7,0.0,34.7802,2016-11-26,2016-11-29
11/26/2016,11/29/2016,First Class,MC-17425,Mark Cousins,Corporate,United States,Mobile,Alabama,36608,South,Office Supplies,Binders,Surelock Post Binders,91.68,3,0.0,45.84,2016-11-26,2016-11-29
11/26/2016,11/29/2016,First Class,MC-17425,Mark Cousins,Corporate,United States,Mobile,Alabama,36608,South,Office Supplies,Binders,Wilson Jones DublLock D-Ring Binders,33.75,5,0.0,16.875,2016-11-26,2016-11-29
11/26/2016,11/29/2016,First Class,MC-17425,Mark Cousins,Corporate,United States,Mobile,Alabama,36608,South,Technology,Machines,Hewlett-Packard Deskjet 3050a All-in-One Color Inkjet Printer,3040.0,8,0.0,1459.2,2016-11-26,2016-11-29
6/12/2017,6/19/2017,Standard Class,ME-17320,Maria Etezadi,Home Office,United States,Columbus,Georgia,31907,South,Office Supplies,Binders,Ibico Plastic Spiral Binding Combs,91.2,3,0.0,41.952,2017-06-12,2017-06-19
6/12/2017,6/19/2017,Standard Class,ME-17320,Maria Etezadi,Home Office,United States,Columbus,Georgia,31907,South,Furniture,Tables,"Iceberg OfficeWorks 42"" Round Tables",452.94,3,0.0,67.941,2017-06-12,2017-06-19
8/17/2015,8/21/2015,Standard Class,SC-20440,Shaun Chance,Corporate,United States,New Bedford,Massachusetts,2740,East,Office Supplies,Binders,Wilson Jones Snap Scratch Pad Binder Tool for Ring Binders,52.2,9,0.0,23.49,2015-08-17,2015-08-21
9/25/2016,10/1/2016,Standard Class,NH-18610,Nicole Hansen,Corporate,United States,Irving,Texas,75061,Central,Office Supplies,Labels,Avery 499,15.936,4,0.2,5.1792,2016-09-25,2016-10-01
5/4/2014,5/4/2014,Same Day,AA-10480,Andrew Allen,Consumer,United States,Middletown,Connecticut,6457,East,Furniture,Furnishings,DAX Wood Document Frame,27.46,2,0.0,9.8856,2014-05-04,2014-05-04
12/1/2015,12/8/2015,Standard Class,LC-17140,Logan Currie,Consumer,United States,Seattle,Washington,98103,West,Office Supplies,Binders,Wilson Jones Heavy-Duty Casebound Ring Binders with Metal Hinges,55.424,2,0.2,19.3984,2015-12-01,2015-12-08
3/11/2016,3/15/2016,Standard Class,MB-18085,Mick Brown,Consumer,United States,Vineland,New Jersey,8360,East,Furniture,Tables,Chromcraft Round Conference Tables,244.006,2,0.3,-31.3722,2016-03-11,2016-03-15
8/26/2016,8/28/2016,First Class,LC-16930,Linda Cazamias,Corporate,United States,Pasadena,Texas,77506,Central,Technology,Accessories,Logitech G700s Rechargeable Gaming Mouse,159.984,2,0.2,43.9956,2016-08-26,2016-08-28
8/26/2016,8/28/2016,First Class,LC-16930,Linda Cazamias,Corporate,United States,Pasadena,Texas,77506,Central,Furniture,Chairs,Hon Deluxe Fabric Upholstered Stacking Chairs,1024.716,6,0.3,-29.2776,2016-08-26,2016-08-28
12/16/2016,12/19/2016,First Class,KD-16495,Keith Dawkins,Corporate,United States,New York City,New York,10009,East,Office Supplies,Fasteners,Stockwell Gold Paper Clips,3.68,2,0.0,1.8032,2016-12-16,2016-12-19
8/8/2014,8/14/2014,Standard Class,MB-17305,Maria Bertelson,Consumer,United States,Glendale,Arizona,85301,West,Furniture,Furnishings,"Eldon Delta Triangular Chair Mat, 52"" x 58"", Clear",121.376,4,0.2,-3.0344,2014-08-08,2014-08-14
8/8/2014,8/14/2014,Standard Class,MB-17305,Maria Bertelson,Consumer,United States,Glendale,Arizona,85301,West,Technology,Accessories,SanDisk Ultra 64 GB MicroSDHC Class 10 Memory Card,95.976,3,0.2,-10.7973,2014-08-08,2014-08-14
5/16/2015,5/16/2015,Same Day,TH-21550,Tracy Hopkins,Home Office,United States,Jacksonville,Florida,32216,South,Technology,Accessories,Razer Kraken PRO Over Ear PC and Music Headset,255.968,4,0.2,31.996,2015-05-16,2015-05-16
12/9/2017,12/13/2017,Standard Class,DK-12835,Damala Kotsonis,Corporate,United States,Detroit,Michigan,48234,Central,Furniture,Chairs,Global Executive Mid-Back Manager's Chair,872.94,3,0.0,226.9644,2017-12-09,2017-12-13
12/9/2017,12/13/2017,Standard Class,DK-12835,Damala Kotsonis,Corporate,United States,Detroit,Michigan,48234,Central,Office Supplies,Binders,Wilson Jones Century Plastic Molded Ring Binders,41.54,2,0.0,19.5238,2017-12-09,2017-12-13
12/9/2017,12/13/2017,Standard Class,DK-12835,Damala Kotsonis,Corporate,United States,Detroit,Michigan,48234,Central,Office Supplies,Paper,Xerox 1946,12.96,2,0.0,6.2208,2017-12-09,2017-12-13
9/24/2015,9/27/2015,Second Class,ON-18715,Odella Nelson,Corporate,United States,Philadelphia,Pennsylvania,19120,East,Office Supplies,Art,Newell 320,6.848,2,0.2,0.5992,2015-09-24,2015-09-27
7/11/2017,7/15/2017,Standard Class,KN-16390,Katherine Nockton,Corporate,United States,Los Angeles,California,90004,West,Office Supplies,Labels,Avery 482,8.67,3,0.0,4.0749,2017-07-11,2017-07-15
12/1/2015,12/2/2015,Same Day,NM-18520,Neoma Murray,Consumer,United States,Houston,Texas,77036,Central,Furniture,Furnishings,"Eldon Image Series Desk Accessories, Burgundy",6.688,4,0.6,-4.0128,2015-12-01,2015-12-02
11/19/2016,11/25/2016,Standard Class,NP-18685,Nora Pelletier,Home Office,United States,Niagara Falls,New York,14304,East,Office Supplies,Art,Newell 340,17.28,6,0.0,5.0112,2016-11-19,2016-11-25
11/19/2016,11/25/2016,Standard Class,NP-18685,Nora Pelletier,Home Office,United States,Niagara Falls,New York,14304,East,Office Supplies,Binders,GBC Plastic Binding Combs,17.712,3,0.2,6.4206,2016-11-19,2016-11-25
3/19/2017,3/24/2017,Standard Class,CG-12040,Catherine Glotzbach,Home Office,United States,New York City,New York,10024,East,Office Supplies,Labels,Avery 506,28.91,7,0.0,13.2986,2017-03-19,2017-03-24
11/13/2016,11/17/2016,Standard Class,CS-12505,Cindy Stewart,Consumer,United States,Thomasville,North Carolina,27360,South,Office Supplies,Supplies,Acme Forged Steel Scissors with Black Enamel Handles,52.136,7,0.2,5.8653,2016-11-13,2016-11-17
11/19/2017,11/20/2017,First Class,KD-16345,Katherine Ducich,Consumer,United States,Westminster,California,92683,West,Technology,Phones,Square Credit Card Reader,31.968,4,0.2,2.3976,2017-11-19,2017-11-20
12/2/2016,12/8/2016,Standard Class,MK-18160,Mike Kennedy,Consumer,United States,San Francisco,California,94122,West,Office Supplies,Paper,Xerox 192,25.92,4,0.0,12.4416,2016-12-02,2016-12-08
12/2/2016,12/8/2016,Standard Class,MK-18160,Mike Kennedy,Consumer,United States,San Francisco,California,94122,West,Office Supplies,Paper,HP Office Recycled Paper (20Lb. and 87 Bright),40.46,7,0.0,19.8254,2016-12-02,2016-12-08
12/2/2016,12/8/2016,Standard Class,MK-18160,Mike Kennedy,Consumer,United States,San Francisco,California,94122,West,Office Supplies,Storage,X-Rack File for Hanging Folders,33.87,3,0.0,8.8062,2016-12-02,2016-12-08
8/25/2017,8/28/2017,Second Class,DW-13540,Don Weiss,Consumer,United States,Jackson,Tennessee,38301,South,Office Supplies,Art,Zebra Zazzle Fluorescent Highlighters,9.728,2,0.2,1.7024,2017-08-25,2017-08-28
8/25/2017,8/28/2017,Second Class,DW-13540,Don Weiss,Consumer,United States,Jackson,Tennessee,38301,South,Office Supplies,Paper,Xerox 199,3.424,1,0.2,1.07,2017-08-25,2017-08-28
10/14/2016,10/18/2016,Standard Class,CP-12340,Christine Phan,Corporate,United States,Seattle,Washington,98115,West,Technology,Accessories,WD My Passport Ultra 500GB Portable External Hard Drive,177.0,3,0.0,30.09,2016-10-14,2016-10-18
11/27/2014,12/3/2014,Standard Class,MS-17770,Maxwell Schwartz,Consumer,United States,New York City,New York,10035,East,Office Supplies,Fasteners,Staples,3.76,2,0.0,1.316,2014-11-27,2014-12-03
11/3/2015,11/7/2015,Standard Class,CM-12655,Corinna Mitchell,Home Office,United States,Los Angeles,California,90008,West,Technology,Phones,Cisco IP Phone 7961G-GE VoIP phone,1212.848,7,0.2,106.1242,2015-11-03,2015-11-07
11/3/2015,11/7/2015,Standard Class,CM-12655,Corinna Mitchell,Home Office,United States,Los Angeles,California,90008,West,Technology,Accessories,Logitech Trackman Marble Mouse,89.97,3,0.0,37.7874,2015-11-03,2015-11-07
11/3/2015,11/7/2015,Standard Class,CM-12655,Corinna Mitchell,Home Office,United States,Los Angeles,California,90008,West,Furniture,Furnishings,Coloredge Poster Frame,42.6,3,0.0,16.614,2015-11-03,2015-11-07
11/29/2014,12/6/2014,Standard Class,Co-12640,Corey-Lock,Consumer,United States,Philadelphia,Pennsylvania,19143,East,Office Supplies,Labels,Avery 488,5.04,2,0.2,1.764,2014-11-29,2014-12-06
4/30/2017,5/5/2017,Second Class,DL-13495,Dionis Lloyd,Corporate,United States,New York City,New York,10024,East,Office Supplies,Envelopes,"#10-4 1/8"" x 9 1/2"" Premium Diagonal Seam Envelopes",62.96,4,0.0,28.332,2017-04-30,2017-05-05
11/24/2017,11/28/2017,Standard Class,TS-21370,Todd Sumrall,Corporate,United States,New York City,New York,10035,East,Office Supplies,Paper,"Adams Telephone Message Book W/Dividers/Space For Phone Numbers, 5 1/4""X8 1/2"", 300/Messages",5.88,1,0.0,2.8812,2017-11-24,2017-11-28
11/24/2017,11/28/2017,Standard Class,TS-21370,Todd Sumrall,Corporate,United States,New York City,New York,10035,East,Furniture,Chairs,Global Ergonomic Managers Chair,977.292,6,0.1,173.7408,2017-11-24,2017-11-28
10/30/2017,11/3/2017,Standard Class,JW-15220,Jane Waco,Corporate,United States,Vancouver,Washington,98661,West,Furniture,Furnishings,Magna Visual Magnetic Picture Hangers,9.64,2,0.0,3.6632,2017-10-30,2017-11-03
12/17/2014,12/19/2014,Second Class,RF-19840,Roy Französisch,Consumer,United States,Columbus,Georgia,31907,South,Office Supplies,Art,Stanley Contemporary Battery Pencil Sharpeners,40.05,3,0.0,11.214,2014-12-17,2014-12-19
9/4/2017,9/8/2017,Standard Class,JD-15790,John Dryer,Consumer,United States,Coppell,Texas,75019,Central,Office Supplies,Art,"Crayola Anti Dust Chalk, 12/Pack",10.192,7,0.2,3.185,2017-09-04,2017-09-08
9/4/2017,9/8/2017,Standard Class,JD-15790,John Dryer,Consumer,United States,Coppell,Texas,75019,Central,Office Supplies,Storage,Acco Perma 3000 Stacking Storage Drawers,16.784,1,0.2,-0.2098,2017-09-04,2017-09-08
9/4/2017,9/8/2017,Standard Class,JD-15790,John Dryer,Consumer,United States,Coppell,Texas,75019,Central,Office Supplies,Art,"Sanford Colorific Eraseable Coloring Pencils, 12 Count",13.12,5,0.2,3.772,2017-09-04,2017-09-08
10/17/2016,10/20/2016,First Class,NK-18490,Neil Knudson,Home Office,United States,San Francisco,California,94122,West,Office Supplies,Binders,"Avery Durable Plastic 1"" Binders",18.16,5,0.2,6.583,2016-10-17,2016-10-20
11/12/2017,11/18/2017,Standard Class,NG-18430,Nathan Gelder,Consumer,United States,Austin,Texas,78745,Central,Office Supplies,Paper,"Wirebound Message Books, 5-1/2 x 4 Forms, 2 or 4 Forms per Page",16.056,3,0.2,5.8203,2017-11-12,2017-11-18
11/12/2017,11/18/2017,Standard Class,NG-18430,Nathan Gelder,Consumer,United States,Austin,Texas,78745,Central,Office Supplies,Paper,Xerox 197,223.056,9,0.2,69.705,2017-11-12,2017-11-18
11/12/2017,11/18/2017,Standard Class,NG-18430,Nathan Gelder,Consumer,United States,Austin,Texas,78745,Central,Office Supplies,Storage,Tennsco Double-Tier Lockers,540.048,3,0.2,-47.2542,2017-11-12,2017-11-18
11/24/2016,12/1/2016,Standard Class,AT-10435,Alyssa Tate,Home Office,United States,Los Angeles,California,90045,West,Technology,Phones,"iKross Bluetooth Portable Keyboard + Cell Phone Stand Holder + Brush for Apple iPhone 5S 5C 5, 4S 4",33.52,2,0.2,3.352,2016-11-24,2016-12-01
11/24/2016,12/1/2016,Standard Class,AT-10435,Alyssa Tate,Home Office,United States,Los Angeles,California,90045,West,Furniture,Furnishings,"DAX Value U-Channel Document Frames, Easel Back",9.94,2,0.0,3.0814,2016-11-24,2016-12-01
8/1/2015,8/7/2015,Standard Class,PC-19000,Pauline Chand,Home Office,United States,Los Angeles,California,90004,West,Office Supplies,Art,Prang Dustless Chalk Sticks,6.72,4,0.0,3.36,2015-08-01,2015-08-07
8/1/2015,8/7/2015,Standard Class,PC-19000,Pauline Chand,Home Office,United States,Los Angeles,California,90004,West,Furniture,Tables,Hon 2111 Invitation Series Corner Table,1004.976,6,0.2,-175.8708,2015-08-01,2015-08-07
12/24/2017,12/29/2017,Standard Class,AR-10540,Andy Reiter,Consumer,United States,New York City,New York,10024,East,Office Supplies,Binders,"Acco Four Pocket Poly Ring Binder with Label Holder, Smoke, 1""",17.88,3,0.2,5.5875,2017-12-24,2017-12-29
9/17/2016,9/23/2016,Standard Class,CS-12505,Cindy Stewart,Consumer,United States,Columbus,Georgia,31907,South,Technology,Machines,Lexmark X 9575 Professional All-in-One Color Printer,396.0,4,0.0,190.08,2016-09-17,2016-09-23
12/10/2017,12/10/2017,Same Day,LS-16975,Lindsay Shagiari,Home Office,United States,Omaha,Nebraska,68104,Central,Office Supplies,Binders,Ibico Covers for Plastic or Wire Binding Elements,34.5,3,0.0,15.525,2017-12-10,2017-12-10
9/12/2017,9/15/2017,First Class,JM-15535,Jessica Myrick,Consumer,United States,Los Angeles,California,90036,West,Furniture,Furnishings,"Eldon Image Series Desk Accessories, Burgundy",8.36,2,0.0,3.0096,2017-09-12,2017-09-15
6/24/2017,7/1/2017,Standard Class,NH-18610,Nicole Hansen,Corporate,United States,Pomona,California,91767,West,Office Supplies,Art,Boston Heavy-Duty Trimline Electric Pencil Sharpeners,385.6,8,0.0,111.824,2017-06-24,2017-07-01
6/24/2017,7/1/2017,Standard Class,NH-18610,Nicole Hansen,Corporate,United States,Pomona,California,91767,West,Office Supplies,Art,4009 Highlighters by Sanford,35.82,9,0.0,11.8206,2017-06-24,2017-07-01
8/18/2017,8/22/2017,Standard Class,RA-19915,Russell Applegate,Consumer,United States,Dallas,Texas,75220,Central,Office Supplies,Storage,Safco Steel Mobile File Cart,200.064,3,0.2,12.504,2017-08-18,2017-08-22
8/18/2017,8/22/2017,Standard Class,RA-19915,Russell Applegate,Consumer,United States,Dallas,Texas,75220,Central,Office Supplies,Binders,Acco D-Ring Binder w/DublLock,21.38,5,0.8,-33.139,2017-08-18,2017-08-22
8/18/2017,8/22/2017,Standard Class,RA-19915,Russell Applegate,Consumer,United States,Dallas,Texas,75220,Central,Office Supplies,Binders,Ibico Plastic and Wire Spiral Binding Combs,6.744,4,0.8,-11.4648,2017-08-18,2017-08-22
12/11/2017,12/17/2017,Standard Class,AI-10855,Arianne Irving,Consumer,United States,Philadelphia,Pennsylvania,19120,East,Furniture,Chairs,"Leather Task Chair, Black",63.686,1,0.3,-9.098,2017-12-11,2017-12-17
12/10/2017,12/14/2017,Second Class,MC-17845,Michael Chen,Consumer,United States,North Las Vegas,Nevada,89031,West,Furniture,Tables,Bretford Just In Time Height-Adjustable Multi-Task Work Tables,1669.6,4,0.0,116.872,2017-12-10,2017-12-14
2/3/2014,2/6/2014,Second Class,TB-21400,Tom Boeckenhauer,Consumer,United States,Seattle,Washington,98105,West,Office Supplies,Binders,Ibico Laser Imprintable Binding System Covers,83.84,2,0.2,27.248,2014-02-03,2014-02-06
2/3/2014,2/6/2014,Second Class,TB-21400,Tom Boeckenhauer,Consumer,United States,Seattle,Washington,98105,West,Office Supplies,Binders,Avery Durable Poly Binders,13.272,3,0.2,4.3134,2014-02-03,2014-02-06
2/11/2017,2/14/2017,Second Class,VW-21775,Victoria Wilson,Corporate,United States,San Francisco,California,94110,West,Office Supplies,Binders,"Acco Pressboard Covers with Storage Hooks, 14 7/8"" x 11"", Dark Blue",21.336,7,0.2,7.7343,2017-02-11,2017-02-14
4/16/2017,4/21/2017,Standard Class,PL-18925,Paul Lucas,Home Office,United States,Chicago,Illinois,60610,Central,Office Supplies,Art,Newell 325,16.52,5,0.2,2.065,2017-04-16,2017-04-21
12/6/2015,12/11/2015,Standard Class,GH-14425,Gary Hwang,Consumer,United States,Tucson,Arizona,85705,West,Furniture,Furnishings,"Howard Miller 13"" Diameter Pewter Finish Round Wall Clock",206.112,6,0.2,48.9516,2015-12-06,2015-12-11
12/6/2015,12/11/2015,Standard Class,GH-14425,Gary Hwang,Consumer,United States,Tucson,Arizona,85705,West,Office Supplies,Paper,Xerox 1970,19.92,5,0.2,6.723,2015-12-06,2015-12-11
12/6/2015,12/11/2015,Standard Class,GH-14425,Gary Hwang,Consumer,United States,Tucson,Arizona,85705,West,Office Supplies,Paper,Xerox 1960,198.272,8,0.2,61.96,2015-12-06,2015-12-11
12/6/2015,12/11/2015,Standard Class,GH-14425,Gary Hwang,Consumer,United States,Tucson,Arizona,85705,West,Office Supplies,Storage,"Belkin 19"" Vented Equipment Shelf, Black",247.104,6,0.2,-58.6872,2015-12-06,2015-12-11
12/6/2015,12/11/2015,Standard Class,GH-14425,Gary Hwang,Consumer,United States,Tucson,Arizona,85705,West,Office Supplies,Art,"BOSTON Model 1800 Electric Pencil Sharpeners, Putty/Woodgrain",86.304,6,0.2,9.7092,2015-12-06,2015-12-11
7/22/2016,7/27/2016,Standard Class,CJ-12010,Caroline Jumper,Consumer,United States,Allentown,Pennsylvania,18103,East,Office Supplies,Art,12 Colored Short Pencils,4.16,2,0.2,0.364,2016-07-22,2016-07-27
7/22/2016,7/27/2016,Standard Class,CJ-12010,Caroline Jumper,Consumer,United States,Allentown,Pennsylvania,18103,East,Furniture,Furnishings,"Master Caster Door Stop, Large Neon Orange",11.648,2,0.2,3.3488,2016-07-22,2016-07-27
11/7/2015,11/10/2015,Second Class,MC-18130,Mike Caudle,Corporate,United States,Newark,Delaware,19711,East,Office Supplies,Fasteners,Rubber Band Ball,26.18,7,0.0,0.5236,2015-11-07,2015-11-10
11/7/2015,11/10/2015,Second Class,MC-18130,Mike Caudle,Corporate,United States,Newark,Delaware,19711,East,Office Supplies,Paper,Loose Memo Sheets,7.3,2,0.0,3.431,2015-11-07,2015-11-10
3/26/2015,3/31/2015,Standard Class,BV-11245,Benjamin Venier,Corporate,United States,Miami,Florida,33142,South,Office Supplies,Paper,Xerox 1988,74.352,3,0.2,23.235,2015-03-26,2015-03-31
8/31/2017,9/5/2017,Standard Class,JF-15490,Jeremy Farry,Consumer,United States,Tempe,Arizona,85281,West,Office Supplies,Storage,"Neat Ideas Personal Hanging Folder Files, Black",10.744,1,0.2,0.8058,2017-08-31,2017-09-05
8/31/2017,9/5/2017,Standard Class,JF-15490,Jeremy Farry,Consumer,United States,Tempe,Arizona,85281,West,Office Supplies,Fasteners,OIC Bulk Pack Metal Binder Clips,8.376,3,0.2,2.7222,2017-08-31,2017-09-05
12/4/2016,12/8/2016,Standard Class,EB-13840,Ellis Ballard,Corporate,United States,New York City,New York,10035,East,Office Supplies,Storage,Belkin OmniView SE Rackmount Kit,212.88,6,0.0,0.0,2016-12-04,2016-12-08
2/10/2017,2/14/2017,Standard Class,MP-18175,Mike Pelletier,Home Office,United States,Laguna Niguel,California,92677,West,Furniture,Bookcases,"Bush Andora Bookcase, Maple/Graphite Gray Finish",203.983,2,0.15,16.7986,2017-02-10,2017-02-14
10/29/2016,11/2/2016,Standard Class,JM-15655,Jim Mitchum,Corporate,United States,Bridgeton,New Jersey,8302,East,Office Supplies,Storage,"Rogers Jumbo File, Granite",40.74,3,0.0,0.4074,2016-10-29,2016-11-02
10/29/2016,11/2/2016,Standard Class,JM-15655,Jim Mitchum,Corporate,United States,Bridgeton,New Jersey,8302,East,Office Supplies,Appliances,"Commercial WindTunnel Clean Air Upright Vacuum, Replacement Belts, Filtration Bags",11.67,3,0.0,3.0342,2016-10-29,2016-11-02
9/15/2017,9/17/2017,Second Class,CL-11890,Carl Ludwig,Consumer,United States,Everett,Massachusetts,2149,East,Technology,Phones,GE DSL Phone Line Filter,39.99,1,0.0,11.5971,2017-09-15,2017-09-17
9/15/2017,9/17/2017,Second Class,CL-11890,Carl Ludwig,Consumer,United States,Everett,Massachusetts,2149,East,Office Supplies,Art,"Avery Hi-Liter EverBold Pen Style Fluorescent Highlighters, 4/Pack",16.28,2,0.0,6.512,2017-09-15,2017-09-17
9/15/2017,9/17/2017,Second Class,CL-11890,Carl Ludwig,Consumer,United States,Everett,Massachusetts,2149,East,Furniture,Bookcases,"Atlantic Metals Mobile 3-Shelf Bookcases, Custom Colors",782.94,3,0.0,203.5644,2017-09-15,2017-09-17
9/15/2017,9/17/2017,Second Class,CL-11890,Carl Ludwig,Consumer,United States,Everett,Massachusetts,2149,East,Office Supplies,Binders,Wilson Jones Heavy-Duty Casebound Ring Binders with Metal Hinges,242.48,7,0.0,116.3904,2017-09-15,2017-09-17
3/11/2014,3/16/2014,Second Class,CK-12205,Chloris Kastensmidt,Consumer,United States,Columbus,Ohio,43229,East,Furniture,Furnishings,Eldon Wave Desk Accessories,8.32,5,0.2,2.288,2014-03-11,2014-03-16
3/11/2014,3/16/2014,Second Class,CK-12205,Chloris Kastensmidt,Consumer,United States,Columbus,Ohio,43229,East,Office Supplies,Fasteners,Stockwell Push Pins,10.464,6,0.2,1.7004,2014-03-11,2014-03-16
2/4/2014,2/8/2014,Standard Class,DB-13270,Deborah Brumfield,Home Office,United States,San Diego,California,92024,West,Office Supplies,Binders,GBC Recycled Grain Textured Covers,82.896,3,0.2,29.0136,2014-02-04,2014-02-08
2/4/2014,2/8/2014,Standard Class,DB-13270,Deborah Brumfield,Home Office,United States,San Diego,California,92024,West,Office Supplies,Paper,"Message Book, Standard Line ""While You Were Out"", 5 1/2"" X 4"", 200 Sets/Book",34.24,4,0.0,16.0928,2014-02-04,2014-02-08
12/31/2014,1/4/2015,Second Class,PC-18745,Pamela Coakley,Corporate,United States,Watertown,New York,13601,East,Furniture,Bookcases,"Atlantic Metals Mobile 4-Shelf Bookcases, Custom Colors",1573.488,7,0.2,196.686,2014-12-31,2015-01-04
11/23/2015,11/27/2015,Standard Class,VB-21745,Victoria Brennan,Corporate,United States,San Antonio,Texas,78207,Central,Office Supplies,Paper,Xerox 1915,335.52,4,0.2,117.432,2015-11-23,2015-11-27
11/23/2015,11/27/2015,Standard Class,VB-21745,Victoria Brennan,Corporate,United States,San Antonio,Texas,78207,Central,Office Supplies,Binders,GBC Recycled Regency Composition Covers,23.912,2,0.8,-40.6504,2015-11-23,2015-11-27
11/23/2015,11/27/2015,Standard Class,VB-21745,Victoria Brennan,Corporate,United States,San Antonio,Texas,78207,Central,Office Supplies,Storage,"Tenex Personal Self-Stacking Standard File Box, Black/Gray",27.056,2,0.2,2.3674,2015-11-23,2015-11-27
7/6/2014,7/8/2014,First Class,EP-13915,Emily Phan,Consumer,United States,New York City,New York,10011,East,Technology,Copiers,Canon Imageclass D680 Copier / Fax,559.992,1,0.2,174.9975,2014-07-06,2014-07-08
11/13/2017,11/18/2017,Second Class,ME-17320,Maria Etezadi,Home Office,United States,Houston,Texas,77095,Central,Office Supplies,Appliances,Hoover Commercial Soft Guard Upright Vacuum And Disposable Filtration Bags,9.324,6,0.8,-24.7086,2017-11-13,2017-11-18
6/17/2016,6/22/2016,Standard Class,IG-15085,Ivan Gibson,Consumer,United States,San Diego,California,92024,West,Office Supplies,Paper,Xerox 1934,111.96,2,0.0,54.8604,2016-06-17,2016-06-22
5/3/2014,5/5/2014,First Class,JS-15940,Joni Sundaresam,Home Office,United States,Appleton,Wisconsin,54915,Central,Office Supplies,Labels,Avery 481,21.56,7,0.0,10.3488,2014-05-03,2014-05-05
10/16/2017,10/21/2017,Standard Class,BO-11425,Bobby Odegard,Consumer,United States,Richmond,Kentucky,40475,South,Office Supplies,Binders,Large Capacity Hanging Post Binders,124.75,5,0.0,57.385,2017-10-16,2017-10-21
2/6/2015,2/13/2015,Standard Class,VW-21775,Victoria Wilson,Corporate,United States,Bellevue,Washington,98006,West,Office Supplies,Art,Newell 310,5.28,3,0.0,1.5312,2015-02-06,2015-02-13
9/4/2017,9/8/2017,Standard Class,AB-10150,Aimee Bixby,Consumer,United States,Long Beach,New York,11561,East,Technology,Accessories,"Verbatim 25 GB 6x Blu-ray Single Layer Recordable Disc, 25/Pack",91.96,4,0.0,39.5428,2017-09-04,2017-09-08
5/9/2016,5/15/2016,Standard Class,JW-16075,Julia West,Consumer,United States,Philadelphia,Pennsylvania,19140,East,Office Supplies,Envelopes,Staple envelope,9.344,1,0.2,3.504,2016-05-09,2016-05-15
5/9/2016,5/15/2016,Standard Class,JW-16075,Julia West,Consumer,United States,Philadelphia,Pennsylvania,19140,East,Office Supplies,Art,Newell 319,79.36,5,0.2,9.92,2016-05-09,2016-05-15
3/16/2015,3/18/2015,Second Class,JE-15475,Jeremy Ellison,Consumer,United States,Seattle,Washington,98103,West,Furniture,Tables,KI Adjustable-Height Table,171.96,2,0.0,44.7096,2015-03-16,2015-03-18
4/9/2016,4/13/2016,Standard Class,EB-13750,Edward Becker,Corporate,United States,Seattle,Washington,98103,West,Office Supplies,Binders,"Acco Pressboard Covers with Storage Hooks, 14 7/8"" x 11"", Light Blue",35.352,9,0.2,12.8151,2016-04-09,2016-04-13
4/4/2014,4/9/2014,Standard Class,PK-18910,Paul Knutson,Home Office,United States,San Francisco,California,94109,West,Office Supplies,Labels,Avery 518,18.9,6,0.0,9.072,2014-04-04,2014-04-09
9/5/2017,9/6/2017,First Class,CS-12400,Christopher Schild,Home Office,United States,Seattle,Washington,98115,West,Office Supplies,Art,Newell 333,2.78,1,0.0,0.7228,2017-09-05,2017-09-06
6/30/2017,6/30/2017,Same Day,SG-20470,Sheri Gordon,Consumer,United States,New York City,New York,10011,East,Furniture,Tables,Bretford CR4500 Series Slim Rectangular Table,1044.63,5,0.4,-295.9785,2017-06-30,2017-06-30
11/9/2015,11/9/2015,Same Day,CM-12190,Charlotte Melton,Consumer,United States,Philadelphia,Pennsylvania,19134,East,Office Supplies,Paper,"While You Were Out Pads, 50 per Pad, 4 x 5 1/4, Green Cycle",11.352,3,0.2,4.1151,2015-11-09,2015-11-09
3/4/2014,3/4/2014,Same Day,CL-12565,Clay Ludtke,Consumer,United States,Columbia,South Carolina,29203,South,Office Supplies,Storage,Sensible Storage WireTech Storage Systems,354.9,5,0.0,17.745,2014-03-04,2014-03-04
3/19/2015,3/25/2015,Standard Class,JO-15550,Jesus Ocampo,Home Office,United States,Seattle,Washington,98105,West,Technology,Phones,Wireless Extenders zBoost YX545 SOHO Signal Booster,453.576,3,0.2,39.6879,2015-03-19,2015-03-25
11/29/2015,11/30/2015,First Class,AW-10840,Anthony Witt,Consumer,United States,Allen,Texas,75002,Central,Technology,Accessories,Kingston Digital DataTraveler 16GB USB 2.0,21.48,3,0.2,-0.2685,2015-11-29,2015-11-30
11/29/2015,11/30/2015,First Class,AW-10840,Anthony Witt,Consumer,United States,Allen,Texas,75002,Central,Office Supplies,Binders,GBC Imprintable Covers,8.784,4,0.8,-13.6152,2015-11-29,2015-11-30
6/11/2017,6/11/2017,Same Day,DV-13465,Dianna Vittorini,Consumer,United States,Los Angeles,California,90004,West,Office Supplies,Paper,"White Dual Perf Computer Printout Paper, 2700 Sheets, 1 Part, Heavyweight, 20 lbs., 14 7/8 x 11",122.97,3,0.0,60.2553,2017-06-11,2017-06-11
11/26/2017,11/30/2017,Standard Class,AH-10075,Adam Hart,Corporate,United States,Atlanta,Georgia,30318,South,Office Supplies,Art,Newell 347,12.84,3,0.0,3.7236,2017-11-26,2017-11-30
11/23/2014,11/25/2014,First Class,SC-20095,Sanjit Chand,Consumer,United States,Los Angeles,California,90004,West,Furniture,Chairs,Novimex Swivel Fabric Task Chair,603.92,5,0.2,-67.941,2014-11-23,2014-11-25
11/23/2014,11/25/2014,First Class,SC-20095,Sanjit Chand,Consumer,United States,Los Angeles,California,90004,West,Office Supplies,Envelopes,Pastel Pink Envelopes,21.84,3,0.0,10.4832,2014-11-23,2014-11-25
11/23/2014,11/25/2014,First Class,SC-20095,Sanjit Chand,Consumer,United States,Los Angeles,California,90004,West,Technology,Accessories,Belkin F8E887 USB Wired Ergonomic Keyboard,29.99,1,0.0,6.2979,2014-11-23,2014-11-25
11/23/2014,11/25/2014,First Class,SC-20095,Sanjit Chand,Consumer,United States,Los Angeles,California,90004,West,Furniture,Chairs,Safco Contoured Stacking Chairs,381.44,2,0.2,23.84,2014-11-23,2014-11-25
12/15/2014,12/18/2014,First Class,MC-18100,Mick Crebagga,Consumer,United States,El Paso,Texas,79907,Central,Technology,Phones,ARKON Windshield Dashboard Air Vent Car Mount Holder,40.68,3,0.2,-9.153,2014-12-15,2014-12-18
12/15/2014,12/18/2014,First Class,MC-18100,Mick Crebagga,Consumer,United States,El Paso,Texas,79907,Central,Furniture,Chairs,"Lifetime Advantage Folding Chairs, 4/Carton",763.28,5,0.3,-21.808,2014-12-15,2014-12-18
4/22/2016,4/27/2016,Standard Class,TT-21460,Tonja Turnell,Home Office,United States,Aurora,Illinois,60505,Central,Office Supplies,Storage,Pizazz Global Quick File,23.952,2,0.2,2.3952,2016-04-22,2016-04-27
5/23/2016,5/27/2016,Standard Class,AP-10720,Anne Pryor,Home Office,United States,Florence,Alabama,35630,South,Office Supplies,Paper,Xerox 1949,4.98,1,0.0,2.4402,2016-05-23,2016-05-27
2/27/2016,3/1/2016,First Class,DL-12865,Dan Lawera,Consumer,United States,New York City,New York,10011,East,Office Supplies,Appliances,"Conquest 14 Commercial Heavy-Duty Upright Vacuum, Collection System, Accessory Kit",170.88,3,0.0,49.5552,2016-02-27,2016-03-01
8/9/2015,8/12/2015,First Class,NP-18325,Naresj Patel,Consumer,United States,New York City,New York,10024,East,Technology,Phones,Nortel Meridian M3904 Professional Digital phone,307.98,2,0.0,89.3142,2015-08-09,2015-08-12
8/9/2015,8/12/2015,First Class,NP-18325,Naresj Patel,Consumer,United States,New York City,New York,10024,East,Furniture,Tables,KI Conference Tables,382.806,9,0.4,-153.1224,2015-08-09,2015-08-12
8/9/2015,8/12/2015,First Class,NP-18325,Naresj Patel,Consumer,United States,New York City,New York,10024,East,Office Supplies,Storage,"Tennsco Lockers, Gray",41.96,2,0.0,2.9372,2015-08-09,2015-08-12
8/9/2015,8/12/2015,First Class,NP-18325,Naresj Patel,Consumer,United States,New York City,New York,10024,East,Office Supplies,Binders,GBC Ibimaster 500 Manual ProClick Binding System,1217.568,2,0.2,456.588,2015-08-09,2015-08-12
8/9/2015,8/12/2015,First Class,NP-18325,Naresj Patel,Consumer,United States,New York City,New York,10024,East,Furniture,Furnishings,Artistic Insta-Plaque,47.04,3,0.0,18.3456,2015-08-09,2015-08-12
8/9/2015,8/12/2015,First Class,NP-18325,Naresj Patel,Consumer,United States,New York City,New York,10024,East,Furniture,Furnishings,Longer-Life Soft White Bulbs,6.16,2,0.0,2.9568,2015-08-09,2015-08-12
8/9/2015,8/12/2015,First Class,NP-18325,Naresj Patel,Consumer,United States,New York City,New York,10024,East,Technology,Phones,Panasonic KX-TG9471B,979.95,5,0.0,274.386,2015-08-09,2015-08-12
8/9/2015,8/12/2015,First Class,NP-18325,Naresj Patel,Consumer,United States,New York City,New York,10024,East,Office Supplies,Paper,Xerox 1886,143.7,3,0.0,68.976,2015-08-09,2015-08-12
8/9/2015,8/12/2015,First Class,NP-18325,Naresj Patel,Consumer,United States,New York City,New York,10024,East,Office Supplies,Fasteners,"Acco Clips to Go Binder Clips, 24 Clips in Two Sizes",10.65,3,0.0,5.0055,2015-08-09,2015-08-12
8/9/2015,8/12/2015,First Class,NP-18325,Naresj Patel,Consumer,United States,New York City,New York,10024,East,Technology,Accessories,Belkin QODE FastFit Bluetooth Keyboard,247.8,4,0.0,34.692,2015-08-09,2015-08-12
5/12/2016,5/16/2016,Standard Class,VG-21805,Vivek Grady,Corporate,United States,Virginia Beach,Virginia,23464,South,Office Supplies,Art,Rogers Handheld Barrel Pencil Sharpener,10.96,4,0.0,2.9592,2016-05-12,2016-05-16
4/15/2016,4/19/2016,Standard Class,MY-18295,Muhammed Yedwab,Corporate,United States,Grapevine,Texas,76051,Central,Office Supplies,Art,"Dixon Ticonderoga Erasable Colored Pencil Set, 12-Color",33.488,7,0.2,5.8604,2016-04-15,2016-04-19
4/15/2016,4/19/2016,Standard Class,MY-18295,Muhammed Yedwab,Corporate,United States,Grapevine,Texas,76051,Central,Office Supplies,Fasteners,Ideal Clamps,8.04,5,0.2,2.9145,2016-04-15,2016-04-19
6/23/2015,6/25/2015,Second Class,RD-19480,Rick Duston,Consumer,United States,Olympia,Washington,98502,West,Technology,Phones,Pyle PRT45 Retro Home Telephone,201.568,4,0.2,22.6764,2015-06-23,2015-06-25
10/19/2014,10/19/2014,Same Day,JF-15490,Jeremy Farry,Consumer,United States,Los Angeles,California,90032,West,Office Supplies,Paper,Spiral Phone Message Books with Labels by Adams,13.44,3,0.0,6.5856,2014-10-19,2014-10-19
3/24/2015,3/27/2015,First Class,DP-13390,Dennis Pardue,Home Office,United States,Peoria,Illinois,61604,Central,Furniture,Bookcases,Sauder Inglewood Library Bookcases,359.058,3,0.3,-35.9058,2015-03-24,2015-03-27
5/8/2017,5/12/2017,Standard Class,MD-17350,Maribeth Dona,Consumer,United States,Columbus,Ohio,43229,East,Furniture,Chairs,Global Chrome Stack Chair,47.992,2,0.3,-2.0568,2017-05-08,2017-05-12
10/16/2017,10/18/2017,First Class,MY-17380,Maribeth Yedwab,Corporate,United States,New York City,New York,10011,East,Furniture,Furnishings,Executive Impressions Supervisor Wall Clock,547.3,13,0.0,175.136,2017-10-16,2017-10-18
11/19/2017,11/21/2017,Second Class,AB-10150,Aimee Bixby,Consumer,United States,Carrollton,Texas,75007,Central,Office Supplies,Paper,Xerox 1901,16.896,4,0.2,5.28,2017-11-19,2017-11-21
11/19/2017,11/21/2017,Second Class,AB-10150,Aimee Bixby,Consumer,United States,Carrollton,Texas,75007,Central,Office Supplies,Supplies,Acme Elite Stainless Steel Scissors,6.672,1,0.2,0.5004,2017-11-19,2017-11-21
11/19/2017,11/21/2017,Second Class,AB-10150,Aimee Bixby,Consumer,United States,Carrollton,Texas,75007,Central,Office Supplies,Art,"Boston School Pro Electric Pencil Sharpener, 1670",99.136,4,0.2,8.6744,2017-11-19,2017-11-21
11/19/2017,11/21/2017,Second Class,AB-10150,Aimee Bixby,Consumer,United States,Carrollton,Texas,75007,Central,Furniture,Furnishings,Telescoping Adjustable Floor Lamp,15.992,2,0.6,-13.993,2017-11-19,2017-11-21
5/8/2016,5/13/2016,Second Class,GB-14530,George Bell,Corporate,United States,Dover,Delaware,19901,East,Furniture,Furnishings,"Tenex 46"" x 60"" Computer Anti-Static Chairmat, Rectangular Shaped",211.96,2,0.0,42.392,2016-05-08,2016-05-13
12/11/2016,12/17/2016,Standard Class,CA-12775,Cynthia Arntzen,Consumer,United States,Smyrna,Tennessee,37167,South,Office Supplies,Art,Prang Drawing Pencil Set,6.672,3,0.2,1.668,2016-12-11,2016-12-17
11/30/2017,12/4/2017,Standard Class,ME-17725,Max Engle,Consumer,United States,Newark,Delaware,19711,East,Office Supplies,Art,"BOSTON Ranger #55 Pencil Sharpener, Black",155.94,6,0.0,45.2226,2017-11-30,2017-12-04
4/19/2016,4/24/2016,Second Class,JO-15280,Jas O'Carroll,Consumer,United States,Los Angeles,California,90049,West,Technology,Phones,PowerGen Dual USB Car Charger,39.96,5,0.2,12.987,2016-04-19,2016-04-24
4/19/2016,4/24/2016,Second Class,JO-15280,Jas O'Carroll,Consumer,United States,Los Angeles,California,90049,West,Office Supplies,Art,Newell 307,5.46,3,0.0,1.5288,2016-04-19,2016-04-24
4/19/2016,4/24/2016,Second Class,JO-15280,Jas O'Carroll,Consumer,United States,Los Angeles,California,90049,West,Office Supplies,Art,Panasonic KP-4ABK Battery-Operated Pencil Sharpener,73.2,5,0.0,21.228,2016-04-19,2016-04-24
4/19/2016,4/24/2016,Second Class,JO-15280,Jas O'Carroll,Consumer,United States,Los Angeles,California,90049,West,Office Supplies,Binders,"Angle-D Binders with Locking Rings, Label Holders",5.84,1,0.2,1.971,2016-04-19,2016-04-24
4/19/2016,4/24/2016,Second Class,JO-15280,Jas O'Carroll,Consumer,United States,Los Angeles,California,90049,West,Office Supplies,Paper,"Adams Telephone Message Book W/Dividers/Space For Phone Numbers, 5 1/4""X8 1/2"", 200/Messages",22.72,4,0.0,10.224,2016-04-19,2016-04-24
4/19/2016,4/24/2016,Second Class,JO-15280,Jas O'Carroll,Consumer,United States,Los Angeles,California,90049,West,Office Supplies,Binders,Avery Binder Labels,9.336,3,0.2,3.2676,2016-04-19,2016-04-24
5/26/2014,5/30/2014,Standard Class,ML-17395,Marina Lichtenstein,Corporate,United States,Los Angeles,California,90008,West,Furniture,Bookcases,Sauder Inglewood Library Bookcases,290.666,2,0.15,27.3568,2014-05-26,2014-05-30
5/26/2014,5/30/2014,Standard Class,ML-17395,Marina Lichtenstein,Corporate,United States,Los Angeles,California,90008,West,Technology,Phones,VTech DS6151,201.584,2,0.2,20.1584,2014-05-26,2014-05-30
5/26/2014,5/30/2014,Standard Class,ML-17395,Marina Lichtenstein,Corporate,United States,Los Angeles,California,90008,West,Technology,Phones,netTALK DUO VoIP Telephone Service,83.984,2,0.2,31.494,2014-05-26,2014-05-30
12/21/2017,12/25/2017,Standard Class,YS-21880,Yana Sorensen,Corporate,United States,Oakland,California,94601,West,Office Supplies,Storage,Letter Size Cart,1000.02,7,0.0,290.0058,2017-12-21,2017-12-25
3/15/2016,3/19/2016,Standard Class,PL-18925,Paul Lucas,Home Office,United States,Philadelphia,Pennsylvania,19143,East,Technology,Accessories,V7 USB Numeric Keypad,83.976,3,0.2,-13.6461,2016-03-15,2016-03-19
8/10/2015,8/16/2015,Standard Class,JK-16120,Julie Kriz,Home Office,United States,Eagan,Minnesota,55122,Central,Office Supplies,Labels,Avery 480,3.75,1,0.0,1.8,2015-08-10,2015-08-16
8/10/2015,8/16/2015,Standard Class,JK-16120,Julie Kriz,Home Office,United States,Eagan,Minnesota,55122,Central,Office Supplies,Labels,Avery 489,41.4,4,0.0,19.872,2015-08-10,2015-08-16
8/10/2015,8/16/2015,Standard Class,JK-16120,Julie Kriz,Home Office,United States,Eagan,Minnesota,55122,Central,Office Supplies,Art,Peel-Off China Markers,29.79,3,0.0,12.5118,2015-08-10,2015-08-16
9/10/2016,9/14/2016,Second Class,PN-18775,Parhena Norris,Home Office,United States,New York City,New York,10011,East,Office Supplies,Storage,Acco Perma 2700 Stacking Storage Drawers,59.48,2,0.0,8.922,2016-09-10,2016-09-14
9/10/2016,9/14/2016,Second Class,PN-18775,Parhena Norris,Home Office,United States,New York City,New York,10011,East,Office Supplies,Paper,"Wirebound Message Books, Four 2 3/4 x 5 White Forms per Page",6.69,1,0.0,3.0774,2016-09-10,2016-09-14
7/8/2017,7/15/2017,Standard Class,JC-15385,Jenna Caffey,Consumer,United States,Kent,Washington,98031,West,Furniture,Furnishings,"GE 48"" Fluorescent Tube, Cool White Energy Saver, 34 Watts, 30/Box",198.46,2,0.0,99.23,2017-07-08,2017-07-15
7/8/2017,7/15/2017,Standard Class,JC-15385,Jenna Caffey,Consumer,United States,Kent,Washington,98031,West,Office Supplies,Labels,"Dot Matrix Printer Tape Reel Labels, White, 5000/Box",786.48,8,0.0,385.3752,2017-07-08,2017-07-15
7/8/2017,7/15/2017,Standard Class,JC-15385,Jenna Caffey,Consumer,United States,Kent,Washington,98031,West,Office Supplies,Binders,"GBC White Gloss Covers, Plain Front",23.168,2,0.2,7.8192,2017-07-08,2017-07-15
7/8/2017,7/15/2017,Standard Class,JC-15385,Jenna Caffey,Consumer,United States,Kent,Washington,98031,West,Technology,Accessories,Micro Innovations USB RF Wireless Keyboard with Mouse,50.0,2,0.0,10.5,2017-07-08,2017-07-15
12/19/2015,12/24/2015,Standard Class,JG-15160,James Galang,Consumer,United States,Los Angeles,California,90049,West,Technology,Phones,ShoreTel ShorePhone IP 230 VoIP phone,675.96,5,0.2,84.495,2015-12-19,2015-12-24
12/19/2015,12/24/2015,Standard Class,JG-15160,James Galang,Consumer,United States,Los Angeles,California,90049,West,Technology,Accessories,Plantronics Savi W720 Multi-Device Wireless Headset System,1265.85,3,0.0,556.974,2015-12-19,2015-12-24
11/16/2015,11/22/2015,Standard Class,PO-19180,Philisse Overcash,Home Office,United States,New York City,New York,10011,East,Office Supplies,Appliances,"Eureka The Boss Plus 12-Amp Hard Box Upright Vacuum, Red",523.25,5,0.0,141.2775,2015-11-16,2015-11-22
9/24/2015,9/30/2015,Standard Class,MC-17275,Marc Crier,Consumer,United States,Lafayette,Louisiana,70506,South,Furniture,Chairs,Harbour Creations Steel Folding Chair,517.5,6,0.0,155.25,2015-09-24,2015-09-30
6/21/2017,6/25/2017,Second Class,AS-10240,Alan Shonely,Consumer,United States,Cleveland,Ohio,44105,East,Furniture,Furnishings,"Stacking Tray, Side-Loading, Legal, Smoke",17.92,5,0.2,2.464,2017-06-21,2017-06-25
6/21/2017,6/25/2017,Second Class,AS-10240,Alan Shonely,Consumer,United States,Cleveland,Ohio,44105,East,Office Supplies,Binders,Deluxe Heavy-Duty Vinyl Round Ring Binder,41.256,6,0.7,-34.38,2017-06-21,2017-06-25
5/8/2016,5/8/2016,Same Day,CL-12565,Clay Ludtke,Consumer,United States,Cleveland,Ohio,44105,East,Office Supplies,Storage,Smead Adjustable Mobile File Trolley with Lockable Top,1006.056,3,0.2,88.0299,2016-05-08,2016-05-08
5/8/2016,5/8/2016,Same Day,CL-12565,Clay Ludtke,Consumer,United States,Cleveland,Ohio,44105,East,Office Supplies,Paper,Xerox 1898,10.688,2,0.2,3.7408,2016-05-08,2016-05-08
5/8/2016,5/8/2016,Same Day,CL-12565,Clay Ludtke,Consumer,United States,Cleveland,Ohio,44105,East,Office Supplies,Paper,Xerox 222,10.368,2,0.2,3.6288,2016-05-08,2016-05-08
5/8/2016,5/8/2016,Same Day,CL-12565,Clay Ludtke,Consumer,United States,Cleveland,Ohio,44105,East,Office Supplies,Storage,Hanging Personal Folder File,25.12,2,0.2,1.57,2016-05-08,2016-05-08
5/8/2016,5/8/2016,Same Day,CL-12565,Clay Ludtke,Consumer,United States,Cleveland,Ohio,44105,East,Technology,Accessories,SanDisk Cruzer 64 GB USB Flash Drive,58.112,2,0.2,7.264,2016-05-08,2016-05-08
11/26/2014,12/2/2014,Standard Class,NW-18400,Natalie Webber,Consumer,United States,Tigard,Oregon,97224,West,Office Supplies,Paper,Xerox 2,15.552,3,0.2,5.4432,2014-11-26,2014-12-02
11/26/2014,12/2/2014,Standard Class,NW-18400,Natalie Webber,Consumer,United States,Tigard,Oregon,97224,West,Office Supplies,Storage,Office Impressions Heavy Duty Welded Shelving & Multimedia Storage Drawers,669.08,5,0.2,-167.27,2014-11-26,2014-12-02
11/26/2014,12/2/2014,Standard Class,NW-18400,Natalie Webber,Consumer,United States,Tigard,Oregon,97224,West,Technology,Phones,Jawbone MINI JAMBOX Wireless Bluetooth Speaker,438.336,4,0.2,-87.6672,2014-11-26,2014-12-02
5/26/2016,6/1/2016,Standard Class,TB-21280,Toby Braunhardt,Consumer,United States,Washington,District of Columbia,20016,East,Office Supplies,Paper,Weyerhaeuser First Choice Laser/Copy Paper (20Lb. and 88 Bright),19.44,3,0.0,9.3312,2016-05-26,2016-06-01
5/26/2016,6/1/2016,Standard Class,TB-21280,Toby Braunhardt,Consumer,United States,Washington,District of Columbia,20016,East,Office Supplies,Binders,Wilson Jones Turn Tabs Binder Tool for Ring Binders,9.64,2,0.0,4.4344,2016-05-26,2016-06-01
5/26/2016,6/1/2016,Standard Class,TB-21280,Toby Braunhardt,Consumer,United States,Washington,District of Columbia,20016,East,Office Supplies,Paper,"Telephone Message Books with Fax/Mobile Section, 5 1/2"" x 3 3/16""",12.7,2,0.0,5.842,2016-05-26,2016-06-01
5/26/2016,6/1/2016,Standard Class,TB-21280,Toby Braunhardt,Consumer,United States,Washington,District of Columbia,20016,East,Furniture,Furnishings,9-3/4 Diameter Round Wall Clock,41.37,3,0.0,17.3754,2016-05-26,2016-06-01
11/29/2014,12/4/2014,Standard Class,BS-11380,Bill Stewart,Corporate,United States,Skokie,Illinois,60076,Central,Office Supplies,Fasteners,Staples,12.624,2,0.2,3.945,2014-11-29,2014-12-04
3/19/2015,3/20/2015,First Class,FH-14365,Fred Hopkins,Corporate,United States,Seattle,Washington,98115,West,Office Supplies,Storage,Deluxe Rollaway Locking File with Drawer,1247.64,3,0.0,349.3392,2015-03-19,2015-03-20
3/19/2015,3/20/2015,First Class,FH-14365,Fred Hopkins,Corporate,United States,Seattle,Washington,98115,West,Technology,Copiers,Canon PC940 Copier,3149.93,7,0.0,1480.4671,2015-03-19,2015-03-20
3/19/2015,3/20/2015,First Class,FH-14365,Fred Hopkins,Corporate,United States,Seattle,Washington,98115,West,Office Supplies,Paper,Multicolor Computer Printout Paper,209.7,2,0.0,100.656,2015-03-19,2015-03-20
11/1/2015,11/3/2015,First Class,VM-21685,Valerie Mitchum,Home Office,United States,Philadelphia,Pennsylvania,19140,East,Technology,Accessories,SanDisk Ultra 32 GB MicroSDHC Class 10 Memory Card,35.36,2,0.2,-3.094,2015-11-01,2015-11-03
11/1/2015,11/3/2015,First Class,VM-21685,Valerie Mitchum,Home Office,United States,Philadelphia,Pennsylvania,19140,East,Office Supplies,Fasteners,"Brites Rubber Bands, 1 1/2 oz. Box",3.168,2,0.2,-0.7128,2015-11-01,2015-11-03
9/26/2015,9/29/2015,Second Class,SF-20200,Sarah Foster,Consumer,United States,Philadelphia,Pennsylvania,19143,East,Office Supplies,Binders,Catalog Binders with Expanding Posts,121.104,6,0.7,-100.92,2015-09-26,2015-09-29
9/26/2015,9/29/2015,Second Class,SF-20200,Sarah Foster,Consumer,United States,Philadelphia,Pennsylvania,19143,East,Technology,Phones,Grandstream GXP2100 Mainstream Business Phone,45.894,1,0.4,-9.1788,2015-09-26,2015-09-29
8/29/2014,8/29/2014,Same Day,HH-15010,Hilary Holden,Corporate,United States,San Francisco,California,94110,West,Office Supplies,Paper,Xerox 1940,109.92,2,0.0,53.8608,2014-08-29,2014-08-29
8/29/2014,8/29/2014,Same Day,HH-15010,Hilary Holden,Corporate,United States,San Francisco,California,94110,West,Office Supplies,Paper,Xerox 1986,13.36,2,0.0,6.4128,2014-08-29,2014-08-29
11/18/2017,11/21/2017,First Class,CD-12280,Christina DeMoss,Consumer,United States,Seattle,Washington,98105,West,Office Supplies,Storage,Eldon Portable Mobile Manager,169.68,6,0.0,45.8136,2017-11-18,2017-11-21
11/18/2017,11/21/2017,First Class,CD-12280,Christina DeMoss,Consumer,United States,Seattle,Washington,98105,West,Technology,Accessories,Imation 16GB Mini TravelDrive USB 2.0 Flash Drive,132.52,4,0.0,54.3332,2017-11-18,2017-11-21
11/18/2017,11/21/2017,First Class,CD-12280,Christina DeMoss,Consumer,United States,Seattle,Washington,98105,West,Office Supplies,Fasteners,Binder Clips by OIC,2.96,2,0.0,1.4208,2017-11-18,2017-11-21
11/18/2017,11/21/2017,First Class,CD-12280,Christina DeMoss,Consumer,United States,Seattle,Washington,98105,West,Office Supplies,Binders,"Wilson Jones 1"" Hanging DublLock Ring Binders",8.448,2,0.2,2.9568,2017-11-18,2017-11-21
11/18/2017,11/21/2017,First Class,CD-12280,Christina DeMoss,Consumer,United States,Seattle,Washington,98105,West,Office Supplies,Storage,Fellowes Bankers Box Stor/Drawer Steel Plus,95.94,3,0.0,9.594,2017-11-18,2017-11-21
5/12/2014,5/15/2014,First Class,HL-15040,Hunter Lopez,Consumer,United States,Milwaukee,Wisconsin,53209,Central,Furniture,Furnishings,"DAX Value U-Channel Document Frames, Easel Back",34.79,7,0.0,10.7849,2014-05-12,2014-05-15
1/20/2017,1/26/2017,Standard Class,TH-21100,Thea Hendricks,Consumer,United States,Los Angeles,California,90045,West,Technology,Phones,RCA Visys Integrated PBX 8-Line Router,160.776,3,0.2,10.0485,2017-01-20,2017-01-26
10/30/2017,11/6/2017,Standard Class,MM-18055,Michelle Moray,Consumer,United States,Seattle,Washington,98115,West,Office Supplies,Binders,"GBC Velobind Prepunched Cover Sets, Regency Series",88.752,3,0.2,27.735,2017-10-30,2017-11-06
10/30/2017,11/6/2017,Standard Class,MM-18055,Michelle Moray,Consumer,United States,Seattle,Washington,98115,West,Office Supplies,Binders,Cardinal Slant-D Ring Binders,13.904,2,0.2,5.214,2017-10-30,2017-11-06
4/30/2017,5/6/2017,Standard Class,QJ-19255,Quincy Jones,Corporate,United States,Philadelphia,Pennsylvania,19143,East,Technology,Phones,Polycom SoundPoint IP 450 VoIP phone,677.58,5,0.4,-158.102,2017-04-30,2017-05-06
4/30/2017,5/6/2017,Standard Class,QJ-19255,Quincy Jones,Corporate,United States,Philadelphia,Pennsylvania,19143,East,Office Supplies,Binders,GBC VeloBind Cover Sets,13.896,3,0.7,-9.264,2017-04-30,2017-05-06
11/24/2016,11/26/2016,Second Class,NS-18505,Neola Schneider,Consumer,United States,Dallas,Texas,75217,Central,Office Supplies,Storage,Sterilite Officeware Hinged File Box,41.92,5,0.2,3.668,2016-11-24,2016-11-26
11/24/2016,11/26/2016,Second Class,NS-18505,Neola Schneider,Consumer,United States,Dallas,Texas,75217,Central,Technology,Accessories,Logitech G19 Programmable Gaming Keyboard,297.576,3,0.2,-7.4394,2016-11-24,2016-11-26
11/24/2016,11/26/2016,Second Class,NS-18505,Neola Schneider,Consumer,United States,Dallas,Texas,75217,Central,Office Supplies,Fasteners,Colored Push Pins,4.344,3,0.2,0.8688,2016-11-24,2016-11-26
11/24/2016,11/26/2016,Second Class,NS-18505,Neola Schneider,Consumer,United States,Dallas,Texas,75217,Central,Technology,Accessories,Logitech G105 Gaming Keyboard,94.992,2,0.2,-2.3748,2016-11-24,2016-11-26
11/24/2016,11/26/2016,Second Class,NS-18505,Neola Schneider,Consumer,United States,Dallas,Texas,75217,Central,Office Supplies,Paper,Xerox 1925,74.352,3,0.2,23.235,2016-11-24,2016-11-26
11/24/2016,11/26/2016,Second Class,NS-18505,Neola Schneider,Consumer,United States,Dallas,Texas,75217,Central,Office Supplies,Art,"Dixon My First Ticonderoga Pencil, #2",14.04,3,0.2,1.5795,2016-11-24,2016-11-26
1/10/2015,1/15/2015,Standard Class,MM-17920,Michael Moore,Consumer,United States,New York City,New York,10011,East,Furniture,Tables,Bush Advantage Collection Racetrack Conference Table,1018.104,4,0.4,-373.3048,2015-01-10,2015-01-15
10/19/2017,10/26/2017,Standard Class,RD-19480,Rick Duston,Consumer,United States,Houston,Texas,77095,Central,Technology,Phones,QVS USB Car Charger 2-Port 2.1Amp for iPod/iPhone/iPad/iPad 2/iPad 3,16.68,3,0.2,5.2125,2017-10-19,2017-10-26
3/22/2016,3/25/2016,First Class,RB-19645,Robert Barroso,Corporate,United States,North Las Vegas,Nevada,89031,West,Technology,Accessories,Logitech ClearChat Comfort/USB Headset H390,58.58,2,0.0,19.3314,2016-03-22,2016-03-25
7/3/2017,7/7/2017,Standard Class,RD-19585,Rob Dowd,Consumer,United States,Plano,Texas,75023,Central,Technology,Phones,netTALK DUO VoIP Telephone Service,167.968,4,0.2,62.988,2017-07-03,2017-07-07
12/11/2015,12/12/2015,First Class,SW-20455,Shaun Weien,Consumer,United States,Suffolk,Virginia,23434,South,Office Supplies,Labels,"Dot Matrix Printer Tape Reel Labels, White, 5000/Box",196.62,2,0.0,96.3438,2015-12-11,2015-12-12
9/17/2015,9/21/2015,Standard Class,SF-20965,Sylvia Foulston,Corporate,United States,Houston,Texas,77041,Central,Furniture,Furnishings,Howard Miller Distant Time Traveler Alarm Clock,21.936,2,0.6,-10.4196,2015-09-17,2015-09-21
9/17/2015,9/21/2015,Standard Class,SF-20965,Sylvia Foulston,Corporate,United States,Houston,Texas,77041,Central,Office Supplies,Binders,GBC Imprintable Covers,6.588,3,0.8,-10.2114,2015-09-17,2015-09-21
5/18/2016,5/24/2016,Standard Class,EB-13930,Eric Barreto,Consumer,United States,San Francisco,California,94110,West,Office Supplies,Storage,Home/Office Personal File Carts,104.28,3,0.0,26.07,2016-05-18,2016-05-24
5/18/2016,5/24/2016,Standard Class,EB-13930,Eric Barreto,Consumer,United States,San Francisco,California,94110,West,Office Supplies,Paper,Universal Premium White Copier/Laser Paper (20Lb. and 87 Bright),17.94,3,0.0,8.7906,2016-05-18,2016-05-24
9/7/2014,9/13/2014,Standard Class,SB-20290,Sean Braxton,Corporate,United States,Philadelphia,Pennsylvania,19134,East,Office Supplies,Storage,"Carina 42""Hx23 3/4""W Media Storage Unit",64.784,1,0.2,-14.5764,2014-09-07,2014-09-13
9/7/2014,9/13/2014,Standard Class,SB-20290,Sean Braxton,Corporate,United States,Philadelphia,Pennsylvania,19134,East,Technology,Phones,invisibleSHIELD by ZAGG Smudge-Free Screen Protector,32.382,3,0.4,4.3176,2014-09-07,2014-09-13
9/7/2014,9/13/2014,Standard Class,SB-20290,Sean Braxton,Corporate,United States,Philadelphia,Pennsylvania,19134,East,Furniture,Furnishings,DAX Natural Wood-Tone Poster Frame,42.368,2,0.2,8.4736,2014-09-07,2014-09-13
9/7/2014,9/13/2014,Standard Class,SB-20290,Sean Braxton,Corporate,United States,Philadelphia,Pennsylvania,19134,East,Technology,Machines,StarTech.com 10/100 VDSL2 Ethernet Extender Kit,399.54,4,0.7,-559.356,2014-09-07,2014-09-13
9/29/2016,10/1/2016,Second Class,PS-18760,Pamela Stobb,Consumer,United States,Los Angeles,California,90008,West,Office Supplies,Paper,Xerox 1887,18.97,1,0.0,9.1056,2016-09-29,2016-10-01
11/7/2016,11/12/2016,Standard Class,CB-12535,Claudia Bergmann,Corporate,United States,San Francisco,California,94110,West,Furniture,Furnishings,"C-Line Magnetic Cubicle Keepers, Clear Polypropylene",14.82,3,0.0,6.2244,2016-11-07,2016-11-12
4/24/2017,4/27/2017,First Class,DK-12835,Damala Kotsonis,Corporate,United States,Philadelphia,Pennsylvania,19143,East,Office Supplies,Appliances,"Acco Smartsocket Table Surge Protector, 6 Color-Coded Adapter Outlets",99.28,2,0.2,12.41,2017-04-24,2017-04-27
4/24/2017,4/27/2017,First Class,DK-12835,Damala Kotsonis,Corporate,United States,Philadelphia,Pennsylvania,19143,East,Office Supplies,Binders,Avery Reinforcements for Hole-Punch Pages,1.188,2,0.7,-0.99,2017-04-24,2017-04-27
4/24/2017,4/27/2017,First Class,DK-12835,Damala Kotsonis,Corporate,United States,Philadelphia,Pennsylvania,19143,East,Office Supplies,Binders,GBC ProClick Spines for 32-Hole Punch,7.518,2,0.7,-5.7638,2017-04-24,2017-04-27
12/10/2017,12/12/2017,First Class,AW-10840,Anthony Witt,Consumer,United States,Philadelphia,Pennsylvania,19140,East,Office Supplies,Paper,Xerox 210,10.368,2,0.2,3.6288,2017-12-10,2017-12-12
12/10/2017,12/12/2017,First Class,AW-10840,Anthony Witt,Consumer,United States,Philadelphia,Pennsylvania,19140,East,Furniture,Furnishings,Electrix Halogen Magnifier Lamp,310.88,2,0.2,23.316,2017-12-10,2017-12-12
8/16/2014,8/20/2014,Standard Class,TS-21610,Troy Staebel,Consumer,United States,Philadelphia,Pennsylvania,19143,East,Furniture,Tables,Chromcraft Rectangular Conference Tables,853.092,6,0.4,-227.4912,2014-08-16,2014-08-20
12/9/2017,12/15/2017,Standard Class,HF-14995,Herbert Flentye,Consumer,United States,Indianapolis,Indiana,46203,Central,Office Supplies,Paper,"Wirebound Message Books, Four 2 3/4 x 5 White Forms per Page",33.45,5,0.0,15.387,2017-12-09,2017-12-15
12/9/2017,12/15/2017,Standard Class,HF-14995,Herbert Flentye,Consumer,United States,Indianapolis,Indiana,46203,Central,Office Supplies,Binders,Economy Binders,10.4,5,0.0,5.096,2017-12-09,2017-12-15
3/14/2016,3/19/2016,Standard Class,HZ-14950,Henia Zydlo,Consumer,United States,Columbus,Ohio,43229,East,Furniture,Furnishings,Advantus Panel Wall Acrylic Frame,21.88,5,0.2,6.2905,2016-03-14,2016-03-19
6/26/2016,6/29/2016,Second Class,AB-10255,Alejandro Ballentine,Home Office,United States,Plano,Texas,75023,Central,Technology,Accessories,Memorex Mini Travel Drive 4 GB USB 2.0 Flash Drive,13.616,2,0.2,3.5742,2016-06-26,2016-06-29
9/25/2015,9/28/2015,Second Class,PO-19195,Phillina Ober,Home Office,United States,Bayonne,New Jersey,7002,East,Technology,Accessories,Memorex Micro Travel Drive 16 GB,63.96,4,0.0,19.8276,2015-09-25,2015-09-28
9/25/2015,9/28/2015,Second Class,PO-19195,Phillina Ober,Home Office,United States,Bayonne,New Jersey,7002,East,Office Supplies,Binders,Tuff Stuff Recycled Round Ring Binders,14.46,3,0.0,7.0854,2015-09-25,2015-09-28
9/25/2015,9/28/2015,Second Class,PO-19195,Phillina Ober,Home Office,United States,Bayonne,New Jersey,7002,East,Technology,Phones,netTALK DUO VoIP Telephone Service,104.98,2,0.0,52.49,2015-09-25,2015-09-28
12/27/2015,12/31/2015,Standard Class,AG-10900,Arthur Gainer,Consumer,United States,Los Angeles,California,90008,West,Office Supplies,Appliances,Belkin F9G930V10-GRY 9 Outlet Surge,106.96,2,0.0,31.0184,2015-12-27,2015-12-31
12/27/2015,12/31/2015,Standard Class,AG-10900,Arthur Gainer,Consumer,United States,Los Angeles,California,90008,West,Office Supplies,Labels,Avery 497,21.56,7,0.0,10.3488,2015-12-27,2015-12-31
6/3/2014,6/7/2014,Second Class,SC-20725,Steven Cartwright,Consumer,United States,Seattle,Washington,98115,West,Furniture,Tables,KI Adjustable-Height Table,515.88,6,0.0,113.4936,2014-06-03,2014-06-07
7/13/2015,7/15/2015,Second Class,ND-18370,Natalie DeCherney,Consumer,United States,New York City,New York,10035,East,Office Supplies,Binders,GBC Plastic Binding Combs,11.808,2,0.2,4.2804,2015-07-13,2015-07-15
7/13/2015,7/15/2015,Second Class,ND-18370,Natalie DeCherney,Consumer,United States,New York City,New York,10035,East,Furniture,Chairs,Safco Contoured Stacking Chairs,1931.04,9,0.1,321.84,2015-07-13,2015-07-15
7/13/2015,7/15/2015,Second Class,ND-18370,Natalie DeCherney,Consumer,United States,New York City,New York,10035,East,Office Supplies,Paper,Easy-staple paper,9.96,2,0.0,4.6812,2015-07-13,2015-07-15
2/2/2014,2/6/2014,Standard Class,CD-12790,Cynthia Delaney,Home Office,United States,San Diego,California,92037,West,Office Supplies,Fasteners,Staples,12.35,5,0.0,5.8045,2014-02-02,2014-02-06
3/8/2016,3/8/2016,Same Day,PG-18820,Patrick Gardner,Consumer,United States,Glendale,Arizona,85301,West,Office Supplies,Binders,"GBC Standard Recycled Report Covers, Clear Plastic Sheets",9.702,3,0.7,-7.1148,2016-03-08,2016-03-08
11/22/2015,11/26/2015,Standard Class,IM-15070,Irene Maddox,Consumer,United States,Philadelphia,Pennsylvania,19120,East,Office Supplies,Binders,GBC Durable Plastic Covers,11.61,2,0.7,-9.288,2015-11-22,2015-11-26
10/30/2017,11/5/2017,Standard Class,JK-15205,Jamie Kunitz,Consumer,United States,San Francisco,California,94122,West,Office Supplies,Labels,Avery 500,43.86,6,0.0,20.6142,2017-10-30,2017-11-05
10/30/2017,11/5/2017,Standard Class,JK-15205,Jamie Kunitz,Consumer,United States,San Francisco,California,94122,West,Technology,Phones,Geemarc AmpliPOWER60,148.48,2,0.2,16.704,2017-10-30,2017-11-05
10/30/2017,11/5/2017,Standard Class,JK-15205,Jamie Kunitz,Consumer,United States,San Francisco,California,94122,West,Office Supplies,Paper,"""While you Were Out"" Message Book, One Form per Page",7.42,2,0.0,3.71,2017-10-30,2017-11-05
10/30/2017,11/5/2017,Standard Class,JK-15205,Jamie Kunitz,Consumer,United States,San Francisco,California,94122,West,Furniture,Chairs,"Global Leather Task Chair, Black",71.992,1,0.2,-0.8999,2017-10-30,2017-11-05
10/30/2017,11/5/2017,Standard Class,JK-15205,Jamie Kunitz,Consumer,United States,San Francisco,California,94122,West,Office Supplies,Art,4009 Highlighters by Sanford,19.9,5,0.0,6.567,2017-10-30,2017-11-05
10/30/2017,11/5/2017,Standard Class,JK-15205,Jamie Kunitz,Consumer,United States,San Francisco,California,94122,West,Office Supplies,Appliances,"Acco 7-Outlet Masterpiece Power Center, Wihtout Fax/Phone Line Protection",1702.12,14,0.0,510.636,2017-10-30,2017-11-05
1/30/2015,2/4/2015,Standard Class,JP-15520,Jeremy Pistek,Consumer,United States,Houston,Texas,77070,Central,Office Supplies,Paper,Rediform Voice Mail Log Books,14.304,6,0.2,5.0064,2015-01-30,2015-02-04
9/8/2017,9/13/2017,Second Class,MM-18055,Michelle Moray,Consumer,United States,Chicago,Illinois,60610,Central,Furniture,Tables,BoxOffice By Design Rectangular and Half-Moon Meeting Room Tables,765.625,7,0.5,-566.5625,2017-09-08,2017-09-13
10/7/2017,10/13/2017,Standard Class,DC-13285,Debra Catini,Consumer,United States,San Francisco,California,94110,West,Furniture,Bookcases,O'Sullivan Manor Hill 2-Door Library in Brianna Oak,307.666,2,0.15,-14.4784,2017-10-07,2017-10-13
4/30/2016,5/4/2016,Standard Class,JL-15835,John Lee,Consumer,United States,New York City,New York,10011,East,Office Supplies,Binders,Tuff Stuff Recycled Round Ring Binders,7.712,2,0.2,2.7956,2016-04-30,2016-05-04
5/19/2016,5/24/2016,Standard Class,BN-11515,Bradley Nguyen,Consumer,United States,New York City,New York,10011,East,Office Supplies,Appliances,Belkin Premiere Surge Master II 8-outlet surge protector,242.9,5,0.0,70.441,2016-05-19,2016-05-24
5/19/2016,5/24/2016,Standard Class,BN-11515,Bradley Nguyen,Consumer,United States,New York City,New York,10011,East,Office Supplies,Storage,Safco Industrial Wire Shelving System,454.9,5,0.0,0.0,2016-05-19,2016-05-24
5/19/2016,5/24/2016,Standard Class,BN-11515,Bradley Nguyen,Consumer,United States,New York City,New York,10011,East,Furniture,Furnishings,Nu-Dell Float Frame 11 x 14 1/2,35.92,4,0.0,15.0864,2016-05-19,2016-05-24
5/19/2016,5/24/2016,Standard Class,BN-11515,Bradley Nguyen,Consumer,United States,New York City,New York,10011,East,Furniture,Furnishings,"DAX Value U-Channel Document Frames, Easel Back",39.76,8,0.0,12.3256,2016-05-19,2016-05-24
5/19/2016,5/24/2016,Standard Class,BN-11515,Bradley Nguyen,Consumer,United States,New York City,New York,10011,East,Office Supplies,Binders,Recycled Easel Ring Binders,47.744,4,0.2,14.92,2016-05-19,2016-05-24
12/20/2015,12/25/2015,Standard Class,KD-16345,Katherine Ducich,Consumer,United States,Chicago,Illinois,60623,Central,Technology,Phones,Apple iPhone 5C,159.984,2,0.2,11.9988,2015-12-20,2015-12-25
12/20/2015,12/25/2015,Standard Class,KD-16345,Katherine Ducich,Consumer,United States,Chicago,Illinois,60623,Central,Technology,Accessories,Logitech G600 MMO Gaming Mouse,255.968,4,0.2,51.1936,2015-12-20,2015-12-25
12/20/2015,12/25/2015,Standard Class,KD-16345,Katherine Ducich,Consumer,United States,Chicago,Illinois,60623,Central,Furniture,Bookcases,"Sauder Facets Collection Library, Sky Alder Finish",359.058,3,0.3,-71.8116,2015-12-20,2015-12-25
12/19/2015,12/20/2015,First Class,JK-15370,Jay Kimmel,Consumer,United States,Philadelphia,Pennsylvania,19143,East,Office Supplies,Appliances,Avanti 4.4 Cu. Ft. Refrigerator,434.352,3,0.2,43.4352,2015-12-19,2015-12-20
12/19/2015,12/20/2015,First Class,JK-15370,Jay Kimmel,Consumer,United States,Philadelphia,Pennsylvania,19143,East,Office Supplies,Appliances,Hoover Replacement Belt for Commercial Guardsman Heavy-Duty Upright Vacuum,3.552,2,0.2,0.444,2015-12-19,2015-12-20
12/19/2015,12/20/2015,First Class,JK-15370,Jay Kimmel,Consumer,United States,Philadelphia,Pennsylvania,19143,East,Office Supplies,Appliances,Fellowes Advanced 8 Outlet Surge Suppressor with Phone/Fax Protection,88.832,4,0.2,7.7728,2015-12-19,2015-12-20
4/29/2017,5/4/2017,Second Class,FM-14215,Filia McAdams,Corporate,United States,Dublin,Ohio,43017,East,Furniture,Tables,"SAFCO PlanMaster Heigh-Adjustable Drafting Table Base, 43w x 30d x 30-37h, Black",1048.35,5,0.4,-69.89,2017-04-29,2017-05-04
2/7/2016,2/7/2016,Same Day,CA-12265,Christina Anderson,Consumer,United States,Springfield,Virginia,22153,South,Technology,Accessories,Micro Innovations USB RF Wireless Keyboard with Mouse,100.0,4,0.0,21.0,2016-02-07,2016-02-07
2/7/2016,2/7/2016,Same Day,CA-12265,Christina Anderson,Consumer,United States,Springfield,Virginia,22153,South,Office Supplies,Labels,Permanent Self-Adhesive File Folder Labels for Typewriters by Universal,7.83,3,0.0,3.6018,2016-02-07,2016-02-07
9/28/2014,10/3/2014,Standard Class,KD-16495,Keith Dawkins,Corporate,United States,Fayetteville,North Carolina,28314,South,Office Supplies,Paper,White GlueTop Scratch Pads,96.256,8,0.2,31.2832,2014-09-28,2014-10-03
9/28/2014,10/3/2014,Standard Class,KD-16495,Keith Dawkins,Corporate,United States,Fayetteville,North Carolina,28314,South,Office Supplies,Paper,Xerox 195,10.688,2,0.2,3.7408,2014-09-28,2014-10-03
7/10/2016,7/14/2016,Standard Class,LH-17155,Logan Haushalter,Consumer,United States,Dallas,Texas,75081,Central,Office Supplies,Storage,"Fellowes Strictly Business Drawer File, Letter/Legal Size",338.04,3,0.2,-33.804,2016-07-10,2016-07-14
7/10/2016,7/14/2016,Standard Class,LH-17155,Logan Haushalter,Consumer,United States,Dallas,Texas,75081,Central,Office Supplies,Art,Boston Heavy-Duty Trimline Electric Pencil Sharpeners,154.24,4,0.2,17.352,2016-07-10,2016-07-14
7/29/2017,8/1/2017,Second Class,AG-10675,Anna Gayman,Consumer,United States,Jacksonville,North Carolina,28540,South,Office Supplies,Appliances,Holmes HEPA Air Purifier,34.848,2,0.2,6.534,2017-07-29,2017-08-01
7/29/2017,8/1/2017,Second Class,AG-10675,Anna Gayman,Consumer,United States,Jacksonville,North Carolina,28540,South,Technology,Phones,Samsung Replacement EH64AVFWE Premium Headset,22.0,5,0.2,1.375,2017-07-29,2017-08-01
7/29/2017,8/1/2017,Second Class,AG-10675,Anna Gayman,Consumer,United States,Jacksonville,North Carolina,28540,South,Office Supplies,Art,Newell 322,4.368,3,0.2,0.3822,2017-07-29,2017-08-01
9/3/2015,9/9/2015,Standard Class,DB-13120,David Bremer,Corporate,United States,San Francisco,California,94122,West,Office Supplies,Storage,Sterilite Officeware Hinged File Box,31.44,3,0.0,8.4888,2015-09-03,2015-09-09
9/3/2015,9/9/2015,Standard Class,DB-13120,David Bremer,Corporate,United States,San Francisco,California,94122,West,Technology,Accessories,Kingston Digital DataTraveler 16GB USB 2.0,17.9,2,0.0,3.401,2015-09-03,2015-09-09
9/3/2015,9/9/2015,Standard Class,DB-13120,David Bremer,Corporate,United States,San Francisco,California,94122,West,Technology,Accessories,"TRENDnet 56K USB 2.0 Phone, Internet and Fax Modem",129.45,5,0.0,46.602,2015-09-03,2015-09-09
8/9/2014,8/16/2014,Standard Class,ED-13885,Emily Ducich,Home Office,United States,San Diego,California,92037,West,Office Supplies,Labels,Avery 494,20.88,8,0.0,9.6048,2014-08-09,2014-08-16
10/30/2017,11/3/2017,Standard Class,MC-18100,Mick Crebagga,Consumer,United States,Philadelphia,Pennsylvania,19140,East,Office Supplies,Paper,Xerox 231,20.736,4,0.2,7.2576,2017-10-30,2017-11-03
10/30/2017,11/3/2017,Standard Class,MC-18100,Mick Crebagga,Consumer,United States,Philadelphia,Pennsylvania,19140,East,Furniture,Furnishings,"Stacking Tray, Side-Loading, Legal, Smoke",7.168,2,0.2,0.9856,2017-10-30,2017-11-03
10/30/2017,11/3/2017,Standard Class,MC-18100,Mick Crebagga,Consumer,United States,Philadelphia,Pennsylvania,19140,East,Office Supplies,Storage,Eldon Shelf Savers Cubes and Bins,11.168,2,0.2,-2.5128,2017-10-30,2017-11-03
10/30/2017,11/3/2017,Standard Class,MC-18100,Mick Crebagga,Consumer,United States,Philadelphia,Pennsylvania,19140,East,Technology,Accessories,First Data FD10 PIN Pad,442.4,7,0.2,-55.3,2017-10-30,2017-11-03
6/6/2014,6/9/2014,First Class,BM-11785,Bryan Mills,Consumer,United States,Rochester,New York,14609,East,Office Supplies,Art,Sanford Liquid Accent Highlighters,13.36,2,0.0,4.9432,2014-06-06,2014-06-09
8/13/2016,8/17/2016,Second Class,EM-14065,Erin Mull,Consumer,United States,Jacksonville,North Carolina,28540,South,Office Supplies,Binders,Acco Translucent Poly Ring Binders,11.232,8,0.7,-8.2368,2016-08-13,2016-08-17
8/13/2016,8/17/2016,Second Class,EM-14065,Erin Mull,Consumer,United States,Jacksonville,North Carolina,28540,South,Office Supplies,Paper,Easy-staple paper,10.272,3,0.2,3.21,2016-08-13,2016-08-17
4/25/2014,4/29/2014,Standard Class,DA-13450,Dianna Arnett,Home Office,United States,Houston,Texas,77095,Central,Office Supplies,Paper,Xerox 1985,10.368,2,0.2,3.6288,2014-04-25,2014-04-29
4/25/2014,4/29/2014,Standard Class,DA-13450,Dianna Arnett,Home Office,United States,Houston,Texas,77095,Central,Office Supplies,Art,12 Colored Short Pencils,6.24,3,0.2,0.546,2014-04-25,2014-04-29
11/22/2015,11/27/2015,Standard Class,MO-17800,Meg O'Connel,Home Office,United States,San Antonio,Texas,78207,Central,Furniture,Tables,Hon 2111 Invitation Series Straight Table,206.962,2,0.3,-32.5226,2015-11-22,2015-11-27
10/14/2017,10/17/2017,First Class,JW-15955,Joni Wasserman,Consumer,United States,Oakland,California,94601,West,Furniture,Furnishings,C-Line Cubicle Keepers Polyproplyene Holder With Velcro Backings,9.46,2,0.0,3.6894,2017-10-14,2017-10-17
12/2/2017,12/5/2017,First Class,VW-21775,Victoria Wilson,Corporate,United States,San Francisco,California,94122,West,Office Supplies,Storage,"Fellowes Mobile File Cart, Black",559.62,9,0.0,151.0974,2017-12-02,2017-12-05
12/2/2017,12/5/2017,First Class,VW-21775,Victoria Wilson,Corporate,United States,San Francisco,California,94122,West,Office Supplies,Paper,Xerox 1940,109.92,2,0.0,53.8608,2017-12-02,2017-12-05
12/2/2017,12/5/2017,First Class,VW-21775,Victoria Wilson,Corporate,United States,San Francisco,California,94122,West,Office Supplies,Paper,Xerox 1962,8.56,2,0.0,3.852,2017-12-02,2017-12-05
12/8/2015,12/11/2015,Second Class,TT-21460,Tonja Turnell,Home Office,United States,Fort Worth,Texas,76106,Central,Office Supplies,Paper,Xerox 1945,360.712,11,0.2,130.7581,2015-12-08,2015-12-11
12/8/2015,12/11/2015,Second Class,TT-21460,Tonja Turnell,Home Office,United States,Fort Worth,Texas,76106,Central,Technology,Phones,Wilson Electronics DB Pro Signal Booster,1718.4,6,0.2,150.36,2015-12-08,2015-12-11
7/13/2015,7/15/2015,First Class,SL-20155,Sara Luxemburg,Home Office,United States,Houston,Texas,77095,Central,Office Supplies,Binders,Wilson Jones Heavy-Duty Casebound Ring Binders with Metal Hinges,41.568,6,0.8,-66.5088,2015-07-13,2015-07-15
5/11/2014,5/17/2014,Standard Class,RM-19375,Raymond Messe,Consumer,United States,Houston,Texas,77095,Central,Technology,Accessories,Logitech ClearChat Comfort/USB Headset H390,46.864,2,0.2,7.6154,2014-05-11,2014-05-17
1/5/2014,1/12/2014,Standard Class,MB-18085,Mick Brown,Consumer,United States,Philadelphia,Pennsylvania,19143,East,Office Supplies,Art,"Avery Hi-Liter EverBold Pen Style Fluorescent Highlighters, 4/Pack",19.536,3,0.2,4.884,2014-01-05,2014-01-12
9/5/2015,9/9/2015,Standard Class,AG-10900,Arthur Gainer,Consumer,United States,San Diego,California,92105,West,Furniture,Bookcases,"Sauder Camden County Barrister Bookcase, Planked Cherry Finish",411.332,4,0.15,-4.8392,2015-09-05,2015-09-09
9/5/2015,9/9/2015,Standard Class,AG-10900,Arthur Gainer,Consumer,United States,San Diego,California,92105,West,Office Supplies,Binders,"DXL Angle-View Binders with Locking Rings, Black",28.752,6,0.2,9.7038,2015-09-05,2015-09-09
9/5/2015,9/9/2015,Standard Class,AG-10900,Arthur Gainer,Consumer,United States,San Diego,California,92105,West,Furniture,Bookcases,"Sauder Camden County Collection Libraries, Planked Cherry Finish",293.199,3,0.15,-20.6964,2015-09-05,2015-09-09
8/4/2016,8/8/2016,Standard Class,ML-17755,Max Ludwig,Home Office,United States,Suffolk,Virginia,23434,South,Office Supplies,Supplies,"Acme 10"" Easy Grip Assistive Scissors",35.06,2,0.0,10.518,2016-08-04,2016-08-08
8/4/2016,8/8/2016,Standard Class,ML-17755,Max Ludwig,Home Office,United States,Suffolk,Virginia,23434,South,Office Supplies,Labels,Avery 476,4.13,1,0.0,1.8998,2016-08-04,2016-08-08
8/4/2016,8/8/2016,Standard Class,ML-17755,Max Ludwig,Home Office,United States,Suffolk,Virginia,23434,South,Furniture,Furnishings,Advantus Panel Wall Certificate Holder - 8.5x11,109.8,9,0.0,46.116,2016-08-04,2016-08-08
8/4/2016,8/8/2016,Standard Class,ML-17755,Max Ludwig,Home Office,United States,Suffolk,Virginia,23434,South,Office Supplies,Labels,Avery 478,9.82,2,0.0,4.8118,2016-08-04,2016-08-08
3/22/2014,3/26/2014,Standard Class,CC-12685,Craig Carroll,Consumer,United States,Greensboro,North Carolina,27405,South,Office Supplies,Binders,"C-Line Peel & Stick Add-On Filing Pockets, 8-3/4 x 5-1/8, 10/Pack",7.644,4,0.7,-5.8604,2014-03-22,2014-03-26
3/22/2014,3/26/2014,Standard Class,CC-12685,Craig Carroll,Consumer,United States,Greensboro,North Carolina,27405,South,Office Supplies,Binders,GBC Prestige Therm-A-Bind Covers,51.465,5,0.7,-39.4565,2014-03-22,2014-03-26
3/2/2017,3/8/2017,Standard Class,SC-20770,Stewart Carmichael,Corporate,United States,Dallas,Texas,75081,Central,Office Supplies,Supplies,Staple remover,6.976,4,0.2,-1.3952,2017-03-02,2017-03-08
3/2/2017,3/8/2017,Standard Class,SC-20770,Stewart Carmichael,Corporate,United States,Dallas,Texas,75081,Central,Office Supplies,Binders,Wilson Jones Leather-Like Binders with DublLock Round Rings,12.222,7,0.8,-20.1663,2017-03-02,2017-03-08
11/27/2016,11/29/2016,Second Class,GG-14650,Greg Guthrie,Corporate,United States,Chicago,Illinois,60623,Central,Office Supplies,Storage,"SAFCO Commercial Wire Shelving, 72h",97.984,2,0.2,-24.496,2016-11-27,2016-11-29
11/27/2016,11/29/2016,Second Class,GG-14650,Greg Guthrie,Corporate,United States,Chicago,Illinois,60623,Central,Technology,Accessories,Memorex Micro Travel Drive 8 GB,62.4,6,0.2,19.5,2016-11-27,2016-11-29
4/28/2014,5/3/2014,Standard Class,MY-18295,Muhammed Yedwab,Corporate,United States,Baltimore,Maryland,21215,East,Office Supplies,Binders,"Acco Data Flex Cable Posts For Top & Bottom Load Binders, 6"" Capacity",20.86,2,0.0,9.387,2014-04-28,2014-05-03
4/28/2014,5/3/2014,Standard Class,MY-18295,Muhammed Yedwab,Corporate,United States,Baltimore,Maryland,21215,East,Office Supplies,Storage,Recycled Steel Personal File for Standard File Folders,497.61,9,0.0,129.3786,2014-04-28,2014-05-03
4/28/2014,5/3/2014,Standard Class,MY-18295,Muhammed Yedwab,Corporate,United States,Baltimore,Maryland,21215,East,Office Supplies,Art,Blackstonian Pencils,5.34,2,0.0,1.4952,2014-04-28,2014-05-03
4/28/2014,5/3/2014,Standard Class,MY-18295,Muhammed Yedwab,Corporate,United States,Baltimore,Maryland,21215,East,Office Supplies,Labels,Avery 488,3.15,1,0.0,1.512,2014-04-28,2014-05-03
11/24/2015,11/28/2015,Standard Class,DP-13000,Darren Powers,Consumer,United States,Los Angeles,California,90004,West,Office Supplies,Paper,Xerox 1919,368.91,9,0.0,180.7659,2015-11-24,2015-11-28
11/24/2015,11/28/2015,Standard Class,DP-13000,Darren Powers,Consumer,United States,Los Angeles,California,90004,West,Office Supplies,Art,Prang Colored Pencils,14.7,5,0.0,6.615,2015-11-24,2015-11-28
11/11/2016,11/16/2016,Standard Class,BD-11770,Bryan Davis,Consumer,United States,New York City,New York,10011,East,Technology,Accessories,Micropad Numeric Keypads,59.97,3,0.0,14.9925,2016-11-11,2016-11-16
11/11/2016,11/16/2016,Standard Class,BD-11770,Bryan Davis,Consumer,United States,New York City,New York,10011,East,Office Supplies,Storage,Safco Steel Mobile File Cart,83.36,1,0.0,20.84,2016-11-11,2016-11-16
7/9/2015,7/13/2015,Standard Class,CB-12535,Claudia Bergmann,Corporate,United States,Franklin,Massachusetts,2038,East,Office Supplies,Paper,Tops Wirebound Message Log Books,6.58,2,0.0,3.0268,2015-07-09,2015-07-13
7/9/2015,7/13/2015,Standard Class,CB-12535,Claudia Bergmann,Corporate,United States,Franklin,Massachusetts,2038,East,Office Supplies,Binders,"Wilson Jones Ledger-Size, Piano-Hinge Binder, 2"", Blue",122.94,3,0.0,59.0112,2015-07-09,2015-07-13
9/22/2017,9/26/2017,Standard Class,JE-15610,Jim Epp,Corporate,United States,Milwaukee,Wisconsin,53209,Central,Office Supplies,Paper,Xerox 1940,219.84,4,0.0,107.7216,2017-09-22,2017-09-26
9/22/2017,9/26/2017,Standard Class,JE-15610,Jim Epp,Corporate,United States,Milwaukee,Wisconsin,53209,Central,Technology,Accessories,Logitech Desktop MK120 Mouse and keyboard Combo,98.16,6,0.0,9.816,2017-09-22,2017-09-26
9/22/2017,9/26/2017,Standard Class,JE-15610,Jim Epp,Corporate,United States,Milwaukee,Wisconsin,53209,Central,Office Supplies,Binders,ACCOHIDE Binder by Acco,33.04,8,0.0,15.5288,2017-09-22,2017-09-26
9/22/2017,9/26/2017,Standard Class,JE-15610,Jim Epp,Corporate,United States,Milwaukee,Wisconsin,53209,Central,Technology,Phones,AT&T CL82213,86.97,3,0.0,25.2213,2017-09-22,2017-09-26
2/15/2015,2/19/2015,Standard Class,RP-19855,Roy Phan,Corporate,United States,Kenosha,Wisconsin,53142,Central,Technology,Phones,Innergie mMini Combo Duo USB Travel Charging Kit,134.97,3,0.0,64.7856,2015-02-15,2015-02-19
2/15/2015,2/19/2015,Standard Class,RP-19855,Roy Phan,Corporate,United States,Kenosha,Wisconsin,53142,Central,Technology,Phones,Samsung Galaxy S III - 16GB - pebble blue (T-Mobile),699.98,2,0.0,195.9944,2015-02-15,2015-02-19
2/15/2015,2/19/2015,Standard Class,RP-19855,Roy Phan,Corporate,United States,Kenosha,Wisconsin,53142,Central,Technology,Accessories,Maxell LTO Ultrium - 800 GB,139.95,5,0.0,26.5905,2015-02-15,2015-02-19
9/30/2014,10/4/2014,Standard Class,RA-19915,Russell Applegate,Consumer,United States,New York City,New York,10011,East,Office Supplies,Paper,Tops Green Bar Computer Printout Paper,48.94,1,0.0,24.47,2014-09-30,2014-10-04
12/1/2014,12/3/2014,First Class,RP-19390,Resi Pölking,Consumer,United States,Madison,Wisconsin,53711,Central,Furniture,Chairs,Office Star - Professional Matrix Back Chair with 2-to-1 Synchro Tilt and Mesh Fabric Seat,2807.84,8,0.0,673.8816,2014-12-01,2014-12-03
12/1/2014,12/3/2014,First Class,RP-19390,Resi Pölking,Consumer,United States,Madison,Wisconsin,53711,Central,Office Supplies,Art,"Hunt BOSTON Vista Battery-Operated Pencil Sharpener, Black",46.64,4,0.0,12.5928,2014-12-01,2014-12-03
12/8/2014,12/13/2014,Standard Class,TB-21175,Thomas Boland,Corporate,United States,Houston,Texas,77041,Central,Office Supplies,Storage,"Companion Letter/Legal File, Black",60.416,2,0.2,6.0416,2014-12-08,2014-12-13
9/5/2016,9/10/2016,Standard Class,BE-11455,Brad Eason,Home Office,United States,Olathe,Kansas,66062,Central,Office Supplies,Art,Panasonic KP-380BK Classic Electric Pencil Sharpener,107.94,3,0.0,26.985,2016-09-05,2016-09-10
8/27/2017,8/30/2017,First Class,MR-17545,Mathew Reese,Home Office,United States,New York City,New York,10024,East,Office Supplies,Storage,Iris Project Case,63.84,8,0.0,16.5984,2017-08-27,2017-08-30
8/27/2017,8/30/2017,First Class,MR-17545,Mathew Reese,Home Office,United States,New York City,New York,10024,East,Technology,Phones,GE 30522EE2,347.97,3,0.0,100.9113,2017-08-27,2017-08-30
8/27/2017,8/30/2017,First Class,MR-17545,Mathew Reese,Home Office,United States,New York City,New York,10024,East,Office Supplies,Binders,DXL Angle-View Binders with Locking Rings by Samsill,37.008,6,0.2,11.565,2017-08-27,2017-08-30
7/7/2016,7/11/2016,Standard Class,RM-19375,Raymond Messe,Consumer,United States,San Jose,California,95123,West,Furniture,Furnishings,"Howard Miller 11-1/2"" Diameter Grantwood Wall Clock",215.65,5,0.0,73.321,2016-07-07,2016-07-11
8/8/2016,8/10/2016,Second Class,JF-15565,Jill Fjeld,Consumer,United States,Dallas,Texas,75081,Central,Office Supplies,Fasteners,OIC Bulk Pack Metal Binder Clips,11.168,4,0.2,3.6296,2016-08-08,2016-08-10
8/8/2016,8/10/2016,Second Class,JF-15565,Jill Fjeld,Consumer,United States,Dallas,Texas,75081,Central,Office Supplies,Paper,"Ink Jet Note and Greeting Cards, 8-1/2"" x 5-1/2"" Card Size",53.952,3,0.2,17.5344,2016-08-08,2016-08-10
11/13/2016,11/19/2016,Standard Class,AS-10135,Adrian Shami,Home Office,United States,Auburn,Washington,98002,West,Furniture,Furnishings,"Eldon Image Series Desk Accessories, Burgundy",4.18,1,0.0,1.5048,2016-11-13,2016-11-19
9/22/2017,9/26/2017,Second Class,JA-15970,Joseph Airdo,Consumer,United States,Philadelphia,Pennsylvania,19134,East,Office Supplies,Binders,Clear Mylar Reinforcing Strips,5.607,1,0.7,-4.2987,2017-09-22,2017-09-26
9/22/2017,9/26/2017,Second Class,JA-15970,Joseph Airdo,Consumer,United States,Philadelphia,Pennsylvania,19134,East,Office Supplies,Supplies,Martin Yale Chadless Opener Electric Letter Opener,4663.736,7,0.2,-1049.3406,2017-09-22,2017-09-26
9/22/2017,9/26/2017,Second Class,JA-15970,Joseph Airdo,Consumer,United States,Philadelphia,Pennsylvania,19134,East,Technology,Accessories,Logitech Wireless Marathon Mouse M705,79.984,2,0.2,22.9954,2017-09-22,2017-09-26
12/25/2016,12/28/2016,First Class,GK-14620,Grace Kelly,Corporate,United States,Los Angeles,California,90049,West,Technology,Phones,Samsung Galaxy Note 2,2575.944,7,0.2,257.5944,2016-12-25,2016-12-28
12/25/2016,12/28/2016,First Class,GK-14620,Grace Kelly,Corporate,United States,Los Angeles,California,90049,West,Office Supplies,Paper,Xerox 225,45.36,7,0.0,21.7728,2016-12-25,2016-12-28
12/25/2016,12/28/2016,First Class,GK-14620,Grace Kelly,Corporate,United States,Los Angeles,California,90049,West,Technology,Accessories,SanDisk Cruzer 64 GB USB Flash Drive,254.24,7,0.0,76.272,2016-12-25,2016-12-28
2/11/2016,2/13/2016,First Class,PB-19210,Phillip Breyer,Corporate,United States,Tulsa,Oklahoma,74133,Central,Technology,Phones,Mediabridge Sport Armband iPhone 5s,69.93,7,0.0,0.6993,2016-02-11,2016-02-13
10/23/2016,10/29/2016,Standard Class,HK-14890,Heather Kirkland,Corporate,United States,Chicago,Illinois,60610,Central,Furniture,Furnishings,DAX Cubicle Frames - 8x10,16.156,7,0.6,-12.117,2016-10-23,2016-10-29
10/23/2016,10/29/2016,Standard Class,HK-14890,Heather Kirkland,Corporate,United States,Chicago,Illinois,60610,Central,Office Supplies,Paper,Xerox 1929,54.816,3,0.2,17.8152,2016-10-23,2016-10-29
6/9/2014,6/11/2014,Second Class,FO-14305,Frank Olsen,Consumer,United States,Harrisonburg,Virginia,22801,South,Furniture,Tables,Bevis 44 x 96 Conference Tables,1441.3,7,0.0,245.021,2014-06-09,2014-06-11
11/20/2017,11/26/2017,Standard Class,BT-11680,Brian Thompson,Consumer,United States,Newark,Ohio,43055,East,Furniture,Furnishings,"Floodlight Indoor Halogen Bulbs, 1 Bulb per Pack, 60 Watts",77.6,5,0.2,28.13,2017-11-20,2017-11-26
11/20/2017,11/26/2017,Standard Class,BT-11680,Brian Thompson,Consumer,United States,Newark,Ohio,43055,East,Furniture,Furnishings,"GE General Purpose, Extra Long Life, Showcase & Floodlight Incandescent Bulbs",4.656,2,0.2,1.5714,2017-11-20,2017-11-26
9/14/2015,9/18/2015,Standard Class,SP-20620,Stefania Perrino,Corporate,United States,Los Angeles,California,90045,West,Furniture,Tables,KI Conference Tables,170.136,3,0.2,-8.5068,2015-09-14,2015-09-18
6/4/2015,6/4/2015,Same Day,LL-16840,Lauren Leatherbury,Consumer,United States,Seattle,Washington,98105,West,Office Supplies,Labels,Avery 501,7.38,2,0.0,3.4686,2015-06-04,2015-06-04
6/4/2015,6/4/2015,Same Day,LL-16840,Lauren Leatherbury,Consumer,United States,Seattle,Washington,98105,West,Office Supplies,Art,"Binney & Smith Crayola Metallic Colored Pencils, 8-Color Set",9.26,2,0.0,3.0558,2015-06-04,2015-06-04
12/13/2015,12/15/2015,Second Class,MC-17575,Matt Collins,Consumer,United States,Los Angeles,California,90036,West,Office Supplies,Labels,Avery 513,9.96,2,0.0,4.5816,2015-12-13,2015-12-15
5/25/2014,5/29/2014,Standard Class,JL-15235,Janet Lee,Consumer,United States,Chicago,Illinois,60623,Central,Office Supplies,Appliances,Harmony Air Purifier,75.6,2,0.8,-166.32,2014-05-25,2014-05-29
5/25/2014,5/29/2014,Standard Class,JL-15235,Janet Lee,Consumer,United States,Chicago,Illinois,60623,Central,Furniture,Furnishings,"Electrix Incandescent Magnifying Lamp, Black",29.32,2,0.6,-24.189,2014-05-25,2014-05-29
2/16/2016,2/20/2016,Standard Class,EA-14035,Erin Ashbrook,Corporate,United States,Chicago,Illinois,60623,Central,Office Supplies,Appliances,Honeywell Enviracaire Portable Air Cleaner for up to 8 x 10 Room,92.064,6,0.8,-225.5568,2016-02-16,2016-02-20
2/16/2016,2/20/2016,Standard Class,EA-14035,Erin Ashbrook,Corporate,United States,Chicago,Illinois,60623,Central,Office Supplies,Fasteners,Advantus Push Pins,6.976,4,0.2,1.8312,2016-02-16,2016-02-20
2/16/2016,2/20/2016,Standard Class,EA-14035,Erin Ashbrook,Corporate,United States,Chicago,Illinois,60623,Central,Furniture,Chairs,"Global Stack Chair with Arms, Black",62.958,3,0.3,-2.6982,2016-02-16,2016-02-20
2/16/2016,2/20/2016,Standard Class,EA-14035,Erin Ashbrook,Corporate,United States,Chicago,Illinois,60623,Central,Office Supplies,Paper,Xerox 206,5.184,1,0.2,1.8144,2016-02-16,2016-02-20
12/22/2016,12/28/2016,Standard Class,SA-20830,Sue Ann Reed,Consumer,United States,Redmond,Oregon,97756,West,Office Supplies,Binders,"Avery 3 1/2"" Diskette Storage Pages, 10/Pack",31.32,10,0.7,-25.056,2016-12-22,2016-12-28
12/22/2016,12/28/2016,Standard Class,SA-20830,Sue Ann Reed,Consumer,United States,Redmond,Oregon,97756,West,Furniture,Furnishings,3M Hangers With Command Adhesive,11.84,4,0.2,3.108,2016-12-22,2016-12-28
12/22/2016,12/28/2016,Standard Class,SA-20830,Sue Ann Reed,Consumer,United States,Redmond,Oregon,97756,West,Furniture,Furnishings,"Seth Thomas 14"" Day/Date Wall Clock",22.784,1,0.2,4.8416,2016-12-22,2016-12-28
2/8/2016,2/11/2016,Second Class,CH-12070,Cathy Hwang,Home Office,United States,Raleigh,North Carolina,27604,South,Technology,Phones,Samsung Galaxy S4 Mini,1127.976,3,0.2,126.8973,2016-02-08,2016-02-11
7/13/2015,7/15/2015,Second Class,ND-18460,Neil Ducich,Corporate,United States,Macon,Georgia,31204,South,Office Supplies,Paper,Xerox 1931,38.88,6,0.0,18.6624,2015-07-13,2015-07-15
5/18/2014,5/24/2014,Standard Class,BS-11755,Bruce Stewart,Consumer,United States,Cleveland,Ohio,44105,East,Technology,Phones,Apple iPhone 5,779.796,2,0.4,-168.9558,2014-05-18,2014-05-24
10/21/2017,10/21/2017,Same Day,SL-20155,Sara Luxemburg,Home Office,United States,Muskogee,Oklahoma,74403,Central,Technology,Phones,Polycom VVX 310 VoIP phone,1439.92,8,0.0,374.3792,2017-10-21,2017-10-21
10/21/2017,10/21/2017,Same Day,SL-20155,Sara Luxemburg,Home Office,United States,Muskogee,Oklahoma,74403,Central,Furniture,Tables,Bevis Boat-Shaped Conference Table,262.11,1,0.0,62.9064,2017-10-21,2017-10-21
11/5/2015,11/9/2015,Standard Class,GB-14530,George Bell,Corporate,United States,Monroe,North Carolina,28110,South,Furniture,Chairs,Harbour Creations Steel Folding Chair,207.0,3,0.2,25.875,2015-11-05,2015-11-09
8/1/2017,8/7/2017,Standard Class,AS-10045,Aaron Smayling,Corporate,United States,Austin,Texas,78745,Central,Technology,Machines,Bady BDG101FRU Card Printer,1439.982,3,0.4,-263.9967,2017-08-01,2017-08-07
8/1/2017,8/7/2017,Standard Class,AS-10045,Aaron Smayling,Corporate,United States,Austin,Texas,78745,Central,Office Supplies,Paper,Xerox 1998,36.288,7,0.2,12.7008,2017-08-01,2017-08-07
6/21/2014,6/24/2014,First Class,RM-19375,Raymond Messe,Consumer,United States,Meriden,Connecticut,6450,East,Office Supplies,Art,Newell 341,21.4,5,0.0,6.206,2014-06-21,2014-06-24
2/19/2017,2/21/2017,Second Class,NH-18610,Nicole Hansen,Corporate,United States,Roswell,Georgia,30076,South,Office Supplies,Appliances,Kensington 7 Outlet MasterPiece Power Center,1245.86,7,0.0,361.2994,2017-02-19,2017-02-21
8/1/2014,8/5/2014,Standard Class,BF-10975,Barbara Fisher,Corporate,United States,Charlotte,North Carolina,28205,South,Office Supplies,Labels,Self-Adhesive Address Labels for Typewriters by Universal,17.544,3,0.2,5.9211,2014-08-01,2014-08-05
8/1/2014,8/5/2014,Standard Class,BF-10975,Barbara Fisher,Corporate,United States,Charlotte,North Carolina,28205,South,Furniture,Furnishings,9-3/4 Diameter Round Wall Clock,44.128,4,0.2,12.1352,2014-08-01,2014-08-05
8/1/2014,8/5/2014,Standard Class,BF-10975,Barbara Fisher,Corporate,United States,Charlotte,North Carolina,28205,South,Office Supplies,Appliances,Honeywell Quietcare HEPA Air Cleaner,62.92,1,0.2,10.2245,2014-08-01,2014-08-05
8/1/2014,8/5/2014,Standard Class,BF-10975,Barbara Fisher,Corporate,United States,Charlotte,North Carolina,28205,South,Office Supplies,Paper,Xerox 1916,78.304,2,0.2,29.364,2014-08-01,2014-08-05
7/18/2016,7/23/2016,Standard Class,KH-16330,Katharine Harms,Corporate,United States,Bowling Green,Kentucky,42104,South,Furniture,Chairs,Hon Olson Stacker Stools,140.81,1,0.0,39.4268,2016-07-18,2016-07-23
2/9/2015,2/11/2015,Second Class,FA-14230,Frank Atkinson,Corporate,United States,San Antonio,Texas,78207,Central,Office Supplies,Labels,Round Specialty Laser Printer Labels,40.096,4,0.2,13.5324,2015-02-09,2015-02-11
2/9/2015,2/11/2015,Second Class,FA-14230,Frank Atkinson,Corporate,United States,San Antonio,Texas,78207,Central,Furniture,Furnishings,"Dana Fluorescent Magnifying Lamp, White, 36""",40.784,2,0.6,-30.588,2015-02-09,2015-02-11
7/29/2017,8/2/2017,Standard Class,GW-14605,Giulietta Weimer,Consumer,United States,Seattle,Washington,98115,West,Technology,Accessories,Imation 8GB Mini TravelDrive USB 2.0 Flash Drive,90.57,3,0.0,11.7741,2017-07-29,2017-08-02
1/12/2017,1/17/2017,Second Class,DA-13450,Dianna Arnett,Home Office,United States,Washington,District of Columbia,20016,East,Office Supplies,Paper,Xerox 195,40.08,6,0.0,19.2384,2017-01-12,2017-01-17
1/12/2017,1/17/2017,Second Class,DA-13450,Dianna Arnett,Home Office,United States,Washington,District of Columbia,20016,East,Furniture,Furnishings,Flat Face Poster Frame,37.68,2,0.0,15.8256,2017-01-12,2017-01-17
9/10/2017,9/10/2017,Same Day,FH-14275,Frank Hawley,Corporate,United States,Los Angeles,California,90004,West,Furniture,Chairs,DMI Arturo Collection Mission-style Design Wood Chair,362.352,3,0.2,27.1764,2017-09-10,2017-09-10
9/10/2017,9/10/2017,Same Day,FH-14275,Frank Hawley,Corporate,United States,Los Angeles,California,90004,West,Office Supplies,Binders,Avery Non-Stick Binders,7.184,2,0.2,2.245,2017-09-10,2017-09-10
7/20/2015,7/25/2015,Second Class,RK-19300,Ralph Kennedy,Consumer,United States,South Bend,Indiana,46614,Central,Office Supplies,Storage,"Multi-Use Personal File Cart and Caster Set, Three Stacking Bins",34.76,1,0.0,9.7328,2015-07-20,2015-07-25
7/20/2015,7/25/2015,Second Class,RK-19300,Ralph Kennedy,Consumer,United States,South Bend,Indiana,46614,Central,Technology,Accessories,Imation Bio 8GB USB Flash Drive Imation Corp,831.2,5,0.0,124.68,2015-07-20,2015-07-25
7/20/2015,7/25/2015,Second Class,RK-19300,Ralph Kennedy,Consumer,United States,South Bend,Indiana,46614,Central,Office Supplies,Paper,Xerox 1981,26.4,5,0.0,11.88,2015-07-20,2015-07-25
7/20/2015,7/25/2015,Second Class,RK-19300,Ralph Kennedy,Consumer,United States,South Bend,Indiana,46614,Central,Office Supplies,Envelopes,"White Envelopes, White Envelopes with Clear Poly Window",106.75,7,0.0,49.105,2015-07-20,2015-07-25
7/20/2015,7/25/2015,Second Class,RK-19300,Ralph Kennedy,Consumer,United States,South Bend,Indiana,46614,Central,Office Supplies,Paper,Tops White Computer Printout Paper,97.82,2,0.0,45.9754,2015-07-20,2015-07-25
7/20/2015,7/25/2015,Second Class,RK-19300,Ralph Kennedy,Consumer,United States,South Bend,Indiana,46614,Central,Office Supplies,Storage,Eldon Portable Mobile Manager,141.4,5,0.0,38.178,2015-07-20,2015-07-25
6/13/2014,6/17/2014,Standard Class,FM-14215,Filia McAdams,Corporate,United States,Los Angeles,California,90032,West,Office Supplies,Art,Staples in misc. colors,14.52,3,0.0,4.7916,2014-06-13,2014-06-17
5/12/2017,5/15/2017,Second Class,AC-10420,Alyssa Crouse,Corporate,United States,Houston,Texas,77041,Central,Office Supplies,Storage,Fellowes Bankers Box Stor/Drawer Steel Plus,127.92,5,0.2,-15.99,2017-05-12,2017-05-15
5/12/2017,5/15/2017,Second Class,AC-10420,Alyssa Crouse,Corporate,United States,Houston,Texas,77041,Central,Office Supplies,Binders,"Wilson Jones Elliptical Ring 3 1/2"" Capacity Binders, 800 sheets",34.24,4,0.8,-53.072,2017-05-12,2017-05-15
9/3/2015,9/5/2015,First Class,JB-15400,Jennifer Braxton,Corporate,United States,Bristol,Connecticut,6010,East,Office Supplies,Appliances,"Holmes Replacement Filter for HEPA Air Cleaner, Very Large Room, HEPA Filter",137.62,2,0.0,60.5528,2015-09-03,2015-09-05
9/3/2015,9/5/2015,First Class,JB-15400,Jennifer Braxton,Corporate,United States,Bristol,Connecticut,6010,East,Technology,Phones,Classic Ivory Antique Telephone ZL1810,100.49,1,0.0,25.1225,2015-09-03,2015-09-05
3/26/2017,3/27/2017,First Class,GM-14440,Gary McGarr,Consumer,United States,New York City,New York,10009,East,Furniture,Bookcases,"Sauder Forest Hills Library with Doors, Woodland Oak Finish",257.568,2,0.2,-28.9764,2017-03-26,2017-03-27
3/26/2017,3/27/2017,First Class,GM-14440,Gary McGarr,Consumer,United States,New York City,New York,10009,East,Technology,Phones,Nokia Lumia 521 (T-Mobile),119.96,4,0.0,33.5888,2017-03-26,2017-03-27
11/12/2014,11/12/2014,Same Day,RF-19840,Roy Französisch,Consumer,United States,San Antonio,Texas,78207,Central,Office Supplies,Storage,"Personal Filing Tote with Lid, Black/Gray",49.632,4,0.2,4.9632,2014-11-12,2014-11-12
10/13/2016,10/17/2016,Standard Class,NC-18625,Noah Childs,Corporate,United States,Aurora,Colorado,80013,West,Furniture,Tables,Hon 5100 Series Wood Tables,727.45,5,0.5,-465.568,2016-10-13,2016-10-17
10/13/2016,10/17/2016,Standard Class,NC-18625,Noah Childs,Corporate,United States,Aurora,Colorado,80013,West,Furniture,Furnishings,"Executive Impressions 8-1/2"" Career Panel/Partition Cubicle Clock",24.96,3,0.2,4.368,2016-10-13,2016-10-17
11/12/2017,11/12/2017,Same Day,NG-18355,Nat Gilpin,Corporate,United States,Newark,Ohio,43055,East,Technology,Phones,Jabra SPEAK 410 Multidevice Speakerphone,370.782,3,0.4,-92.6955,2017-11-12,2017-11-12
4/15/2017,4/18/2017,First Class,AH-10075,Adam Hart,Corporate,United States,Henderson,Nevada,89015,West,Furniture,Furnishings,"Howard Miller 12"" Round Wall Clock",196.45,5,0.0,70.722,2017-04-15,2017-04-18
6/25/2015,7/1/2015,Standard Class,CH-12070,Cathy Hwang,Home Office,United States,Philadelphia,Pennsylvania,19143,East,Office Supplies,Paper,Xerox 211,31.104,6,0.2,10.8864,2015-06-25,2015-07-01
6/25/2015,7/1/2015,Standard Class,CH-12070,Cathy Hwang,Home Office,United States,Philadelphia,Pennsylvania,19143,East,Office Supplies,Storage,Tennsco Industrial Shelving,78.256,2,0.2,-17.6076,2015-06-25,2015-07-01
8/26/2016,8/29/2016,Second Class,CC-12145,Charles Crestani,Consumer,United States,Seattle,Washington,98103,West,Office Supplies,Paper,Xerox 1931,6.48,1,0.0,3.1104,2016-08-26,2016-08-29
7/21/2014,7/25/2014,Standard Class,ME-18010,Michelle Ellison,Corporate,United States,San Francisco,California,94122,West,Office Supplies,Art,Newell 334,99.2,5,0.0,25.792,2014-07-21,2014-07-25
7/21/2014,7/25/2014,Standard Class,ME-18010,Michelle Ellison,Corporate,United States,San Francisco,California,94122,West,Furniture,Chairs,Global Troy Executive Leather Low-Back Tilter,801.568,2,0.2,50.098,2014-07-21,2014-07-25
7/21/2014,7/25/2014,Standard Class,ME-18010,Michelle Ellison,Corporate,United States,San Francisco,California,94122,West,Furniture,Tables,"Hon 30"" x 60"" Table with Locking Drawer",272.848,1,0.2,27.2848,2014-07-21,2014-07-25
11/21/2017,11/25/2017,Standard Class,BP-11230,Benjamin Patterson,Consumer,United States,Spokane,Washington,99207,West,Furniture,Tables,Safco Drafting Table,70.98,1,0.0,20.5842,2017-11-21,2017-11-25
6/4/2014,6/9/2014,Standard Class,MP-17470,Mark Packer,Home Office,United States,Columbus,Ohio,43229,East,Office Supplies,Paper,Easy-staple paper,16.224,2,0.2,5.8812,2014-06-04,2014-06-09
3/10/2016,3/16/2016,Standard Class,CJ-12010,Caroline Jumper,Consumer,United States,Long Beach,New York,11561,East,Furniture,Bookcases,O'Sullivan Living Dimensions 5-Shelf Bookcases,176.784,1,0.2,-22.098,2016-03-10,2016-03-16
3/25/2017,3/29/2017,Standard Class,JC-15775,John Castell,Consumer,United States,San Antonio,Texas,78207,Central,Technology,Phones,Panasonic KX-TG9471B,470.376,3,0.2,47.0376,2017-03-25,2017-03-29
12/29/2017,1/2/2018,Standard Class,JG-15160,James Galang,Consumer,United States,Los Angeles,California,90049,West,Furniture,Chairs,"Global High-Back Leather Tilter, Burgundy",393.568,4,0.2,-44.2764,2017-12-29,2018-01-02
12/29/2017,1/2/2018,Standard Class,JG-15160,James Galang,Consumer,United States,Los Angeles,California,90049,West,Technology,Phones,Adtran 1202752G1,302.376,3,0.2,22.6782,2017-12-29,2018-01-02
3/28/2017,4/2/2017,Standard Class,CK-12760,Cyma Kinney,Corporate,United States,Jacksonville,Florida,32216,South,Office Supplies,Binders,Canvas Sectional Post Binders,68.742,9,0.7,-48.1194,2017-03-28,2017-04-02
3/5/2015,3/5/2015,Same Day,LF-17185,Luke Foster,Consumer,United States,New York City,New York,10011,East,Office Supplies,Envelopes,Staple envelope,29.34,3,0.0,14.67,2015-03-05,2015-03-05
3/5/2015,3/5/2015,Same Day,LF-17185,Luke Foster,Consumer,United States,New York City,New York,10011,East,Furniture,Chairs,"Global Value Mid-Back Manager's Chair, Gray",383.607,7,0.1,63.9345,2015-03-05,2015-03-05
3/5/2015,3/5/2015,Same Day,LF-17185,Luke Foster,Consumer,United States,New York City,New York,10011,East,Office Supplies,Storage,"Fellowes Strictly Business Drawer File, Letter/Legal Size",563.4,4,0.0,67.608,2015-03-05,2015-03-05
11/13/2016,11/17/2016,Standard Class,CC-12430,Chuck Clark,Home Office,United States,Philadelphia,Pennsylvania,19143,East,Office Supplies,Paper,White Computer Printout Paper by Universal,217.056,7,0.2,78.6828,2016-11-13,2016-11-17
1/19/2017,1/23/2017,Second Class,DL-12865,Dan Lawera,Consumer,United States,Keller,Texas,76248,Central,Office Supplies,Labels,Avery 510,6.0,2,0.2,2.1,2017-01-19,2017-01-23
4/22/2016,4/26/2016,Second Class,PG-18895,Paul Gonzalez,Consumer,United States,San Francisco,California,94122,West,Furniture,Furnishings,Ultra Door Pull Handle,31.56,3,0.0,10.4148,2016-04-22,2016-04-26
5/13/2014,5/15/2014,First Class,EH-14005,Erica Hernandez,Home Office,United States,Hialeah,Florida,33012,South,Office Supplies,Fasteners,Staples,7.104,2,0.2,2.3976,2014-05-13,2014-05-15
5/13/2014,5/15/2014,First Class,EH-14005,Erica Hernandez,Home Office,United States,Hialeah,Florida,33012,South,Office Supplies,Binders,GBC DocuBind P100 Manual Binding Machine,398.352,8,0.7,-331.96,2014-05-13,2014-05-15
10/21/2014,10/22/2014,First Class,TB-21520,Tracy Blumstein,Consumer,United States,Fairfield,Ohio,45014,East,Office Supplies,Appliances,Fellowes Superior 10 Outlet Split Surge Protector,121.792,4,0.2,13.7016,2014-10-21,2014-10-22
10/21/2014,10/22/2014,First Class,TB-21520,Tracy Blumstein,Consumer,United States,Fairfield,Ohio,45014,East,Furniture,Tables,"Hon Practical Foundations 30 x 60 Training Table, Light Gray/Charcoal",409.59,3,0.4,-122.877,2014-10-21,2014-10-22
3/14/2014,3/18/2014,Standard Class,DK-13225,Dean Katz,Corporate,United States,Huntington Beach,California,92646,West,Office Supplies,Paper,Xerox 1972,10.56,2,0.0,4.752,2014-03-14,2014-03-18
3/14/2014,3/18/2014,Standard Class,DK-13225,Dean Katz,Corporate,United States,Huntington Beach,California,92646,West,Office Supplies,Art,Avery Hi-Liter Fluorescent Desk Style Markers,3.38,1,0.0,1.2506,2014-03-14,2014-03-18
12/22/2017,12/24/2017,Second Class,JP-15520,Jeremy Pistek,Consumer,United States,Port Orange,Florida,32127,South,Office Supplies,Envelopes,Staple envelope,7.824,1,0.2,2.934,2017-12-22,2017-12-24
11/24/2016,11/29/2016,Standard Class,CD-11980,Carol Darley,Consumer,United States,Medford,Oregon,97504,West,Office Supplies,Paper,"IBM Multi-Purpose Copy Paper, 8 1/2 x 11"", Case",24.784,1,0.2,7.745,2016-11-24,2016-11-29
12/2/2017,12/5/2017,First Class,AS-10090,Adam Shillingsburg,Consumer,United States,Charlottesville,Virginia,22901,South,Office Supplies,Art,Newell 309,34.65,3,0.0,10.395,2017-12-02,2017-12-05
12/31/2015,1/4/2016,Standard Class,JO-15280,Jas O'Carroll,Consumer,United States,Missoula,Montana,59801,West,Office Supplies,Binders,Ibico Hi-Tech Manual Binding System,487.984,2,0.2,152.495,2015-12-31,2016-01-04
10/3/2017,10/6/2017,First Class,AC-10450,Amy Cox,Consumer,United States,Minneapolis,Minnesota,55407,Central,Office Supplies,Binders,GBC DocuBind TL300 Electric Binding System,1793.98,2,0.0,843.1706,2017-10-03,2017-10-06
8/29/2014,9/2/2014,Second Class,RA-19945,Ryan Akin,Consumer,United States,Miami,Florida,33178,South,Office Supplies,Envelopes,Jiffy Padded Mailers with Self-Seal Closure,29.808,2,0.2,10.8054,2014-08-29,2014-09-02
8/29/2014,9/2/2014,Second Class,RA-19945,Ryan Akin,Consumer,United States,Miami,Florida,33178,South,Office Supplies,Binders,GBC DocuBind 200 Manual Binding Machine,505.176,4,0.7,-336.784,2014-08-29,2014-09-02
8/29/2014,9/2/2014,Second Class,RA-19945,Ryan Akin,Consumer,United States,Miami,Florida,33178,South,Furniture,Tables,Balt Solid Wood Rectangular Table,174.0585,3,0.45,-110.7645,2014-08-29,2014-09-02
6/29/2016,7/3/2016,Second Class,Co-12640,Corey-Lock,Consumer,United States,Florence,South Carolina,29501,South,Office Supplies,Storage,Fellowes Bankers Box Stor/Drawer Steel Plus,191.88,6,0.0,19.188,2016-06-29,2016-07-03
8/20/2016,8/23/2016,First Class,DW-13480,Dianna Wilson,Home Office,United States,Detroit,Michigan,48205,Central,Technology,Phones,"SKILCRAFT Telephone Shoulder Rest, 2"" x 6.5"" x 2.5"", Black",14.78,2,0.0,3.9906,2016-08-20,2016-08-23
10/21/2017,10/22/2017,First Class,DK-12835,Damala Kotsonis,Corporate,United States,Springfield,Oregon,97477,West,Office Supplies,Paper,Xerox 218,5.184,1,0.2,1.8144,2017-10-21,2017-10-22
10/21/2017,10/22/2017,First Class,DK-12835,Damala Kotsonis,Corporate,United States,Springfield,Oregon,97477,West,Furniture,Chairs,Global Comet Stacking Armless Chair,478.48,2,0.2,47.848,2017-10-21,2017-10-22
10/21/2017,10/22/2017,First Class,DK-12835,Damala Kotsonis,Corporate,United States,Springfield,Oregon,97477,West,Technology,Accessories,Memorex Froggy Flash Drive 8 GB,28.4,2,0.2,6.745,2017-10-21,2017-10-22
10/21/2017,10/24/2017,First Class,MD-17860,Michael Dominguez,Corporate,United States,Indianapolis,Indiana,46203,Central,Office Supplies,Storage,SAFCO Boltless Steel Shelving,909.12,8,0.0,9.0912,2017-10-21,2017-10-24
5/17/2016,5/21/2016,Standard Class,RP-19855,Roy Phan,Corporate,United States,Apopka,Florida,32712,South,Office Supplies,Binders,Pressboard Hanging Data Binders for Unburst Sheets,2.952,2,0.7,-2.1648,2016-05-17,2016-05-21
5/17/2016,5/21/2016,Standard Class,RP-19855,Roy Phan,Corporate,United States,Apopka,Florida,32712,South,Office Supplies,Binders,"GBC Prepunched Paper, 19-Hole, for Binding Systems, 24-lb",27.018,6,0.7,-21.6144,2016-05-17,2016-05-21
2/3/2015,2/4/2015,First Class,RW-19540,Rick Wilson,Corporate,United States,Los Angeles,California,90008,West,Furniture,Furnishings,Hand-Finished Solid Wood Document Frame,136.92,4,0.0,41.076,2015-02-03,2015-02-04
12/18/2017,12/23/2017,Standard Class,DB-13660,Duane Benoit,Consumer,United States,Oceanside,New York,11572,East,Furniture,Furnishings,"DAX Charcoal/Nickel-Tone Document Frame, 5 x 7",18.96,2,0.0,8.532,2017-12-18,2017-12-23
11/15/2016,11/22/2016,Standard Class,SC-20770,Stewart Carmichael,Corporate,United States,Los Angeles,California,90008,West,Technology,Accessories,Imation 16GB Mini TravelDrive USB 2.0 Flash Drive,99.39,3,0.0,40.7499,2016-11-15,2016-11-22
7/3/2017,7/6/2017,Second Class,FH-14275,Frank Hawley,Corporate,United States,Houston,Texas,77041,Central,Office Supplies,Paper,Xerox 1891,273.896,7,0.2,92.4399,2017-07-03,2017-07-06
7/3/2017,7/6/2017,Second Class,FH-14275,Frank Hawley,Corporate,United States,Houston,Texas,77041,Central,Technology,Machines,Hewlett-Packard Deskjet 5550 Printer,597.132,3,0.4,49.761,2017-07-03,2017-07-06
1/15/2014,1/17/2014,First Class,EH-13990,Erica Hackney,Consumer,United States,Roswell,Georgia,30076,South,Technology,Accessories,Logitech 910-002974 M325 Wireless Mouse for Web Scrolling,149.95,5,0.0,65.978,2014-01-15,2014-01-17
4/30/2017,5/5/2017,Standard Class,AS-10630,Ann Steele,Home Office,United States,Boynton Beach,Florida,33437,South,Office Supplies,Labels,Avery 474,4.608,2,0.2,1.6704,2017-04-30,2017-05-05
4/30/2017,5/5/2017,Standard Class,AS-10630,Ann Steele,Home Office,United States,Boynton Beach,Florida,33437,South,Office Supplies,Art,Staples in misc. colors,15.528,3,0.2,4.8525,2017-04-30,2017-05-05
4/30/2017,5/5/2017,Standard Class,AS-10630,Ann Steele,Home Office,United States,Boynton Beach,Florida,33437,South,Office Supplies,Labels,Avery 499,11.952,3,0.2,3.8844,2017-04-30,2017-05-05
11/8/2015,11/14/2015,Standard Class,HA-14905,Helen Abelman,Consumer,United States,Franklin,Massachusetts,2038,East,Office Supplies,Art,American Pencil,11.65,5,0.0,3.3785,2015-11-08,2015-11-14
10/30/2015,11/1/2015,Second Class,CH-12070,Cathy Hwang,Home Office,United States,Detroit,Michigan,48227,Central,Technology,Phones,Panasonic KX T7736-B Digital phone,299.9,2,0.0,74.975,2015-10-30,2015-11-01
8/17/2017,8/19/2017,First Class,EH-13765,Edward Hooks,Corporate,United States,Watertown,New York,13601,East,Office Supplies,Binders,GBC DocuBind TL200 Manual Binding Machine,895.92,5,0.2,302.373,2017-08-17,2017-08-19
8/17/2017,8/19/2017,First Class,EH-13765,Edward Hooks,Corporate,United States,Watertown,New York,13601,East,Furniture,Chairs,Global Commerce Series Low-Back Swivel/Tilt Chairs,462.564,2,0.1,97.6524,2017-08-17,2017-08-19
10/3/2015,10/9/2015,Standard Class,MZ-17515,Mary Zewe,Corporate,United States,Reading,Pennsylvania,19601,East,Office Supplies,Storage,Staple magnet,15.008,2,0.2,1.5008,2015-10-03,2015-10-09
7/8/2016,7/10/2016,Second Class,SC-20230,Scot Coram,Corporate,United States,Arlington,Texas,76017,Central,Technology,Phones,Cisco SPA 502G IP Phone,863.64,9,0.2,107.955,2016-07-08,2016-07-10
7/8/2016,7/10/2016,Second Class,SC-20230,Scot Coram,Corporate,United States,Arlington,Texas,76017,Central,Office Supplies,Art,Newell 345,47.616,3,0.2,3.5712,2016-07-08,2016-07-10
12/5/2017,12/7/2017,Second Class,NP-18325,Naresj Patel,Consumer,United States,San Diego,California,92024,West,Office Supplies,Paper,Xerox 1960,92.94,3,0.0,41.823,2017-12-05,2017-12-07
3/9/2017,3/13/2017,Standard Class,LW-16990,Lindsay Williams,Corporate,United States,San Francisco,California,94110,West,Technology,Accessories,Logitech Wireless Headset h800,199.98,2,0.0,69.993,2017-03-09,2017-03-13
6/9/2016,6/15/2016,Standard Class,GM-14680,Greg Matthias,Consumer,United States,Los Angeles,California,90045,West,Technology,Phones,Avaya 4621SW VoIP phone,177.48,3,0.2,19.9665,2016-06-09,2016-06-15
11/28/2017,12/1/2017,First Class,RH-19495,Rick Hansen,Consumer,United States,Denver,Colorado,80219,West,Office Supplies,Paper,"Eaton Premium Continuous-Feed Paper, 25% Cotton, Letter Size, White, 1000 Shts/Box",88.768,2,0.2,31.0688,2017-11-28,2017-12-01
3/16/2017,3/18/2017,Second Class,VM-21685,Valerie Mitchum,Home Office,United States,Seattle,Washington,98105,West,Office Supplies,Paper,Xerox 214,6.48,1,0.0,3.1104,2017-03-16,2017-03-18
3/16/2017,3/18/2017,Second Class,VM-21685,Valerie Mitchum,Home Office,United States,Seattle,Washington,98105,West,Office Supplies,Storage,Safco Commercial Shelving,46.51,1,0.0,1.8604,2017-03-16,2017-03-18
3/16/2017,3/18/2017,Second Class,VM-21685,Valerie Mitchum,Home Office,United States,Seattle,Washington,98105,West,Technology,Phones,Mitel MiVoice 5330e IP Phone,659.976,3,0.2,49.4982,2017-03-16,2017-03-18
11/27/2016,11/29/2016,Second Class,CC-12670,Craig Carreira,Consumer,United States,Scottsdale,Arizona,85254,West,Technology,Phones,Motorola Moto X,271.992,1,0.2,23.7993,2016-11-27,2016-11-29
8/6/2017,8/10/2017,Second Class,SV-20365,Seth Vernon,Consumer,United States,Lafayette,Louisiana,70506,South,Furniture,Bookcases,O'Sullivan 2-Shelf Heavy-Duty Bookcases,145.74,3,0.0,23.3184,2017-08-06,2017-08-10
8/6/2017,8/10/2017,Second Class,SV-20365,Seth Vernon,Consumer,United States,Lafayette,Louisiana,70506,South,Furniture,Furnishings,Longer-Life Soft White Bulbs,15.4,5,0.0,7.392,2017-08-06,2017-08-10
11/27/2017,12/3/2017,Standard Class,LW-16990,Lindsay Williams,Corporate,United States,San Francisco,California,94109,West,Office Supplies,Paper,Tops White Computer Printout Paper,244.55,5,0.0,114.9385,2017-11-27,2017-12-03
11/27/2017,12/3/2017,Standard Class,LW-16990,Lindsay Williams,Corporate,United States,San Francisco,California,94109,West,Technology,Accessories,Enermax Briskie RF Wireless Keyboard and Mouse Combo,166.16,8,0.0,59.8176,2017-11-27,2017-12-03
5/25/2015,5/27/2015,Second Class,NP-18685,Nora Pelletier,Home Office,United States,San Francisco,California,94109,West,Furniture,Furnishings,Ultra Door Push Plate,14.73,3,0.0,4.8609,2015-05-25,2015-05-27
7/8/2016,7/12/2016,Standard Class,JE-15715,Joe Elijah,Consumer,United States,Broomfield,Colorado,80020,West,Office Supplies,Binders,GBC Twin Loop Wire Binding Elements,19.968,2,0.7,-13.312,2016-07-08,2016-07-12
7/8/2016,7/12/2016,Standard Class,JE-15715,Joe Elijah,Consumer,United States,Broomfield,Colorado,80020,West,Office Supplies,Storage,"Perma STOR-ALL Hanging File Box, 13 1/8""W x 12 1/4""D x 10 1/2""H",33.488,7,0.2,-1.2558,2016-07-08,2016-07-12
7/8/2016,7/12/2016,Standard Class,JE-15715,Joe Elijah,Consumer,United States,Broomfield,Colorado,80020,West,Office Supplies,Binders,Wilson Jones Active Use Binders,8.736,4,0.7,-6.1152,2016-07-08,2016-07-12
7/8/2016,7/12/2016,Standard Class,JE-15715,Joe Elijah,Consumer,United States,Broomfield,Colorado,80020,West,Furniture,Chairs,SAFCO Arco Folding Chair,662.88,3,0.2,74.574,2016-07-08,2016-07-12
8/29/2017,9/1/2017,First Class,CP-12085,Cathy Prescott,Corporate,United States,Quincy,Illinois,62301,Central,Office Supplies,Labels,Avery 505,47.36,4,0.2,17.76,2017-08-29,2017-09-01
8/29/2017,9/1/2017,First Class,CP-12085,Cathy Prescott,Corporate,United States,Quincy,Illinois,62301,Central,Office Supplies,Storage,Advantus Rolling Storage Box,27.44,2,0.2,2.401,2017-08-29,2017-09-01
8/29/2017,9/1/2017,First Class,CP-12085,Cathy Prescott,Corporate,United States,Quincy,Illinois,62301,Central,Office Supplies,Binders,Wilson Jones Easy Flow II Sheet Lifters,3.24,9,0.8,-5.184,2017-08-29,2017-09-01
6/20/2016,6/26/2016,Standard Class,EA-14035,Erin Ashbrook,Corporate,United States,Carrollton,Texas,75007,Central,Technology,Accessories,Logitech Trackman Marble Mouse,95.968,4,0.2,26.3912,2016-06-20,2016-06-26
6/20/2016,6/26/2016,Standard Class,EA-14035,Erin Ashbrook,Corporate,United States,Carrollton,Texas,75007,Central,Office Supplies,Paper,Xerox 206,10.368,2,0.2,3.6288,2016-06-20,2016-06-26
9/2/2017,9/6/2017,Standard Class,AC-10615,Ann Chong,Corporate,United States,New York City,New York,10009,East,Office Supplies,Art,Newell 324,23.1,2,0.0,6.468,2017-09-02,2017-09-06
9/2/2017,9/6/2017,Standard Class,AC-10615,Ann Chong,Corporate,United States,New York City,New York,10009,East,Furniture,Furnishings,DAX Cubicle Frames - 8x10,11.54,2,0.0,3.462,2017-09-02,2017-09-06
9/2/2017,9/6/2017,Standard Class,AC-10615,Ann Chong,Corporate,United States,New York City,New York,10009,East,Furniture,Tables,Bush Advantage Collection Racetrack Conference Table,254.526,1,0.4,-93.3262,2017-09-02,2017-09-06
9/2/2017,9/6/2017,Standard Class,AC-10615,Ann Chong,Corporate,United States,New York City,New York,10009,East,Office Supplies,Appliances,Fellowes Basic Home/Office Series Surge Protectors,12.98,1,0.0,3.7642,2017-09-02,2017-09-06
9/2/2017,9/6/2017,Standard Class,AC-10615,Ann Chong,Corporate,United States,New York City,New York,10009,East,Office Supplies,Binders,"ACCOHIDE 3-Ring Binder, Blue, 1""",26.432,8,0.2,8.9208,2017-09-02,2017-09-06
9/2/2017,9/6/2017,Standard Class,AC-10615,Ann Chong,Corporate,United States,New York City,New York,10009,East,Technology,Phones,Cisco SPA508G,197.97,3,0.0,57.4113,2017-09-02,2017-09-06
9/2/2017,9/6/2017,Standard Class,AC-10615,Ann Chong,Corporate,United States,New York City,New York,10009,East,Office Supplies,Labels,Avery 518,18.9,6,0.0,9.072,2017-09-02,2017-09-06
9/2/2017,9/6/2017,Standard Class,AC-10615,Ann Chong,Corporate,United States,New York City,New York,10009,East,Furniture,Chairs,Global Commerce Series High-Back Swivel/Tilt Chairs,1282.41,5,0.1,213.735,2017-09-02,2017-09-06
9/2/2017,9/6/2017,Standard Class,AC-10615,Ann Chong,Corporate,United States,New York City,New York,10009,East,Office Supplies,Art,BIC Brite Liner Grip Highlighters,4.92,3,0.0,2.214,2017-09-02,2017-09-06
9/2/2017,9/6/2017,Standard Class,AC-10615,Ann Chong,Corporate,United States,New York City,New York,10009,East,Technology,Accessories,WD My Passport Ultra 2TB Portable External Hard Drive,238.0,2,0.0,38.08,2017-09-02,2017-09-06
9/2/2017,9/6/2017,Standard Class,AC-10615,Ann Chong,Corporate,United States,New York City,New York,10009,East,Technology,Accessories,Sony Micro Vault Click 16 GB USB 2.0 Flash Drive,167.97,3,0.0,40.3128,2017-09-02,2017-09-06
9/2/2017,9/6/2017,Standard Class,AC-10615,Ann Chong,Corporate,United States,New York City,New York,10009,East,Office Supplies,Paper,Xerox 1962,17.12,4,0.0,7.704,2017-09-02,2017-09-06
9/10/2017,9/15/2017,Second Class,RW-19690,Robert Waldorf,Consumer,United States,Springfield,Missouri,65807,Central,Office Supplies,Binders,3M Organizer Strips,16.2,3,0.0,7.776,2017-09-10,2017-09-15
9/10/2017,9/15/2017,Second Class,RW-19690,Robert Waldorf,Consumer,United States,Springfield,Missouri,65807,Central,Office Supplies,Appliances,"Holmes Replacement Filter for HEPA Air Cleaner, Medium Room",33.99,3,0.0,14.6157,2017-09-10,2017-09-15
9/10/2017,9/15/2017,Second Class,RW-19690,Robert Waldorf,Consumer,United States,Springfield,Missouri,65807,Central,Technology,Accessories,Logitech G105 Gaming Keyboard,296.85,5,0.0,53.433,2017-09-10,2017-09-15
9/10/2017,9/15/2017,Second Class,RW-19690,Robert Waldorf,Consumer,United States,Springfield,Missouri,65807,Central,Technology,Accessories,Imation Clip USB flash drive - 8 GB,112.8,6,0.0,6.768,2017-09-10,2017-09-15
9/10/2017,9/15/2017,Second Class,RW-19690,Robert Waldorf,Consumer,United States,Springfield,Missouri,65807,Central,Office Supplies,Binders,Newell 3-Hole Punched Plastic Slotted Magazine Holders for Binders,13.71,3,0.0,6.5808,2017-09-10,2017-09-15
9/10/2017,9/15/2017,Second Class,RW-19690,Robert Waldorf,Consumer,United States,Springfield,Missouri,65807,Central,Office Supplies,Paper,Xerox 1970,24.9,5,0.0,11.703,2017-09-10,2017-09-15
9/10/2017,9/15/2017,Second Class,RW-19690,Robert Waldorf,Consumer,United States,Springfield,Missouri,65807,Central,Office Supplies,Storage,Fellowes Stor/Drawer Steel Plus Storage Drawers,286.29,3,0.0,17.1774,2017-09-10,2017-09-15
9/10/2017,9/15/2017,Second Class,RW-19690,Robert Waldorf,Consumer,United States,Springfield,Missouri,65807,Central,Office Supplies,Appliances,Acco 6 Outlet Guardian Standard Surge Suppressor,24.18,2,0.0,7.254,2017-09-10,2017-09-15
12/21/2017,12/28/2017,Standard Class,DB-13210,Dean Braden,Consumer,United States,Paterson,New Jersey,7501,East,Technology,Phones,Jabra SPEAK 410,281.97,3,0.0,78.9516,2017-12-21,2017-12-28
12/21/2017,12/28/2017,Standard Class,DB-13210,Dean Braden,Consumer,United States,Paterson,New Jersey,7501,East,Office Supplies,Supplies,"Acme Hot Forged Carbon Steel Scissors with Nickel-Plated Handles, 3 7/8"" Cut, 8""L",69.5,5,0.0,20.155,2017-12-21,2017-12-28
12/21/2017,12/28/2017,Standard Class,DB-13210,Dean Braden,Consumer,United States,Paterson,New Jersey,7501,East,Office Supplies,Paper,Xerox 1913,166.44,3,0.0,79.8912,2017-12-21,2017-12-28
9/23/2017,9/29/2017,Standard Class,BD-11320,Bill Donatelli,Consumer,United States,Tulsa,Oklahoma,74133,Central,Technology,Accessories,Imation Secure+ Hardware Encrypted USB 2.0 Flash Drive; 16GB,291.96,4,0.0,102.186,2017-09-23,2017-09-29
5/6/2017,5/11/2017,Standard Class,ML-17755,Max Ludwig,Home Office,United States,Chicago,Illinois,60623,Central,Office Supplies,Art,Blackstonian Pencils,6.408,3,0.2,0.6408,2017-05-06,2017-05-11
5/6/2017,5/11/2017,Standard Class,ML-17755,Max Ludwig,Home Office,United States,Chicago,Illinois,60623,Central,Technology,Accessories,Imation Secure+ Hardware Encrypted USB 2.0 Flash Drive; 16GB,408.744,7,0.2,76.6395,2017-05-06,2017-05-11
12/14/2014,12/19/2014,Standard Class,JD-16015,Joy Daniels,Consumer,United States,Chicago,Illinois,60610,Central,Office Supplies,Binders,Avery Heavy-Duty EZD View Binder with Locking Rings,5.104,4,0.8,-8.6768,2014-12-14,2014-12-19
12/14/2014,12/19/2014,Standard Class,JD-16015,Joy Daniels,Consumer,United States,Chicago,Illinois,60610,Central,Office Supplies,Fasteners,Assorted Color Push Pins,2.896,2,0.2,0.4706,2014-12-14,2014-12-19
12/14/2014,12/19/2014,Standard Class,JD-16015,Joy Daniels,Consumer,United States,Chicago,Illinois,60610,Central,Technology,Accessories,Belkin Standard 104 key USB Keyboard,35.016,3,0.2,-2.1885,2014-12-14,2014-12-19
10/18/2014,10/20/2014,Second Class,AS-10225,Alan Schoenberger,Corporate,United States,Montgomery,Alabama,36116,South,Office Supplies,Storage,"Gould Plastics 18-Pocket Panel Bin, 34w x 5-1/4d x 20-1/2h",275.97,3,0.0,11.0388,2014-10-18,2014-10-20
10/18/2014,10/20/2014,Second Class,AS-10225,Alan Schoenberger,Corporate,United States,Montgomery,Alabama,36116,South,Technology,Phones,Avaya IP Phone 1140E VoIP phone,1394.95,5,0.0,362.687,2014-10-18,2014-10-20
10/18/2014,10/20/2014,Second Class,AS-10225,Alan Schoenberger,Corporate,United States,Montgomery,Alabama,36116,South,Furniture,Chairs,"Global Wood Trimmed Manager's Task Chair, Khaki",545.88,6,0.0,70.9644,2014-10-18,2014-10-20
5/8/2015,5/12/2015,Standard Class,AA-10375,Allen Armold,Consumer,United States,Salem,Oregon,97301,West,Office Supplies,Art,Newell 321,5.248,2,0.2,0.5904,2015-05-08,2015-05-12
4/14/2016,4/14/2016,Same Day,KT-16465,Kean Takahito,Consumer,United States,Glendale,Arizona,85301,West,Furniture,Chairs,Hon 4070 Series Pagoda Armless Upholstered Stacking Chairs,933.536,4,0.2,105.0228,2016-04-14,2016-04-14
4/14/2016,4/14/2016,Same Day,KT-16465,Kean Takahito,Consumer,United States,Glendale,Arizona,85301,West,Office Supplies,Storage,"Fellowes Personal Hanging Folder Files, Navy",42.976,4,0.2,4.2976,2016-04-14,2016-04-14
12/14/2015,12/16/2015,Second Class,MM-18280,Muhammed MacIntyre,Corporate,United States,Columbus,Georgia,31907,South,Office Supplies,Binders,3-ring staple pack,3.76,2,0.0,1.8048,2015-12-14,2015-12-16
12/3/2014,12/9/2014,Standard Class,NG-18430,Nathan Gelder,Consumer,United States,Oklahoma City,Oklahoma,73120,Central,Technology,Phones,Jabra Supreme Plus Driver Edition Headset,479.96,4,0.0,134.3888,2014-12-03,2014-12-09
11/25/2014,11/27/2014,Second Class,LW-16825,Laurel Workman,Corporate,United States,Brentwood,California,94513,West,Office Supplies,Appliances,Belkin F9G930V10-GRY 9 Outlet Surge,320.88,6,0.0,93.0552,2014-11-25,2014-11-27
11/25/2014,11/27/2014,Second Class,LW-16825,Laurel Workman,Corporate,United States,Brentwood,California,94513,West,Furniture,Furnishings,Staple-based wall hangings,23.88,3,0.0,10.5072,2014-11-25,2014-11-27
11/25/2014,11/27/2014,Second Class,LW-16825,Laurel Workman,Corporate,United States,Brentwood,California,94513,West,Office Supplies,Paper,"Wirebound Message Books, Four 2 3/4 x 5 White Forms per Page",26.76,4,0.0,12.3096,2014-11-25,2014-11-27
7/25/2016,7/27/2016,First Class,CB-12415,Christy Brittain,Consumer,United States,Columbus,Ohio,43229,East,Technology,Copiers,Hewlett Packard LaserJet 3310 Copier,1439.976,4,0.4,191.9968,2016-07-25,2016-07-27
11/9/2015,11/13/2015,Standard Class,AS-10090,Adam Shillingsburg,Consumer,United States,Springfield,Missouri,65807,Central,Office Supplies,Binders,Binder Posts,17.22,3,0.0,7.9212,2015-11-09,2015-11-13
11/9/2015,11/13/2015,Standard Class,AS-10090,Adam Shillingsburg,Consumer,United States,Springfield,Missouri,65807,Central,Furniture,Tables,Bevis Round Conference Table Top & Single Column Base,1024.38,7,0.0,215.1198,2015-11-09,2015-11-13
11/9/2015,11/13/2015,Standard Class,AS-10090,Adam Shillingsburg,Consumer,United States,Springfield,Missouri,65807,Central,Office Supplies,Envelopes,"#10- 4 1/8"" x 9 1/2"" Recycled Envelopes",26.22,3,0.0,12.3234,2015-11-09,2015-11-13
11/9/2015,11/13/2015,Standard Class,AS-10090,Adam Shillingsburg,Consumer,United States,Springfield,Missouri,65807,Central,Office Supplies,Paper,Xerox 1978,17.34,3,0.0,8.4966,2015-11-09,2015-11-13
2/24/2017,2/28/2017,Standard Class,CB-12415,Christy Brittain,Consumer,United States,Philadelphia,Pennsylvania,19134,East,Office Supplies,Binders,"ACCOHIDE 3-Ring Binder, Blue, 1""",4.956,4,0.7,-3.7996,2017-02-24,2017-02-28
6/25/2017,7/2/2017,Standard Class,ML-17755,Max Ludwig,Home Office,United States,Springfield,Oregon,97477,West,Office Supplies,Labels,Alphabetical Labels for Top Tab Filing,71.04,6,0.2,26.64,2017-06-25,2017-07-02
6/25/2017,7/2/2017,Standard Class,ML-17755,Max Ludwig,Home Office,United States,Springfield,Oregon,97477,West,Office Supplies,Art,"Eldon Spacemaker Box, Quick-Snap Lid, Clear",5.344,2,0.2,0.7348,2017-06-25,2017-07-02
6/25/2017,7/2/2017,Standard Class,ML-17755,Max Ludwig,Home Office,United States,Springfield,Oregon,97477,West,Office Supplies,Fasteners,Plymouth Boxed Rubber Bands by Plymouth,11.304,3,0.2,-2.1195,2017-06-25,2017-07-02
12/2/2017,12/4/2017,Second Class,JS-16030,Joy Smith,Consumer,United States,Houston,Texas,77036,Central,Office Supplies,Appliances,3.6 Cubic Foot Counter Height Office Refrigerator,294.62,5,0.8,-766.012,2017-12-02,2017-12-04
12/2/2017,12/4/2017,Second Class,JS-16030,Joy Smith,Consumer,United States,Houston,Texas,77036,Central,Furniture,Furnishings,Advantus Panel Wall Acrylic Frame,8.752,4,0.6,-3.7196,2017-12-02,2017-12-04
2/6/2014,2/9/2014,First Class,ND-18460,Neil Ducich,Corporate,United States,Chesapeake,Virginia,23320,South,Office Supplies,Labels,Avery 480,15.0,4,0.0,7.2,2014-02-06,2014-02-09
2/6/2014,2/9/2014,First Class,ND-18460,Neil Ducich,Corporate,United States,Chesapeake,Virginia,23320,South,Technology,Phones,Aastra 57i VoIP phone,161.61,1,0.0,42.0186,2014-02-06,2014-02-09
2/6/2014,2/9/2014,First Class,ND-18460,Neil Ducich,Corporate,United States,Chesapeake,Virginia,23320,South,Technology,Phones,AT&T CL82213,144.95,5,0.0,42.0355,2014-02-06,2014-02-09
4/11/2017,4/18/2017,Standard Class,LW-17215,Luke Weiss,Consumer,United States,Pasadena,California,91104,West,Technology,Accessories,SanDisk Ultra 64 GB MicroSDHC Class 10 Memory Card,199.95,5,0.0,21.9945,2017-04-11,2017-04-18
4/11/2017,4/18/2017,Standard Class,LW-17215,Luke Weiss,Consumer,United States,Pasadena,California,91104,West,Office Supplies,Art,"Dixon Ticonderoga Erasable Colored Pencil Set, 12-Color",41.86,7,0.0,14.2324,2017-04-11,2017-04-18
12/25/2017,12/28/2017,Second Class,JW-15955,Joni Wasserman,Consumer,United States,Louisville,Kentucky,40214,South,Office Supplies,Storage,Fellowes Bankers Box Stor/Drawer Steel Plus,95.94,3,0.0,9.594,2017-12-25,2017-12-28
12/25/2017,12/28/2017,Second Class,JW-15955,Joni Wasserman,Consumer,United States,Louisville,Kentucky,40214,South,Furniture,Chairs,"Global Value Mid-Back Manager's Chair, Gray",304.45,5,0.0,76.1125,2017-12-25,2017-12-28
4/11/2017,4/18/2017,Standard Class,SC-20050,Sample Company A,Home Office,United States,Lubbock,Texas,79424,Central,Office Supplies,Binders,Flexible Leather- Look Classic Collection Ring Binder,11.364,3,0.8,-17.046,2017-04-11,2017-04-18
12/31/2014,1/4/2015,Standard Class,RW-19630,Rob Williams,Corporate,United States,Columbia,Missouri,65203,Central,Office Supplies,Art,"BIC Brite Liner Grip Highlighters, Assorted, 5/Pack",29.68,7,0.0,11.5752,2014-12-31,2015-01-04
12/31/2014,1/4/2015,Standard Class,RW-19630,Rob Williams,Corporate,United States,Columbia,Missouri,65203,Central,Technology,Accessories,Sabrent 4-Port USB 2.0 Hub,47.53,7,0.0,16.1602,2014-12-31,2015-01-04
8/3/2017,8/4/2017,First Class,CM-12190,Charlotte Melton,Consumer,United States,Chicago,Illinois,60623,Central,Furniture,Bookcases,"O'Sullivan Elevations Bookcase, Cherry Finish",183.372,2,0.3,-36.6744,2017-08-03,2017-08-04
11/15/2014,11/21/2014,Standard Class,JF-15190,Jamie Frazer,Consumer,United States,Johnson City,Tennessee,37604,South,Office Supplies,Art,Newell 310,4.224,3,0.2,0.4752,2014-11-15,2014-11-21
11/15/2014,11/21/2014,Standard Class,JF-15190,Jamie Frazer,Consumer,United States,Johnson City,Tennessee,37604,South,Office Supplies,Appliances,"1.7 Cubic Foot Compact ""Cube"" Office Refrigerators",333.056,2,0.2,29.1424,2014-11-15,2014-11-21
11/15/2014,11/21/2014,Standard Class,JF-15190,Jamie Frazer,Consumer,United States,Johnson City,Tennessee,37604,South,Office Supplies,Paper,"Southworth 100% Résumé Paper, 24lb.",24.896,4,0.2,7.78,2014-11-15,2014-11-21
12/11/2015,12/11/2015,Same Day,SC-20800,Stuart Calhoun,Consumer,United States,Houston,Texas,77041,Central,Technology,Accessories,Logitech Wireless Performance Mouse MX for PC and Mac,159.984,2,0.2,35.9964,2015-12-11,2015-12-11
12/11/2015,12/11/2015,Same Day,SC-20800,Stuart Calhoun,Consumer,United States,Houston,Texas,77041,Central,Office Supplies,Storage,Eldon ProFile File 'N Store Portable File Tub Letter/Legal Size Black,46.344,3,0.2,4.6344,2015-12-11,2015-12-11
9/18/2016,9/23/2016,Standard Class,AM-10705,Anne McFarland,Consumer,United States,Auburn,Alabama,36830,South,Furniture,Chairs,Office Star - Professional Matrix Back Chair with 2-to-1 Synchro Tilt and Mesh Fabric Seat,350.98,1,0.0,84.2352,2016-09-18,2016-09-23
9/18/2016,9/23/2016,Standard Class,AM-10705,Anne McFarland,Consumer,United States,Auburn,Alabama,36830,South,Office Supplies,Paper,Southworth Parchment Paper & Envelopes,13.08,2,0.0,6.0168,2016-09-18,2016-09-23
9/18/2016,9/23/2016,Standard Class,AM-10705,Anne McFarland,Consumer,United States,Auburn,Alabama,36830,South,Office Supplies,Storage,Tennsco Double-Tier Lockers,900.08,4,0.0,117.0104,2016-09-18,2016-09-23
3/19/2015,3/23/2015,Standard Class,BK-11260,Berenike Kampe,Consumer,United States,San Bernardino,California,92404,West,Office Supplies,Binders,GBC Imprintable Covers,17.568,2,0.2,6.3684,2015-03-19,2015-03-23
3/19/2015,3/23/2015,Standard Class,BK-11260,Berenike Kampe,Consumer,United States,San Bernardino,California,92404,West,Office Supplies,Labels,Self-Adhesive Address Labels for Typewriters by Universal,14.62,2,0.0,6.8714,2015-03-19,2015-03-23
3/19/2015,3/23/2015,Standard Class,BK-11260,Berenike Kampe,Consumer,United States,San Bernardino,California,92404,West,Office Supplies,Supplies,Acme Elite Stainless Steel Scissors,33.36,4,0.0,8.6736,2015-03-19,2015-03-23
3/19/2015,3/23/2015,Standard Class,BK-11260,Berenike Kampe,Consumer,United States,San Bernardino,California,92404,West,Office Supplies,Paper,"Wirebound Message Books, 5-1/2 x 4 Forms, 2 or 4 Forms per Page",40.14,6,0.0,19.6686,2015-03-19,2015-03-23
9/19/2016,9/21/2016,First Class,RH-19510,Rick Huthwaite,Home Office,United States,Providence,Rhode Island,2908,East,Office Supplies,Storage,"Hot File 7-Pocket, Floor Stand",1606.23,9,0.0,481.869,2016-09-19,2016-09-21
9/19/2016,9/21/2016,First Class,RH-19510,Rick Huthwaite,Home Office,United States,Providence,Rhode Island,2908,East,Office Supplies,Paper,"Adams Telephone Message Book W/Dividers/Space For Phone Numbers, 5 1/4""X8 1/2"", 200/Messages",17.04,3,0.0,7.668,2016-09-19,2016-09-21
9/19/2016,9/21/2016,First Class,RH-19510,Rick Huthwaite,Home Office,United States,Providence,Rhode Island,2908,East,Office Supplies,Binders,JM Magazine Binder,49.53,3,0.0,23.7744,2016-09-19,2016-09-21
9/19/2016,9/21/2016,First Class,RH-19510,Rick Huthwaite,Home Office,United States,Providence,Rhode Island,2908,East,Furniture,Chairs,"Lifetime Advantage Folding Chairs, 4/Carton",872.32,4,0.0,244.2496,2016-09-19,2016-09-21
8/20/2017,8/22/2017,Second Class,GM-14500,Gene McClure,Consumer,United States,Fresno,California,93727,West,Office Supplies,Binders,GBC Recycled Regency Composition Covers,239.12,5,0.2,77.714,2017-08-20,2017-08-22
3/13/2015,3/15/2015,First Class,MC-17275,Marc Crier,Consumer,United States,Seattle,Washington,98103,West,Furniture,Bookcases,"Safco Value Mate Series Steel Bookcases, Baked Enamel Finish on Steel, Gray",141.96,2,0.0,39.7488,2015-03-13,2015-03-15
9/8/2016,9/10/2016,Second Class,VM-21685,Valerie Mitchum,Home Office,United States,Lancaster,California,93534,West,Office Supplies,Binders,"Square Ring Data Binders, Rigid 75 Pt. Covers, 11"" x 14-7/8""",33.024,2,0.2,11.5584,2016-09-08,2016-09-10
9/8/2016,9/10/2016,Second Class,VM-21685,Valerie Mitchum,Home Office,United States,Lancaster,California,93534,West,Office Supplies,Binders,Premium Transparent Presentation Covers by GBC,67.136,4,0.2,23.4976,2016-09-08,2016-09-10
11/26/2015,11/30/2015,Standard Class,GP-14740,Guy Phonely,Corporate,United States,Leominster,Massachusetts,1453,East,Office Supplies,Binders,"Pressboard Covers with Storage Hooks, 9 1/2"" x 11"", Light Blue",14.73,3,0.0,6.9231,2015-11-26,2015-11-30
11/26/2015,11/30/2015,Standard Class,GP-14740,Guy Phonely,Corporate,United States,Leominster,Massachusetts,1453,East,Office Supplies,Storage,"Tennsco Lockers, Sand",104.9,5,0.0,25.176,2015-11-26,2015-11-30
11/26/2015,11/30/2015,Standard Class,GP-14740,Guy Phonely,Corporate,United States,Leominster,Massachusetts,1453,East,Office Supplies,Binders,Aluminum Screw Posts,61.04,4,0.0,30.52,2015-11-26,2015-11-30
11/26/2015,11/30/2015,Standard Class,GP-14740,Guy Phonely,Corporate,United States,Leominster,Massachusetts,1453,East,Office Supplies,Paper,Loose Memo Sheets,10.95,3,0.0,5.1465,2015-11-26,2015-11-30
12/9/2016,12/13/2016,Standard Class,GB-14530,George Bell,Corporate,United States,Fort Worth,Texas,76106,Central,Office Supplies,Paper,Things To Do Today Pad,9.392,2,0.2,3.2872,2016-12-09,2016-12-13
12/9/2016,12/13/2016,Standard Class,GB-14530,George Bell,Corporate,United States,Fort Worth,Texas,76106,Central,Office Supplies,Art,"Hunt BOSTON Vista Battery-Operated Pencil Sharpener, Black",9.328,1,0.2,0.8162,2016-12-09,2016-12-13
9/25/2017,9/29/2017,Standard Class,CT-11995,Carol Triggs,Consumer,United States,Rochester,Minnesota,55901,Central,Office Supplies,Binders,ACCOHIDE Binder by Acco,8.26,2,0.0,3.8822,2017-09-25,2017-09-29
9/25/2017,9/29/2017,Standard Class,CT-11995,Carol Triggs,Consumer,United States,Rochester,Minnesota,55901,Central,Furniture,Chairs,"Global Leather Task Chair, Black",269.97,3,0.0,51.2943,2017-09-25,2017-09-29
1/23/2015,1/27/2015,Standard Class,CW-11905,Carl Weiss,Home Office,United States,Bozeman,Montana,59715,West,Office Supplies,Paper,"Wirebound Service Call Books, 5 1/2"" x 4""",29.04,3,0.0,13.9392,2015-01-23,2015-01-27
1/23/2015,1/27/2015,Standard Class,CW-11905,Carl Weiss,Home Office,United States,Bozeman,Montana,59715,West,Office Supplies,Labels,Avery 500,14.62,2,0.0,6.8714,2015-01-23,2015-01-27
6/18/2015,6/23/2015,Standard Class,SN-20560,Skye Norling,Home Office,United States,Peoria,Arizona,85345,West,Office Supplies,Paper,Xerox 1922,11.952,3,0.2,4.3326,2015-06-18,2015-06-23
6/18/2015,6/23/2015,Standard Class,SN-20560,Skye Norling,Home Office,United States,Peoria,Arizona,85345,West,Office Supplies,Binders,Peel & Stick Add-On Corner Pockets,4.536,7,0.7,-3.3264,2015-06-18,2015-06-23
6/18/2015,6/23/2015,Standard Class,SN-20560,Skye Norling,Home Office,United States,Peoria,Arizona,85345,West,Office Supplies,Binders,Aluminum Screw Posts,9.156,2,0.7,-6.104,2015-06-18,2015-06-23
6/18/2015,6/23/2015,Standard Class,SN-20560,Skye Norling,Home Office,United States,Peoria,Arizona,85345,West,Furniture,Furnishings,Flat Face Poster Frame,75.36,5,0.2,20.724,2015-06-18,2015-06-23
10/2/2015,10/8/2015,Standard Class,EB-13705,Ed Braxton,Corporate,United States,San Diego,California,92105,West,Office Supplies,Binders,GBC Personal VeloBind Strips,57.504,6,0.2,20.1264,2015-10-02,2015-10-08
11/18/2017,11/23/2017,Standard Class,JW-15220,Jane Waco,Corporate,United States,Lakewood,Ohio,44107,East,Office Supplies,Art,BIC Liqua Brite Liner,38.864,7,0.2,7.7728,2017-11-18,2017-11-23
8/17/2014,8/23/2014,Standard Class,KB-16585,Ken Black,Corporate,United States,Houston,Texas,77095,Central,Office Supplies,Paper,Xerox 203,15.552,3,0.2,5.4432,2014-08-17,2014-08-23
7/17/2016,7/21/2016,Standard Class,MC-17590,Matt Collister,Corporate,United States,Perth Amboy,New Jersey,8861,East,Office Supplies,Appliances,Kensington 4 Outlet MasterPiece Compact Power Control Center,162.64,2,0.0,45.5392,2016-07-17,2016-07-21
7/17/2016,7/21/2016,Standard Class,MC-17590,Matt Collister,Corporate,United States,Perth Amboy,New Jersey,8861,East,Technology,Phones,Bose SoundLink Bluetooth Speaker,597.0,3,0.0,280.59,2016-07-17,2016-07-21
7/17/2016,7/21/2016,Standard Class,MC-17590,Matt Collister,Corporate,United States,Perth Amboy,New Jersey,8861,East,Office Supplies,Paper,"Eaton Premium Continuous-Feed Paper, 25% Cotton, Letter Size, White, 1000 Shts/Box",55.48,1,0.0,26.6304,2016-07-17,2016-07-21
7/11/2015,7/13/2015,First Class,CK-12595,Clytie Kelty,Consumer,United States,Philadelphia,Pennsylvania,19134,East,Furniture,Furnishings,"Howard Miller 13-3/4"" Diameter Brushed Chrome Round Wall Clock",289.8,7,0.2,36.225,2015-07-11,2015-07-13
7/11/2015,7/13/2015,First Class,CK-12595,Clytie Kelty,Consumer,United States,Philadelphia,Pennsylvania,19134,East,Office Supplies,Binders,Acco Suede Grain Vinyl Round Ring Binder,2.502,3,0.7,-2.0016,2015-07-11,2015-07-13
7/11/2015,7/13/2015,First Class,CK-12595,Clytie Kelty,Consumer,United States,Philadelphia,Pennsylvania,19134,East,Office Supplies,Binders,3M Organizer Strips,6.48,4,0.7,-4.752,2015-07-11,2015-07-13
7/11/2015,7/13/2015,First Class,CK-12595,Clytie Kelty,Consumer,United States,Philadelphia,Pennsylvania,19134,East,Furniture,Chairs,Novimex Fabric Task Chair,341.488,8,0.3,-73.176,2015-07-11,2015-07-13
7/11/2015,7/13/2015,First Class,CK-12595,Clytie Kelty,Consumer,United States,Philadelphia,Pennsylvania,19134,East,Office Supplies,Art,Newell 333,11.12,5,0.2,0.834,2015-07-11,2015-07-13
7/11/2015,7/13/2015,First Class,CK-12595,Clytie Kelty,Consumer,United States,Philadelphia,Pennsylvania,19134,East,Furniture,Furnishings,"Master Big Foot Doorstop, Beige",25.344,6,0.2,3.4848,2015-07-11,2015-07-13
12/1/2016,12/7/2016,Standard Class,RD-19480,Rick Duston,Consumer,United States,Richmond,Indiana,47374,Central,Furniture,Furnishings,DAX Cubicle Frames - 8x10,17.31,3,0.0,5.193,2016-12-01,2016-12-07
12/22/2017,12/25/2017,First Class,TP-21130,Theone Pippenger,Consumer,United States,Detroit,Michigan,48227,Central,Technology,Accessories,Microsoft Wireless Mobile Mouse 4000,199.95,5,0.0,63.984,2017-12-22,2017-12-25
12/22/2017,12/25/2017,First Class,TP-21130,Theone Pippenger,Consumer,United States,Detroit,Michigan,48227,Central,Furniture,Chairs,Hon GuestStacker Chair,1586.69,7,0.0,412.5394,2017-12-22,2017-12-25
12/22/2017,12/25/2017,First Class,TP-21130,Theone Pippenger,Consumer,United States,Detroit,Michigan,48227,Central,Technology,Accessories,Logitech Gaming G510s - Keyboard,84.99,1,0.0,30.5964,2017-12-22,2017-12-25
12/22/2017,12/25/2017,First Class,TP-21130,Theone Pippenger,Consumer,United States,Detroit,Michigan,48227,Central,Furniture,Tables,Bevis 44 x 96 Conference Tables,411.8,2,0.0,70.006,2017-12-22,2017-12-25
10/31/2014,11/4/2014,Standard Class,GG-14650,Greg Guthrie,Corporate,United States,Los Angeles,California,90049,West,Office Supplies,Fasteners,Staples,11.34,3,0.0,5.2164,2014-10-31,2014-11-04
10/31/2014,11/4/2014,Standard Class,GG-14650,Greg Guthrie,Corporate,United States,Los Angeles,California,90049,West,Office Supplies,Storage,"Letter/Legal File Tote with Clear Snap-On Lid, Black Granite",80.3,5,0.0,20.878,2014-10-31,2014-11-04
10/31/2014,11/4/2014,Standard Class,GG-14650,Greg Guthrie,Corporate,United States,Los Angeles,California,90049,West,Office Supplies,Binders,"Avery Framed View Binder, EZD Ring (Locking), Navy, 1 1/2""",15.968,2,0.2,5.3892,2014-10-31,2014-11-04
10/31/2014,11/4/2014,Standard Class,GG-14650,Greg Guthrie,Corporate,United States,Los Angeles,California,90049,West,Office Supplies,Paper,Xerox 1952,64.74,13,0.0,30.4278,2014-10-31,2014-11-04
10/31/2014,11/4/2014,Standard Class,GG-14650,Greg Guthrie,Corporate,United States,Los Angeles,California,90049,West,Office Supplies,Binders,"Fellowes Twister Kit, Gray/Clear, 3/pkg",19.296,3,0.2,6.03,2014-10-31,2014-11-04
10/31/2014,11/4/2014,Standard Class,GG-14650,Greg Guthrie,Corporate,United States,Los Angeles,California,90049,West,Office Supplies,Storage,Tennsco Regal Shelving Units,405.64,4,0.0,12.1692,2014-10-31,2014-11-04
10/31/2014,11/4/2014,Standard Class,GG-14650,Greg Guthrie,Corporate,United States,Los Angeles,California,90049,West,Furniture,Chairs,Novimex Fabric Task Chair,146.352,3,0.2,-9.147,2014-10-31,2014-11-04
10/31/2014,11/4/2014,Standard Class,GG-14650,Greg Guthrie,Corporate,United States,Los Angeles,California,90049,West,Technology,Accessories,Maxell LTO Ultrium - 800 GB,251.91,9,0.0,47.8629,2014-10-31,2014-11-04
10/31/2014,11/4/2014,Standard Class,GG-14650,Greg Guthrie,Corporate,United States,Los Angeles,California,90049,West,Office Supplies,Art,Newell 325,12.39,3,0.0,3.717,2014-10-31,2014-11-04
4/13/2015,4/19/2015,Standard Class,ZC-21910,Zuschuss Carroll,Consumer,United States,Pomona,California,91767,West,Technology,Accessories,Plantronics Audio 478 Stereo USB Headset,199.96,4,0.0,69.986,2015-04-13,2015-04-19
4/13/2015,4/19/2015,Standard Class,ZC-21910,Zuschuss Carroll,Consumer,United States,Pomona,California,91767,West,Furniture,Tables,Hon 94000 Series Round Tables,710.832,3,0.2,-97.7394,2015-04-13,2015-04-19
7/21/2016,7/23/2016,Second Class,CC-12610,Corey Catlett,Corporate,United States,Philadelphia,Pennsylvania,19134,East,Office Supplies,Binders,GBC Instant Report Kit,1.941,1,0.7,-1.294,2016-07-21,2016-07-23
11/20/2017,11/25/2017,Standard Class,KA-16525,Kelly Andreada,Consumer,United States,Ontario,California,91761,West,Furniture,Chairs,Novimex High-Tech Fabric Mesh Task Chair,283.92,5,0.2,-46.137,2017-11-20,2017-11-25
11/26/2016,12/2/2016,Standard Class,TC-20980,Tamara Chand,Corporate,United States,Seattle,Washington,98105,West,Office Supplies,Binders,Newell 3-Hole Punched Plastic Slotted Magazine Holders for Binders,7.312,2,0.2,2.5592,2016-11-26,2016-12-02
11/7/2017,11/12/2017,Second Class,DB-13270,Deborah Brumfield,Home Office,United States,Brentwood,California,94513,West,Technology,Accessories,Anker Ultra-Slim Mini Bluetooth 3.0 Wireless Keyboard,59.97,3,0.0,13.7931,2017-11-07,2017-11-12
11/7/2017,11/12/2017,Second Class,DB-13270,Deborah Brumfield,Home Office,United States,Brentwood,California,94513,West,Technology,Phones,"Plantronics CS 50-USB - headset - Convertible, Monaural",761.544,7,0.2,66.6351,2017-11-07,2017-11-12
12/1/2014,12/5/2014,Standard Class,TR-21325,Toby Ritter,Consumer,United States,San Francisco,California,94122,West,Furniture,Furnishings,"Floodlight Indoor Halogen Bulbs, 1 Bulb per Pack, 60 Watts",58.2,3,0.0,28.518,2014-12-01,2014-12-05
9/12/2017,9/15/2017,First Class,BF-11080,Bart Folk,Consumer,United States,Baltimore,Maryland,21215,East,Office Supplies,Paper,"Adams Telephone Message Book w/Frequently-Called Numbers Space, 400 Messages per Book",39.9,5,0.0,19.95,2017-09-12,2017-09-15
9/12/2017,9/15/2017,First Class,BF-11080,Bart Folk,Consumer,United States,Baltimore,Maryland,21215,East,Office Supplies,Appliances,Fellowes Basic Home/Office Series Surge Protectors,90.86,7,0.0,26.3494,2017-09-12,2017-09-15
9/12/2017,9/15/2017,First Class,BF-11080,Bart Folk,Consumer,United States,Baltimore,Maryland,21215,East,Office Supplies,Paper,Xerox 1939,94.85,5,0.0,45.528,2017-09-12,2017-09-15
12/24/2015,12/29/2015,Standard Class,MS-17365,Maribeth Schnelling,Consumer,United States,Phoenix,Arizona,85023,West,Office Supplies,Paper,Computer Printout Paper with Letter-Trim Perforations,106.232,7,0.2,37.1812,2015-12-24,2015-12-29
12/24/2015,12/29/2015,Standard Class,MS-17365,Maribeth Schnelling,Consumer,United States,Phoenix,Arizona,85023,West,Technology,Phones,ClearSounds CSC500 Amplified Spirit Phone Corded phone,111.984,2,0.2,11.1984,2015-12-24,2015-12-29
12/24/2015,12/29/2015,Standard Class,MS-17365,Maribeth Schnelling,Consumer,United States,Phoenix,Arizona,85023,West,Furniture,Furnishings,Magna Visual Magnetic Picture Hangers,7.712,2,0.2,1.7352,2015-12-24,2015-12-29
2/23/2017,3/1/2017,Standard Class,CK-12595,Clytie Kelty,Consumer,United States,Los Angeles,California,90008,West,Office Supplies,Paper,"Ampad Phone Message Book, Recycled, 400 Message Capacity, 5 ¾ x 11",37.44,6,0.0,16.848,2017-02-23,2017-03-01
11/23/2014,11/29/2014,Standard Class,ED-13885,Emily Ducich,Home Office,United States,Houston,Texas,77036,Central,Office Supplies,Labels,Alphabetical Labels for Top Tab Filing,23.68,2,0.2,8.88,2014-11-23,2014-11-29
6/23/2016,6/28/2016,Standard Class,IM-15070,Irene Maddox,Consumer,United States,New York City,New York,10009,East,Office Supplies,Labels,"Avery 4027 File Folder Labels for Dot Matrix Printers, 5000 Labels per Box, White",122.12,4,0.0,56.1752,2016-06-23,2016-06-28
6/23/2016,6/28/2016,Standard Class,IM-15070,Irene Maddox,Consumer,United States,New York City,New York,10009,East,Office Supplies,Labels,Avery 52,18.45,5,0.0,8.6715,2016-06-23,2016-06-28
6/23/2016,6/28/2016,Standard Class,IM-15070,Irene Maddox,Consumer,United States,New York City,New York,10009,East,Office Supplies,Storage,Fellowes Bankers Box Staxonsteel Drawer File/Stacking System,324.9,5,0.0,38.988,2016-06-23,2016-06-28
6/23/2016,6/28/2016,Standard Class,IM-15070,Irene Maddox,Consumer,United States,New York City,New York,10009,East,Office Supplies,Paper,Tops White Computer Printout Paper,146.73,3,0.0,68.9631,2016-06-23,2016-06-28
6/23/2016,6/28/2016,Standard Class,IM-15070,Irene Maddox,Consumer,United States,New York City,New York,10009,East,Office Supplies,Fasteners,Translucent Push Pins by OIC,3.96,2,0.0,1.4652,2016-06-23,2016-06-28
10/26/2015,10/30/2015,Standard Class,MY-17380,Maribeth Yedwab,Corporate,United States,Rancho Cucamonga,California,91730,West,Office Supplies,Labels,Avery 507,5.76,2,0.0,2.6496,2015-10-26,2015-10-30
7/15/2017,7/19/2017,Standard Class,MM-17260,Magdelene Morse,Consumer,United States,Wilmington,Delaware,19805,East,Office Supplies,Binders,GBC Standard Plastic Binding Systems Combs,26.55,3,0.0,13.0095,2017-07-15,2017-07-19
7/15/2017,7/19/2017,Standard Class,MM-17260,Magdelene Morse,Consumer,United States,Wilmington,Delaware,19805,East,Furniture,Tables,Hon 2111 Invitation Series Straight Table,310.443,3,0.3,-48.7839,2017-07-15,2017-07-19
11/17/2014,11/21/2014,Standard Class,MP-17470,Mark Packer,Home Office,United States,Moorhead,Minnesota,56560,Central,Furniture,Chairs,Global Super Steno Chair,479.9,5,0.0,81.583,2014-11-17,2014-11-21
4/13/2015,4/15/2015,Second Class,AW-10840,Anthony Witt,Consumer,United States,Farmington,New Mexico,87401,West,Office Supplies,Supplies,Martin-Yale Premier Letter Opener,12.88,1,0.0,0.3864,2015-04-13,2015-04-15
11/25/2015,11/29/2015,Standard Class,SF-20065,Sandra Flanagan,Consumer,United States,Wilmington,North Carolina,28403,South,Office Supplies,Art,Newell 349,13.12,5,0.2,1.476,2015-11-25,2015-11-29
5/15/2016,5/20/2016,Standard Class,SN-20710,Steve Nguyen,Home Office,United States,Jackson,Mississippi,39212,South,Office Supplies,Binders,GBC DocuBind P50 Personal Binding Machine,511.84,8,0.0,240.5648,2016-05-15,2016-05-20
5/15/2016,5/20/2016,Standard Class,SN-20710,Steve Nguyen,Home Office,United States,Jackson,Mississippi,39212,South,Office Supplies,Art,Boston KS Multi-Size Manual Pencil Sharpener,91.96,4,0.0,25.7488,2016-05-15,2016-05-20
5/15/2016,5/20/2016,Standard Class,SN-20710,Steve Nguyen,Home Office,United States,Jackson,Mississippi,39212,South,Office Supplies,Art,Newell 344,8.34,3,0.0,2.1684,2016-05-15,2016-05-20
9/7/2017,9/12/2017,Standard Class,RD-19900,Ruben Dartt,Consumer,United States,Portland,Oregon,97206,West,Office Supplies,Storage,Hanging Personal Folder File,37.68,3,0.2,2.355,2017-09-07,2017-09-12
9/7/2017,9/12/2017,Standard Class,RD-19900,Ruben Dartt,Consumer,United States,Portland,Oregon,97206,West,Technology,Accessories,Logitech Wireless Marathon Mouse M705,279.944,7,0.2,80.4839,2017-09-07,2017-09-12
3/10/2014,3/17/2014,Standard Class,KT-16480,Kean Thornton,Consumer,United States,Denver,Colorado,80219,West,Office Supplies,Storage,Tennsco 6- and 18-Compartment Lockers,636.408,3,0.2,-15.9102,2014-03-10,2014-03-17
3/10/2014,3/17/2014,Standard Class,KT-16480,Kean Thornton,Consumer,United States,Denver,Colorado,80219,West,Office Supplies,Art,"BOSTON Ranger #55 Pencil Sharpener, Black",83.168,4,0.2,9.3564,2014-03-10,2014-03-17
7/18/2014,7/18/2014,Same Day,AH-10120,Adrian Hane,Home Office,United States,Tucson,Arizona,85705,West,Furniture,Chairs,Office Star - Ergonomically Designed Knee Chair,259.136,4,0.2,-25.9136,2014-07-18,2014-07-18
3/24/2017,3/28/2017,Second Class,BM-11650,Brian Moss,Corporate,United States,New York City,New York,10009,East,Office Supplies,Paper,Xerox 1888,221.92,4,0.0,106.5216,2017-03-24,2017-03-28
3/24/2017,3/28/2017,Second Class,BM-11650,Brian Moss,Corporate,United States,New York City,New York,10009,East,Technology,Accessories,Memorex Micro Travel Drive 8 GB,26.0,2,0.0,11.7,2017-03-24,2017-03-28
9/30/2014,10/5/2014,Standard Class,BW-11200,Ben Wallace,Consumer,United States,Boynton Beach,Florida,33437,South,Office Supplies,Paper,Xerox 217,15.552,3,0.2,5.4432,2014-09-30,2014-10-05
9/26/2014,9/26/2014,Same Day,HG-14965,Henry Goldwyn,Corporate,United States,Mesquite,Texas,75150,Central,Office Supplies,Binders,Acco 3-Hole Punch,0.876,1,0.8,-1.4016,2014-09-26,2014-09-26
10/31/2015,10/31/2015,Same Day,SG-20080,Sandra Glassco,Consumer,United States,Redlands,California,92374,West,Office Supplies,Paper,Xerox 191,19.98,1,0.0,9.3906,2015-10-31,2015-10-31
10/31/2015,10/31/2015,Same Day,SG-20080,Sandra Glassco,Consumer,United States,Redlands,California,92374,West,Office Supplies,Binders,GBC DocuBind P100 Manual Binding Machine,398.352,3,0.2,124.485,2015-10-31,2015-10-31
10/31/2015,10/31/2015,Same Day,SG-20080,Sandra Glassco,Consumer,United States,Redlands,California,92374,West,Office Supplies,Art,Newell 308,5.04,3,0.0,1.26,2015-10-31,2015-10-31
10/31/2015,10/31/2015,Same Day,SG-20080,Sandra Glassco,Consumer,United States,Redlands,California,92374,West,Office Supplies,Fasteners,OIC Bulk Pack Metal Binder Clips,17.45,5,0.0,8.027,2015-10-31,2015-10-31
10/31/2015,10/31/2015,Same Day,SG-20080,Sandra Glassco,Consumer,United States,Redlands,California,92374,West,Furniture,Chairs,"Global Fabric Manager's Chair, Dark Gray",323.136,4,0.2,20.196,2015-10-31,2015-10-31
10/31/2015,10/31/2015,Same Day,SG-20080,Sandra Glassco,Consumer,United States,Redlands,California,92374,West,Office Supplies,Supplies,Acme Tagit Stainless Steel Antibacterial Scissors,29.7,3,0.0,8.019,2015-10-31,2015-10-31
10/31/2015,10/31/2015,Same Day,SG-20080,Sandra Glassco,Consumer,United States,Redlands,California,92374,West,Technology,Phones,Polycom SoundStation2 EX Conference phone,1295.84,4,0.2,145.782,2015-10-31,2015-10-31
10/31/2015,10/31/2015,Same Day,SG-20080,Sandra Glassco,Consumer,United States,Redlands,California,92374,West,Office Supplies,Storage,Mobile Personal File Cube,46.84,2,0.0,12.6468,2015-10-31,2015-10-31
10/31/2015,10/31/2015,Same Day,SG-20080,Sandra Glassco,Consumer,United States,Redlands,California,92374,West,Furniture,Bookcases,DMI Eclipse Executive Suite Bookcases,425.833,1,0.15,20.0392,2015-10-31,2015-10-31
10/12/2015,10/17/2015,Second Class,RK-19300,Ralph Kennedy,Consumer,United States,Rochester,New York,14609,East,Furniture,Tables,"SAFCO PlanMaster Heigh-Adjustable Drafting Table Base, 43w x 30d x 30-37h, Black",209.67,1,0.4,-13.978,2015-10-12,2015-10-17
9/19/2016,9/23/2016,Standard Class,SW-20245,Scot Wooten,Consumer,United States,Stockton,California,95207,West,Office Supplies,Paper,"Xerox Color Copier Paper, 11"" x 17"", Ream",159.88,7,0.0,73.5448,2016-09-19,2016-09-23
4/13/2017,4/15/2017,First Class,RW-19630,Rob Williams,Corporate,United States,Seattle,Washington,98105,West,Office Supplies,Paper,Xerox 4200 Series MultiUse Premium Copy Paper (20Lb. and 84 Bright),5.28,1,0.0,2.376,2017-04-13,2017-04-15
4/13/2017,4/15/2017,First Class,RW-19630,Rob Williams,Corporate,United States,Seattle,Washington,98105,West,Office Supplies,Binders,GBC DocuBind TL200 Manual Binding Machine,895.92,5,0.2,302.373,2017-04-13,2017-04-15
1/7/2017,1/13/2017,Standard Class,TS-21085,Thais Sissman,Consumer,United States,Ormond Beach,Florida,32174,South,Office Supplies,Binders,Zipper Ring Binder Pockets,2.808,3,0.7,-1.9656,2017-01-07,2017-01-13
11/9/2017,11/11/2017,First Class,JB-15400,Jennifer Braxton,Corporate,United States,Sunnyvale,California,94086,West,Furniture,Chairs,"Global Leather Task Chair, Black",215.976,3,0.2,-2.6997,2017-11-09,2017-11-11
9/22/2017,9/24/2017,Second Class,EH-14005,Erica Hernandez,Home Office,United States,Lansing,Michigan,48911,Central,Furniture,Bookcases,O'Sullivan 4-Shelf Bookcase in Odessa Pine,241.96,2,0.0,41.1332,2017-09-22,2017-09-24
9/22/2017,9/24/2017,Second Class,EH-14005,Erica Hernandez,Home Office,United States,Lansing,Michigan,48911,Central,Office Supplies,Labels,Avery 511,27.72,9,0.0,13.3056,2017-09-22,2017-09-24
12/1/2017,12/5/2017,Standard Class,EH-14005,Erica Hernandez,Home Office,United States,Philadelphia,Pennsylvania,19143,East,Office Supplies,Envelopes,Quality Park Security Envelopes,104.68,5,0.2,35.3295,2017-12-01,2017-12-05
12/1/2017,12/5/2017,Standard Class,EH-14005,Erica Hernandez,Home Office,United States,Philadelphia,Pennsylvania,19143,East,Technology,Phones,"Belkin SportFit Armband For iPhone 5s/5c, Fuchsia",62.958,7,0.4,9.4437,2017-12-01,2017-12-05
6/23/2014,6/28/2014,Standard Class,BS-11665,Brian Stugart,Consumer,United States,Philadelphia,Pennsylvania,19143,East,Technology,Accessories,Sony 64GB Class 10 Micro SDHC R40 Memory Card,86.376,3,0.2,1.0797,2014-06-23,2014-06-28
10/4/2015,10/9/2015,Standard Class,JK-16120,Julie Kriz,Home Office,United States,Philadelphia,Pennsylvania,19134,East,Furniture,Furnishings,"DataProducts Ampli Magnifier Task Lamp, Black,",64.944,3,0.2,6.4944,2015-10-04,2015-10-09
10/4/2015,10/9/2015,Standard Class,JK-16120,Julie Kriz,Home Office,United States,Philadelphia,Pennsylvania,19134,East,Office Supplies,Paper,Xerox 1946,20.736,4,0.2,7.2576,2015-10-04,2015-10-09
5/20/2014,5/22/2014,Second Class,RF-19345,Randy Ferguson,Corporate,United States,Dover,New Hampshire,3820,East,Office Supplies,Appliances,Acco 6 Outlet Guardian Basic Surge Suppressor,33.28,4,0.0,9.3184,2014-05-20,2014-05-22
5/20/2014,5/22/2014,Second Class,RF-19345,Randy Ferguson,Corporate,United States,Dover,New Hampshire,3820,East,Office Supplies,Art,"Sanford Colorific Scented Colored Pencils, 12/Pack",38.52,9,0.0,11.9412,2014-05-20,2014-05-22
5/20/2014,5/22/2014,Second Class,RF-19345,Randy Ferguson,Corporate,United States,Dover,New Hampshire,3820,East,Furniture,Furnishings,24-Hour Round Wall Clock,139.86,7,0.0,60.1398,2014-05-20,2014-05-22
11/20/2015,11/26/2015,Standard Class,DL-12865,Dan Lawera,Consumer,United States,New York City,New York,10011,East,Office Supplies,Paper,"Message Book, Phone, Wirebound Standard Line Memo, 2 3/4"" X 5""",19.65,3,0.0,9.039,2015-11-20,2015-11-26
11/30/2015,12/4/2015,Standard Class,WB-21850,William Brown,Consumer,United States,Philadelphia,Pennsylvania,19134,East,Office Supplies,Binders,Fellowes PB200 Plastic Comb Binding Machine,152.991,3,0.7,-122.3928,2015-11-30,2015-12-04
11/30/2015,12/4/2015,Standard Class,WB-21850,William Brown,Consumer,United States,Philadelphia,Pennsylvania,19134,East,Office Supplies,Fasteners,Revere Boxed Rubber Bands by Revere,10.584,7,0.2,-2.3814,2015-11-30,2015-12-04
11/30/2015,12/4/2015,Standard Class,WB-21850,William Brown,Consumer,United States,Philadelphia,Pennsylvania,19134,East,Technology,Phones,Motorla HX550 Universal Bluetooth Headset,94.92,4,0.4,15.82,2015-11-30,2015-12-04
12/31/2015,1/5/2016,Standard Class,TB-21625,Trudy Brown,Consumer,United States,Grand Prairie,Texas,75051,Central,Furniture,Furnishings,"Eldon Expressions Wood Desk Accessories, Oak",14.76,5,0.6,-11.439,2015-12-31,2016-01-05
12/31/2015,1/5/2016,Standard Class,TB-21625,Trudy Brown,Consumer,United States,Grand Prairie,Texas,75051,Central,Office Supplies,Binders,Newell 3-Hole Punched Plastic Slotted Magazine Holders for Binders,3.656,4,0.8,-5.8496,2015-12-31,2016-01-05
11/16/2017,11/16/2017,Same Day,CB-12415,Christy Brittain,Consumer,United States,New York City,New York,10009,East,Office Supplies,Paper,Tops Green Bar Computer Printout Paper,146.82,3,0.0,73.41,2017-11-16,2017-11-16
6/6/2014,6/11/2014,Standard Class,GT-14635,Grant Thornton,Corporate,United States,Long Beach,New York,11561,East,Office Supplies,Binders,Wilson Jones Century Plastic Molded Ring Binders,149.544,9,0.2,50.4711,2014-06-06,2014-06-11
6/6/2014,6/11/2014,Standard Class,GT-14635,Grant Thornton,Corporate,United States,Long Beach,New York,11561,East,Office Supplies,Supplies,Acme Office Executive Series Stainless Steel Trimmers,17.14,2,0.0,4.4564,2014-06-06,2014-06-11
6/6/2014,6/11/2014,Standard Class,GT-14635,Grant Thornton,Corporate,United States,Long Beach,New York,11561,East,Furniture,Tables,"Chromcraft Bull-Nose Wood 48"" x 96"" Rectangular Conference Tables",991.764,3,0.4,-347.1174,2014-06-06,2014-06-11
9/1/2016,9/5/2016,Standard Class,DK-13225,Dean Katz,Corporate,United States,Philadelphia,Pennsylvania,19140,East,Office Supplies,Paper,"Telephone Message Books with Fax/Mobile Section, 5 1/2"" x 3 3/16""",30.48,6,0.2,9.906,2016-09-01,2016-09-05
9/1/2016,9/5/2016,Standard Class,DK-13225,Dean Katz,Corporate,United States,Philadelphia,Pennsylvania,19140,East,Technology,Phones,Anker 36W 4-Port USB Wall Charger Travel Power Adapter for iPhone 5s 5c 5,23.988,2,0.4,-4.7976,2016-09-01,2016-09-05
9/1/2016,9/5/2016,Standard Class,DK-13225,Dean Katz,Corporate,United States,Philadelphia,Pennsylvania,19140,East,Office Supplies,Fasteners,Staples,16.688,7,0.2,5.4236,2016-09-01,2016-09-05
6/25/2016,6/29/2016,Standard Class,TS-21160,Theresa Swint,Corporate,United States,York,Pennsylvania,17403,East,Furniture,Chairs,"Global Leather Highback Executive Chair with Pneumatic Height Adjustment, Black",422.058,3,0.3,-18.0882,2016-06-25,2016-06-29
6/25/2016,6/29/2016,Standard Class,TS-21160,Theresa Swint,Corporate,United States,York,Pennsylvania,17403,East,Office Supplies,Binders,GBC Wire Binding Strips,38.088,4,0.7,-27.9312,2016-06-25,2016-06-29
6/25/2016,6/29/2016,Standard Class,TS-21160,Theresa Swint,Corporate,United States,York,Pennsylvania,17403,East,Office Supplies,Storage,"Gould Plastics 9-Pocket Panel Bin, 18-3/8w x 5-1/4d x 20-1/2h, Black",254.352,6,0.2,-50.8704,2016-06-25,2016-06-29
12/12/2014,12/17/2014,Standard Class,WB-21850,William Brown,Consumer,United States,Concord,California,94521,West,Furniture,Furnishings,Eldon Advantage Chair Mats for Low to Medium Pile Carpets,43.31,1,0.0,4.331,2014-12-12,2014-12-17
3/31/2017,4/5/2017,Standard Class,DO-13435,Denny Ordway,Consumer,United States,New York City,New York,10035,East,Technology,Phones,Spigen Samsung Galaxy S5 Case Wallet,84.95,5,0.0,22.087,2017-03-31,2017-04-05
11/19/2017,11/26/2017,Standard Class,AF-10870,Art Ferguson,Consumer,United States,College Station,Texas,77840,Central,Furniture,Chairs,Office Star Flex Back Scooter Chair with White Frame,233.058,3,0.3,-53.2704,2017-11-19,2017-11-26
11/24/2014,11/29/2014,Second Class,RB-19435,Richard Bierner,Consumer,United States,Saint Louis,Missouri,63116,Central,Technology,Accessories,Memorex Mini Travel Drive 16 GB USB 2.0 Flash Drive,111.79,7,0.0,43.5981,2014-11-24,2014-11-29
11/22/2015,11/26/2015,Standard Class,AR-10540,Andy Reiter,Consumer,United States,Quincy,Massachusetts,2169,East,Office Supplies,Paper,Xerox 1970,14.94,3,0.0,7.0218,2015-11-22,2015-11-26
7/14/2016,7/18/2016,Standard Class,DR-12880,Dan Reichenbach,Corporate,United States,New York City,New York,10009,East,Office Supplies,Binders,GBC Standard Plastic Binding Systems Combs,14.16,2,0.2,5.133,2016-07-14,2016-07-18
4/30/2016,5/5/2016,Standard Class,BF-11170,Ben Ferrer,Home Office,United States,Dallas,Texas,75081,Central,Furniture,Furnishings,Flat Face Poster Frame,22.608,3,0.6,-10.1736,2016-04-30,2016-05-05
7/25/2016,7/27/2016,Second Class,LB-16735,Larry Blacks,Consumer,United States,Los Angeles,California,90032,West,Office Supplies,Fasteners,OIC Binder Clips,21.48,6,0.0,10.74,2016-07-25,2016-07-27
6/22/2014,6/24/2014,First Class,DV-13465,Dianna Vittorini,Consumer,United States,Minneapolis,Minnesota,55407,Central,Office Supplies,Storage,Office Impressions Heavy Duty Welded Shelving & Multimedia Storage Drawers,501.81,3,0.0,0.0,2014-06-22,2014-06-24
6/22/2014,6/24/2014,First Class,DV-13465,Dianna Vittorini,Consumer,United States,Minneapolis,Minnesota,55407,Central,Office Supplies,Storage,Fellowes Bankers Box Recycled Super Stor/Drawer,161.94,3,0.0,9.7164,2014-06-22,2014-06-24
10/21/2017,10/26/2017,Standard Class,NK-18490,Neil Knudson,Home Office,United States,Deltona,Florida,32725,South,Office Supplies,Art,Newell 33,17.856,4,0.2,2.0088,2017-10-21,2017-10-26
9/3/2016,9/9/2016,Standard Class,CS-11950,Carlos Soltero,Consumer,United States,Chicago,Illinois,60610,Central,Office Supplies,Binders,"XtraLife ClearVue Slant-D Ring Binder, White, 3""",8.808,3,0.8,-14.9736,2016-09-03,2016-09-09
5/14/2016,5/14/2016,Same Day,LH-17155,Logan Haushalter,Consumer,United States,Cincinnati,Ohio,45231,East,Furniture,Furnishings,"GE 48"" Fluorescent Tube, Cool White Energy Saver, 34 Watts, 30/Box",79.384,1,0.2,29.769,2016-05-14,2016-05-14
1/7/2016,1/12/2016,Standard Class,DW-13480,Dianna Wilson,Home Office,United States,Oakland,California,94601,West,Office Supplies,Art,Panasonic KP-350BK Electric Pencil Sharpener with Auto Stop,34.58,1,0.0,10.0282,2016-01-07,2016-01-12
3/13/2017,3/19/2017,Standard Class,KF-16285,Karen Ferguson,Home Office,United States,Manteca,California,95336,West,Office Supplies,Paper,Multicolor Computer Printout Paper,314.55,3,0.0,150.984,2017-03-13,2017-03-19
10/13/2016,10/19/2016,Standard Class,HA-14920,Helen Andreada,Consumer,United States,Laredo,Texas,78041,Central,Technology,Accessories,Razer Kraken PRO Over Ear PC and Music Headset,191.976,3,0.2,23.997,2016-10-13,2016-10-19
10/13/2016,10/19/2016,Standard Class,HA-14920,Helen Andreada,Consumer,United States,Laredo,Texas,78041,Central,Office Supplies,Paper,Array Memo Cubes,8.288,2,0.2,3.0044,2016-10-13,2016-10-19
10/13/2016,10/19/2016,Standard Class,HA-14920,Helen Andreada,Consumer,United States,Laredo,Texas,78041,Central,Furniture,Furnishings,"Tenex ""The Solids"" Textured Chair Mats",139.92,5,0.6,-150.414,2016-10-13,2016-10-19
10/13/2016,10/19/2016,Standard Class,HA-14920,Helen Andreada,Consumer,United States,Laredo,Texas,78041,Central,Office Supplies,Art,Newell 334,15.872,1,0.2,1.1904,2016-10-13,2016-10-19
10/13/2016,10/19/2016,Standard Class,HA-14920,Helen Andreada,Consumer,United States,Laredo,Texas,78041,Central,Office Supplies,Binders,Avery Non-Stick Binders,6.286,7,0.8,-11.0005,2016-10-13,2016-10-19
1/27/2017,1/30/2017,Second Class,JH-15820,John Huston,Consumer,United States,Kent,Ohio,44240,East,Office Supplies,Art,Newell 312,14.016,3,0.2,1.752,2017-01-27,2017-01-30
1/27/2017,1/30/2017,Second Class,JH-15820,John Huston,Consumer,United States,Kent,Ohio,44240,East,Technology,Accessories,Anker Ultrathin Bluetooth Wireless Keyboard Aluminum Cover with Stand ,71.976,3,0.2,-8.997,2017-01-27,2017-01-30
1/27/2017,1/30/2017,Second Class,JH-15820,John Huston,Consumer,United States,Kent,Ohio,44240,East,Technology,Phones,JBL Micro Wireless Portable Bluetooth Speaker,107.982,3,0.4,-26.9955,2017-01-27,2017-01-30
11/19/2017,11/25/2017,Standard Class,LC-16930,Linda Cazamias,Corporate,United States,San Angelo,Texas,76903,Central,Furniture,Chairs,"Lifetime Advantage Folding Chairs, 4/Carton",305.312,2,0.3,-8.7232,2017-11-19,2017-11-25
8/1/2014,8/3/2014,First Class,IL-15100,Ivan Liston,Consumer,United States,San Francisco,California,94122,West,Office Supplies,Binders,Wilson Jones data.warehouse D-Ring Binders with DublLock,19.752,3,0.2,6.9132,2014-08-01,2014-08-03
7/30/2016,8/4/2016,Standard Class,LS-16975,Lindsay Shagiari,Home Office,United States,Houston,Texas,77070,Central,Office Supplies,Binders,GBC VeloBind Cover Sets,9.264,3,0.8,-13.896,2016-07-30,2016-08-04
7/30/2015,8/3/2015,Second Class,CC-12610,Corey Catlett,Corporate,United States,Houston,Texas,77041,Central,Office Supplies,Storage,Eldon ProFile File 'N Store Portable File Tub Letter/Legal Size Black,61.792,4,0.2,6.1792,2015-07-30,2015-08-03
10/15/2016,10/21/2016,Standard Class,PB-18805,Patrick Bzostek,Home Office,United States,Salt Lake City,Utah,84106,West,Office Supplies,Paper,Xerox 1982,45.68,2,0.0,21.0128,2016-10-15,2016-10-21
10/15/2016,10/21/2016,Standard Class,PB-18805,Patrick Bzostek,Home Office,United States,Salt Lake City,Utah,84106,West,Office Supplies,Paper,Xerox 1986,60.12,9,0.0,28.8576,2016-10-15,2016-10-21
10/15/2016,10/21/2016,Standard Class,PB-18805,Patrick Bzostek,Home Office,United States,Salt Lake City,Utah,84106,West,Office Supplies,Binders,"Acco Data Flex Cable Posts For Top & Bottom Load Binders, 6"" Capacity",41.72,5,0.2,13.0375,2016-10-15,2016-10-21
10/15/2016,10/21/2016,Standard Class,PB-18805,Patrick Bzostek,Home Office,United States,Salt Lake City,Utah,84106,West,Office Supplies,Paper,"Recycled Desk Saver Line ""While You Were Out"" Book, 5 1/2"" X 4""",71.6,8,0.0,32.936,2016-10-15,2016-10-21
5/7/2016,5/11/2016,Standard Class,CJ-12010,Caroline Jumper,Consumer,United States,New York City,New York,10009,East,Office Supplies,Binders,"GBC Twin Loop Wire Binding Elements, 9/16"" Spine, Black",85.232,7,0.2,30.8966,2016-05-07,2016-05-11
5/7/2016,5/11/2016,Standard Class,CJ-12010,Caroline Jumper,Consumer,United States,New York City,New York,10009,East,Office Supplies,Labels,Alphabetical Labels for Top Tab Filing,44.4,3,0.0,22.2,2016-05-07,2016-05-11
5/7/2016,5/11/2016,Standard Class,CJ-12010,Caroline Jumper,Consumer,United States,New York City,New York,10009,East,Furniture,Chairs,Hon Mobius Operator's Chair,442.764,4,0.1,59.0352,2016-05-07,2016-05-11
5/7/2016,5/11/2016,Standard Class,CJ-12010,Caroline Jumper,Consumer,United States,New York City,New York,10009,East,Technology,Machines,Bady BDG101FRU Card Printer,3999.95,5,0.0,1159.9855,2016-05-07,2016-05-11
5/7/2016,5/11/2016,Standard Class,CJ-12010,Caroline Jumper,Consumer,United States,New York City,New York,10009,East,Technology,Accessories,SanDisk Ultra 64 GB MicroSDHC Class 10 Memory Card,199.95,5,0.0,21.9945,2016-05-07,2016-05-11
5/7/2016,5/11/2016,Standard Class,CJ-12010,Caroline Jumper,Consumer,United States,New York City,New York,10009,East,Furniture,Furnishings,Staple-based wall hangings,63.68,8,0.0,28.0192,2016-05-07,2016-05-11
8/1/2017,8/4/2017,Second Class,HK-14890,Heather Kirkland,Corporate,United States,Salinas,California,93905,West,Office Supplies,Binders,GBC Prestige Therm-A-Bind Covers,54.896,2,0.2,18.5274,2017-08-01,2017-08-04
7/14/2016,7/14/2016,Same Day,RH-19600,Rob Haberlin,Consumer,United States,Huntsville,Alabama,35810,South,Technology,Accessories,HP Standard 104 key PS/2 Keyboard,29.0,2,0.0,7.25,2016-07-14,2016-07-14
8/10/2017,8/15/2017,Standard Class,IL-15100,Ivan Liston,Consumer,United States,Columbus,Indiana,47201,Central,Office Supplies,Envelopes,Staple envelope,70.08,6,0.0,35.04,2017-08-10,2017-08-15
8/10/2017,8/15/2017,Standard Class,IL-15100,Ivan Liston,Consumer,United States,Columbus,Indiana,47201,Central,Furniture,Furnishings,"Tenex Traditional Chairmats for Medium Pile Carpet, Standard Lip, 36"" x 48""",121.3,2,0.0,25.473,2017-08-10,2017-08-15
8/10/2017,8/15/2017,Standard Class,IL-15100,Ivan Liston,Consumer,United States,Columbus,Indiana,47201,Central,Technology,Phones,Aastra 57i VoIP phone,1454.49,9,0.0,378.1674,2017-08-10,2017-08-15
6/25/2016,6/29/2016,Standard Class,AS-10240,Alan Shonely,Consumer,United States,Los Angeles,California,90049,West,Office Supplies,Appliances,Fellowes Mighty 8 Compact Surge Protector,60.81,3,0.0,17.0268,2016-06-25,2016-06-29
12/10/2016,12/17/2016,Standard Class,AP-10915,Arthur Prichep,Consumer,United States,Seattle,Washington,98105,West,Office Supplies,Binders,GBC DocuBind P50 Personal Binding Machine,153.552,3,0.2,51.8238,2016-12-10,2016-12-17
12/10/2016,12/17/2016,Standard Class,AP-10915,Arthur Prichep,Consumer,United States,Seattle,Washington,98105,West,Office Supplies,Appliances,Holmes HEPA Air Purifier,65.34,3,0.0,22.869,2016-12-10,2016-12-17
12/10/2016,12/17/2016,Standard Class,AP-10915,Arthur Prichep,Consumer,United States,Seattle,Washington,98105,West,Office Supplies,Paper,Xerox 1988,123.92,4,0.0,55.764,2016-12-10,2016-12-17
12/10/2016,12/17/2016,Standard Class,AP-10915,Arthur Prichep,Consumer,United States,Seattle,Washington,98105,West,Office Supplies,Appliances,Harmony HEPA Quiet Air Purifiers,35.1,3,0.0,12.285,2016-12-10,2016-12-17
12/10/2016,12/17/2016,Standard Class,AP-10915,Arthur Prichep,Consumer,United States,Seattle,Washington,98105,West,Technology,Accessories,Kingston Digital DataTraveler 16GB USB 2.0,44.75,5,0.0,8.5025,2016-12-10,2016-12-17
12/1/2016,12/6/2016,Standard Class,AG-10390,Allen Goldenen,Consumer,United States,Knoxville,Tennessee,37918,South,Office Supplies,Art,Newell 343,4.704,2,0.2,0.4116,2016-12-01,2016-12-06
11/28/2014,12/4/2014,Standard Class,BF-11080,Bart Folk,Consumer,United States,Montgomery,Alabama,36116,South,Office Supplies,Art,Newell 331,14.67,3,0.0,3.9609,2014-11-28,2014-12-04
3/28/2015,4/2/2015,Standard Class,CK-12205,Chloris Kastensmidt,Consumer,United States,Philadelphia,Pennsylvania,19120,East,Office Supplies,Paper,Xerox 1999,15.552,3,0.2,5.4432,2015-03-28,2015-04-02
3/28/2015,4/2/2015,Standard Class,CK-12205,Chloris Kastensmidt,Consumer,United States,Philadelphia,Pennsylvania,19120,East,Office Supplies,Paper,Southworth Parchment Paper & Envelopes,5.232,1,0.2,1.7004,2015-03-28,2015-04-02
6/1/2014,6/6/2014,Standard Class,LT-17110,Liz Thompson,Consumer,United States,Little Rock,Arkansas,72209,South,Furniture,Furnishings,3M Hangers With Command Adhesive,22.2,6,0.0,9.102,2014-06-01,2014-06-06
6/1/2014,6/6/2014,Standard Class,LT-17110,Liz Thompson,Consumer,United States,Little Rock,Arkansas,72209,South,Technology,Phones,Adtran 1202752G1,881.93,7,0.0,229.3018,2014-06-01,2014-06-06
9/6/2015,9/12/2015,Standard Class,BT-11305,Beth Thompson,Home Office,United States,Seattle,Washington,98103,West,Office Supplies,Binders,Acco Hanging Data Binders,6.096,2,0.2,2.1336,2015-09-06,2015-09-12
9/6/2015,9/12/2015,Standard Class,BT-11305,Beth Thompson,Home Office,United States,Seattle,Washington,98103,West,Furniture,Furnishings,"Howard Miller 16"" Diameter Gallery Wall Clock",191.82,3,0.0,74.8098,2015-09-06,2015-09-12
6/29/2015,7/5/2015,Standard Class,SC-20725,Steven Cartwright,Consumer,United States,Lancaster,Pennsylvania,17602,East,Furniture,Furnishings,"Eldon Executive Woodline II Desk Accessories, Mahogany",20.104,1,0.2,1.7591,2015-06-29,2015-07-05
9/10/2016,9/12/2016,Second Class,CG-12040,Catherine Glotzbach,Home Office,United States,Bristol,Tennessee,37620,South,Office Supplies,Art,"Boston Model 1800 Electric Pencil Sharpener, Gray",67.56,3,0.2,8.445,2016-09-10,2016-09-12
7/14/2014,7/20/2014,Standard Class,AW-10930,Arthur Wiediger,Home Office,United States,Aurora,Illinois,60505,Central,Office Supplies,Binders,Acco D-Ring Binder w/DublLock,29.932,7,0.8,-46.3946,2014-07-14,2014-07-20
7/14/2014,7/20/2014,Standard Class,AW-10930,Arthur Wiediger,Home Office,United States,Aurora,Illinois,60505,Central,Technology,Phones,I Need's 3d Hello Kitty Hybrid Silicone Case Cover for HTC One X 4g with 3d Hello Kitty Stylus Pen Green/pink,38.272,4,0.2,3.8272,2014-07-14,2014-07-20
8/22/2015,8/26/2015,Standard Class,RB-19705,Roger Barcio,Home Office,United States,New York City,New York,10009,East,Office Supplies,Art,Newell Chalk Holder,16.52,4,0.0,7.5992,2015-08-22,2015-08-26
11/14/2014,11/16/2014,Second Class,ML-17410,Maris LaWare,Consumer,United States,Fairfield,Connecticut,6824,East,Technology,Phones,Polycom SoundPoint Pro SE-225 Corded phone,832.93,7,0.0,233.2204,2014-11-14,2014-11-16
11/14/2014,11/16/2014,Second Class,ML-17410,Maris LaWare,Consumer,United States,Fairfield,Connecticut,6824,East,Office Supplies,Binders,Acco 3-Hole Punch,43.8,10,0.0,21.024,2014-11-14,2014-11-16
11/27/2016,11/30/2016,First Class,VB-21745,Victoria Brennan,Corporate,United States,Lincoln Park,Michigan,48146,Central,Office Supplies,Appliances,Euro-Pro Shark Turbo Vacuum,167.292,6,0.1,29.7408,2016-11-27,2016-11-30
11/21/2017,11/25/2017,Standard Class,SW-20275,Scott Williamson,Consumer,United States,New York City,New York,10035,East,Furniture,Furnishings,Howard Miller Distant Time Traveler Alarm Clock,27.42,1,0.0,11.2422,2017-11-21,2017-11-25
10/1/2017,10/2/2017,First Class,NS-18505,Neola Schneider,Consumer,United States,San Jose,California,95123,West,Office Supplies,Binders,Wilson Jones Easy Flow II Sheet Lifters,1.44,1,0.2,0.504,2017-10-01,2017-10-02
10/1/2017,10/2/2017,First Class,NS-18505,Neola Schneider,Consumer,United States,San Jose,California,95123,West,Office Supplies,Binders,Storex Dura Pro Binders,61.776,13,0.2,20.8494,2017-10-01,2017-10-02
10/1/2017,10/2/2017,First Class,NS-18505,Neola Schneider,Consumer,United States,San Jose,California,95123,West,Office Supplies,Appliances,"Belkin 325VA UPS Surge Protector, 6'",241.96,2,0.0,60.49,2017-10-01,2017-10-02
10/1/2017,10/2/2017,First Class,NS-18505,Neola Schneider,Consumer,United States,San Jose,California,95123,West,Furniture,Chairs,"Metal Folding Chairs, Beige, 4/Carton",108.608,4,0.2,9.5032,2017-10-01,2017-10-02
9/20/2014,9/25/2014,Standard Class,DB-13555,Dorothy Badders,Corporate,United States,Jacksonville,Florida,32216,South,Office Supplies,Art,Nontoxic Chalk,2.816,2,0.2,0.9856,2014-09-20,2014-09-25
7/28/2017,8/1/2017,Standard Class,MH-17620,Matt Hagelstein,Corporate,United States,San Francisco,California,94110,West,Office Supplies,Binders,Zipper Ring Binder Pockets,9.984,4,0.2,3.6192,2017-07-28,2017-08-01
7/28/2017,8/1/2017,Standard Class,MH-17620,Matt Hagelstein,Corporate,United States,San Francisco,California,94110,West,Office Supplies,Storage,Super Decoflex Portable Personal File,14.98,1,0.0,4.1944,2017-07-28,2017-08-01
7/28/2017,8/1/2017,Standard Class,MH-17620,Matt Hagelstein,Corporate,United States,San Francisco,California,94110,West,Technology,Phones,Wilson Electronics DB Pro Signal Booster,1145.6,4,0.2,100.24,2017-07-28,2017-08-01
12/6/2015,12/6/2015,Same Day,DK-13375,Dennis Kane,Consumer,United States,Marion,Ohio,43302,East,Technology,Phones,Polycom SoundStation2 EX Conference phone,485.94,2,0.4,-89.089,2015-12-06,2015-12-06
12/6/2015,12/6/2015,Same Day,DK-13375,Dennis Kane,Consumer,United States,Marion,Ohio,43302,East,Office Supplies,Art,Newell 312,37.376,8,0.2,4.672,2015-12-06,2015-12-06
12/6/2015,12/6/2015,Same Day,DK-13375,Dennis Kane,Consumer,United States,Marion,Ohio,43302,East,Furniture,Chairs,Global Low Back Tilter Chair,70.686,1,0.3,-24.2352,2015-12-06,2015-12-06
7/31/2017,8/5/2017,Standard Class,EA-14035,Erin Ashbrook,Corporate,United States,Philadelphia,Pennsylvania,19134,East,Office Supplies,Paper,Xerox 1991,54.816,3,0.2,17.8152,2017-07-31,2017-08-05
3/19/2016,3/21/2016,Second Class,BT-11440,Bobby Trafton,Consumer,United States,Littleton,Colorado,80122,West,Furniture,Bookcases,"Atlantic Metals Mobile 2-Shelf Bookcases, Custom Colors",72.294,1,0.7,-98.8018,2016-03-19,2016-03-21
7/29/2017,8/3/2017,Standard Class,LA-16780,Laura Armstrong,Corporate,United States,Austin,Texas,78745,Central,Office Supplies,Fasteners,Assorted Color Push Pins,2.896,2,0.2,0.4706,2017-07-29,2017-08-03
7/29/2017,8/3/2017,Standard Class,LA-16780,Laura Armstrong,Corporate,United States,Austin,Texas,78745,Central,Technology,Phones,Cisco SPA301,124.792,1,0.2,15.599,2017-07-29,2017-08-03
10/1/2016,10/5/2016,Standard Class,GM-14680,Greg Matthias,Consumer,United States,New York City,New York,10024,East,Furniture,Tables,"Chromcraft Bull-Nose Wood 48"" x 96"" Rectangular Conference Tables",330.588,1,0.4,-115.7058,2016-10-01,2016-10-05
3/31/2014,4/5/2014,Standard Class,AA-10315,Alex Avila,Consumer,United States,San Francisco,California,94122,West,Office Supplies,Binders,GBC DocuBind 200 Manual Binding Machine,673.568,2,0.2,252.588,2014-03-31,2014-04-05
3/31/2014,4/5/2014,Standard Class,AA-10315,Alex Avila,Consumer,United States,San Francisco,California,94122,West,Office Supplies,Appliances,Fellowes Advanced Computer Series Surge Protectors,52.98,2,0.0,14.8344,2014-03-31,2014-04-05
6/26/2017,7/1/2017,Standard Class,DB-13405,Denny Blanton,Consumer,United States,La Porte,Indiana,46350,Central,Furniture,Furnishings,Eldon Antistatic Chair Mats for Low to Medium Pile Carpets,526.45,5,0.0,31.587,2017-06-26,2017-07-01
7/9/2017,7/14/2017,Standard Class,JH-15820,John Huston,Consumer,United States,Chicago,Illinois,60610,Central,Office Supplies,Storage,Recycled Steel Personal File for Hanging File Folders,228.92,5,0.2,14.3075,2017-07-09,2017-07-14
12/14/2015,12/16/2015,Second Class,DJ-13630,Doug Jacobs,Consumer,United States,Portland,Oregon,97206,West,Technology,Phones,HTC One,319.968,4,0.2,35.9964,2015-12-14,2015-12-16
12/5/2017,12/10/2017,Standard Class,QJ-19255,Quincy Jones,Corporate,United States,Burlington,Vermont,5408,East,Technology,Accessories,Logitech ClearChat Comfort/USB Headset H390,205.03,7,0.0,67.6599,2017-12-05,2017-12-10
9/15/2015,9/17/2015,Second Class,CT-11995,Carol Triggs,Consumer,United States,Indianapolis,Indiana,46203,Central,Office Supplies,Storage,Fellowes Stor/Drawer Steel Plus Storage Drawers,190.86,2,0.0,11.4516,2015-09-15,2015-09-17
9/15/2015,9/17/2015,Second Class,CT-11995,Carol Triggs,Consumer,United States,Indianapolis,Indiana,46203,Central,Office Supplies,Art,Manco Dry-Lighter Erasable Highlighter,24.32,8,0.0,8.2688,2015-09-15,2015-09-17
7/15/2016,7/21/2016,Standard Class,RH-19510,Rick Huthwaite,Home Office,United States,Provo,Utah,84604,West,Office Supplies,Supplies,Fiskars Home & Office Scissors,44.4,5,0.0,12.432,2016-07-15,2016-07-21
4/20/2017,4/26/2017,Standard Class,SJ-20125,Sanjit Jacobs,Home Office,United States,Chicago,Illinois,60610,Central,Furniture,Furnishings,Eldon Cleatmat Chair Mats for Medium Pile Carpets,44.4,2,0.6,-52.17,2017-04-20,2017-04-26
11/15/2016,11/17/2016,Second Class,TG-21310,Toby Gnade,Consumer,United States,Los Angeles,California,90049,West,Office Supplies,Binders,Fellowes PB500 Electric Punch Plastic Comb Binding Machine with Manual Bind,1016.792,1,0.2,381.297,2016-11-15,2016-11-17
11/15/2016,11/17/2016,Second Class,TG-21310,Toby Gnade,Consumer,United States,Los Angeles,California,90049,West,Office Supplies,Binders,Avery Self-Adhesive Photo Pockets for Polaroid Photos,38.136,7,0.2,13.3476,2016-11-15,2016-11-17
11/26/2016,12/1/2016,Standard Class,CT-11995,Carol Triggs,Consumer,United States,Philadelphia,Pennsylvania,19134,East,Technology,Phones,Mitel MiVoice 5330e IP Phone,494.982,3,0.4,-115.4958,2016-11-26,2016-12-01
11/21/2017,11/25/2017,Standard Class,BF-11005,Barry Franz,Home Office,United States,Pasadena,California,91104,West,Office Supplies,Storage,Eldon Portable Mobile Manager,56.56,2,0.0,15.2712,2017-11-21,2017-11-25
11/21/2017,11/25/2017,Standard Class,BF-11005,Barry Franz,Home Office,United States,Pasadena,California,91104,West,Office Supplies,Art,Newell 344,5.56,2,0.0,1.4456,2017-11-21,2017-11-25
11/21/2017,11/25/2017,Standard Class,BF-11005,Barry Franz,Home Office,United States,Pasadena,California,91104,West,Office Supplies,Fasteners,Advantus T-Pin Paper Clips,9.02,2,0.0,3.5178,2017-11-21,2017-11-25
11/21/2017,11/25/2017,Standard Class,BF-11005,Barry Franz,Home Office,United States,Pasadena,California,91104,West,Office Supplies,Appliances,"Acco Six-Outlet Power Strip, 4' Cord Length",8.62,1,0.0,2.2412,2017-11-21,2017-11-25
11/21/2017,11/25/2017,Standard Class,BF-11005,Barry Franz,Home Office,United States,Pasadena,California,91104,West,Technology,Phones,Mitel MiVoice 5330e IP Phone,659.976,3,0.2,49.4982,2017-11-21,2017-11-25
2/15/2015,2/18/2015,Second Class,JM-16195,Justin MacKendrick,Consumer,United States,Los Angeles,California,90004,West,Office Supplies,Paper,Xerox 1959,13.36,2,0.0,6.4128,2015-02-15,2015-02-18
2/15/2015,2/18/2015,Second Class,JM-16195,Justin MacKendrick,Consumer,United States,Los Angeles,California,90004,West,Office Supplies,Binders,"Acco Data Flex Cable Posts For Top & Bottom Load Binders, 6"" Capacity",41.72,5,0.2,13.0375,2015-02-15,2015-02-18
2/15/2015,2/18/2015,Second Class,JM-16195,Justin MacKendrick,Consumer,United States,Los Angeles,California,90004,West,Office Supplies,Binders,Avery Durable Binders,11.52,5,0.2,4.176,2015-02-15,2015-02-18
2/15/2015,2/18/2015,Second Class,JM-16195,Justin MacKendrick,Consumer,United States,Los Angeles,California,90004,West,Office Supplies,Appliances,Kensington 6 Outlet MasterPiece HOMEOFFICE Power Control Center,541.44,6,0.0,157.0176,2015-02-15,2015-02-18
2/15/2015,2/18/2015,Second Class,JM-16195,Justin MacKendrick,Consumer,United States,Los Angeles,California,90004,West,Office Supplies,Paper,Xerox 22,19.44,3,0.0,9.3312,2015-02-15,2015-02-18
4/15/2016,4/17/2016,Second Class,JK-16120,Julie Kriz,Home Office,United States,San Diego,California,92105,West,Office Supplies,Paper,Xerox 1911,143.7,3,0.0,68.976,2016-04-15,2016-04-17
9/28/2015,10/1/2015,First Class,HG-14965,Henry Goldwyn,Corporate,United States,San Francisco,California,94110,West,Office Supplies,Appliances,Holmes Odor Grabber,43.26,3,0.0,14.2758,2015-09-28,2015-10-01
9/28/2015,10/1/2015,First Class,HG-14965,Henry Goldwyn,Corporate,United States,San Francisco,California,94110,West,Office Supplies,Appliances,Holmes HEPA Air Purifier,43.56,2,0.0,15.246,2015-09-28,2015-10-01
9/17/2016,9/22/2016,Standard Class,LA-16780,Laura Armstrong,Corporate,United States,Bangor,Maine,4401,East,Technology,Phones,Wi-Ex zBoost YX540 Cellular Phone Signal Booster,437.85,3,0.0,131.355,2016-09-17,2016-09-22
9/17/2016,9/22/2016,Standard Class,LA-16780,Laura Armstrong,Corporate,United States,Bangor,Maine,4401,East,Furniture,Furnishings,"C-Line Cubicle Keepers Polyproplyene Holder w/Velcro Back, 8-1/2x11, 25/Bx",109.48,2,0.0,33.9388,2016-09-17,2016-09-22
6/16/2017,6/19/2017,First Class,TS-21610,Troy Staebel,Consumer,United States,San Francisco,California,94122,West,Furniture,Chairs,Hon Multipurpose Stacking Arm Chairs,1212.96,7,0.2,90.972,2017-06-16,2017-06-19
6/16/2017,6/19/2017,First Class,TS-21610,Troy Staebel,Consumer,United States,San Francisco,California,94122,West,Office Supplies,Paper,"Wirebound Message Books, Four 2 3/4"" x 5"" Forms per Page, 600 Sets per Book",18.54,2,0.0,8.7138,2017-06-16,2017-06-19
11/8/2015,11/10/2015,Second Class,MZ-17335,Maria Zettner,Home Office,United States,San Diego,California,92024,West,Office Supplies,Fasteners,Advantus Plastic Paper Clips,5.0,1,0.0,2.4,2015-11-08,2015-11-10
11/8/2015,11/10/2015,Second Class,MZ-17335,Maria Zettner,Home Office,United States,San Diego,California,92024,West,Technology,Accessories,Logitech G19 Programmable Gaming Keyboard,371.97,3,0.0,66.9546,2015-11-08,2015-11-10
12/18/2015,12/18/2015,Same Day,MW-18220,Mitch Webber,Consumer,United States,New York City,New York,10035,East,Technology,Accessories,Imation Bio 8GB USB Flash Drive Imation Corp,166.24,1,0.0,24.936,2015-12-18,2015-12-18
2/6/2017,2/9/2017,First Class,MV-17485,Mark Van Huff,Consumer,United States,Arlington,Virginia,22204,South,Furniture,Bookcases,"Bush Andora Bookcase, Maple/Graphite Gray Finish",359.97,3,0.0,79.1934,2017-02-06,2017-02-09
11/14/2016,11/16/2016,Second Class,AA-10375,Allen Armold,Consumer,United States,Atlanta,Georgia,30318,South,Technology,Accessories,Logitech diNovo Edge Keyboard,499.98,2,0.0,114.9954,2016-11-14,2016-11-16
11/14/2016,11/16/2016,Second Class,AA-10375,Allen Armold,Consumer,United States,Atlanta,Georgia,30318,South,Office Supplies,Paper,Xerox 4200 Series MultiUse Premium Copy Paper (20Lb. and 84 Bright),5.28,1,0.0,2.376,2016-11-14,2016-11-16
11/14/2016,11/16/2016,Second Class,AA-10375,Allen Armold,Consumer,United States,Atlanta,Georgia,30318,South,Office Supplies,Binders,"ACCOHIDE 3-Ring Binder, Blue, 1""",8.26,2,0.0,3.8822,2016-11-14,2016-11-16
10/12/2017,10/12/2017,Same Day,SM-20320,Sean Miller,Home Office,United States,Monroe,North Carolina,28110,South,Office Supplies,Paper,Xerox 1989,7.968,2,0.2,2.6892,2017-10-12,2017-10-12
9/17/2017,9/17/2017,Same Day,TP-21415,Tom Prescott,Consumer,United States,Seattle,Washington,98115,West,Office Supplies,Paper,Xerox 1984,12.96,2,0.0,6.3504,2017-09-17,2017-09-17
12/20/2017,12/26/2017,Standard Class,DK-13225,Dean Katz,Corporate,United States,Rochester,New York,14609,East,Office Supplies,Paper,Xerox 227,6.48,1,0.0,3.1104,2017-12-20,2017-12-26
12/20/2017,12/26/2017,Standard Class,DK-13225,Dean Katz,Corporate,United States,Rochester,New York,14609,East,Office Supplies,Binders,Wilson Jones Leather-Like Binders with DublLock Round Rings,6.984,1,0.2,2.3571,2017-12-20,2017-12-26
12/2/2017,12/7/2017,Standard Class,MK-17905,Michael Kennedy,Corporate,United States,Miami,Florida,33180,South,Office Supplies,Art,Bulldog Vacuum Base Pencil Sharpener,47.96,5,0.2,4.1965,2017-12-02,2017-12-07
9/21/2015,9/27/2015,Standard Class,CS-12130,Chad Sievert,Consumer,United States,Seattle,Washington,98105,West,Office Supplies,Storage,Fellowes Bases and Tops For Staxonsteel/High-Stak Systems,199.74,6,0.0,47.9376,2015-09-21,2015-09-27
3/6/2015,3/11/2015,Standard Class,JL-15850,John Lucas,Consumer,United States,San Francisco,California,94122,West,Furniture,Furnishings,Deflect-o Glass Clear Studded Chair Mats,435.26,7,0.0,95.7572,2015-03-06,2015-03-11
3/6/2015,3/11/2015,Standard Class,JL-15850,John Lucas,Consumer,United States,San Francisco,California,94122,West,Technology,Copiers,Canon PC1060 Personal Laser Copier,1119.984,2,0.2,377.9946,2015-03-06,2015-03-11
10/3/2014,10/8/2014,Second Class,AR-10405,Allen Rosenblatt,Corporate,United States,Los Angeles,California,90036,West,Furniture,Tables,Bevis Round Conference Room Tables and Bases,143.432,1,0.2,3.5858,2014-10-03,2014-10-08
10/3/2014,10/8/2014,Second Class,AR-10405,Allen Rosenblatt,Corporate,United States,Los Angeles,California,90036,West,Furniture,Chairs,"Global Deluxe Stacking Chair, Gray",122.352,3,0.2,13.7646,2014-10-03,2014-10-08
6/27/2014,7/1/2014,Standard Class,LM-17065,Liz MacKendrick,Consumer,United States,Southaven,Mississippi,38671,South,Office Supplies,Storage,"SAFCO Commercial Wire Shelving, 72h",306.2,5,0.0,0.0,2014-06-27,2014-07-01
6/27/2014,7/1/2014,Standard Class,LM-17065,Liz MacKendrick,Consumer,United States,Southaven,Mississippi,38671,South,Furniture,Tables,KI Adjustable-Height Table,85.98,1,0.0,22.3548,2014-06-27,2014-07-01
6/27/2014,7/1/2014,Standard Class,LM-17065,Liz MacKendrick,Consumer,United States,Southaven,Mississippi,38671,South,Technology,Accessories,Sony Micro Vault Click 16 GB USB 2.0 Flash Drive,223.96,4,0.0,53.7504,2014-06-27,2014-07-01
10/30/2017,11/2/2017,First Class,JK-15625,Jim Karlsson,Consumer,United States,Seattle,Washington,98115,West,Furniture,Chairs,Novimex Fabric Task Chair,97.568,2,0.2,-6.098,2017-10-30,2017-11-02
10/30/2017,11/2/2017,First Class,JK-15625,Jim Karlsson,Consumer,United States,Seattle,Washington,98115,West,Furniture,Chairs,Global Super Steno Chair,614.272,8,0.2,-23.0352,2017-10-30,2017-11-02
10/30/2017,11/2/2017,First Class,JK-15625,Jim Karlsson,Consumer,United States,Seattle,Washington,98115,West,Furniture,Bookcases,Bestar Classic Bookcase,199.98,2,0.0,37.9962,2017-10-30,2017-11-02
9/3/2016,9/5/2016,First Class,FM-14215,Filia McAdams,Corporate,United States,Middletown,Connecticut,6457,East,Office Supplies,Paper,"Adams Phone Message Book, 200 Message Capacity, 8 1/16 x 11",48.16,7,0.0,22.1536,2016-09-03,2016-09-05
3/5/2015,3/9/2015,Standard Class,SF-20200,Sarah Foster,Consumer,United States,New Castle,Indiana,47362,Central,Technology,Phones,I Need's 3d Hello Kitty Hybrid Silicone Case Cover for HTC One X 4g with 3d Hello Kitty Stylus Pen Green/pink,23.92,2,0.0,6.6976,2015-03-05,2015-03-09
3/5/2015,3/9/2015,Standard Class,SF-20200,Sarah Foster,Consumer,United States,New Castle,Indiana,47362,Central,Office Supplies,Appliances,Staple holder,60.69,7,0.0,16.3863,2015-03-05,2015-03-09
5/5/2016,5/8/2016,First Class,PJ-18835,Patrick Jones,Corporate,United States,Murfreesboro,Tennessee,37130,South,Office Supplies,Paper,Xerox 1965,14.352,3,0.2,5.2026,2016-05-05,2016-05-08
11/17/2017,11/23/2017,Standard Class,CS-12355,Christine Sundaresam,Consumer,United States,Salem,Virginia,24153,South,Office Supplies,Appliances,Bionaire 99.97% HEPA Air Cleaner,35.04,2,0.0,12.264,2017-11-17,2017-11-23
6/1/2017,6/5/2017,Second Class,BB-10990,Barry Blumstein,Corporate,United States,Toledo,Ohio,43615,East,Office Supplies,Appliances,"Eureka Sanitaire  Multi-Pro Heavy-Duty Upright, Disposable Bags",17.48,5,0.2,1.311,2017-06-01,2017-06-05
6/10/2017,6/13/2017,First Class,BW-11200,Ben Wallace,Consumer,United States,Los Angeles,California,90032,West,Office Supplies,Art,Newell 351,16.4,5,0.0,4.756,2017-06-10,2017-06-13
1/8/2017,1/11/2017,First Class,RS-19420,Ricardo Sperren,Corporate,United States,Seattle,Washington,98115,West,Furniture,Tables,Balt Solid Wood Round Tables,892.98,2,0.0,80.3682,2017-01-08,2017-01-11
4/20/2015,4/25/2015,Standard Class,TS-21160,Theresa Swint,Corporate,United States,Columbus,Georgia,31907,South,Technology,Phones,Pyle PMP37LED,287.97,3,0.0,77.7519,2015-04-20,2015-04-25
4/20/2015,4/25/2015,Standard Class,TS-21160,Theresa Swint,Corporate,United States,Columbus,Georgia,31907,South,Furniture,Furnishings,"GE 48"" Fluorescent Tube, Cool White Energy Saver, 34 Watts, 30/Box",595.38,6,0.0,297.69,2015-04-20,2015-04-25
4/20/2015,4/25/2015,Standard Class,TS-21160,Theresa Swint,Corporate,United States,Columbus,Georgia,31907,South,Office Supplies,Paper,Xerox 2,12.96,2,0.0,6.2208,2015-04-20,2015-04-25
11/1/2015,11/6/2015,Standard Class,QJ-19255,Quincy Jones,Corporate,United States,New York City,New York,10009,East,Technology,Phones,Cush Cases Heavy Duty Rugged Cover Case for Samsung Galaxy S5 - Purple,4.95,1,0.0,1.3365,2015-11-01,2015-11-06
12/23/2017,12/27/2017,Standard Class,FM-14215,Filia McAdams,Corporate,United States,Middletown,Connecticut,6457,East,Furniture,Furnishings,"Tenex Traditional Chairmats for Medium Pile Carpet, Standard Lip, 36"" x 48""",181.95,3,0.0,38.2095,2017-12-23,2017-12-27
11/1/2015,11/5/2015,Standard Class,VD-21670,Valerie Dominguez,Consumer,United States,New York City,New York,10011,East,Office Supplies,Paper,Avoid Verbal Orders Carbonless Minifold Book,13.52,4,0.0,6.2192,2015-11-01,2015-11-05
11/1/2015,11/5/2015,Standard Class,VD-21670,Valerie Dominguez,Consumer,United States,New York City,New York,10011,East,Furniture,Furnishings,"Howard Miller 11-1/2"" Diameter Ridgewood Wall Clock",259.7,5,0.0,106.477,2015-11-01,2015-11-05
11/1/2015,11/5/2015,Standard Class,VD-21670,Valerie Dominguez,Consumer,United States,New York City,New York,10011,East,Technology,Phones,Plantronics MX500i Earset,42.95,1,0.0,1.2885,2015-11-01,2015-11-05
11/1/2015,11/5/2015,Standard Class,VD-21670,Valerie Dominguez,Consumer,United States,New York City,New York,10011,East,Technology,Accessories,Razer Tiamat Over Ear 7.1 Surround Sound PC Gaming Headset,1399.93,7,0.0,601.9699,2015-11-01,2015-11-05
11/1/2015,11/5/2015,Standard Class,VD-21670,Valerie Dominguez,Consumer,United States,New York City,New York,10011,East,Technology,Phones,Xblue XB-1670-86 X16 Small Office Telephone - Titanium,503.96,4,0.0,125.99,2015-11-01,2015-11-05
11/14/2014,11/18/2014,Standard Class,JL-15505,Jeremy Lonsdale,Consumer,United States,Midland,Michigan,48640,Central,Office Supplies,Binders,Storex DuraTech Recycled Plastic Frosted Binders,12.72,3,0.0,6.36,2014-11-14,2014-11-18
11/14/2014,11/18/2014,Standard Class,JL-15505,Jeremy Lonsdale,Consumer,United States,Midland,Michigan,48640,Central,Office Supplies,Binders,Avery Durable Binders,11.52,4,0.0,5.6448,2014-11-14,2014-11-18
1/17/2016,1/21/2016,Standard Class,DL-13495,Dionis Lloyd,Corporate,United States,Columbus,Georgia,31907,South,Technology,Accessories,First Data FD10 PIN Pad,316.0,4,0.0,31.6,2016-01-17,2016-01-21
9/17/2017,9/22/2017,Second Class,MO-17800,Meg O'Connel,Home Office,United States,Roswell,Georgia,30076,South,Furniture,Chairs,Global Ergonomic Managers Chair,723.92,4,0.0,188.2192,2017-09-17,2017-09-22
9/17/2017,9/22/2017,Second Class,MO-17800,Meg O'Connel,Home Office,United States,Roswell,Georgia,30076,South,Office Supplies,Paper,Easy-staple paper,106.32,3,0.0,49.9704,2017-09-17,2017-09-22
12/23/2016,12/24/2016,First Class,BP-11185,Ben Peterman,Corporate,United States,Chicago,Illinois,60623,Central,Furniture,Bookcases,"Bush Westfield Collection Bookcases, Fully Assembled",141.372,2,0.3,-14.1372,2016-12-23,2016-12-24
8/6/2015,8/8/2015,First Class,MS-17980,Michael Stewart,Corporate,United States,Houston,Texas,77041,Central,Office Supplies,Paper,Xerox 188,27.216,3,0.2,9.8658,2015-08-06,2015-08-08
11/5/2017,11/9/2017,Standard Class,SV-20935,Susan Vittorini,Consumer,United States,New York City,New York,10009,East,Technology,Accessories,Enermax Aurora Lite Keyboard,390.75,5,0.0,171.93,2017-11-05,2017-11-09
6/11/2017,6/12/2017,First Class,BC-11125,Becky Castell,Home Office,United States,Peoria,Arizona,85345,West,Furniture,Chairs,Global Leather Executive Chair,280.792,1,0.2,35.099,2017-06-11,2017-06-12
6/11/2017,6/12/2017,First Class,BC-11125,Becky Castell,Home Office,United States,Peoria,Arizona,85345,West,Office Supplies,Storage,"Sortfiler Multipurpose Personal File Organizer, Black",68.448,4,0.2,7.7004,2017-06-11,2017-06-12
6/11/2017,6/12/2017,First Class,BC-11125,Becky Castell,Home Office,United States,Peoria,Arizona,85345,West,Office Supplies,Art,Boston 16801 Nautilus Battery Pencil Sharpener,88.04,5,0.2,6.603,2017-06-11,2017-06-12
6/11/2017,6/12/2017,First Class,BC-11125,Becky Castell,Home Office,United States,Peoria,Arizona,85345,West,Office Supplies,Art,Newell 319,15.872,1,0.2,1.984,2017-06-11,2017-06-12
6/11/2017,6/12/2017,First Class,BC-11125,Becky Castell,Home Office,United States,Peoria,Arizona,85345,West,Office Supplies,Storage,Fellowes Officeware Wire Shelving,215.592,3,0.2,-48.5082,2017-06-11,2017-06-12
7/20/2017,7/25/2017,Standard Class,EM-13825,Elizabeth Moffitt,Corporate,United States,Sioux Falls,South Dakota,57103,Central,Office Supplies,Labels,Avery 486,14.62,2,0.0,6.8714,2017-07-20,2017-07-25
7/20/2017,7/25/2017,Standard Class,EM-13825,Elizabeth Moffitt,Corporate,United States,Sioux Falls,South Dakota,57103,Central,Office Supplies,Appliances,"1.7 Cubic Foot Compact ""Cube"" Office Refrigerators",416.32,2,0.0,112.4064,2017-07-20,2017-07-25
7/20/2017,7/25/2017,Standard Class,EM-13825,Elizabeth Moffitt,Corporate,United States,Sioux Falls,South Dakota,57103,Central,Office Supplies,Binders,Avery Printable Repositionable Plastic Tabs,43.0,5,0.0,20.21,2017-07-20,2017-07-25
7/20/2017,7/25/2017,Standard Class,EM-13825,Elizabeth Moffitt,Corporate,United States,Sioux Falls,South Dakota,57103,Central,Furniture,Chairs,Novimex Fabric Task Chair,182.94,3,0.0,27.441,2017-07-20,2017-07-25
7/20/2017,7/25/2017,Standard Class,EM-13825,Elizabeth Moffitt,Corporate,United States,Sioux Falls,South Dakota,57103,Central,Office Supplies,Binders,Cardinal Slant-D Ring Binders,60.83,7,0.0,30.415,2017-07-20,2017-07-25
7/20/2017,7/25/2017,Standard Class,EM-13825,Elizabeth Moffitt,Corporate,United States,Sioux Falls,South Dakota,57103,Central,Technology,Accessories,Logitech G35 7.1-Channel Surround Sound Headset,389.97,3,0.0,132.5898,2017-07-20,2017-07-25
12/23/2015,12/26/2015,First Class,BD-11500,Bradley Drucker,Consumer,United States,Richmond,Virginia,23223,South,Office Supplies,Appliances,Belkin Premiere Surge Master II 8-outlet surge protector,194.32,4,0.0,56.3528,2015-12-23,2015-12-26
3/20/2017,3/24/2017,Standard Class,HW-14935,Helen Wasserman,Corporate,United States,Seattle,Washington,98115,West,Technology,Accessories,Imation Secure Drive + Hardware Encrypted USB flash drive - 16 GB,265.93,7,0.0,63.8232,2017-03-20,2017-03-24
